Amos,météo,16,ICI.Radio-Canada.ca,Des semaines chaudes et sèches à venir en Abitibi-Témiscamingue,,,https://ici.radio-canada.ca/nouvelle/1704892/temperature-meteo-ete-2020-abitibi-temiscamingue-previsions,2021-07-23 16:09:29,local
Amos,météo,17,ICI.Radio-Canada.ca,La saison des sports d'hiver s'annonce prometteuse en Abitibi-Témiscamingue,2020-12-20,215,https://ici.radio-canada.ca/nouvelle/1758509/sport-hiver-abitibi-ski-patin-covid,2021-07-23 16:09:29,local
Amos,météo,18,ICI.Radio-Canada.ca,L'Harricana remanie des directions d'écoles pour préparer la relève,2021-05-14,70,https://ici.radio-canada.ca/nouvelle/1793312/releve-directions-ecoles-amos-harricana,2021-07-23 16:09:29,local
Amos,météo,19,ICI.Radio-Canada.ca,Amos annonce une légère hausse de taxes pour 2021,2020-12-15,220,https://ici.radio-canada.ca/nouvelle/1757450/amos-budget-2021-hausse-taxes,2021-07-23 16:09:30,local
Amos,météo,20,ICI.Radio-Canada.ca,Des places limitées dans des camps de jour de l'Abitibi-Témiscamingue,2021-05-31,53,https://ici.radio-canada.ca/nouvelle/1797605/manque-moniteurs-camps-jour-abitibi-temiscamingue,2021-07-23 16:09:30,local
Amos,météo,21,ICI.Radio-Canada.ca,Le Refuge Pageau d'Amos a perdu sa mère fondatrice,2021-05-13,71,https://ici.radio-canada.ca/nouvelle/1792897/refuge-pageau-amos-deces-louise-fondatrice,2021-07-23 16:09:30,local
Amos,météo,22,ICI.Radio-Canada.ca,"Le député de Pontiac, William Amos, « nu » lors de la période de questions à Ottawa",2021-04-19,95,https://ici.radio-canada.ca/nouvelle/1784998/william-amos-nu-pontiac-periode-question-videoconference,2021-07-23 16:09:30,local
Amos,météo,23,ICI.Radio-Canada.ca,Les travaux de rénovation de la cathédrale d'Amos sont lancés,2021-04-29,85,https://ici.radio-canada.ca/nouvelle/1788361/lancement-travaux-renovation-amos,2021-07-23 16:09:30,local
Amos,météo,24,Le Journal de Québec,Séance virtuelle : le député William Amos surpris en train d'uriner,2021-05-27,57,https://www.journaldequebec.com/2021/05/27/le-depute-william-amos-se-fait-surprendre-une-deuxieme-fois-par-sa-camera,2021-07-23 16:09:30,local
Amos,météo,25,ICI.Radio-Canada.ca,Un lendemain de tempête en Abitibi-Témiscamingue différent pour tout le monde,2020-11-03,262,https://ici.radio-canada.ca/nouvelle/1746488/pannes-electricite-courant-tempete-neige-abitibi,2021-07-23 16:09:31,local
