Villes,Mots-clés,position du média,Nom du média,Titre de l'article,Date de publication,Journée de différence,URL,date et heure saisie,type mot-clés
Amos,accident,1,ICI.Radio-Canada.ca,Mort de Michaël Bédard : pas d'accusations contre le policier impliqué dans l'accident,2021-07-22,1,https://ici.radio-canada.ca/nouvelle/1810992/accident-mortel-route-dpcp-amos-route-117,2021-07-23 16:06:27,local
Amos,accident,2,ICI.Radio-Canada.ca,Des ruptures de services sporadiques au bloc opératoire de Ville-Marie cet été,2021-07-02,21,https://ici.radio-canada.ca/nouvelle/1805891/arret-chirurgie-operation-hopital-ville-marie-infirmieres,2021-07-23 16:06:28,local
Amos,accident,3,Fraternité Matin,Port-Bouët Adjoufou : Un accident de circulation fait 16 victimes dont 03 décès certains (Gspm),2021-07-14,9,https://www.fratmat.info/article/213934/societe/port-bouet-adjoufou-un-accident-de-circulation-fait-16-victimes-dont-03-deces-certains-gspm,2021-07-23 16:06:28,local
Amos,accident,4,ICI.Radio-Canada.ca,Accident mortel de motomarine près de Senneterre,2021-06-14,39,https://ici.radio-canada.ca/nouvelle/1801290/lac-attic-temoins-victime-surete-du-quebec,2021-07-23 16:06:28,local
Amos,accident,5,ICI.Radio-Canada.ca,Accident impliquant un autobus scolaire près des côtes Joannès,2020-09-03,323,https://ici.radio-canada.ca/nouvelle/1731342/route-117-accident-cotes-joannes-autobus,2021-07-23 16:06:28,local
Amos,accident,6,ICI.Radio-Canada.ca,Accident mortel à Granada : Mathieu Desgagné est acquitté,2021-04-23,91,https://ici.radio-canada.ca/nouvelle/1787303/accident-mortel-ganada-conduite-dangereuse-negligence-criminelle,2021-07-23 16:06:28,local
Amos,accident,7,Linfodrome.ci,"Accident sur la route de Bassam ce matin, des morts signalés",2021-07-14,9,https://www.linfodrome.com/sujet-du-jour/68582-accident-sur-la-route-de-bassam-ce-matin-des-morts-signales,2021-07-23 16:06:29,local
Amos,accident,8,ICI.Radio-Canada.ca,Sécurité de la route 109 : le MTQ analysera les demandes de Pikogan,2021-04-28,86,https://ici.radio-canada.ca/nouvelle/1788628/pieton-accident-mortel-109-accotements,2021-07-23 16:06:29,local
Amos,accident,9,ICI.Radio-Canada.ca,Un mort dans une collision frontale près d'Amos,,,https://ici.radio-canada.ca/nouvelle/1129541/accident-mortel-surete-quebec-amos,2021-07-23 16:06:29,local
Amos,accident,10,La Presse,L'éditeur Michel Brûlé meurt dans un accident de vélo au Brésil,2021-05-31,53,https://www.lapresse.ca/actualites/2021-05-31/l-editeur-michel-brule-meurt-dans-un-accident-de-velo-au-bresil.php,2021-07-23 16:06:29,local
Amos,accident,11,MédiAT,Collision sur la route 111 Ouest à Amos,2021-02-23,150,https://mediat.ca/nouvelles/collision-sur-la-route-111-ouest-a-amos/,2021-07-23 16:06:29,local
Amos,accident,12,ICI.Radio-Canada.ca,Capacités affaiblies par l'alcool et conduite imprudente à l'origine d'un accident mortel sur la 117,2021-01-12,192,https://ici.radio-canada.ca/nouvelle/1762593/alcool-conduite-accident-mortel,2021-07-23 16:06:30,local
Amos,accident,13,ICI.Radio-Canada.ca,La CSN réclame une enquête sur un accident mortel sur la route Billy-Diamond,2021-06-03,50,https://ici.radio-canada.ca/nouvelle/1798647/ambulanciers-enquete-accident-relais-381,2021-07-23 16:06:30,local
Amos,accident,14,iHeartRadio,Accident mortel à La Reine : la SQ enquête,2021-06-16,37,https://www.iheartradio.ca/energie/energie-rouyn/nouvelles/accident-mortel-a-la-reine-la-sq-enquete-1.15430359,2021-07-23 16:06:30,local
Amos,accident,15,ICI.Radio-Canada.ca,La Ville d'Amos veut améliorer la fluidité sur la 1re Avenue,2021-06-15,38,https://ici.radio-canada.ca/nouvelle/1801823/travaux-amos-fluidite-premiere-avenue,2021-07-23 16:06:30,local
Amos,accident,16,ICI.Radio-Canada.ca,Un appui de taille pour le projet du Centre récréatif Dominic-Boutin,2021-05-10,74,https://ici.radio-canada.ca/nouvelle/1792042/subvention-centre-recreatif-dominic-boutin-saint-marc-figuery,2021-07-23 16:06:30,local
Amos,accident,17,Le Droit - Groupe Capitales Médias,Enquête réclamée pour l'apparition dénudée de Will Amos,2021-04-15,99,https://www.ledroit.com/actualites/enquete-reclamee-pour-lapparition-denudee-de-will-amos-3f8a18520df3135e9e34118c7c4f8250,2021-07-23 16:06:31,local
Amos,accident,18,ICI.Radio-Canada.ca,Une manifestation « pour toutes les personnes qui ont perdu la vie sur la route 109 »,2021-05-17,67,https://ici.radio-canada.ca/nouvelle/1793748/manifestation-route-109-amos-pikogan,2021-07-23 16:06:31,local
Amos,accident,19,ICI.Radio-Canada.ca,Accident mortel à Cadillac : une accusation criminelle contre Jesse Bibeau,2020-09-10,316,https://ici.radio-canada.ca/nouvelle/1732928/accident-voiture-mort-cadillac-alcool-volant-accusation,2021-07-23 16:06:31,local
Amos,accident,20,ICI.Radio-Canada.ca,Amos aura sa piste de ski de fond éclairée,2021-04-09,105,https://ici.radio-canada.ca/nouvelle/1783607/piste-ski-fond-eclairage-amos,2021-07-23 16:06:31,local
Amos,accident,21,MédiAT,L'accident à Val-Senneville sur la 397 a fait un mort,2021-03-28,117,https://mediat.ca/nouvelles/accident-a-val-senneville-sur-la-397/,2021-07-23 16:06:32,local
Amos,accident,22,ICI.Radio-Canada.ca,Deux femmes blessées dans une collision frontale à Amos,,,https://ici.radio-canada.ca/nouvelle/1114824/deux-femmes-blessees-dans-une-collision-frontale-a-amos,2021-07-23 16:06:32,local
Amos,accident,23,ICI.Radio-Canada.ca,D'autres réductions de services à prévoir pour les blocs opératoires de Val-d'Or et Amos,2021-04-29,85,https://ici.radio-canada.ca/nouvelle/1789069/cisssat-reduction-services-penurie-main-doeuvre-amos-valdor,2021-07-23 16:06:32,local
Amos,accident,24,TVA Nouvelles,Un homme atteint par balle perd la vie à Montréal-Nord,2021-05-29,55,https://www.tvanouvelles.ca/2021/05/29/un-homme-atteint-par-balle-dans-montreal-nord,2021-07-23 16:06:32,local
Amos,accident,25,MédiAT,Grave accident à Taschereau,2021-04-02,112,https://mediat.ca/nouvelles/grave-accident-a-taschereau/,2021-07-23 16:06:32,local
Amos,décès OR mort,1,ICI.Radio-Canada.ca,Mort de Michaël Bédard : pas d'accusations contre le policier impliqué dans l'accident,2021-07-22,1,https://ici.radio-canada.ca/nouvelle/1810992/accident-mortel-route-dpcp-amos-route-117,2021-07-23 16:07:09,local
Amos,décès OR mort,2,ICI.Radio-Canada.ca,Homme dans un état grave après une intervention policière à Amos : le BEI enquête,2021-07-06,17,https://ici.radio-canada.ca/nouvelle/1806872/homme-hospitalise-poste-sq-bureau-enquetes-independantes,2021-07-23 16:07:09,local
Amos,décès OR mort,3,NecrologieCanada,LABBe Ginette 1951 2021,2021-07-16,7,https://necrocanada.com/deces-2021/labbe-ginette-1951-2021/,2021-07-23 16:07:09,local
Amos,décès OR mort,4,NecrologieCanada,GAUTHIER Lisette 1943 2021,2021-07-14,9,https://necrocanada.com/deces-2021/gauthier-lisette-1943-2021/,2021-07-23 16:07:10,local
Amos,décès OR mort,5,NecrologieCanada,PETIT Michel 1950 2021,2021-07-07,16,https://necrocanada.com/deces-2021/petit-michel-1950-2021/,2021-07-23 16:07:10,local
Amos,décès OR mort,6,NecrologieCanada,Kengal Angel Gail Amos Morley August 20 1985 July 7 2021,2021-07-12,11,https://necrocanada.com/deces-2021/kengal-angel-gail-amos-morley-august-20-1985july-7-2021/,2021-07-23 16:07:10,local
Amos,décès OR mort,7,Le Nouvelliste - Groupe Capitales Médias,Amos Daragon - Le Phénix : une deuxième version plus électrisante,2021-07-03,20,https://www.lenouvelliste.ca/arts/amos-daragon-le-phenix--une-deuxieme-version-plus-electrisante-62d655607905b60e7f57dabb2b8edb77,2021-07-23 16:07:10,local
Amos,décès OR mort,8,NecrologieCanada,BRASSARD Cecile 1936 2021,2021-07-19,4,https://necrocanada.com/deces-2021/brassard-cecile-1936-2021/,2021-07-23 16:07:10,local
Amos,décès OR mort,9,NecrologieCanada,PAQUETTE Jean-Louis 1937 2021,2021-06-29,24,https://necrocanada.com/deces-2021/paquette-jean-louis-1937-2021/,2021-07-23 16:07:10,local
Amos,décès OR mort,10,NecrologieCanada,SILLS Raymonde 1936 2021,2021-06-27,26,https://necrocanada.com/deces-2021/sills-raymonde-1936-2021/,2021-07-23 16:07:11,local
Amos,décès OR mort,11,NecrologieCanada,BRAND Engelbertus ‘Bert’ of Exeter 2021,2021-07-16,7,https://necrocanada.com/deces-2021/brand-engelbertus-bert-of-exeter-2021/,2021-07-23 16:07:11,local
Amos,décès OR mort,12,NecrologieCanada,Helen Mary Burtis 1928 2021,2021-07-02,21,https://necrocanada.com/deces-2021/helenmaryburtis-1928-2021/,2021-07-23 16:07:11,local
Amos,décès OR mort,13,ICI.Radio-Canada.ca,Noyade dans une poursuite policière à Amos : pas d'accusations,2021-04-19,95,https://ici.radio-canada.ca/nouvelle/1786223/noyade-poursuite-policiere-amos-pas-accusation-dpcp,2021-07-23 16:07:11,local
Amos,décès OR mort,14,Outre-mer la 1ère,"Assassinat du président Jovenel Moïse : ""C'est une très mauvaise nouvelle pour Haïti"" - Outre-mer la 1ère",2021-07-07,16,https://la1ere.francetvinfo.fr/assassinat-du-president-jovenel-moise-c-est-une-tres-mauvaise-nouvelle-pour-haiti-1053589.html,2021-07-23 16:07:12,local
Amos,décès OR mort,15,La Presse,Le BEI enquête sur la mort d'un suspect à Amos,2020-09-27,299,https://www.lapresse.ca/actualites/justice-et-faits-divers/2020-09-27/le-bei-enquete-sur-la-mort-d-un-suspect-a-amos.php,2021-07-23 16:07:12,local
Amos,décès OR mort,16,NecrologieCanada,COMTOIS Celine 1941 2020,2021-06-25,28,https://necrocanada.com/deces-2021/comtois-celine-1941-2020/,2021-07-23 16:07:12,local
Amos,décès OR mort,17,ICI.Radio-Canada.ca,Le Refuge Pageau d'Amos a perdu sa mère fondatrice,2021-05-13,71,https://ici.radio-canada.ca/nouvelle/1792897/refuge-pageau-amos-deces-louise-fondatrice,2021-07-23 16:07:12,local
Amos,décès OR mort,18,NecrologieCanada,BeCHARD Georges 1949 2020,2021-06-30,23,https://necrocanada.com/deces-2021/bechard-georges-1949-2020/,2021-07-23 16:07:12,local
Amos,décès OR mort,19,Radio-Canada.ca,Article | Sur la trace des enfants autochtones disparus,2021-05-25,59,https://ici.radio-canada.ca/espaces-autochtones/1795170/disparition-quebec-enfants-premieres-nations-morts-hopital,2021-07-23 16:07:13,local
Amos,décès OR mort,20,ICI.Radio-Canada.ca,Une manifestation « pour toutes les personnes qui ont perdu la vie sur la route 109 »,2021-05-17,67,https://ici.radio-canada.ca/nouvelle/1793748/manifestation-route-109-amos-pikogan,2021-07-23 16:07:13,local
Amos,décès OR mort,21,La Presse,Un jeune homme tué par balle à Montréal-Nord,2021-05-29,55,https://www.lapresse.ca/actualites/justice-et-faits-divers/2021-05-29/un-jeune-homme-tue-par-balle-a-montreal-nord.php,2021-07-23 16:07:13,local
Amos,décès OR mort,22,Le Droit - Groupe Capitales Médias,Le député Will Amos «nu» lors de la période de questions à Ottawa,2021-04-14,100,https://www.ledroit.com/actualites/le-depute-will-amos-nu-lors-de-la-periode-de-questions-a-ottawa-fba299fc5f3807b71753a2768f4adde6,2021-07-23 16:07:13,local
Amos,décès OR mort,23,ICI.Radio-Canada.ca,Le projet Dumont pourrait décoller cette année à Launay,2021-04-30,84,https://ici.radio-canada.ca/nouvelle/1789427/projet-dumont-nickel-launay,2021-07-23 16:07:13,local
Amos,décès OR mort,24,Le Journal de Québec,"Mort de Joyce Echaquan: «on a assisté à un meurtre au second degré», soutient le Dr Stanley Vollant",2020-10-02,294,https://www.journaldequebec.com/2020/10/03/mort-de-joyce-echaquan-on-a-assiste-a-un-meurtre-au-seconde-degre-soutient-le-dr-stanley-vollant,2021-07-23 16:07:14,local
Amos,décès OR mort,25,Le Devoir,Les communautés autochtones n'écartent pas les fouilles radar,2021-06-02,51,https://www.ledevoir.com/societe/606648/pensionnats-autochtones-les-communautes-autochtones-du-quebec-n-ecartent-pas-les-fouilles-radar,2021-07-23 16:07:14,local
Amos,incendie,1,ICI.Radio-Canada.ca,Un feu de broussailles mobilise les pompiers d'Amos,2021-04-10,104,https://ici.radio-canada.ca/nouvelle/1783808/incendie-feu-foret-sopfeu-abitibi-temiscaminue-pompiers,2021-07-23 16:07:22,local
Amos,incendie,2,Radio-Canada.ca,Une centaine de pompiers en renfort pour combattre l'incendie de Landrienne,2021-06-19,34,https://ici.radio-canada.ca/nouvelle/1803016/feu-landrienne-sopfeu-abitibi,2021-07-23 16:07:22,local
Amos,incendie,3,ICI.Radio-Canada.ca,"Le feu de forêt de Landrienne est contenu, selon la SOPFEU",2021-06-20,33,https://ici.radio-canada.ca/nouvelle/1802943/feu-incendie-landrienne-sopfeu-pompier-route-386,2021-07-23 16:07:22,local
Amos,incendie,4,ICI.Radio-Canada.ca,Des avions-citernes de la SOPFEU interviennent au Témiscamingue,2021-05-20,64,https://ici.radio-canada.ca/nouvelle/1794868/avions-citernes-sopfeu-temiscamingue-nddn,2021-07-23 16:07:22,local
Amos,incendie,5,ICI.Radio-Canada.ca,Le pont de la Calamité en Abitibi-Ouest détruit par les flammes,2021-06-01,52,https://ici.radio-canada.ca/nouvelle/1797696/pont-couvert-abitibi-ouest-incendie,2021-07-23 16:07:23,local
Amos,incendie,6,ICI.Radio-Canada.ca,Concert au profit des sinistrés de l'incendie de l'avenue Carter à Rouyn-Noranda,2021-04-11,103,https://ici.radio-canada.ca/nouvelle/1783887/incendie-rouyn-noranda-sinistres-concert-solidarite,2021-07-23 16:07:23,local
Amos,incendie,7,ICI.Radio-Canada.ca,Début d'incendie dans un commerce de Val-d'Or,2021-05-31,53,https://ici.radio-canada.ca/nouvelle/1797583/incendie-charcuterie-nord-valdor,2021-07-23 16:07:23,local
Amos,incendie,8,ICI.Radio-Canada.ca,Gurdeep Pandher amène la danse pendjabi à Québec,2021-07-10,13,https://ici.radio-canada.ca/nouvelle/1808061/gurdeep-pandher-danse-quebec-bhangra,2021-07-23 16:07:23,local
Amos,incendie,9,ICI.Radio-Canada.ca,Feux de forêt : les prochains jours seront « critiques » selon la SOPFEU,2021-06-16,37,https://ici.radio-canada.ca/nouvelle/1802155/sopfeu-feux-foret-abitibi-temiscamingue,2021-07-23 16:07:23,local
Amos,incendie,10,Radio-Canada.ca,Les pompiers progressent dans leur lutte contre le feu à Landrienne,2021-06-20,33,https://ici.radio-canada.ca/nouvelle/1803170/feu-incendie-landrienne-sopfeu-pompiers,2021-07-23 16:07:24,local
Amos,incendie,11,ICI.Radio-Canada.ca,Un centre d'entraînement des pompiers verra le jour à Macamic,2021-05-30,54,https://ici.radio-canada.ca/nouvelle/1797259/feu-incendie-formation-centre-macamic-abitibi-ouest,2021-07-23 16:07:24,local
Amos,incendie,12,MédiAT,Incendie majeur à Rouyn-Noranda,2021-03-13,132,https://mediat.ca/nouvelles/incendie-majeur-a-rouyn-noranda/,2021-07-23 16:07:24,local
Amos,incendie,13,ICI.Radio-Canada.ca,Près de 24 heures pour maîtriser un feu dans la fosse Canadian Malartic,2021-01-17,187,https://ici.radio-canada.ca/nouvelle/1763844/incendie-mine-canadian-malartic-fosse,2021-07-23 16:07:24,local
Amos,incendie,14,ICI.Radio-Canada.ca,Un incendie détruit partiellement une résidence d'Amos,,,https://ici.radio-canada.ca/nouvelle/1141733/incendie-chemin-jacob-amos,2021-07-23 16:07:24,local
Amos,incendie,15,Outre-mer la 1ère,"Assassinat du président Jovenel Moïse : ""C'est une très mauvaise nouvelle pour Haïti"" - Outre-mer la 1ère",2021-07-07,16,https://la1ere.francetvinfo.fr/assassinat-du-president-jovenel-moise-c-est-une-tres-mauvaise-nouvelle-pour-haiti-1053589.html,2021-07-23 16:07:24,local
Amos,incendie,16,TVA Nouvelles,Un homme atteint par balle perd la vie à Montréal-Nord,2021-05-29,55,https://www.tvanouvelles.ca/2021/05/29/un-homme-atteint-par-balle-dans-montreal-nord,2021-07-23 16:07:25,local
Amos,incendie,17,ICI.Radio-Canada.ca,"Danger d'incendie : retour à la normale au Témiscamingue, toujours élevé à Val-d'Or",,,https://ici.radio-canada.ca/nouvelle/1239264/danger-incendie-bas-modere-abitibi-temiscamingue,2021-07-23 16:07:25,local
Amos,incendie,18,TVA Nouvelles,Coups de feu à profusion dans l'est de Montréal,2021-02-09,164,https://www.tvanouvelles.ca/2021/02/09/coups-de-feu-a-profusion-dans-lest-de-montreal-1,2021-07-23 16:07:25,local
Amos,incendie,19,iHeartRadio,Un nouveau directeur du Service de sécurité incendie à Val-d'Or,2021-03-02,143,https://www.iheartradio.ca/energie/energie-rouyn/nouvelles/un-nouveau-directeur-du-service-de-securite-incendie-a-val-d-or-1.14688301,2021-07-23 16:07:25,local
Amos,incendie,20,ICI.Radio-Canada.ca,L'incendie à la Maison des jeunes d'Amos a-t-elle changé la perception de ce lieu?,,,https://ici.radio-canada.ca/nouvelle/1259340/lincendie-a-la-maison-des-jeunes-damos-a-t-elle-change-la-perception-de-ce-lieu,2021-07-23 16:07:26,local
Amos,incendie,21,MédiAT,Incendie dans une résidence de Vassan,2021-04-13,101,https://mediat.ca/nouvelles/incendie-dans-une-residence-de-vassan/,2021-07-23 16:07:26,local
Amos,incendie,22,Le Soleil - Groupe Capitales Médias,Le député libéral William Amos encore dans l'embarras après avoir été vu uriner,2021-05-28,56,https://www.lesoleil.com/actualite/le-depute-liberal-william-amos-encore-dans-lembarras-apres-avoir-ete-vu-uriner-c5df02dc02073f378963658c0ac8649e,2021-07-23 16:07:26,local
Amos,incendie,23,MédiAT,"ENTREVUE : Renaître après un incendie, la Maison des jeunes Desjardins d'Amos revient en force",2020-09-18,308,https://mediat.ca/nouvelles/entrevue-renaitre-apres-un-incendie-la-maison-des-jeunes-desjardins-damos-revient-en-force/,2021-07-23 16:07:26,local
Amos,incendie,24,La Tribune - Groupe Capitales Médias,Incendie criminel chez TVA: le conspirationniste plaide coupable,2021-03-19,126,https://www.latribune.ca/actualites/le-fil-groupe-capitales-medias/incendie-criminel-chez-tva-le-conspirationniste-plaide-coupable-8785d14f6ef363363132934ed5fcdceb,2021-07-23 16:07:26,local
Amos,incendie,25,ICI.Radio-Canada.ca,Amos n'a pas jeté l'éponge pour la relance de l'usine Résolu,2021-05-07,77,https://ici.radio-canada.ca/nouvelle/1791339/usine-resolu-amos-relance,2021-07-23 16:07:27,local
Amos,police OR Sûreté,1,ICI.Radio-Canada.ca,Homme dans un état grave après une intervention policière à Amos : le BEI enquête,2021-07-06,17,https://ici.radio-canada.ca/nouvelle/1806872/homme-hospitalise-poste-sq-bureau-enquetes-independantes,2021-07-23 16:07:34,local
Amos,police OR Sûreté,2,ICI.Radio-Canada.ca,Mort de Michaël Bédard : pas d'accusations contre le policier impliqué dans l'accident,2021-07-22,1,https://ici.radio-canada.ca/nouvelle/1810992/accident-mortel-route-dpcp-amos-route-117,2021-07-23 16:07:35,local
Amos,police OR Sûreté,3,Le Citoyen Rouyn - La Sarre,17 chefs d'accusation après avoir fui la police,2021-06-29,24,https://www.lecitoyenrouynlasarre.com/article/2021/06/29/17-chefs-d-accusation-apres-avoir-fui-la-police,2021-07-23 16:07:35,local
Amos,police OR Sûreté,4,ICI.Radio-Canada.ca,La MRC Abitibi vient en aide à la Maison du Bouleau Blanc,2021-07-02,21,https://ici.radio-canada.ca/nouvelle/1806169/don-maison-bouleau-blanc-soins-palliatifs-amos,2021-07-23 16:07:35,local
Amos,police OR Sûreté,5,ICI.Radio-Canada.ca,Un homme qui roulait à 245 km/h sur la route 111 a été arrêté,2021-07-13,10,https://ici.radio-canada.ca/nouvelle/1808714/amende-ticket-vitesse-abitibi-moto-arrete-homme,2021-07-23 16:07:35,local
Amos,police OR Sûreté,6,ICI.Radio-Canada.ca,Noyade dans une poursuite policière à Amos : pas d'accusations,2021-04-19,95,https://ici.radio-canada.ca/nouvelle/1786223/noyade-poursuite-policiere-amos-pas-accusation-dpcp,2021-07-23 16:07:35,local
Amos,police OR Sûreté,7,Le Journal de Montréal,Intercepté à 155 km/h au-dessus de la limite permise,2021-07-14,9,https://www.journaldemontreal.com/2021/07/14/intercepte-a-155-km-h-au-dessus-de-la-limite-permise,2021-07-23 16:07:36,local
Amos,police OR Sûreté,8,TVA Nouvelles,Un homme atteint par balle perd la vie à Montréal-Nord,2021-05-29,55,https://www.tvanouvelles.ca/2021/05/29/un-homme-atteint-par-balle-dans-montreal-nord,2021-07-23 16:07:36,local
Amos,police OR Sûreté,9,ICI.Radio-Canada.ca,Disparition de Jacques Hébert : la Sûreté du Québec réduit ses effectifs à Berry,2020-08-26,331,https://ici.radio-canada.ca/nouvelle/1729218/disparition-jacques-hebert-berry-amos-benevoles-recherches,2021-07-23 16:07:36,local
Amos,police OR Sûreté,10,ICI.Radio-Canada.ca,Le Bureau des enquêtes indépendantes enquête sur un décès à Amos,2020-09-28,298,https://ici.radio-canada.ca/nouvelle/1736866/amos-mort-noyer-riviere-harricana-policiers-police,2021-07-23 16:07:36,local
Amos,police OR Sûreté,11,Radio-Canada.ca,Un homme meurt après avoir été trouvé étendu devant le poste de police de Kuujjuarapik,2021-04-30,84,https://ici.radio-canada.ca/nouvelle/1789271/kativk-eeyou-eenou-service-de-police-enquete,2021-07-23 16:07:36,local
Amos,police OR Sûreté,12,ICI.Radio-Canada.ca,Des sections de la route 395 seront asphaltées cet été,2021-06-07,46,https://ici.radio-canada.ca/nouvelle/1799531/route-mtq-amos-preissac-sainte-gertrude-manneville,2021-07-23 16:07:37,local
Amos,police OR Sûreté,13,La Presse,Une fusillade éclate à Montréal-Nord mercredi matin,2020-12-30,205,https://www.lapresse.ca/actualites/justice-et-faits-divers/2020-12-30/une-fusillade-eclate-a-montreal-nord-mercredi-matin.php,2021-07-23 16:07:37,local
Amos,police OR Sûreté,14,ICI.Radio-Canada.ca,Le projet Dumont pourrait décoller cette année à Launay,2021-04-30,84,https://ici.radio-canada.ca/nouvelle/1789427/projet-dumont-nickel-launay,2021-07-23 16:07:37,local
Amos,police OR Sûreté,15,iHeartRadio,Importante frappe contre la drogue en région,2021-06-04,49,https://www.iheartradio.ca/energie/energie-rouyn/nouvelles/importante-frappe-contre-la-drogue-en-region-1.15353006,2021-07-23 16:07:37,local
Amos,police OR Sûreté,16,ICI.Radio-Canada.ca,Le coroner demande à la SQ d'en faire plus pour la santé mentale de ses policiers,2021-04-10,104,https://ici.radio-canada.ca/nouvelle/1783356/suicide-martin-bernier-enqueteur-rouyn-noranda,2021-07-23 16:07:37,local
Amos,police OR Sûreté,17,ICI.Radio-Canada.ca,La Ville d'Amos obtient 10 M$ de Québec pour son futur parc industriel,2021-04-09,105,https://ici.radio-canada.ca/nouvelle/1783663/annonce-quebec-futur-parc-industriel-amos,2021-07-23 16:07:38,local
Amos,police OR Sûreté,18,Le Journal de Montréal,Coups de feu à profusion dans l'Est de Montréal,2021-02-09,164,https://www.journaldemontreal.com/2021/02/09/coups-de-feu-a-profusion-dans-lest-de-montreal,2021-07-23 16:07:38,local
Amos,police OR Sûreté,19,ICI.Radio-Canada.ca,Amos veut maximiser le transport des marchandises par le train,2021-04-20,94,https://ici.radio-canada.ca/nouvelle/1786523/amos-transport-train-gare-multimodale,2021-07-23 16:07:38,local
Amos,police OR Sûreté,20,ICI.Radio-Canada.ca,La Ville d'Amos veut améliorer la fluidité sur la 1re Avenue,2021-06-15,38,https://ici.radio-canada.ca/nouvelle/1801823/travaux-amos-fluidite-premiere-avenue,2021-07-23 16:07:38,local
Amos,police OR Sûreté,21,Radio-Canada.ca,Enquête pour homicide à Puvirnituq : un suspect comparaît lundi,2021-03-04,141,https://ici.radio-canada.ca/espaces-autochtones/1774124/nunavik-police-sq-amos-comparution,2021-07-23 16:07:39,local
Amos,police OR Sûreté,22,ICI.Radio-Canada.ca,Amos aura sa piste de ski de fond éclairée,2021-04-09,105,https://ici.radio-canada.ca/nouvelle/1783607/piste-ski-fond-eclairage-amos,2021-07-23 16:07:39,local
Amos,police OR Sûreté,23,Le Soleil - Groupe Capitales Médias,Le député libéral William Amos encore dans l'embarras après avoir été vu uriner,2021-05-28,56,https://www.lesoleil.com/actualite/le-depute-liberal-william-amos-encore-dans-lembarras-apres-avoir-ete-vu-uriner-c5df02dc02073f378963658c0ac8649e,2021-07-23 16:07:39,local
Amos,police OR Sûreté,24,ICI.Radio-Canada.ca,Amos n'a pas jeté l'éponge pour la relance de l'usine Résolu,2021-05-07,77,https://ici.radio-canada.ca/nouvelle/1791339/usine-resolu-amos-relance,2021-07-23 16:07:39,local
Amos,police OR Sûreté,25,La Presse,Pensionnat de Saint-Marc-de-Figuery | « Il faut fouiller ici »,2021-06-21,32,https://www.lapresse.ca/actualites/2021-06-21/pensionnat-de-saint-marc-de-figuery/il-faut-fouiller-ici.php,2021-07-23 16:07:39,local
Amos,Cégep,1,Le Citoyen Rouyn - La Sarre,Shawn Lanoue prend la barre des Forestiers d'Amos,2021-07-21,2,https://www.lecitoyenrouynlasarre.com/article/2021/07/21/shawn-lanoue-prend-la-barre-des-forestiers-d-amos,2021-07-23 16:07:47,local
Amos,Cégep,2,ICI.Radio-Canada.ca,Le Cégep offrira le programme de Techniques de pharmacie au campus d'Amos,2020-12-16,219,https://ici.radio-canada.ca/nouvelle/1757721/techniques-pharmacie-abitibi-temiscamingue-amos,2021-07-23 16:07:47,local
Amos,Cégep,3,ICI.Radio-Canada.ca,Plus de 250 enseignants du Cégep de l'Abitibi-Témiscamingue sont en grève,2021-05-11,73,https://ici.radio-canada.ca/nouvelle/1792317/greve-enseignants-cegep-abitibi-temiscamingue,2021-07-23 16:07:47,local
Amos,Cégep,4,Le Citoyen Val-d'Or - Amos,03 mai 2021 Deux jours de grève au Cégep,2021-05-03,81,https://www.lecitoyenvaldoramos.com/article/2021/05/03/deux-jours-de-greve-au-cegep,2021-07-23 16:07:47,local
Amos,Cégep,5,ICI.Radio-Canada.ca,Des changements mineurs au Cégep de l'Abitibi-Témiscamingue pour le confinement,2021-01-07,197,https://ici.radio-canada.ca/nouvelle/1761536/cegep-cours-session-hiver-reconfinement-ferme,2021-07-23 16:07:48,local
Amos,Cégep,6,Le Citoyen Val-d'Or - Amos,01 mai 2021 Le Cégep plonge dans le esport,2021-05-01,83,https://www.lecitoyenvaldoramos.com/article/2021/05/01/le-cegep-plonge-dans-le-esport,2021-07-23 16:07:48,local
Amos,Cégep,7,Radio-Canada.ca,Recrutement d'étudiants indiens : Québec perd une première bataille judiciaire,2021-01-12,192,https://ici.radio-canada.ca/nouvelle/1762478/recrutement-immigration-inde-kolan-mastantuono-cegep-fraudes-upac,2021-07-23 16:07:48,local
Amos,Cégep,8,ICI.Radio-Canada.ca,"Recrutement intense, cours en anglais : le lucratif marché des étudiants indiens au Québec",2020-11-17,248,https://ici.radio-canada.ca/nouvelle/1749970/immigration-quebec-inde-matrix-canada-soupcons-etudes,2021-07-23 16:07:48,local
