Chisasibi,Chine,14,Droit-Inc.com,"Guerrier un jour, avocat toujours…",,,https://www.droit-inc.com/article5430-Guerrier-un-jour-avocat-toujours,2021-08-03 18:13:24,national
Chisasibi,Chine,15,Le Monde,Avec les Cris et les Inuits dans les terres du Grand Nord,,,https://www.lemonde.fr/international/article/2008/07/01/avec-les-cris-et-les-inuits-dans-les-terres-du-grand-nord_1064821_3210.html,2021-08-03 18:13:25,national
Chisasibi,Biden OR Trump,1,Radio-Canada.ca,L'épine dorsale de Chisasibi : deux femmes à la tête du conseil de bande,2021-04-26,99,http://ici.radio-canada.ca/amp/1787392/chisasibi-gouvernance-nation-cri-femme-politique,2021-08-03 18:13:31,national
Chisasibi,Biden OR Trump,2,ICI.Radio-Canada.ca,Une fausse rumeur a fait craindre le pire à Chisasibi,2021-01-21,194,https://ici.radio-canada.ca/espaces-autochtones/1121569/une-fausse-rumeur-a-fait-craindre-le-pire-a-chisasibi,2021-08-03 18:13:31,national
Chisasibi,Biden OR Trump,3,ICI.Radio-Canada.ca,D'importants investissements pour un réseau Internet plus rapide dans le Nord-du-Québec,2020-11-24,252,https://ici.radio-canada.ca/nouvelle/1752082/internet-haute-vitesse-eeyou-lebel-sur-quevillon-matagami,2021-08-03 18:13:31,national
Chisasibi,Biden OR Trump,4,Radio-Canada.ca,Tout ce que vous devez savoir sur l'éclipse solaire de jeudi,2021-06-09,55,http://ici.radio-canada.ca/amp/1799735/eclipse-annulaire-partielle-soleil-observation-jeudi,2021-08-03 18:13:31,national
Chisasibi,Biden OR Trump,5,Le Devoir,La Baie-James a enrichi à la fois le Québec et les façons de faire d'Hydro-Québec,2021-04-30,95,https://www.ledevoir.com/opinion/idees/599806/idees-la-baie-james-a-enrichi-a-la-fois-le-quebec-et-les-facons-de-faire-d-hydro-quebec,2021-08-03 18:13:32,national
Chisasibi,Biden OR Trump,6,ICI.Radio-Canada.ca,Guide 101 des pow-wow,2021-01-21,194,https://ici.radio-canada.ca/espaces-autochtones/1034841/pow-wow-autochtones-calendrier,2021-08-03 18:13:32,national
Chisasibi,Biden OR Trump,7,Le Devoir,Recul du français comme langue de travail principale au Québec,,,https://www.ledevoir.com/politique/canada/514207/recul-du-francais-comme-langue-de-travail-principale-au-quebec,2021-08-03 18:13:32,national
Chisasibi,Biden OR Trump,8,Le Devoir,"Entretien avec Georges-Yvan Gagnon, président d'Augyva - Touchez du fer !",,,https://www.ledevoir.com/economie/323389/entretien-avec-georges-yvan-gagnon-president-d-augyva-touchez-du-fer,2021-08-03 18:13:32,national
Chisasibi,Biden OR Trump,9,LaPresse.ca,Élections Québec 2018 | élections québec 2018,,,https://www.lapresse.ca/actualites/elections-quebec-2018/,2021-08-03 18:13:32,national
Chisasibi,Biden OR Trump,10,Le Devoir,Tous égaux devant la mort?,,,https://www.ledevoir.com/opinion/chroniques/491350/tous-egaux-devant-la-mort,2021-08-03 18:13:32,national
Chisasibi,déficit,1,La Sentinelle et le Jamésien,Feu vert pour Maheux-Cree,2021-03-13,143,https://www.lasentinelle.ca/feu-vert-pour-maheux-cree/,2021-08-03 18:13:38,national
Chisasibi,déficit,2,Le Journal de Québec,Retour d'une liaison aérienne entre Val-D'or et Montréal,2020-08-18,350,https://www.journaldequebec.com/2020/08/18/retour-dune-liaison-aerienne-entre-val-dor-et-montreal,2021-08-03 18:13:38,national
Chisasibi,déficit,3,LesAffaires.com,Les principaux acteurs du « Cri inc. » | LesAffaires.com,,,https://www.lesaffaires.com/dossier/grand-nord/les-principaux-acteurs-du--cri-inc-/549186,2021-08-03 18:13:39,national
