Sainte-Anne-des-Monts,police OR Sûreté,16,L’Avantage gaspésien,Un policier annemontois blanchi pour une intervention ayant causé des lésions à un individu,2021-04-08,117,https://www.lavantagegaspesien.com/article/2021/04/08/un-policier-annemontois-blanchi-pour-une-intervention-ayant-cause-des-lesions-a-un-individu,2021-08-03 09:10:20,local
Sainte-Anne-des-Monts,police OR Sûreté,17,L’Avantage gaspésien,Des stupéfiants saisis dans deux résidences de Matane,2021-04-04,121,https://www.lavantagegaspesien.com/article/2021/04/04/des-stupefiants-saisis-dans-deux-residences-de-matane,2021-08-03 09:10:20,local
Sainte-Anne-des-Monts,police OR Sûreté,18,ICI.Radio-Canada.ca,Accident mortel à Sainte-Anne-des-Monts : pas d'accusations contre les policiers,2020-10-28,279,https://ici.radio-canada.ca/nouvelle/1745150/dpcp-intervention-policiers-mort-marie-eve-mimeault-ste-anne-des-monts-bei,2021-08-03 09:10:20,local
Sainte-Anne-des-Monts,police OR Sûreté,19,ICI.Radio-Canada.ca,L'homme porté disparu près de Carleton-sur-Mer a été retrouvé,2021-04-04,121,https://ici.radio-canada.ca/nouvelle/1782212/retrouve-disparition-felix-falardeau-recherches-police,2021-08-03 09:10:20,local
Sainte-Anne-des-Monts,police OR Sûreté,20,Le Soleil - Groupe Capitales Médias,Camping sauvage: la Gaspésie a fait ses devoirs,2021-04-24,101,https://www.lesoleil.com/actualite/en-region/camping-sauvage-la-gaspesie-a-fait-ses-devoirs-08e412c380d502b4b7c9e939e81c670c,2021-08-03 09:10:20,local
Sainte-Anne-des-Monts,police OR Sûreté,21,ICI.Radio-Canada.ca,Des accusations pour le meurtre de Maxime Dugas-Lepage à Sainte-Anne-des-Monts,,,https://ici.radio-canada.ca/nouvelle/1493031/arrestations-disparition-sainte-anne-des-monts-janvier-2020,2021-08-03 09:10:20,local
Sainte-Anne-des-Monts,police OR Sûreté,22,Le Soleil - Groupe Capitales Médias,Accident mortel à Sainte-Anne-des-Monts: le travail de la SQ sous enquête,,,https://www.lesoleil.com/actualite/en-region/accident-mortel-a-sainte-anne-des-monts-le-travail-de-la-sq-sous-enquete-921ee1ac9059ca777c8c77749f717353,2021-08-03 09:10:21,local
Sainte-Anne-des-Monts,police OR Sûreté,23,L’Avantage gaspésien,La Sûreté du Québec ordonne la fermeture du Dollarama de Sainte-Anne-des-Monts,,,https://www.lavantagegaspesien.com/article/2020/04/24/la-surete-du-quebec-ordonne-la-fermeture-du-dollarama-de-sainte-anne-des-monts,2021-08-03 09:10:21,local
Sainte-Anne-des-Monts,police OR Sûreté,24,L’Avantage gaspésien,Bilan du démantèlement d'un réseau de vente de stupéfiants à Matane 17 nov,2020-11-17,259,https://www.lavantagegaspesien.com/article/2020/11/17/bilan-du-demantelement-d-un-reseau-de-vente-de-stupefiants-a-matane,2021-08-03 09:10:21,local
Sainte-Anne-des-Monts,police OR Sûreté,25,ICI.Radio-Canada.ca,Un suspect arrêté pour une présumée agression sexuelle à Gaspé,2021-05-17,78,https://ici.radio-canada.ca/nouvelle/1793846/arrestation-surete-quebec-sq-agression-sexuelle-ecole-secondaire-ce-pouliot,2021-08-03 09:10:21,local
Sainte-Anne-des-Monts,Cégep,1,Le Devoir,L'intelligence artificielle au service de la faune marine,2021-08-03,0,https://www.ledevoir.com/societe/science/622272/science-l-intelligence-artificielle-au-service-de-la-faune-marine,2021-08-03 09:10:31,local
Sainte-Anne-des-Monts,Cégep,2,ICI.Radio-Canada.ca,Le Cégep de la Gaspésie-Les Îles prêt à reprendre la formation des étudiants étrangers,2021-06-11,53,https://ici.radio-canada.ca/nouvelle/1800656/cegep-gaspesie-iles-rapport-enquete-formation-etudiants-etrangers,2021-08-03 09:10:31,local
Sainte-Anne-des-Monts,Cégep,3,journal le soir,La relance de l'énergie éolienne,2021-07-18,16,https://journallesoir.ca/2021/07/18/la-relance-de-lenergie-eolienne/,2021-08-03 09:10:31,local
Sainte-Anne-des-Monts,Cégep,4,ICI.Radio-Canada.ca,La vaccination sans rendez-vous est amorcée au Cégep de la Gaspésie | Coronavirus,2021-05-14,81,https://ici.radio-canada.ca/nouvelle/1793096/vaccination-etudiants-cegep-gaspesie-moderna-carleton-gaspe,2021-08-03 09:10:31,local
Sainte-Anne-des-Monts,Cégep,5,ICI.Radio-Canada.ca,Les votes de grève se multiplient dans les cégeps,2021-01-20,195,https://ici.radio-canada.ca/nouvelle/1764397/syndicat-education-greve-cegep-negociation-secteur-public-csq,2021-08-03 09:10:31,local
Sainte-Anne-des-Monts,Cégep,6,Cégep de Matane,Centre de la Haute-Gaspésie,,,https://www.cegep-matane.qc.ca/cegep/centre-haute-gaspesie/,2021-08-03 09:10:32,local
Sainte-Anne-des-Monts,Cégep,7,Paris-Normandie,Mort de quatre ados sur une route de l’Eure : enquête pour homicide involontaire contre le conducteur,2021-07-25,9,https://www.paris-normandie.fr/id216109/article/2021-07-25/mort-de-quatre-ados-sur-une-route-de-leure-enquete-pour-homicide-involontaire,2021-08-03 09:10:32,local
Sainte-Anne-des-Monts,Cégep,8,ICI.Radio-Canada.ca,Le CSS des Chic-Chocs lance une enquête sur le climat de travail,2021-05-26,69,https://ici.radio-canada.ca/nouvelle/1796044/centre-services-scolaires-chic-chocs-enquete-climat-travail-education,2021-08-03 09:10:32,local
Sainte-Anne-des-Monts,Cégep,9,Le Soleil - Groupe Capitales Médias,"COVID-19: éclosions, fermetures d'écoles et dépistage massif en Haute-Gaspésie",2021-06-11,53,https://www.lesoleil.com/actualite/en-region/covid-19-eclosions-fermetures-decoles-et-depistage-massif-en-haute-gaspesie-96a3da575851820999cdc26058e977f2,2021-08-03 09:10:32,local
Sainte-Anne-des-Monts,Cégep,10,Info Dimanche,Le Cégep de Rivière-du-Loup dévoile les lauréats de son 46e Gala des réussites | infodimanche.com,2021-05-06,89,https://www.infodimanche.com/actualites/actualite/425429/le-cegep-de-riviere-du-loup-devoile-les-laureats-de-son-46e-gala-des-reussites,2021-08-03 09:10:33,local
Sainte-Anne-des-Monts,Cégep,11,Le Quotidien - Groupe Capitales Médias,Randonnée hors norme dans les monts Groulx | Actualités,2021-07-04,30,https://www.lequotidien.com/actualites/randonnee-hors-norme-dans-les-monts-groulx-a5622e38e57767326e007efb62874e60,2021-08-03 09:10:33,local
Sainte-Anne-des-Monts,Cégep,12,Mon Matane,Perquisitions et arrestations en matière de stupéfiants à Sainte-Anne-des-Monts,2021-04-23,102,https://monmatane.com/perquisitions-et-arrestations-en-matiere-de-stupefiants-a-sainte-anne-des-monts/,2021-08-03 09:10:33,local
Sainte-Anne-des-Monts,Cégep,13,ICI.Radio-Canada.ca,De retour au bureau... ou presque,2021-06-27,37,https://ici.radio-canada.ca/nouvelle/1804158/teletravail-telus-mrc-matapedia-cegep-gaspesie-iles,2021-08-03 09:10:34,local
Sainte-Anne-des-Monts,Cégep,14,ICI.Radio-Canada.ca,"Du jaune et du répit pour la Côte-Nord, la Gaspésie et les Îles | Coronavirus",2021-03-17,139,https://ici.radio-canada.ca/nouvelle/1777814/zones-jaunes-gaspesie-iles-cote-nord-mesures-sanitaires-covid-19,2021-08-03 09:10:34,local
Sainte-Anne-des-Monts,Cégep,15,Cégep de Matane,Nouvelles | Le Cégep de Matane honore la réussite de ses étudiants,2021-04-14,111,https://www.cegep-matane.qc.ca/nouvelles/2021/le-cegep-de-matane-honore-la-reussite-de-ses-etudiants/,2021-08-03 09:10:34,local
Sainte-Anne-des-Monts,Cégep,16,ICI.Radio-Canada.ca,Les sauveteurs continuent de se faire rares dans l'Est-du-Québec,2021-06-26,38,https://ici.radio-canada.ca/nouvelle/1804704/penurie-sauveteur-est-du-quebec-piscine,2021-08-03 09:10:34,local
Sainte-Anne-des-Monts,Cégep,17,L'Écho de Maskinongé,La doyenne… à Sainte-Anne-de-la-Pérade,2021-05-31,64,https://www.lechodemaskinonge.com/actualites/la-doyenne-a-sainte-anne-de-la-perade/,2021-08-03 09:10:34,local
Sainte-Anne-des-Monts,Cégep,18,Le Soleil - Groupe Capitales Médias,Cégep de la Gaspésie et des Îles: des millions pour l'émancipation des femmes en Afrique de l'Ouest,2021-02-06,178,https://www.lesoleil.com/actualite/en-region/cegep-de-la-gaspesie-et-des-iles-des-millions-pour-lemancipation-des-femmes-en-afrique-de-louest-170aab22e904d0fb6c88a08abc1b9de3,2021-08-03 09:10:35,local
Sainte-Anne-des-Monts,Cégep,19,ICI.Radio-Canada.ca,Matane souhaite encadrer la construction de minimaisons,2021-05-15,80,https://ici.radio-canada.ca/nouvelle/1793382/mini-maisons-urbanisme-reglement-municipal-jerome-landry-maire,2021-08-03 09:10:35,local
Sainte-Anne-des-Monts,Cégep,20,Radio-Canada.ca,Campeurs nomades : défaire les stéréotypes pour avancer,2021-05-07,88,https://ici.radio-canada.ca/nouvelle/1790886/tourisme-nomade-vanlife-interdiction-halte-gaspesie,2021-08-03 09:10:35,local
Sainte-Anne-des-Monts,Cégep,21,L’Avantage gaspésien,Des administrateurs du CSS des Chic-Chocs affirment ne subir aucune pression de la direction,2021-04-07,118,https://www.lavantagegaspesien.com/article/2021/04/07/des-administrateurs-du-css-des-chic-chocs-affirment-ne-subir-aucune-pression-de-la-direction,2021-08-03 09:10:35,local
Sainte-Anne-des-Monts,Cégep,22,La Tribune - Groupe Capitales Médias,Vers l'infini et plus loin encore pour une étudiante du Cégep Garneau,2021-06-30,34,https://www.latribune.ca/actualites/le-fil-groupe-capitales-medias/vers-linfini-et-plus-loin-encore-pour-une-etudiante-du-cegep-garneau-e90df9e956e7de90e5f0026ea7cf1929,2021-08-03 09:10:35,local
Sainte-Anne-des-Monts,Cégep,23,ICI.Radio-Canada.ca,Les cégeps de l'Est-du-Québec privés d'une bonne part de leurs étudiants étrangers,2020-08-28,340,https://ici.radio-canada.ca/nouvelle/1729231/etudiant-etranger-session-automne-cegep-est-quebec,2021-08-03 09:10:36,local
Sainte-Anne-des-Monts,Cégep,24,ICI.Radio-Canada.ca,Les travaux sont lancés pour le nouveau pavillon du CPE de Matane,2021-05-31,64,https://ici.radio-canada.ca/nouvelle/1797502/cpe-matane-garderie-places-construction-travaux,2021-08-03 09:10:36,local
Sainte-Anne-des-Monts,Cégep,25,Le Droit - Groupe Capitales Médias,Accès restreint: un Collège Saint-Alexandre qui regorge d'histoire [PHOTOS et VIDÉO],2021-06-18,46,https://www.ledroit.com/actualites/acces-restreint-un-college-saint-alexandre-qui-regorge-dhistoire-photos-et-video-29d311720087bed7c8841b9431710845,2021-08-03 09:10:36,local
Sainte-Anne-des-Monts,"""Centre de services scolaire"" OR ""Commission scolaire""",1,L’Avantage gaspésien,Simon Deschênes accuse le Centre de services scolaire des Chic-Chocs de négliger les dossiers de Sainte-Anne-des-Monts,2021-07-23,11,https://www.lavantagegaspesien.com/article/2021/07/23/simon-deschenes-accuse-le-centre-de-services-scolaire-des-chic-chocs-de-negliger-les-dossiers-de-sainte-anne-des-monts,2021-08-03 09:10:46,local
Sainte-Anne-des-Monts,"""Centre de services scolaire"" OR ""Commission scolaire""",2,ICI.Radio-Canada.ca,Dépistage massif à Sainte-Anne-des-Monts | Coronavirus,2021-06-11,53,https://ici.radio-canada.ca/nouvelle/1800884/sainte-anne-des-monts-covid-19-depistage-fermetures-ecoles,2021-08-03 09:10:46,local
Sainte-Anne-des-Monts,"""Centre de services scolaire"" OR ""Commission scolaire""",3,ICI.Radio-Canada.ca,Sainte-Anne-des-Monts veut une résidence pour les étudiants en formation professionnelle,2021-04-06,119,https://ici.radio-canada.ca/nouvelle/1782724/residence-renovation-sainte-anne-des-monts-centre-services-scolaires,2021-08-03 09:10:46,local
Sainte-Anne-des-Monts,"""Centre de services scolaire"" OR ""Commission scolaire""",4,ICI.Radio-Canada.ca,Rien ne va plus entre le comité de parents et le CSS des Chic-Chocs,2021-05-21,74,https://ici.radio-canada.ca/nouvelle/1794938/css-chic-chocs-parents-comite-enquete-ministre-education-plaintes,2021-08-03 09:10:46,local
Sainte-Anne-des-Monts,"""Centre de services scolaire"" OR ""Commission scolaire""",5,L’Avantage gaspésien,04 mars 2021 Vague de démissions au nouveau centre de services scolaire des Chic-Chocs,2021-03-04,152,https://www.lavantagegaspesien.com/article/2021/03/04/vague-de-demissions-au-nouveau-centre-de-services-scolaire-des-chic-chocs,2021-08-03 09:10:47,local
Sainte-Anne-des-Monts,"""Centre de services scolaire"" OR ""Commission scolaire""",6,ICI.Radio-Canada.ca,"Qualité de l'air à l'école : des classes à problèmes à Matane, Sept-Îles et New Richmond",2021-04-28,97,https://ici.radio-canada.ca/nouvelle/1788625/qualite-air-ecole-monts-et-marees-eastern-shores-co2,2021-08-03 09:10:47,local
Sainte-Anne-des-Monts,"""Centre de services scolaire"" OR ""Commission scolaire""",7,L’Avantage gaspésien,Un diagnostic organisationnel sera lancé au Centre de services scolaire des Chic-Chocs,2021-05-26,69,https://www.lavantagegaspesien.com/article/2021/05/26/un-diagnostic-organisationnel-sera-lance-au-centre-de-services-scolaire-des-chic-chocs,2021-08-03 09:10:47,local
Sainte-Anne-des-Monts,"""Centre de services scolaire"" OR ""Commission scolaire""",8,ICI.Radio-Canada.ca,Qualité de l'air : beaucoup d'écoles de la Gaspésie et des Îles n'atteignent pas la cible,2021-04-22,103,https://ici.radio-canada.ca/nouvelle/1787168/qualite-air-css-rene-levesque-iles-de-la-madeleine-cible-dioxyde-carbone,2021-08-03 09:10:47,local
Sainte-Anne-des-Monts,"""Centre de services scolaire"" OR ""Commission scolaire""",9,L’Avantage gaspésien,Sainte-Anne-des-Monts veut un réel portrait du marché du logement locatif,2021-04-22,103,https://www.lavantagegaspesien.com/article/2021/04/22/sainte-anne-des-monts-veut-un-reel-portrait-du-marche-du-logement-locatif,2021-08-03 09:10:47,local
Sainte-Anne-des-Monts,"""Centre de services scolaire"" OR ""Commission scolaire""",10,CIMT-CHAU,Encore des grèves à venir dans le milieu de l'éducation,2021-06-05,59,https://cimtchau.ca/nouvelles/encore-des-greves-a-venir-dans-le-milieu-de-leducation/,2021-08-03 09:10:48,local
Sainte-Anne-des-Monts,"""Centre de services scolaire"" OR ""Commission scolaire""",11,L’Avantage gaspésien,Nominations intérimaires à la direction générale du CSSCC,2021-07-01,33,https://www.lavantagegaspesien.com/article/2021/07/01/nominations-interimaires-a-la-direction-generale-des-chic-chocs,2021-08-03 09:10:48,local
Sainte-Anne-des-Monts,"""Centre de services scolaire"" OR ""Commission scolaire""",12,Radio-Canada.ca,COVID-19 : retour sur les bancs d'école pour les élèves du secondaire | Coronavirus,2021-01-18,197,https://ici.radio-canada.ca/nouvelle/1763832/retour-secondaire-ecole-coronavirus-mesures-sanitaires,2021-08-03 09:10:48,local
Sainte-Anne-des-Monts,"""Centre de services scolaire"" OR ""Commission scolaire""",13,Le Soleil - Groupe Capitales Médias,Des rats sonnent la fin des classes dans une école du Bas-Saint-Laurent,2021-06-21,43,https://www.lesoleil.com/actualite/en-region/des-rats-sonnent-la-fin-des-classes-dans-une-ecole-du-bas-saint-laurent-87f2c2cb1e0cf8ac693ee770de1c0c2e,2021-08-03 09:10:49,local
Sainte-Anne-des-Monts,"""Centre de services scolaire"" OR ""Commission scolaire""",14,CIMT-CHAU,Diplôme d'études professionnelles en Conduite d'engins de chantier : le partenariat se poursuit,2021-06-09,55,https://cimtchau.ca/nouvelles/diplome-detudes-professionnelles-en-conduite-dengins-de-chantier-offert-en-gaspesie-le-partenariat-se-poursuit/,2021-08-03 09:10:49,local
Sainte-Anne-des-Monts,"""Centre de services scolaire"" OR ""Commission scolaire""",15,ICI.Radio-Canada.ca,Deux cas de COVID-19 à l'école de Saint-Omer,2021-04-09,116,https://ici.radio-canada.ca/nouvelle/1783302/covid-19-ecole-audomarois-saint-omer-carleton-8-avril-2021,2021-08-03 09:10:49,local
Sainte-Anne-des-Monts,"""Centre de services scolaire"" OR ""Commission scolaire""",16,L’Avantage gaspésien,Le CSS des Chic-Chocs commente la démission de cinq administrateurs,2021-03-24,132,https://www.lavantagegaspesien.com/article/2021/03/24/le-css-des-chic-chocs-commente-la-demission-de-cinq-administrateurs,2021-08-03 09:10:49,local
Sainte-Anne-des-Monts,"""Centre de services scolaire"" OR ""Commission scolaire""",17,L’Avantage gaspésien,Des administrateurs du CSS des Chic-Chocs affirment ne subir aucune pression de la direction,2021-04-07,118,https://www.lavantagegaspesien.com/article/2021/04/07/des-administrateurs-du-css-des-chic-chocs-affirment-ne-subir-aucune-pression-de-la-direction,2021-08-03 09:10:49,local
Sainte-Anne-des-Monts,"""Centre de services scolaire"" OR ""Commission scolaire""",18,ICI.Radio-Canada.ca,Les enseignants du primaire et du secondaire sortent les piquets de grève,2021-04-14,111,https://ici.radio-canada.ca/nouvelle/1784631/greve-education-csq-primaire-secondaire,2021-08-03 09:10:49,local
Sainte-Anne-des-Monts,"""Centre de services scolaire"" OR ""Commission scolaire""",19,Le Journal de Québec,Palmarès des commissions scolaires: les meilleures et les pires,,,https://www.journaldequebec.com/2020/01/06/des-commissions-scolaires-qui-sameliorent,2021-08-03 09:10:50,local
Sainte-Anne-des-Monts,"""Centre de services scolaire"" OR ""Commission scolaire""",20,Radio Gaspésie C J R G - FM,Grève mardi des employés de soutien du CSS des Chic-Chocs,2021-05-03,92,https://www.radiogaspesie.ca/nouvelles/actualite/greve-mardi-des-employes-de-soutien-du-css-des-chic-chocs/,2021-08-03 09:10:50,local
Sainte-Anne-des-Monts,"""Centre de services scolaire"" OR ""Commission scolaire""",21,Mon Matane,Avis de grève des enseignants du Centre de services scolaire des Monts-et-Marées,2021-04-09,116,https://monmatane.com/avis-de-greve-des-enseignants-du-centre-de-services-scolaire-des-monts-et-marees/,2021-08-03 09:10:50,local
Sainte-Anne-des-Monts,"""Centre de services scolaire"" OR ""Commission scolaire""",22,ICI.Radio-Canada.ca,Un membre du personnel de l'école Saint-Maxime du Mont-Louis atteint de COVID-19 | Coronavirus,2021-05-08,87,https://ici.radio-canada.ca/nouvelle/1791355/cas-covid-19-mont-louis-ecole,2021-08-03 09:10:50,local
Sainte-Anne-des-Monts,"""Centre de services scolaire"" OR ""Commission scolaire""",23,L’Avantage gaspésien,Vente de la Maison Saint-Paul: déjà des projets pour le nouveau propriétaire,2021-03-30,126,https://www.lavantagegaspesien.com/article/2021/03/30/vente-de-la-maison-saint-paul-deja-des-projets-pour-le-nouveau-proprietaire,2021-08-03 09:10:50,local
Sainte-Anne-des-Monts,"""Centre de services scolaire"" OR ""Commission scolaire""",24,L'Oeil Régional,Le journal de la Vallée du Richelieu,2021-03-03,153,https://www.oeilregional.com/nos-ecoles-debordent/,2021-08-03 09:10:51,local
Sainte-Anne-des-Monts,"""Centre de services scolaire"" OR ""Commission scolaire""",25,ICI.Radio-Canada.ca,Le dépistage se poursuit à Matapédia et à Saint-François-d'Assise | Coronavirus,2021-05-20,75,https://ici.radio-canada.ca/nouvelle/1794693/covid-eclosion-ecole-avignon-saint-francois-matapedia-test,2021-08-03 09:10:51,local
Sainte-Anne-des-Monts,CISSS OR CIUSSS,1,TVA Nouvelles,Côte-Nord et Gaspésie Est-du-Québec: plusieurs urgences débordent,2021-07-26,8,https://www.tvanouvelles.ca/2021/07/26/est-du-quebec-plusieurs-urgences-debordent,2021-08-03 09:11:02,local
Sainte-Anne-des-Monts,CISSS OR CIUSSS,2,Le Journal de Montréal,Hôpitaux débordés: «La pression est concentrée aux urgences»,2021-08-02,1,https://www.journaldemontreal.com/2021/08/02/hopitaux-debordes-la-pression-est-concentree-aux-urgences-1,2021-08-03 09:11:02,local
Sainte-Anne-des-Monts,CISSS OR CIUSSS,3,TVA Nouvelles,Les urgences de Saint-Jérôme et de Saint-Eustache à éviter,2021-07-25,9,https://www.tvanouvelles.ca/2021/07/25/les-urgences-de-saint-jerome-et-de-saint-eustache-a-eviter,2021-08-03 09:11:02,local
Sainte-Anne-des-Monts,CISSS OR CIUSSS,4,ICI.Radio-Canada.ca,Reprise des visites à l'hôpital de Sainte-Anne-des-Monts,2021-06-21,43,https://ici.radio-canada.ca/nouvelle/1803393/covid-19-visiteurs-hopital-sainte-anne-des-monts-depistage-haute-gaspesie-coronavirus,2021-08-03 09:11:02,local
Sainte-Anne-des-Monts,CISSS OR CIUSSS,5,ICI.Radio-Canada.ca,"242 tests de dépistage de la COVID-19 effectués samedi, en Haute-Gaspésie | Coronavirus",2021-06-12,52,https://ici.radio-canada.ca/nouvelle/1801120/haute-gaspesie-covid-sainte-anne-des-monts-depistage,2021-08-03 09:11:02,local
Sainte-Anne-des-Monts,CISSS OR CIUSSS,6,Journal Accès,360 sur l'actualité : Édition du 7 juillet 2021 - Accès Laurentides,2021-07-07,27,https://www.journalacces.ca/360-sur-lactualite-edition-du-7-juillet-2021/,2021-08-03 09:11:03,local
Sainte-Anne-des-Monts,CISSS OR CIUSSS,7,Le Soleil - Groupe Capitales Médias,Neuf millions$ pour l'urgence de Sainte-Anne-des-Monts,2020-08-27,341,https://www.lesoleil.com/actualite/sante/neuf-millions-pour-lurgence-de-sainte-anne-des-monts-a120859a34507f57517622776a529b25,2021-08-03 09:11:03,local
Sainte-Anne-des-Monts,CISSS OR CIUSSS,8,NecrologieCanada,Lise Touchette 1939 2021,2021-07-13,21,https://necrocanada.com/deces-2021/lise-touchette-1939-2021/,2021-08-03 09:11:03,local
Sainte-Anne-des-Monts,CISSS OR CIUSSS,9,ICI.Radio-Canada.ca,Le CISSS de la Gaspésie embauche près de 400 étudiants pour l'été,2021-06-15,49,https://ici.radio-canada.ca/nouvelle/1801604/emploi-sante-etudiant-cisss-gaspesie-main-oeuvre-sante-employes-vacances,2021-08-03 09:11:03,local
Sainte-Anne-des-Monts,CISSS OR CIUSSS,10,L’Avantage gaspésien,Hospitalisations Covid à Rimouski plutôt qu'à Gaspé pour les gens de Sainte-Anne-des-Monts et les environs,2020-10-06,301,https://www.lavantagegaspesien.com/article/2020/10/06/hospitalisations-covid-a-rimouski-plutot-qu-a-gaspe-pour-les-gens-de-sainte-anne-des-monts-et-les-environs,2021-08-03 09:11:04,local
Sainte-Anne-des-Monts,CISSS OR CIUSSS,11,ICI.Radio-Canada.ca,Un pas de plus vers la construction d'un nouvel hôpital à Maria,2021-06-08,56,https://ici.radio-canada.ca/nouvelle/1799979/hopital-maria-construction-cisss-gaspesie-pdci-etape-financement,2021-08-03 09:11:04,local
Sainte-Anne-des-Monts,CISSS OR CIUSSS,12,L’Avantage gaspésien,Il n'y aura pas de gratuité du stationnement pour les employés de la santé,2021-05-21,74,https://www.lavantagegaspesien.com/article/2021/05/21/il-n-y-aura-pas-de-gratuite-du-stationnement-pour-les-employes-de-la-sante,2021-08-03 09:11:04,local
Sainte-Anne-des-Monts,CISSS OR CIUSSS,13,ICI.Radio-Canada.ca,Le Vérificateur général du Québec se penche sur la gestion du CISSS de la Gaspésie,2021-05-21,74,https://ici.radio-canada.ca/nouvelle/1795085/audit-cisss-gaspesie-verificateur-analyse-demission-gestion,2021-08-03 09:11:04,local
Sainte-Anne-des-Monts,CISSS OR CIUSSS,14,ICI.Radio-Canada.ca,Nouvelle éclosion de COVID-19 en Haute-Gaspésie | Coronavirus,2021-06-07,57,https://ici.radio-canada.ca/nouvelle/1799515/eclosion-covid-19-haute-gaspesie-sainte-anne-monts-polyvalente-gabriel-le-courtois,2021-08-03 09:11:04,local
Sainte-Anne-des-Monts,CISSS OR CIUSSS,15,ICI.Radio-Canada.ca,Un syndicat soulève des enjeux de sécurité en obstétrique à l'hôpital de Chandler,2021-06-23,41,https://ici.radio-canada.ca/nouvelle/1804102/infirmieres-obstetrique-hopital-chandler-securite-cisss-gaspesie-gestion-siiieq,2021-08-03 09:11:04,local
Sainte-Anne-des-Monts,CISSS OR CIUSSS,16,L’Avantage gaspésien,L'hôpital de Sainte-Anne-des-Monts en mode recrutement,,,https://www.lavantagegaspesien.com/article/2020/03/06/l-hopital-de-sainte-anne-des-monts-en-mode-recrutement,2021-08-03 09:11:05,local
Sainte-Anne-des-Monts,CISSS OR CIUSSS,17,ICI.Radio-Canada.ca,CISSS des Îles : des projets immobiliers et un déficit moins lourd qu'anticipé,2021-04-21,104,https://ici.radio-canada.ca/nouvelle/1786730/projet-cisss-iles-crdi-tsa-maison-aines-hebergement-sante-mentale-deficit-vaccination-chsld-plaisance,2021-08-03 09:11:05,local
Sainte-Anne-des-Monts,CISSS OR CIUSSS,18,ICI.Radio-Canada.ca,Trois nouveaux cas de COVID-19 sont enregistrés dans l'Est-du-Québec,,,https://ici.radio-canada.ca/nouvelle/1722757/bilan-tests-depistage-28-juillet-2020-est-du-quebec-covid-19-coronavirus,2021-08-03 09:11:05,local
Sainte-Anne-des-Monts,CISSS OR CIUSSS,19,ICI.Radio-Canada.ca,"Le climat de travail s'est amélioré au sein du CISSS des Îles-de-la-Madeleine, selon sa pdg",2021-06-23,41,https://ici.radio-canada.ca/nouvelle/1803904/jasmine-martineau-cisss-iles-de-la-madeleine-bilan-retraite-climat-hostile,2021-08-03 09:11:05,local
Sainte-Anne-des-Monts,CISSS OR CIUSSS,20,ICI.Radio-Canada.ca,Près de trois semaines sans service d'obstétrique à l'hôpital de Matane,2021-06-02,62,https://ici.radio-canada.ca/nouvelle/1798296/obstetrique-matane-rupture-services-infirmiere-cisss-bas-saint-laurent,2021-08-03 09:11:05,local
Sainte-Anne-des-Monts,CISSS OR CIUSSS,21,Radio-Canada.ca,Contrat illégal à la Résidence des Bâtisseurs de Matane : l'appel d'offres sera relancé,2021-03-02,154,https://ici.radio-canada.ca/nouvelle/1774420/contrat-cisss-bas-saint-laurent-residence-batisseurs-matane-amp-aines,2021-08-03 09:11:06,local
Sainte-Anne-des-Monts,CISSS OR CIUSSS,22,ICI.Radio-Canada.ca,COVID-19 : la contagion se poursuit en Haute-Gaspésie,2021-06-11,53,https://ici.radio-canada.ca/nouvelle/1800858/bilan-covid-19-gaspesie-iles-11-juin-2021,2021-08-03 09:11:06,local
Sainte-Anne-des-Monts,CISSS OR CIUSSS,23,ICI.Radio-Canada.ca,"Regroupement de deux étages de l'hôpital de Matane, faute de personnel",2021-05-15,80,https://ici.radio-canada.ca/nouvelle/1793410/fermeture-etage-hopital-matane-ete-2021,2021-08-03 09:11:06,local
Sainte-Anne-des-Monts,CISSS OR CIUSSS,24,ICI.Radio-Canada.ca,Nouvelle rupture de services à l'hôpital de Sainte-Anne-des-Monts : des élus en colère,,,https://ici.radio-canada.ca/nouvelle/1133977/rupture-services-hopital-sainte-anne-monts-elus-coleres-haute-gaspesie,2021-08-03 09:11:06,local
Sainte-Anne-des-Monts,CISSS OR CIUSSS,25,L’Avantage gaspésien,Une cinquantaine de postes à combler au réseau local de santé de la Haute-Gaspésie,2021-04-22,103,https://www.lavantagegaspesien.com/article/2021/04/22/une-cinquantaine-de-postes-a-combler-au-reseau-local-de-sante-de-la-haute-gaspesie,2021-08-03 09:11:06,local
