Villes,Mots-clés,position du média,Nom du média,Titre de l'article,Date de publication,Journée de différence,URL
Alma ,Accident,1,Le Quotidien - Groupe Capitales Médias,Sortie de route sur la 169 à Alma | Justice et faits divers | Actualités,2021-05-24,8,https://www.lequotidien.com/actualites/justice-et-faits-divers/sortie-de-route-sur-la-169-a-alma-aed1cf2d645bd679b3264e74d266a3b8
Alma ,Accident,2,La Presse,Quatre blessés dans un accident à Alma,2020-07-26,310,https://www.lapresse.ca/actualites/justice-et-faits-divers/2020-07-26/quatre-blesses-dans-un-accident-a-alma.php
Alma ,Accident,3,Le Quotidien - Groupe Capitales Médias,Grave accident entre un quadriporteur et une voiture à Alma,2020-10-31,213,https://www.lequotidien.com/actualites/grave-accident-entre-un-quadriporteur-et-une-voiture-a-alma-57d24ee6241e495a2ebc70c0e8b61c76
Alma ,Accident,4,Le Quotidien - Groupe Capitales Médias,Accident impliquant un autobus à Alma | Justice et faits divers | Actualités,2020-09-18,256,https://www.lequotidien.com/actualites/justice-et-faits-divers/accident-impliquant-un-autobus-a-alma-e2d47badb77961f6a5f779e46d79b186
Alma ,Cégep,1,L'Étoile du Lac,Les cégeps d'Alma et Saint-Félicien en grève,2021-05-11,21,https://www.letoiledulac.com/actualite/les-cegeps-dalma-et-saint-felicien-en-greve/
Alma ,Cégep,2,ICI.Radio-Canada.ca,Le nouveau programme de pharmacie fait fureur au Collège d'Alma,2021-05-13,19,https://ici.radio-canada.ca/nouvelle/1792605/techniques-pharmacie-college-alma-demandes
Alma ,Cégep,3,Le Quotidien - Groupe Capitales Médias,Grève au Collège d'Alma: des moyens de pression différents,2021-05-20,12,https://www.lequotidien.com/actualites/greve-au-college-dalma-des-moyens-de-pression-differents-9879284e82f9d597e019e6c59b37cb12
Alma ,Cégep,4,ICI.Radio-Canada.ca,Une deuxième année difficile pour le recrutement d'étudiants étrangers,2021-05-18,14,https://ici.radio-canada.ca/nouvelle/1793969/etudiants-etrangers-recrutement-covid-cegeps
Alma ,Police OR Sûreté,1,Journal Le Lac St-Jean,Perquisition en matière de stupéfiants à Alma,2021-05-05,27,https://lelacstjean.com/actualite/perquisition-en-matiere-de-stupefiants-a-alma/
Alma ,Police OR Sûreté,2,ICI.Radio-Canada.ca,La SQ cherche les victimes d'un présumé prédateur sexuel à Alma,2021-05-13,19,https://ici.radio-canada.ca/nouvelle/1792849/agressions-sexuelles-surete-quebec-pornographie-juvenile
Alma ,Police OR Sûreté,3,Le Quotidien - Groupe Capitales Médias,Sortie de route sur la 169 à Alma | Justice et faits divers | Actualités,2021-05-24,8,https://www.lequotidien.com/actualites/justice-et-faits-divers/sortie-de-route-sur-la-169-a-alma-aed1cf2d645bd679b3264e74d266a3b8
Alma ,Police OR Sûreté,4,Le Journal de Québec,La justice reprend son cours après l'incendie du palais de justice de Roberval,2021-05-10,22,https://www.journaldequebec.com/2021/05/10/debut-de-lenquete-a-roberval-1
Alma ,décès OR mort,1,Le Quotidien - Groupe Capitales Médias,Cinq nouveaux cas et près de 200 000 doses administrées au Saguenay-Lac-Saint-Jean,2021-06-01,0,https://www.lequotidien.com/actualites/covid-19/cinq-nouveaux-cas-et-pres-de-200-000-doses-administrees-au-saguenay-lac-saint-jean-2db9e8cbe50c305d89ce3689dd59c097
Alma ,décès OR mort,2,NecrologieCanada,HARVEY Roch 1937 2021,2021-05-15,17,https://necrocanada.com/deces-2021/harvey-roch-1937-2021/
Alma ,décès OR mort,3,Journal Le Lac St-Jean,Faits divers Découverte d'un corps inanimé à Alma,2021-04-17,45,https://lelacstjean.com/faitsdivers/decouverte-dun-corps-inanime-a-alma/
Alma ,décès OR mort,4,Le Quotidien - Groupe Capitales Médias,Un voyage dans l'histoire judiciaire du Saguenay-Lac-Saint-Jean,2021-05-06,26,https://www.lequotidien.com/actualites/justice-et-faits-divers/un-voyage-dans-lhistoire-judiciaire-du-saguenay-lac-saint-jean-1b010e38b5d1185e5f3e031a3ce95e55
Alma ,Incendie,1,Le Journal de Québec,La justice reprend son cours après l'incendie du palais de justice de Roberval,2021-05-10,22,https://www.journaldequebec.com/2021/05/10/debut-de-lenquete-a-roberval-1
Alma ,Incendie,2,Le Quotidien - Groupe Capitales Médias,Incendie du Palais de justice de Roberval: des impacts sur les comparutions,2021-05-09,23,https://www.lequotidien.com/actualites/incendie-du-palais-de-justice-de-roberval-des-impacts-sur-les-comparutions-f87d7e84461fb2a677b1b169386f1ae9
Alma ,Incendie,3,,,2021-05-09,23,https://www.lapresse.ca/actualites/2021-05-09/incendie/le-palais-de-justice-de-roberval-sera-reconstruit-annonce-le-gouvernement.php
Alma ,Incendie,4,,,2021-05-09,23,https://lactualite.com/actualites/incendie-au-palais-de-justice-de-roberval-le-projet-de-modernisation-tient-toujours/
Alma ,Préfêt,1,Ouest-France,Rennes. Peu de commerces seront ouverts ce dimanche,2021-05-22,10,https://www.ouest-france.fr/bretagne/rennes-35000/rennes-peu-de-commerces-seront-ouverts-ce-dimanche-1bb612e8-bb08-11eb-a8ac-d7792e53330a
Alma ,Préfêt,2,Le Quotidien - Groupe Capitales Médias,La MRC du Domaine-du-Roy élira son préfet au suffrage universel,2021-02-11,110,https://www.lequotidien.com/actualites/la-mrc-du-domaine-du-roy-elira-son-prefet-au-suffrage-universel-32483f20380cd6b3dcc9a3f4614f9e25
Alma ,Préfêt,3,actu.fr,Elections départementales. Voici les candidatures pour les cantons de Seine-et-Marne,2021-05-06,26,https://actu.fr/societe/elections-departementales-voici-les-premieres-candidatures-en-seine-et-marne_41618644.html
Alma ,Préfêt,4,Le Quotidien - Groupe Capitales Médias,Un don de 20 000 $ pour la Moisson d'Alma,2020-12-01,182,https://www.lequotidien.com/actualites/un-don-de-20-000--pour-la-moisson-dalma-b7136d6d02a4cb625ceff6d6d96b277c
Alma ,Centre de services scolaire OR commission scolaire,1,Le Quotidien - Groupe Capitales Médias,École Saint-Julien d'Alma: le Centre de services scolaire se fait rassurant,2021-05-07,25,https://www.lequotidien.com/actualites/ecole-saint-julien-dalma-le-centre-de-services-scolaire-se-fait-rassurant-9d48ccd15621d4f0c55448b1d6b5e28d
Alma ,Centre de services scolaire OR commission scolaire,2,Le Quotidien - Groupe Capitales Médias,Un événement qui suscite de l'inquiétude à l'école Saint-Julien d'Alma,2021-05-06,26,https://www.lequotidien.com/actualites/un-evenement-qui-suscite-de-linquietude-a-lecole-saint-julien-dalma-c39cf41a86279a339f85a640854efc0c
Alma ,Centre de services scolaire OR commission scolaire,3,La Voix de l'est - Groupe Capitales Médias,Recycler les masques | Actualités,2021-05-15,17,https://www.lavoixdelest.ca/actualites/recycler-les-masques-a67612da42a4aaccc0d6fcb958470d2e
Alma ,Centre de services scolaire OR commission scolaire,4,ICI.Radio-Canada.ca,Du plomb dans l'eau de nombreuses écoles de la région,2020-12-09,174,https://ici.radio-canada.ca/nouvelle/1755744/plomb-eau-ecoles-saguenay-lac-saint-jean
Alma ,CISSS OR CIUSSS,1,ICI.Radio-Canada.ca,Le centre de prélèvements d'Alma déménage,2021-05-26,6,https://ici.radio-canada.ca/nouvelle/1796187/centre-alma-demenagement-prise-sang-prelevements
Alma ,CISSS OR CIUSSS,2,ICI.Radio-Canada.ca,Interruption du service d'hémato-oncologie cet été à Dolbeau-Mistassini,2021-05-27,5,https://ici.radio-canada.ca/nouvelle/1796128/hopital-soins-cancer-patients-ciusss-penurie
Alma ,CISSS OR CIUSSS,3,ICI.Radio-Canada.ca,Une vingtaine de cas et deux résidents hospitalisés au Manoir Champlain | Coronavirus,2021-05-28,4,https://ici.radio-canada.ca/nouvelle/1796921/eclosion-covid-manoir-champlain
Alma ,CISSS OR CIUSSS,4,NecrologieCanada,Simard Edmond 28 mai 2021,2021-06-01,0,https://necrocanada.com/deces-2021/simard-edmond-28-mai-2021/
Alma ,Maire OR Mairesse,1,Le Journal de Québec,Le maire d'Alma ne se représentera pas,2021-05-18,14,https://www.journaldequebec.com/2021/05/18/le-maire-dalma-ne-se-representera-pas-1
Alma ,Maire OR Mairesse,2,ICI.Radio-Canada.ca,Une capitainerie 10 fois plus grande à Dam-en-Terre,2021-05-28,4,https://ici.radio-canada.ca/nouvelle/1796914/bateaux-lac-saint-jean
Alma ,Maire OR Mairesse,3,Le Quotidien - Groupe Capitales Médias,Une première candidature officialisée pour la mairie d'Alma,2021-05-26,6,https://www.lequotidien.com/actualites/une-premiere-candidature-officialisee-pour-la-mairie-dalma-1c4b3c4ffd1adf47505e1c242f1ae80e
Alma ,Maire OR Mairesse,4,Journal Le Lac St-Jean,Parc industriel du secteur sud : Alma se retire du projet,2021-05-04,28,https://lelacstjean.com/actualite/parc-industriel-du-secteur-sud-alma-se-retire-du-projet/
Alma ,Candidat,1,Le Quotidien - Groupe Capitales Médias,Alma: un troisième candidat dans Delisle-Saint-Coeur-de-Marie,2021-06-01,0,https://www.lequotidien.com/actualites/alma-un-troisieme-candidat-dans-delisle-saint-coeur-de-marie-6a960b0c3448c163e198973bfa092e0d
Alma ,Candidat,2,Le Quotidien - Groupe Capitales Médias,Une première candidature officialisée pour la mairie d'Alma,2021-05-26,6,https://www.lequotidien.com/actualites/une-premiere-candidature-officialisee-pour-la-mairie-dalma-1c4b3c4ffd1adf47505e1c242f1ae80e
Alma ,Candidat,3,Journal Le Lac St-Jean,Alma: Chantale Fortin candidate dans le district 1,2021-05-08,24,https://lelacstjean.com/actualite/alma-chantale-fortin-candidate-dans-le-district-1/
Alma ,Candidat,4,Courrier international,Élections au Mexique : émotion après l'assassinat par balles d'une candidate,2021-05-26,6,https://www.courrierinternational.com/article/violences-politiques-elections-au-mexique-emotion-apres-lassassinat-par-balles-dune
Alma ,Travaux ET Routiers,1,Le Quotidien - Groupe Capitales Médias,Des travaux routiers aux quatre coins de la région,2021-05-28,4,https://www.lequotidien.com/actualites/des-travaux-routiers-aux-quatre-coins-de-la-region-2077a7a0e77e137631ed89e7986ec976
Alma ,Travaux ET Routiers,2,Journal Le Lac St-Jean,Investissements routiers: 54 M$ pour la MRC de Lac-Saint-Jean-Est,2021-04-18,44,https://lelacstjean.com/actualite/investissements-routiers-54-m-pour-la-mrc-de-lac-saint-jean-est/
Alma ,Travaux ET Routiers,3,Journal Le Lac St-Jean,Lien routier Alma-La Baie : Un carrefour giratoire à l'intersection 170 et 169,2021-04-06,56,https://lelacstjean.com/actualite/autoroute-70-un-carrefour-giratoire-a-lintersection-170-et-169/
Alma ,Travaux ET Routiers,4,Le Quotidien - Groupe Capitales Médias,Le tracé de l'autoroute 70 à Alma n'est toujours pas déterminé,2021-03-30,63,https://www.lequotidien.com/actualites/le-trace-de-lautoroute-70-a-alma-nest-toujours-pas-determine-e1a28ac40a5b5c6f08c587b40aa69f76
Alma ,Autobus OR Tramway,1,Le Journal de Québec,Forte baisse des disparitions d'enfants au Québec,2021-05-04,28,https://www.journaldequebec.com/2021/05/04/forte-baisse-des-disparitions-denfants
Alma ,Autobus OR Tramway,2,Le Quotidien - Groupe Capitales Médias,Un autobus scolaire passe près d'écraser un enfant à Chicoutimi [VIDÉO],2020-10-23,221,https://www.lequotidien.com/actualites/justice-et-faits-divers/un-autobus-scolaire-passe-pres-decraser-un-enfant-a-chicoutimi-video-2a8ed73d7a4ecf4c2026f4ffbd839cef
Alma ,Autobus OR Tramway,3,Le Quotidien - Groupe Capitales Médias,Intercar reprendra le trajet entre Alma et Québec,2021-02-26,95,https://www.lequotidien.com/affaires/intercar-reprendra-le-trajet-entre-alma-et-quebec-070b1d9815f94a61ea96b2d158954c25
Alma ,Autobus OR Tramway,4,Le Quotidien - Groupe Capitales Médias,Accident impliquant un autobus à Alma | Justice et faits divers | Actualités,2020-09-18,256,https://www.lequotidien.com/actualites/justice-et-faits-divers/accident-impliquant-un-autobus-a-alma-e2d47badb77961f6a5f779e46d79b186
Alma ,Météo,1,Le Quotidien - Groupe Capitales Médias,Cocktail météo attendu pour la fin de semaine,2021-03-25,68,https://www.lequotidien.com/actualites/cocktail-meteo-attendu-pour-la-fin-de-semaine-0b6af4f01f201cbfc900938f48e0f5af
Alma ,Météo,2,MétéoMédia,"En été au Québec, il fait chaud!",2020-07-01,335,https://www.meteomedia.com/ca/nouvelles/article/en-ete-au-quebec-il-fait-chaud
Alma ,Météo,3,Le Quotidien - Groupe Capitales Médias,Nombreux records pour le cocktail météo des derniers jours,2021-03-15,78,https://www.lequotidien.com/actualites/nombreux-records-pour-le-cocktail-meteo-des-derniers-jours-e992e8bae67fb8b483b424c8b4139fcb
Alma ,Météo,4,ICI.Radio-Canada.ca,Plus de neige attendue de mercredi à jeudi dans le Bas-Saguenay,2021-04-20,42,https://ici.radio-canada.ca/nouvelle/1786587/meteo-tempete-depression
Alma ,Constrution,1,ICI.Radio-Canada.ca,Une capitainerie 10 fois plus grande à Dam-en-Terre,2021-05-28,4,https://ici.radio-canada.ca/nouvelle/1796914/bateaux-lac-saint-jean
Alma ,Constrution,2,ICI.Radio-Canada.ca,23 000 $ pour sept projets almatois en développement durable,2021-05-11,21,https://ici.radio-canada.ca/nouvelle/1792316/projets-alma-developpement-durable
Alma ,Constrution,3,Le Journal de Québec,Le maire d'Alma ne se représentera pas,2021-05-18,14,https://www.journaldequebec.com/2021/05/18/le-maire-dalma-ne-se-representera-pas-1
Alma ,Constrution,4,Le Quotidien - Groupe Capitales Médias,Rio Tinto rappelle les risques de circuler à vélo près de ses installations,2021-05-14,18,https://www.lequotidien.com/actualites/rio-tinto-rappelle-les-risques-de-circuler-a-velo-pres-de-ses-installations-54765770f406434e907935c50aee6928
Alma ,Élection OR campagne,1,Le Quotidien - Groupe Capitales Médias,Alma: un troisième candidat dans Delisle-Saint-Coeur-de-Marie,2021-06-01,0,https://www.lequotidien.com/actualites/alma-un-troisieme-candidat-dans-delisle-saint-coeur-de-marie-6a960b0c3448c163e198973bfa092e0d
Alma ,Élection OR campagne,2,ICI.Radio-Canada.ca,Marc Asselin quittera la politique municipale en novembre,2021-05-18,14,https://ici.radio-canada.ca/nouvelle/1793999/marc-asselin-depart-politique-alma
Alma ,Élection OR campagne,3,Journal Le Lac St-Jean,Capitation 2021: La campagne est maintenant en cours,2021-05-10,22,https://lelacstjean.com/actualite/capitation-2021-la-campagne-est-maintenant-en-cours/
Alma ,Élection OR campagne,4,Le Journal de Montréal,"La campagne de vaccination, un excellent modèle à suivre",2021-05-19,13,https://www.journaldemontreal.com/2021/05/19/la-campagne-de-vaccination-un-excellent-modele-a-suivre
Alma ,député,1,Courrier international,Élections au Mexique : émotion après l'assassinat par balles d'une candidate,2021-05-26,6,https://www.courrierinternational.com/article/violences-politiques-elections-au-mexique-emotion-apres-lassassinat-par-balles-dune
Alma ,député,2,ICI.Radio-Canada.ca,Levée de boucliers régionale contre l'Association de l'aluminium du Canada,2021-05-07,25,https://ici.radio-canada.ca/nouvelle/1791009/rio-tinto-reactions-emplois
Alma ,député,3,ICI.Radio-Canada.ca,Du mentorat pour convaincre les jeunes de faire le saut en politique,2021-05-21,11,https://ici.radio-canada.ca/nouvelle/1794703/conseil-ville-municipal-elu-campagne-election
Alma ,député,4,Libération,"Appel pour les libertés, contre les idées d’extrême droite",2021-05-04,28,https://www.liberation.fr/idees-et-debats/tribunes/appel-pour-les-libertes-contre-les-idees-dextreme-droite-20210504_XRVRUYXD5RDGPG6YY2TWUV6MQY/
Alma ,Armes à feu,1,Le Journal de Québec,Saguenay: lourdes accusations contre un homme arrêté au Walmart,2021-05-21,11,https://www.journaldequebec.com/2021/05/21/saguenay-lourdes-accusations-contre-un-homme-arrete-au-walmart-1
Alma ,Armes à feu,2,Droit-Inc.com,Feu au palais de justice de Roberval : questions-réponses avec la bâtonnière…,2021-05-10,22,https://www.droit-inc.com/article28664-Feu-au-palais-de-justice-de-Roberval-questions-reponses-avec-la-batonniere
Alma ,Armes à feu,3,Courrier international,Élections au Mexique : émotion après l'assassinat par balles d'une candidate,2021-05-26,6,https://www.courrierinternational.com/article/violences-politiques-elections-au-mexique-emotion-apres-lassassinat-par-balles-dune
Alma ,Armes à feu,4,Le Quotidien - Groupe Capitales Médias,Incendie suspect de véhicule à Alma | Justice et faits divers | Actualités,2021-03-04,89,https://www.lequotidien.com/actualites/justice-et-faits-divers/incendie-suspect-de-vehicule-a-alma-ae7ae5d9187fd6e6f1ec0164d7bbdcab
Alma ,Santé publique,1,Le Quotidien - Groupe Capitales Médias,Cinq nouveaux cas et près de 200 000 doses administrées au Saguenay-Lac-Saint-Jean,2021-06-01,0,https://www.lequotidien.com/actualites/covid-19/cinq-nouveaux-cas-et-pres-de-200-000-doses-administrees-au-saguenay-lac-saint-jean-2db9e8cbe50c305d89ce3689dd59c097
Alma ,Santé publique,2,ICI.Radio-Canada.ca,35 patients ont contracté la COVID-19 à l'hôpital de Chicoutimi puis sont décédés,2021-05-05,27,https://ici.radio-canada.ca/nouvelle/1790723/covid-19-hopitaux-deces
Alma ,Santé publique,3,ICI.Radio-Canada.ca,Une vingtaine de cas et deux résidents hospitalisés au Manoir Champlain | Coronavirus,2021-05-28,4,https://ici.radio-canada.ca/nouvelle/1796921/eclosion-covid-manoir-champlain
Alma ,Santé publique,4,NecrologieCanada,BEAULIEU Germaine 1928 2021,2021-06-01,0,https://necrocanada.com/deces-2021/beaulieu-germaine-1928-2021/
Alma ,COVID,1,Le Quotidien - Groupe Capitales Médias,Cinq nouveaux cas et près de 200 000 doses administrées au Saguenay-Lac-Saint-Jean,2021-06-01,0,https://www.lequotidien.com/actualites/covid-19/cinq-nouveaux-cas-et-pres-de-200-000-doses-administrees-au-saguenay-lac-saint-jean-2db9e8cbe50c305d89ce3689dd59c097
Alma ,COVID,2,ICI.Radio-Canada.ca,Vaccin contre la COVID-19 : près de 4500 rendez-vous pris en quelques heures | Coronavirus,2021-03-02,91,https://ici.radio-canada.ca/nouvelle/1774546/campagne-vaccination-coronavirus-ciusss
Alma ,COVID,3,Le Devoir,Quoi retenir de la fin de semaine?,2021-05-02,30,https://www.ledevoir.com/societe/599951/pour-votre-info-quoi-retenir-de-la-fin-de-semaine
Alma ,COVID,4,ICI.Radio-Canada.ca,Le CIUSSS ferme l'unité COVID-19 de l'hôpital d'Alma | Coronavirus,2021-01-27,125,https://ici.radio-canada.ca/nouvelle/1766452/unite-covid-alma-fermeture-baisse
Alma ,Immigration,1,ICI.Radio-Canada.ca,Le Collège d'Alma s'apprête à accueillir une cohorte d'étudiants étrangers,2021-01-06,146,https://ici.radio-canada.ca/nouvelle/1761191/aide-arrivee-etudes-pandemie-quarantaine
Alma ,Immigration,2,La Presse,Pénurie de main-d'œuvre dans le secteur manufacturier | Des solutions à trouver d'urgence,2021-05-19,13,https://www.lapresse.ca/affaires/2021-05-19/penurie-de-main-d-oeuvre-dans-le-secteur-manufacturier/des-solutions-a-trouver-d-urgence.php
Alma ,Immigration,3,Le Devoir,Le désir inébranlable de soigner pour une immigrante mexicaine,2021-03-02,91,https://www.ledevoir.com/societe/596129/immigration-le-desir-inebranlable-de-soigner-pour-une-immigrante-mexicaine
Alma ,Immigration,4,ICI.Radio-Canada.ca,"Pandémie et démographie : moins d'immigrants et de naissances, plus de décès",2021-03-18,75,https://ici.radio-canada.ca/nouvelle/1778413/demographie-population-pandemie-immigration-naissances
Alma ,Climat,1,Mediapart,Climat: «Mobilisations larges et luttes locales sont indissociables»,2021-05-25,7,https://www.mediapart.fr/journal/france/250521/climat-mobilisations-larges-et-luttes-locales-sont-indissociables
Alma ,Climat,2,Arcinfo,"Grève pour l'avenir à Neuchâtel: «Si on veut créer un monde commun, il faut partager nos compétences»",2021-05-21,11,https://www.arcinfo.ch/dossiers/s-adapter-au-changement-climatique/articles/greve-pour-l-avenir-a-neuchatel-si-on-veut-creer-un-monde-commun-il-faut-partager-nos-competences-1075120
Alma ,Climat,3,Radio Classique,"Loi Climat : qu'est-ce que l'artificialisation des sols, qui doit être divisée par deux d'ici 2030 ?",2021-05-05,27,https://www.radioclassique.fr/magazine/articles/loi-climat-quest-ce-que-lartificialisation-des-sols-qui-doit-etre-divisee-par-deux-dici-2030/
Alma ,Climat,4,Europe 1,"Marche pour le climat : ""Toutes les grandes mesures sont absentes du texte de loi""",2021-05-09,23,https://www.europe1.fr/societe/marche-pour-le-climat-toutes-les-grandes-mesures-sont-absentes-du-texte-de-loi-4044027
Alma ,Racisme,1,Libération,"Appel pour les libertés, contre les idées d’extrême droite",2021-05-04,28,https://www.liberation.fr/idees-et-debats/tribunes/appel-pour-les-libertes-contre-les-idees-dextreme-droite-20210504_XRVRUYXD5RDGPG6YY2TWUV6MQY/
Alma ,Racisme,2,ICI.Radio-Canada.ca,Racisme dans la police : les cégeps défendent la qualité de leur formation,2020-10-17,227,https://ici.radio-canada.ca/nouvelle/1741800/racisme-police-formation-cegeps-techniques-policieres-quebec
Alma ,Racisme,3,udemnouvelles,"Christiane-Marie Edom, une Française noire à Alma",2021-04-30,32,https://nouvelles.umontreal.ca/article/2021/04/30/christiane-marie-edom-une-francaise-noire-a-alma/
Alma ,Racisme,4,Le Quotidien - Groupe Capitales Médias,Sesame Street lance de nouvelles vidéos éducatives sur le racisme,2021-03-25,68,https://www.lequotidien.com/arts/sesame-street-lance-de-nouvelles-videos-educatives-sur-le-racisme-8f585b225190617f8fcb9d562ed64b62
Alma ,Premier ministre,1,Radio-Canada.ca,Comme Churchill en 1945?,2021-05-03,29,https://ici.radio-canada.ca/nouvelle/1789774/auger-michelc-analyse-legault-crise-logement
Alma ,Premier ministre,2,ICI.Radio-Canada.ca,Le nouveau programme de pharmacie fait fureur au Collège d'Alma,2021-05-13,19,https://ici.radio-canada.ca/nouvelle/1792605/techniques-pharmacie-college-alma-demandes
Alma ,Premier ministre,3,ICI.Radio-Canada.ca,Levée de boucliers régionale contre l'Association de l'aluminium du Canada,2021-05-07,25,https://ici.radio-canada.ca/nouvelle/1791009/rio-tinto-reactions-emplois
Alma ,Premier ministre,4,Guy Bouchard,"Femmessor | 52,5 M$ pour soutenir l'entrepreneuriat inclusif et d'impact",2021-06-01,0,https://informeaffaires.com/national-et-international/actualites-nationales/femmessor-525-m-pour-soutenir-lentrepreneuriat
Alma ,Chine,1,Droit-Inc.com,Feu au palais de justice de Roberval : questions-réponses avec la bâtonnière…,2021-05-10,22,https://www.droit-inc.com/article28664-Feu-au-palais-de-justice-de-Roberval-questions-reponses-avec-la-batonniere
Alma ,Chine,2,Le Quotidien - Groupe Capitales Médias,"Les «deux Michael» emprisonnés en Chine depuis deux ans, jour pour jour [VIDÉO]",2020-12-10,173,https://www.lequotidien.com/actualites/les-deux-michael-emprisonnes-en-chine-depuis-deux-ans-jour-pour-jour-video-d8199310d58df4098d86472a9323e628
Alma ,Chine,3,iHeartRadio,Un élu d'Alma fait une sortie contre le maire Marc Asselin,2020-10-13,231,https://www.iheartradio.ca/energie/energie-saguenay/nouvelles/un-elu-d-alma-fait-une-sortie-contre-le-maire-marc-asselin-1.13707094
Alma ,Chine,4,Guy Bouchard,COVID-19 | Le Charnu se relocalise à… Alma | Journal Informes Affaires,2020-06-09,357,https://informeaffaires.com/regional/commerces-et-services/covid-19-le-charnu-se-relocalise-a-alma
Alma ,Biden OR Trump,1,ICI.Radio-Canada.ca,Élection de Joe Biden : la région réagit favorablement,2020-11-07,206,https://ici.radio-canada.ca/nouvelle/1747901/joe-biden-saguenay-reaction-favoranble
Alma ,Biden OR Trump,2,ICI.Radio-Canada.ca,La région surveille l'issue du scrutin aux États-Unis,2020-11-04,209,https://ici.radio-canada.ca/nouvelle/1746847/reactions-saguenay-lac-saint-jean-election-americaine
Alma ,Biden OR Trump,3,La Presse,"Joe Biden, 46e président | « La démocratie l'a emporté »",2021-01-20,132,https://www.lapresse.ca/international/etats-unis/2021-01-20/joe-biden-46e-president/la-democratie-l-a-emporte.php
Alma ,Biden OR Trump,4,La Presse,COVID-19 | Trump déclaré négatif par son médecin,2020-10-12,232,https://www.lapresse.ca/international/etats-unis/2020-10-12/covid-19/trump-declare-negatif-par-son-medecin.php
Alma ,déficit,1,ICI.Radio-Canada.ca,Des services suspendus ou reportés à l'hôpital d'Alma | Coronavirus,2020-10-15,229,https://ici.radio-canada.ca/nouvelle/1741501/hopital-alma-services-reorganisation
Alma ,déficit,2,Journal Le Lac St-Jean,Club Rotary d'Alma : Une levée de fonds virtuelle cette année,2020-12-23,160,https://lelacstjean.com/actualite/club-rotary-dalma-une-levee-de-fonds-virtuelle-cette-annee/
Alma ,déficit,3,ICI.Radio-Canada.ca,L'hôpital d'Alma illuminé tel un phare dans la nuit | Coronavirus,2020-10-02,242,https://ici.radio-canada.ca/nouvelle/1738130/hopital-alma-vert-espoir-covid
Alma ,déficit,4,Radio-Canada.ca,Le plus fort déficit démographique à Montréal depuis 20 ans,2021-01-14,138,https://ici.radio-canada.ca/nouvelle/1763174/isq-deficit-population-montreal-regions-croissance-covid
