Villes,Mots-clés,position du média,Nom du média,Titre de l'article,Date de publication,Journée de différence,URL,date et heure saisie,type mot-clés
Gaspé,accident,1,TVA Nouvelles,Collision mortelle avec un orignal en Gaspésie,2021-10-06,13,https://www.tvanouvelles.ca/2021/10/06/collision-mortelle-avec-un-orignal-en-gaspesie-1,2021-10-19 12:10:25,local
Gaspé,accident,2,Le Droit - Groupe Capitales Médias,"Autre collision mortelle avec un orignal, cette fois en Gaspésie",2021-10-06,13,https://www.ledroit.com/actualites/le-fil-groupe-capitales-medias/autre-collision-mortelle-avec-un-orignal-cette-fois-en-gaspesie-38d6d0318231b497de1645ad81a29834,2021-10-19 12:10:25,local
Gaspé,accident,3,Showbizz.net,Un accident de voiture survient lors d'un tournage et les artistes deviennent les premiers répondants,2021-10-14,5,https://showbizz.net/stars/un-accident-de-voiture-survient-lors-dun-tournage-et-les-artistes-sont-les-premiers-repondants,2021-10-19 12:10:26,local
Gaspé,accident,4,La Presse,Grave accident de véhicule côte-à-côte en Gaspésie,2021-07-18,93,https://www.lapresse.ca/actualites/justice-et-faits-divers/2021-07-18/grave-accident-de-vehicule-cote-a-cote-en-gaspesie.php,2021-10-19 12:10:26,local
Gaspé,accident,5,Le Journal de Québec,"Accident mortel en Gaspésie: décès d'une femme et d'un bambin, un bébé entre la vie et la mort",2021-06-28,113,https://www.journaldequebec.com/2021/06/28/accident-mortel-en-gaspesie-deces-dune-femme-et-dun-bambin-un-bebe-entre-la-vie-et-la-mort,2021-10-19 12:10:26,local
Gaspé,accident,6,Le Journal de Québec,Accident mortel en Gaspésie: élan de solidarité pour une fillette mal en point,2021-07-03,108,https://www.journaldequebec.com/2021/07/02/accident-mortel-en-gaspesie-campagne-pour-aider-une-fillette-blessee,2021-10-19 12:10:26,local
Gaspé,accident,7,Le Journal de Québec,La Gaspésie s'inquiète pour la vie de touristes imprudents,2021-07-14,97,https://www.journaldequebec.com/2021/07/14/sauvetages-appel-a-la-vigilance-sur-le-fleuve-apres-un-incident,2021-10-19 12:10:27,local
Gaspé,accident,8,Le Soleil - Groupe Capitales Médias,"Accident mortel de moto à Chandler, en Gaspésie",2021-06-05,136,https://www.lesoleil.com/actualite/en-region/accident-mortel-de-moto-a-chandler-en-gaspesie-fa8a0be0db9b8f1d8f256f415803f5f1,2021-10-19 12:10:27,local
Gaspé,accident,9,Le Journal de Québec,Gaspésie: un accident de la route fait un mort et un blessé,2021-07-13,98,https://www.journaldequebec.com/2021/07/13/gaspesie-un-accident-de-la-route-fait-deux-blesses-1,2021-10-19 12:10:27,local
Gaspé,accident,10,Le Soleil - Groupe Capitales Médias,Collision mortelle avec deux orignaux en Gaspésie | L'Est du Québec | Actualités,2021-05-31,141,https://www.lesoleil.com/actualite/en-region/collision-mortelle-avec-deux-orignaux-en-gaspesie-e19e9d22ddef0f732515d7cf2b43321a,2021-10-19 12:10:28,local
Gaspé,accident,11,Le Soleil - Groupe Capitales Médias,Feu de cour fatal en Gaspésie: un éclat de métal a causé la mort de Myla Lepage Babin,2021-07-29,82,https://www.lesoleil.com/actualite/en-region/feu-de-cour-fatal-en-gaspesie-un-eclat-de-metal-a-cause-la-mort-de-myla-lepage-babin-3a0e96d49bebb9a0e65d5c02f6c5be0c,2021-10-19 12:10:28,local
Gaspé,accident,12,Le Journal de Québec,Grave accident de la route à Gaspé,,,https://www.journaldequebec.com/2020/07/22/grave-accident-de-la-route-a-gaspe,2021-10-19 12:10:28,local
Gaspé,accident,13,Le Soleil - Groupe Capitales Médias,Accident mortel sur l'autoroute 20 près de Rimouski,2021-08-23,57,https://www.lesoleil.com/actualite/en-region/accident-mortel-sur-lautoroute-20-pres-de-rimouski-78bd131acc51e509935c26974b26d88d,2021-10-19 12:10:28,local
Gaspé,accident,14,Le Soleil - Groupe Capitales Médias,Troisième décès dans l'accident du 28 juin à Caplan,2021-07-22,89,https://www.lesoleil.com/actualite/en-region/troisieme-deces-dans-laccident-du-28-juin-a-caplan-7912f6fc6853214245fd4454cf01e24e,2021-10-19 12:10:28,local
Gaspé,accident,15,Le Journal de Québec,Collision avec un poids lourd: une famille décimée à Lac-au-Saumon,2021-08-05,75,https://www.journaldequebec.com/2021/08/05/lac-au-saumon-six-blesses-graves-dans-une-collision-avec-un-poids-lourd,2021-10-19 12:10:29,local
Gaspé,accident,16,Le Journal de Québec,Gaspésie: un trentenaire hospitalisé après un accident de motocross,2021-05-10,162,https://www.journaldequebec.com/2021/05/09/gaspesie-un-trentenaire-hospitalise-apres-un-accident-de-motocross,2021-10-19 12:10:29,local
Gaspé,accident,17,Le Journal de Québec,"Gaspésie: écrasé sous un VTT, un jeune enfant décède",2021-09-01,48,https://www.journaldequebec.com/2021/09/01/gaspesie-ecrase-sous-un-vtt-un-jeune-enfant-decede,2021-10-19 12:10:29,local
Gaspé,accident,18,Le Journal de Québec,Mort d'une femme et de son enfant sur la route 132: l'identité de la conductrice dévoilée,2021-06-29,112,https://www.journaldequebec.com/2021/06/29/deces-dune-femme-et-son-enfant-sur-la-route-132-lidentite-de-la-conductrice-devoilee,2021-10-19 12:10:29,local
Gaspé,accident,19,ICI.Radio-Canada.ca,Collision entre deux camions à Maria,2021-06-28,113,https://ici.radio-canada.ca/nouvelle/1805159/collision-camions-poids-lourds-route-132-maria-gaspesie-28-juin-2021,2021-10-19 12:10:29,local
Gaspé,accident,20,Le Journal de Québec,Un motocycliste perd la vie à Saint-Siméon-de-Bonaventure,2021-06-29,112,https://www.journaldequebec.com/2021/06/29/un-motocycliste-perd-la-vie-a-saint-simeon-de-bonaventure-1,2021-10-19 12:10:29,local
Gaspé,accident,21,L’Avantage gaspésien,Accident de la route à Matane,2021-07-23,88,https://www.lavantagegaspesien.com/article/2021/07/23/accident-de-la-route-a-matane,2021-10-19 12:10:30,local
Gaspé,accident,22,Le Journal de Montréal,Grave accident à Caplan: la fillette d'un an est décédée,2021-07-22,89,https://www.journaldemontreal.com/2021/07/22/grave-accident-a-caplan--la-fillette-dun-an-est-decedee,2021-10-19 12:10:30,local
Gaspé,accident,23,Le Soleil - Groupe Capitales Médias,Autre grave accident de motoneige en Gaspésie | L'Est du Québec | Actualités,2021-02-15,246,https://www.lesoleil.com/actualite/en-region/autre-grave-accident-de-motoneige-en-gaspesie-c19bf907a57d61ff2c049df7306f29a4,2021-10-19 12:10:30,local
Gaspé,accident,24,Radio Gaspésie C J R G - FM,4 blessés dans deux accidents de la route,2021-09-09,40,https://www.radiogaspesie.ca/nouvelles/actualite/44-blesses-dans-deux-accident-de-la-route/,2021-10-19 12:10:30,local
Gaspé,accident,25,Le Journal de Québec,Gaspésie: décès d'un pêcheur et d'un plongeur sous-marin,2021-04-11,191,https://www.journaldequebec.com/2021/04/11/gaspesie-deces-dun-pecheur-et-dun-plongeur-sous-marin-durant-le-week-end,2021-10-19 12:10:30,local
Gaspé,décès OR mort,1,Le Journal de Québec,COVID-19: 342 nouveaux cas et quatre décès de plus au Québec,2021-10-19,0,https://www.journaldequebec.com/2021/10/19/covid-19-342-nouveaux-cas-et-quatre-deces-de-plus-au-quebec,2021-10-19 12:11:11,local
Gaspé,décès OR mort,2,ICI.Radio-Canada.ca,La Marche mondiale des femmes trouve des échos dans l'Est-du-Québec,2021-10-17,2,https://ici.radio-canada.ca/nouvelle/1832312/cacouna-gaspe-baie-comeau-rouge-journee-internationale-femmes,2021-10-19 12:11:11,local
Gaspé,décès OR mort,3,Le Journal de Québec,COVID-19: 512 nouveaux cas et sept décès de plus au Québec,2021-10-13,6,https://www.journaldequebec.com/2021/10/13/covid-19-512-nouveaux-cas-et-sept-deces-de-plus-au-quebec,2021-10-19 12:11:11,local
Gaspé,décès OR mort,4,CIMT-CHAU,COVID-19 : Trois nouveaux cas et un décès additionnel en Gaspésie,2021-10-15,4,https://cimtchau.ca/nouvelles/covid-19-trois-nouveaux-cas-et-un-deces-en-gaspesie/,2021-10-19 12:11:11,local
Gaspé,décès OR mort,5,Le Soleil - Groupe Capitales Médias,"Autre collision mortelle avec un orignal, cette fois en Gaspésie",2021-10-06,13,https://www.lesoleil.com/actualite/en-region/autre-collision-mortelle-avec-un-orignal-cette-fois-en-gaspesie-38d6d0318231b497de1645ad81a29834,2021-10-19 12:11:12,local
Gaspé,décès OR mort,6,Le Soleil - Groupe Capitales Médias,Feu de cour fatal en Gaspésie: un éclat de métal a causé la mort de Myla Lepage Babin,2021-07-29,82,https://www.lesoleil.com/actualite/en-region/feu-de-cour-fatal-en-gaspesie-un-eclat-de-metal-a-cause-la-mort-de-myla-lepage-babin-3a0e96d49bebb9a0e65d5c02f6c5be0c,2021-10-19 12:11:12,local
Gaspé,décès OR mort,7,CIMT-CHAU,Bilan Covid du jour pour la Gaspésie - TVA CIMT CHAU,2021-10-17,2,https://cimtchau.ca/nouvelles/bilan-covid-du-jour-pour-la-gaspesie-2/,2021-10-19 12:11:12,local
Gaspé,décès OR mort,8,NecrologieCanada,Cotton Paul-emile 2021,2021-10-05,14,https://necrocanada.com/deces-2021/cotton-paul-emile-2021/,2021-10-19 12:11:12,local
Gaspé,décès OR mort,9,Le Journal de Québec,Gaspésie: décès d'un pêcheur et d'un plongeur sous-marin,2021-04-11,191,https://www.journaldequebec.com/2021/04/11/gaspesie-deces-dun-pecheur-et-dun-plongeur-sous-marin-durant-le-week-end,2021-10-19 12:11:13,local
Gaspé,décès OR mort,10,TVA Nouvelles,410 nouveaux cas au Québec,2021-10-18,1,https://www.tvanouvelles.ca/2021/10/18/410-nouveaux-cas-au-quebec,2021-10-19 12:11:13,local
Gaspé,décès OR mort,11,NecrologieCanada,Madeleine Boulay 22 janvier 1947 – 26 septembre 2021 74 ans,2021-09-29,20,https://necrocanada.com/deces-2021/madeleine-boulay-22-janvier-1947-26-septembre-2021-74-ans/,2021-10-19 12:11:13,local
Gaspé,décès OR mort,12,NecrologieCanada,Madeleine Boulay 2021,2021-09-29,20,https://necrocanada.com/deces-2021/madeleine-boulay-2021/,2021-10-19 12:11:13,local
Gaspé,décès OR mort,13,NecrologieCanada,Yvan Adams 2021,2021-09-29,20,https://necrocanada.com/deces-2021/yvan-adams-2021/,2021-10-19 12:11:13,local
Gaspé,décès OR mort,14,Le Journal de Québec,"Accident mortel en Gaspésie: décès d'une femme et d'un bambin, un bébé entre la vie et la mort",2021-06-28,113,https://www.journaldequebec.com/2021/06/28/accident-mortel-en-gaspesie-deces-dune-femme-et-dun-bambin-un-bebe-entre-la-vie-et-la-mort,2021-10-19 12:11:14,local
Gaspé,décès OR mort,15,NecrologieCanada,Francine Mallais (1960 – 2021),2021-10-02,17,https://necrocanada.com/deces-2021/francine-mallais-1960-2021/,2021-10-19 12:11:14,local
Gaspé,décès OR mort,16,journal le soir,Double meurtre: traitement prolongé,2021-10-18,1,https://journallesoir.ca/2021/10/18/double-meurtre-traitement-prolonge/,2021-10-19 12:11:14,local
Gaspé,décès OR mort,17,CIMT-CHAU,COVID-19 : Un nouveau cas recensé en Gaspésie - TVA CIMT CHAU,2021-10-02,17,https://cimtchau.ca/nouvelles/covid-19-un-nouveau-cas-recense-en-gaspesie/,2021-10-19 12:11:14,local
Gaspé,décès OR mort,18,Le Journal de Québec,Accident mortel en Gaspésie: élan de solidarité pour une fillette mal en point,2021-07-03,108,https://www.journaldequebec.com/2021/07/02/accident-mortel-en-gaspesie-campagne-pour-aider-une-fillette-blessee,2021-10-19 12:11:14,local
Gaspé,décès OR mort,19,Le Journal de Québec,La Gaspésie s'inquiète pour la vie de touristes imprudents,2021-07-14,97,https://www.journaldequebec.com/2021/07/14/sauvetages-appel-a-la-vigilance-sur-le-fleuve-apres-un-incident,2021-10-19 12:11:15,local
Gaspé,décès OR mort,20,Le Soleil - Groupe Capitales Médias,Mort de l'ex-député de Gaspé Guy Lelièvre,2021-03-30,203,https://www.lesoleil.com/actualite/politique/mort-de-lex-depute-de-gaspe-guy-lelievre-578efbaf44dfa7e24db475db2b621486,2021-10-19 12:11:15,local
Gaspé,décès OR mort,21,CIMT-CHAU,Un nouveau cas de COVID-19 en Gaspésie - TVA CIMT CHAU,2021-09-24,25,https://cimtchau.ca/nouvelles/un-nouveau-cas-de-covid-19-en-gaspesie-6/,2021-10-19 12:11:15,local
Gaspé,décès OR mort,22,journal le soir,COVID-19 : 18 octobre 2021 – mise à jour des cas confirmés,2021-10-18,1,https://journallesoir.ca/2021/10/18/covid-19-18-octobre-2021-mise-a-jour-des-cas-confirmes/,2021-10-19 12:11:15,local
Gaspé,décès OR mort,23,TVA Nouvelles,512 nouveaux cas au Québec,2021-10-13,6,https://www.tvanouvelles.ca/2021/10/13/512-nouveaux-cas-au-quebec,2021-10-19 12:11:15,local
Gaspé,décès OR mort,24,Le Journal de Québec,Gaspésie: un accident de la route fait un mort et un blessé,2021-07-13,98,https://www.journaldequebec.com/2021/07/13/gaspesie-un-accident-de-la-route-fait-deux-blesses-1,2021-10-19 12:11:16,local
Gaspé,décès OR mort,25,Le Soleil - Groupe Capitales Médias,Un homme meurt écrasé sous son chalet à Gaspé,2021-09-16,33,https://www.lesoleil.com/actualite/en-region/un-homme-meurt-ecrase-sous-son-chalet-a-gaspe-0a6cd2d81bb08c871e140f5052dbef4f,2021-10-19 12:11:16,local
Gaspé,incendie,1,Radio Gaspésie C J R G - FM,De la fumée de feux de forêt de l'Ouest en Gaspésie,2021-10-06,13,https://www.radiogaspesie.ca/nouvelles/actualite/de-la-fumee-de-feux-de-foret-de-louest-en-gaspesie/,2021-10-19 12:11:25,local
Gaspé,incendie,2,Le Journal de Québec,Service incendie: une petite municipalité poursuivie pour près de 300 000$,2021-10-09,10,https://www.journaldequebec.com/2021/10/09/service-incendie-une-petite-municipalite-poursuivie-pour-pres-de-300-000-1,2021-10-19 12:11:25,local
Gaspé,incendie,3,L’Avantage gaspésien,Un incendie fait une blessée grave à Cap-Chat,2021-09-27,22,https://www.lavantagegaspesien.com/article/2021/09/27/un-incendie-fait-une-blessee-grave-a-cap-chat,2021-10-19 12:11:25,local
Gaspé,incendie,4,Radio-Canada.ca,"Piles au lithium, « la bombe à retardement » dans les centres de tri",2021-09-29,20,https://ici.radio-canada.ca/nouvelle/1827726/piles-lithium-centres-tri-recyclage-respect-bac-incendie,2021-10-19 12:11:26,local
Gaspé,incendie,5,Le journal de Lévis,Incendie majeur à la Davie,2021-10-06,13,https://www.journaldelevis.com/1298/%C3%80_la_une_aujourd_hui.html?id=91753,2021-10-19 12:11:26,local
Gaspé,incendie,6,Le Soleil - Groupe Capitales Médias,Feu de cour fatal en Gaspésie: un éclat de métal a causé la mort de Myla Lepage Babin,2021-07-29,82,https://www.lesoleil.com/actualite/en-region/feu-de-cour-fatal-en-gaspesie-un-eclat-de-metal-a-cause-la-mort-de-myla-lepage-babin-3a0e96d49bebb9a0e65d5c02f6c5be0c,2021-10-19 12:11:26,local
Gaspé,incendie,7,Le Soleil - Groupe Capitales Médias,Une église détruite par le feu en Gaspésie [VIDÉO],2021-04-27,175,https://www.lesoleil.com/actualite/en-region/une-eglise-detruite-par-le-feu-en-gaspesie-video-a272d524d4541c444f96340ca44761c0,2021-10-19 12:11:26,local
Gaspé,incendie,8,CIMT-CHAU,La foudre à l'origine d'un incendie à Gaspé,2021-09-07,42,https://cimtchau.ca/nouvelles/la-foudre-a-lorigine-dun-incendie-a-gaspe/,2021-10-19 12:11:26,local
Gaspé,incendie,9,ICI.Radio-Canada.ca,Incendie sur le mont Saint-Joseph : la direction du parc en mode prévention,2021-07-20,91,https://ici.radio-canada.ca/nouvelle/1810239/incendie-motorise-mont-st-joseph-signalisation-parc-regional-sensibilisation,2021-10-19 12:11:27,local
Gaspé,incendie,10,La Presse,"Un feu de camp mortel à Caplan, en Gaspésie",2021-04-25,177,https://www.lapresse.ca/actualites/regional/2021-04-25/un-feu-de-camp-mortel-a-caplan-en-gaspesie.php,2021-10-19 12:11:27,local
Gaspé,incendie,11,Le Soleil - Groupe Capitales Médias,Résidence détruite par le feu à Gaspé | Actualités,,,https://www.lesoleil.com/actualite/residence-detruite-par-le-feu-a-gaspe-9727632cdf6f384b34a1b5efc291baef,2021-10-19 12:11:27,local
Gaspé,incendie,12,ICI.Radio-Canada.ca,Un incendie majeur ravage l'église de Listuguj,2021-04-27,175,https://ici.radio-canada.ca/nouvelle/1788201/feu-eglise-listuguj-presbytere-ristigouche-patrimoine-catholique,2021-10-19 12:11:27,local
Gaspé,incendie,13,Le Soleil - Groupe Capitales Médias,Incendie de forêt maîtrisé en Haute-Gaspésie: 23 hectares partis en fumée,,,https://www.lesoleil.com/actualite/en-region/incendie-de-foret-maitrise-en-haute-gaspesie-23-hectares-partis-en-fumee-6aaa166e2f3c89fbfe87ffe4b72e07eb,2021-10-19 12:11:27,local
Gaspé,incendie,14,CIMT-CHAU,Deux fois plus de feux de forêt en Gaspésie en août,2021-09-02,47,https://cimtchau.ca/nouvelles/deux-fois-plus-de-feux-de-foret-en-gaspesie-en-aout/,2021-10-19 12:11:28,local
Gaspé,incendie,15,ICI.Radio-Canada.ca,L'enquête se poursuit sur l'incendie mortel de Saint-Siméon en 2018,2021-07-20,91,https://ici.radio-canada.ca/nouvelle/1810448/enquete-police-incendie-mortel-sq-feu-saint-simeon-baie-chaleurs,2021-10-19 12:11:28,local
Gaspé,incendie,16,Radio Gaspésie C J R G - FM,Interdiction de feu à ciel ouvert,2021-06-09,132,https://www.radiogaspesie.ca/nouvelles/actualite/interdiction-de-feu-a-ciel-ouvert/,2021-10-19 12:11:28,local
Gaspé,incendie,17,ICI.Radio-Canada.ca,Levée de l'interdiction de faire des feux à ciel ouvert dans l'Est-du-Québec,2021-06-15,126,https://ici.radio-canada.ca/nouvelle/1801890/incendie-foret-bois-sopfeu-pluie-meteo-pompier-forestier,2021-10-19 12:11:28,local
Gaspé,incendie,18,Le journal de Lévis,Offrir une autre option,2021-10-19,0,https://www.journaldelevis.com/1298/%C3%80_la_une_aujourd_hui.html?id=91866,2021-10-19 12:11:28,local
Gaspé,incendie,19,Le Soleil - Groupe Capitales Médias,Incendie majeur à la ferme le Caprivore | L'Est du Québec | Actualités,2021-02-19,242,https://www.lesoleil.com/actualite/en-region/incendie-majeur-a-la-ferme-le-caprivore-a6fe2545ce993be19c8d89a62b596ea9,2021-10-19 12:11:29,local
Gaspé,incendie,20,ICI.Radio-Canada.ca,Patrimoine Gaspésie veut des réponses sur l'incendie de la maison Busteed,2021-06-01,140,https://ici.radio-canada.ca/nouvelle/1797681/incendie-maison-busteed-listuguj-enquete,2021-10-19 12:11:29,local
Gaspé,incendie,21,Le Soleil - Groupe Capitales Médias,"Un feu de cour provoque une explosion mortelle à Caplan, en Gaspésie",2021-04-25,177,https://www.lesoleil.com/actualite/en-region/un-feu-de-cour-provoque-une-explosion-mortelle-a-caplan-en-gaspesie-09496abe6c4f5649c9e9fc200852cb68,2021-10-19 12:11:29,local
Gaspé,incendie,22,Le Soleil - Groupe Capitales Médias,"Il y a 70 ans, Cap-Chat était ravagée par les flammes",2021-07-04,107,https://www.lesoleil.com/actualite/en-region/il-y-a-70-ans-cap-chat-etait-ravagee-par-les-flammes-89446c665e396a57b307cab26736a78c,2021-10-19 12:11:29,local
Gaspé,incendie,23,Le Soleil - Groupe Capitales Médias,Incendie majeur au Kamouraska | L'Est du Québec | Actualités,2021-06-07,134,https://www.lesoleil.com/actualite/en-region/incendie-majeur-au-kamouraska-3fc01d65aba65590cafbc26df8759095,2021-10-19 12:11:29,local
Gaspé,incendie,24,Le Soleil - Groupe Capitales Médias,La Haute-Gaspésie emboucanée par un feu de forêt,,,https://www.lesoleil.com/actualite/environnement/la-haute-gaspesie-emboucanee-par-un-feu-de-foret-05a35539f110466023f829a3e529fdde,2021-10-19 12:11:29,local
Gaspé,incendie,25,ICI.Radio-Canada.ca,"Le feu de forêt à Tadoussac est considéré comme contenu à 1,5 hectare",2021-08-08,72,https://ici.radio-canada.ca/nouvelle/1815180/feu-foret-tadoussac-traversier-coupe-islet-contenu-fumee-foret,2021-10-19 12:11:30,local
Gaspé,police OR Sûreté,1,L’Avantage gaspésien,Un Matanais activement recherché par la police pour agression sexuelle armée et proxénétisme,2021-10-18,1,https://www.lavantagegaspesien.com/article/2021/10/18/un-matanais-activement-recherche-par-la-police-pour-agression-sexuelle-armee-et-proxenetisme,2021-10-19 12:11:37,local
Gaspé,police OR Sûreté,2,Le Journal de Québec,Perquisition à Gaspé: la SQ procède à l'arrestation de deux individus,2021-10-14,5,https://www.journaldequebec.com/2021/10/14/perquisition-a-gaspe-la-sq-procede-a-larrestation-de-deux-individus,2021-10-19 12:11:37,local
Gaspé,police OR Sûreté,3,TVA Nouvelles,Collision mortelle avec un orignal en Gaspésie,2021-10-06,13,https://www.tvanouvelles.ca/2021/10/06/collision-mortelle-avec-un-orignal-en-gaspesie-1,2021-10-19 12:11:37,local
Gaspé,police OR Sûreté,4,journal le soir,Double meurtre: traitement prolongé,2021-10-18,1,https://journallesoir.ca/2021/10/18/double-meurtre-traitement-prolonge/,2021-10-19 12:11:38,local
Gaspé,police OR Sûreté,5,Le Nouvelliste - Groupe Capitales Médias,"Autre collision mortelle avec un orignal, cette fois en Gaspésie",2021-10-06,13,https://www.lenouvelliste.ca/actualites/le-fil-groupe-capitales-medias/autre-collision-mortelle-avec-un-orignal-cette-fois-en-gaspesie-38d6d0318231b497de1645ad81a29834,2021-10-19 12:11:38,local
Gaspé,police OR Sûreté,6,Le Soleil - Groupe Capitales Médias,Toujours aucune piste pour élucider la disparition de Nadia Lantin,2021-09-28,21,https://www.lesoleil.com/actualite/en-region/toujours-aucune-piste-pour-elucider-la-disparition-de-nadia-lantin-41461b21c2060387edb1f765617188e9,2021-10-19 12:11:38,local
Gaspé,police OR Sûreté,7,La Presse,"Lutte contre les armes à feu | Québec déclenche un Carcajou 2,0 à l'échelle provinciale",2021-09-24,25,https://www.lapresse.ca/actualites/politique/2021-09-24/lutte-contre-les-armes-a-feu/quebec-declenche-un-carcajou-2-0-a-l-echelle-provinciale.php,2021-10-19 12:11:38,local
Gaspé,police OR Sûreté,8,Le Soleil - Groupe Capitales Médias,Une femme portée disparue dans l'arrière-pays gaspésien,2021-09-24,25,https://www.lesoleil.com/actualite/en-region/une-femme-portee-disparue-dans-larriere-pays-gaspesien-d08331cdec01b5d8f2174f4cdc318242,2021-10-19 12:11:38,local
Gaspé,police OR Sûreté,9,Le Soleil - Groupe Capitales Médias,Gaspésie: l'homme en crise se rend pacifiquement,2021-03-04,229,https://www.lesoleil.com/actualite/en-region/gaspesie-lhomme-en-crise-se-rend-pacifiquement-c312ee5bf857f6b0b076a8f1e3caefeb,2021-10-19 12:11:38,local
Gaspé,police OR Sûreté,10,ICI.Radio-Canada.ca,Québec outille les élus municipaux contre l'intimidation et le harcèlement en ligne | Élections municipales au Québec 2021,2021-10-07,12,https://ici.radio-canada.ca/nouvelle/1829973/quebec-andree-laforest-mesure-lutte-intimidation-elu-municipal-reseaux-sociaux,2021-10-19 12:11:39,local
Gaspé,police OR Sûreté,11,Le Journal de Québec,Gaspé : un homme arrêté pour agression sexuelle sur une mineure,2021-05-17,155,https://www.journaldequebec.com/2021/05/17/gaspe--un-homme-arrete-pour-agression-sexuelle-sur-une-mineure,2021-10-19 12:11:39,local
Gaspé,police OR Sûreté,12,L'Avant-Poste,Recherché pour introductions par effraction à Gaspé,2021-08-13,67,https://www.lavantposte.ca/article/2021/08/13/recherche-pour-introductions-par-effraction-a-gaspe,2021-10-19 12:11:39,local
Gaspé,police OR Sûreté,13,Le Soleil - Groupe Capitales Médias,Quatre individus arrêtés pour fraude en Gaspésie | L'Est du Québec | Actualités,2021-06-09,132,https://www.lesoleil.com/actualite/en-region/quatre-individus-arretes-pour-fraude-en-gaspesie-6105d48a2d173c0a1b235fff87f196fa,2021-10-19 12:11:39,local
Gaspé,police OR Sûreté,14,Le Journal de Québec,La Gaspésie s'inquiète pour la vie de touristes imprudents,2021-07-14,97,https://www.journaldequebec.com/2021/07/14/sauvetages-appel-a-la-vigilance-sur-le-fleuve-apres-un-incident,2021-10-19 12:11:39,local
Gaspé,police OR Sûreté,15,Le Journal de Québec,Disparition: une femme de Montréal pourrait se trouver en Gaspésie,2021-07-10,101,https://www.journaldequebec.com/2021/07/10/disparition-une-femme-de-montreal-pourrait-se-trouver-en-gaspesie,2021-10-19 12:11:40,local
Gaspé,police OR Sûreté,16,ICI.Radio-Canada.ca,Des Madelinots irrités par la présence accrue de policiers aux Iles,2021-05-25,147,https://ici.radio-canada.ca/nouvelle/1795859/manifestation-iles-madeleine-police-fermeture-zone-peche-baleines-noires,2021-10-19 12:11:40,local
Gaspé,police OR Sûreté,17,La Presse,Fraude avec des cartes bancaires | Trois Montréalais arrêtés en Gaspésie,2021-06-23,118,https://www.lapresse.ca/actualites/justice-et-faits-divers/2021-06-23/fraude-avec-des-cartes-bancaires/trois-montrealais-arretes-en-gaspesie.php,2021-10-19 12:11:40,local
Gaspé,police OR Sûreté,18,ICI.Radio-Canada.ca,Passeport vaccinal : entre réticence et satisfaction dans l'Est-du-Québec,2021-08-06,74,https://ici.radio-canada.ca/nouvelle/1814641/passeport-vaccinal-legault-preuve-vaccin-reaction-police,2021-10-19 12:11:40,local
Gaspé,police OR Sûreté,19,La Voix de l'est - Groupe Capitales Médias,Le plongeur en apnée disparu à Gaspé retrouvé sans vie,2021-04-11,191,https://www.lavoixdelest.ca/actualites/le-fil-groupe-capitales-medias/le-plongeur-en-apnee-disparu-a-gaspe-retrouve-sans-vie-9dd5198e51b1b655d610edeabfdcbd48,2021-10-19 12:11:40,local
Gaspé,police OR Sûreté,20,Le Soleil - Groupe Capitales Médias,"Près de 4,1 M$ pour la réalisation de 16 projets de développement régional en Gaspésie",2021-08-23,57,https://www.lesoleil.com/actualite/en-region/pres-de-41-m-pour-la-realisation-de-16-projets-de-developpement-regional-en-gaspesie-2a5f075cfa7fd561536a63de627bee9f,2021-10-19 12:11:40,local
Gaspé,police OR Sûreté,21,Le Devoir,"Double meurtre à Listuguj, en Gaspésie: un suspect comparaît",2021-05-17,155,https://www.ledevoir.com/societe/601838/un-homme-et-un-enfant-ont-ete-tues-samedi-a-listuguj-en-gaspesie,2021-10-19 12:11:41,local
Gaspé,police OR Sûreté,22,Le Soleil - Groupe Capitales Médias,Expansion majeure imminente à l'usine de LM Wind Power à Gaspé,2021-06-28,113,https://www.lesoleil.com/actualite/en-region/expansion-majeure-imminente-a-lusine-de-lm-wind-power-a-gaspe-104aae41a4c1deb4ba43558004c5e420,2021-10-19 12:11:41,local
Gaspé,police OR Sûreté,23,Le Soleil - Groupe Capitales Médias,Un homme meurt écrasé sous son chalet à Gaspé,2021-09-16,33,https://www.lesoleil.com/actualite/en-region/un-homme-meurt-ecrase-sous-son-chalet-a-gaspe-0a6cd2d81bb08c871e140f5052dbef4f,2021-10-19 12:11:41,local
