Plessisville,Chine,20,LesAffaires.com,Des opportunités d'affaires en Amérique latine,2020-12-09,253,https://www.lesaffaires.com/dossier/perspectives-des-marches-etrangers/des-opportunites-d-affaires-en-amerique-latine/621924,2021-08-19 10:37:06,national
Plessisville,Chine,21,La Nouvelle Union,Marché mondial du bois dur : un geste pour améliorer leur compétitivité,,,https://www.lanouvelle.net/2018/10/16/marche-mondial-du-bois-dur-un-geste-pour-ameliorer-leur-competitivite/,2021-08-19 10:37:06,national
Plessisville,Chine,22,La Nouvelle Union,Immigration : «Il faut aimer et accepter les choses nouvelles»,,,https://www.lanouvelle.net/2018/05/28/immigration-il-faut-aimer-et-accepter-les-choses-nouvelles/,2021-08-19 10:37:06,national
Plessisville,Chine,23,Truck Stop Québec,Opération nationale contre la vitesse sur les routes,2021-06-11,69,https://www.truckstopquebec.com/operation-nationale-contre-la-vitesse-sur-les-routes-63847/,2021-08-19 10:37:06,national
Plessisville,Chine,24,Le Nouvelliste - Groupe Capitales Médias,"COVID-19: 87 nouveaux cas dans la région, nouvelle éclosion dans une résidence pour aînés de Shawinigan",2020-11-13,279,https://www.lenouvelliste.ca/actualites/covid-19/covid-19-87-nouveaux-cas-dans-la-region-nouvelle-eclosion-dans-une-residence-pour-aines-de-shawinigan-a3862271facd9047a1a2f380b0f6504c,2021-08-19 10:37:06,national
Plessisville,Chine,25,Le Nouvelliste - Groupe Capitales Médias,Troisième vague: des patients plus jeunes et non immunisés,2021-05-14,97,https://www.lenouvelliste.ca/actualites/covid-19/troisieme-vague-des-patients-plus-jeunes-et-non-immunises-3febe87b53b385d115cc8902303aa7c2,2021-08-19 10:37:07,national
Plessisville,Biden OR Trump,1,Le Journal de Montréal,Fruit d'Or va agrandir son usine de Plessisville,2020-09-01,352,https://www.journaldemontreal.com/2020/09/01/fruit-dor-va-agrandir-son-usine-de-plessisville,2021-08-19 10:37:16,national
Plessisville,Biden OR Trump,2,Le Journal de Montréal,Il n'abandonnera pas les étudiants,2020-10-12,311,https://www.journaldemontreal.com/2020/10/12/il-nabandonnera-pas-les-etudiants,2021-08-19 10:37:16,national
Plessisville,Biden OR Trump,3,La Presse,Le Québec consolide son statut de deuxième producteur mondial de la canneberge,2020-12-12,250,https://www.lapresse.ca/affaires/economie/2020-12-12/le-quebec-consolide-son-statut-de-deuxieme-producteur-mondial-de-la-canneberge.php,2021-08-19 10:37:16,national
Plessisville,Biden OR Trump,4,Le Quotidien - Groupe Capitales Médias,Faire de la poutine une appellation protégée | Roger Blackburn | Chroniques,2021-05-16,95,https://www.lequotidien.com/chroniques/roger-blackburn/faire-de-la-poutine-une-appellation-protegee-6b8bc14c71f6ebe47a7c2932af03de33,2021-08-19 10:37:16,national
Plessisville,Biden OR Trump,5,Le Devoir,Alimentation: Fruit d'or avale un concurrent américain,2021-03-03,169,https://www.ledevoir.com/economie/596169/alimentation-fruit-d-or-avale-un-concurrent-americain,2021-08-19 10:37:17,national
Plessisville,Biden OR Trump,6,Le Journal de Québec,Il vole des véhicules... alors qu'il lui est interdit de conduire,2020-10-09,314,https://www.journaldequebec.com/2020/10/09/il-vole-des-vehicules-alors-quil-lui-est-interdit-de-conduire,2021-08-19 10:37:17,national
Plessisville,Biden OR Trump,7,Le Nouvelliste - Groupe Capitales Médias,"Plus de 1,5 M$ pour Aldes Canada et Conception E.M. 2010 [ARTICLE AUDIO]",2021-06-14,66,https://www.lenouvelliste.ca/affaires/plus-de-15-m-pour-aldes-canada-et-conception-em-2010-article-audio-26d4de6b1fb54e1af0559e81b7a15414,2021-08-19 10:37:17,national
Plessisville,Biden OR Trump,8,Le Journal de Montréal,Un demi-million de poules devront être abattues,,,https://www.journaldemontreal.com/2020/05/28/un-demi-million-de-poules-devront-etre-abattues,2021-08-19 10:37:17,national
Plessisville,Biden OR Trump,9,Le Journal de Montréal,Victoriaville: rejet des offres patronales chez Lactancia,2020-08-28,356,https://www.journaldemontreal.com/2020/08/28/le-syndicat-rejette-loffre-de-la-direction-de-lactancia-a-victoriaville,2021-08-19 10:37:18,national
Plessisville,Biden OR Trump,10,LesAffaires.com,Des opportunités d'affaires en Amérique latine,2020-12-09,253,https://www.lesaffaires.com/dossier/perspectives-des-marches-etrangers/des-opportunites-d-affaires-en-amerique-latine/621924,2021-08-19 10:37:18,national
Plessisville,Biden OR Trump,11,La Nouvelle Union,"De la guerre froide au bonheur, la session d'hiver sera chaude!",,,https://www.lanouvelle.net/2018/12/10/de-la-guerre-froide-au-bonheur-la-session-dhiver-sera-chaude/,2021-08-19 10:37:18,national
Plessisville,Biden OR Trump,12,Le Journal de Montréal,Elle devient populaire sur YouTube en démystifiant la Tourette,2020-09-02,351,https://www.journaldemontreal.com/2020/09/02/elle-devient-populaire-sur-youtube-en-demystifiant-la-tourette-1,2021-08-19 10:37:19,national
Plessisville,Biden OR Trump,13,Truck Stop Québec,"Purolator prévoit cueillir et livrer 46 millions de colis aux fêtes, une augmentation de près de 20 %",2020-11-09,283,https://www.truckstopquebec.com/purolator-prevoit-cueillir-et-livrer-46-millions-de-colis-aux-fetes-une-augmentation-de-pres-de-20-63212/,2021-08-19 10:37:19,national
Plessisville,Biden OR Trump,14,ICI.Radio-Canada.ca,La diversification économique d'Asbestos est bien enclenchée,2020-10-20,303,https://ici.radio-canada.ca/nouvelle/1742403/entreprises-investissements-developpement-partenariats-emplois,2021-08-19 10:37:19,national
Plessisville,Biden OR Trump,15,Le Journal de Montréal,"Le Grand R, nouveau complexe de villégiature",,,https://www.journaldemontreal.com/2015/02/13/le-grand-r-nouveau-complexe-de-villegiature,2021-08-19 10:37:19,national
Plessisville,Biden OR Trump,16,Le Journal de Montréal,Vol de données chez Desjardins: des suspects pourraient échapper à la justice,,,https://www.journaldemontreal.com/2020/06/19/vol-de-donnees-chez-desjardins-des-suspects-pourraient-echapper-a-la-justice,2021-08-19 10:37:19,national
Plessisville,Biden OR Trump,17,Le Devoir,Inspirante Victoriaville,,,https://www.ledevoir.com/societe/environnement/567945/habitation-inspirante-victoriaville,2021-08-19 10:37:20,national
Plessisville,Biden OR Trump,18,La Tribune - Groupe Capitales Médias,Un premier recours collectif contre un projet éolien sera entendu,,,https://www.latribune.ca/affaires/un-premier-recours-collectif-contre-un-projet-eolien-sera-entendu-e4d634c52fd9155a357260552d7e3472,2021-08-19 10:37:20,national
Plessisville,Biden OR Trump,19,Le Journal de Montréal,Coupable d'avoir scié sa victime,,,https://www.journaldemontreal.com/2015/04/01/coupable-davoir-scie-sa-victime,2021-08-19 10:37:20,national
Plessisville,Biden OR Trump,20,Le Devoir,Le registre sur la ligne de tir,,,https://www.ledevoir.com/politique/quebec/462311/le-registre-sur-la-ligne-de-tir,2021-08-19 10:37:20,national
Plessisville,Biden OR Trump,21,Le Journal de Montréal,Il y aura un T-Rex électrique,,,https://www.journaldemontreal.com/2018/04/04/il-y-aura-un-t-rex-electrique,2021-08-19 10:37:20,national
Plessisville,Biden OR Trump,22,Le Devoir,Plaidoyer pour que le Québec cesse de s'étaler,,,https://www.ledevoir.com/societe/transports-urbanisme/566240/urbanisme-pour-que-le-quebec-cesse-de-s-etaler,2021-08-19 10:37:21,national
Plessisville,Biden OR Trump,23,La Presse,Mobilité partagée: Sainte-Julie innove | La Presse,,,https://www.lapresse.ca/auto/2019-07-03/mobilite-partagee-sainte-julie-innove,2021-08-19 10:37:21,national
Plessisville,Biden OR Trump,24,Le Journal de Montréal,Princeville: un garage rasé par les flammes,,,https://www.journaldemontreal.com/2015/09/12/princeville-un-garage-rase-par-les-flammes,2021-08-19 10:37:21,national
Plessisville,Biden OR Trump,25,Le Journal de Montréal,Le Canadien de passage au CHU Sainte-Justine,,,https://www.journaldemontreal.com/2017/12/12/le-canadien-de-passage-au-chu-sainte-justine,2021-08-19 10:37:21,national
Plessisville,déficit,1,La Nouvelle Union,Tarifs de non-résident : la Ville de Plessisville explique,2021-02-02,198,https://www.lanouvelle.net/2021/02/02/tarifs-de-non-resident-la-ville-de-plessisville-explique/,2021-08-19 10:37:30,national
Plessisville,déficit,2,La Presse,Un répertoire de maisons décorées ! | La Presse,2020-12-18,244,https://www.lapresse.ca/societe/famille/2020-12-18/un-repertoire-de-maisons-decorees.php,2021-08-19 10:37:30,national
Plessisville,déficit,3,La Nouvelle Union,La Financière agricole trace son bilan de la mi-saison dans la région,2021-07-14,36,https://www.lanouvelle.net/2021/07/14/la-financiere-agricole-trace-son-bilan-de-la-mi-saison-dans-la-region/,2021-08-19 10:37:30,national
Plessisville,déficit,4,La Nouvelle Union,Citadelle prévoit des hausses de vente de 100 millions $ d'ici 2022,,,https://www.lanouvelle.net/2018/07/12/citadelle-prevoit-des-hausses-de-vente-de-100-millions-dici-2022/,2021-08-19 10:37:30,national
Plessisville,déficit,5,La Nouvelle Union,"1,8 G $ pour relancer l'économie et soutenir les Québécois",2020-11-12,280,https://www.lanouvelle.net/2020/11/12/18-g-pour-relancer-leconomie-et-soutenir-les-quebecois/,2021-08-19 10:37:31,national
Plessisville,déficit,6,La Nouvelle Union,"Malgré un déficit, Rock la Cauze remet 17 000 $",,,https://www.lanouvelle.net/2019/08/30/malgre-un-deficit-rock-la-cauze-remet-17-000/,2021-08-19 10:37:31,national
Plessisville,déficit,7,La Nouvelle Union,La CCIBFE revient sur le dernier budget fédéral,2021-04-22,119,https://www.lanouvelle.net/2021/04/22/la-ccibfe-revient-sur-le-dernier-budget-federal/,2021-08-19 10:37:31,national
Plessisville,déficit,8,Mon Victo,À savoir sur le budget fédéral | Fin annoncée de la PCRE Accueil,2021-04-19,122,https://monvicto.com/a-savoir-sur-le-budget-federal-fin-annoncee-de-la-pcre/,2021-08-19 10:37:31,national
Plessisville,déficit,9,La Nouvelle Union,Le personnel professionnel du Cégep en grève le 13 mai,2021-05-04,107,https://www.lanouvelle.net/2021/05/04/le-personnel-professionnel-du-cegep-en-greve-le-13-mai/,2021-08-19 10:37:31,national
Plessisville,déficit,10,La Nouvelle Union,Robert Béliveau accède à la présidence de la CCIBFE,2020-08-25,359,https://www.lanouvelle.net/2020/08/25/robert-beliveau-accede-a-la-presidence-de-la-ccibfe/,2021-08-19 10:37:32,national
Plessisville,déficit,11,La Nouvelle Union,Une nouvelle formation en génie industriel en ligne au Cégep,2020-10-27,296,https://www.lanouvelle.net/2020/10/27/une-nouvelle-formation-en-genie-industriel-en-ligne-au-cegep/,2021-08-19 10:37:32,national
Plessisville,déficit,12,La Nouvelle Union,Période de consultation pour la paroisse Notre-Dame-des-Érables,,,https://www.lanouvelle.net/2018/03/20/periode-de-consultation-paroisse-dame-erables/,2021-08-19 10:37:32,national
Plessisville,déficit,13,La Nouvelle Union,Sani Marc réalise une nouvelle acquisition,,,https://www.lanouvelle.net/2019/04/30/sani-marc-realise-une-nouvelle-acquisition/,2021-08-19 10:37:32,national
Plessisville,déficit,14,La Nouvelle Union,Résultats financiers : le cégep de Victo se classe au 7e rang,,,https://www.lanouvelle.net/2017/03/10/resultats-financiers-le-cegep-de-victo-se-classe-au-7e-rang/,2021-08-19 10:37:32,national
Plessisville,déficit,15,La Nouvelle Union,La nouvelle «passion» de Marc Patry,,,https://www.lanouvelle.net/2019/10/19/la-nouvelle-passion-de-marc-patry/,2021-08-19 10:37:33,national
Plessisville,déficit,16,La Nouvelle Union,Débat : les candidats s'expriment devant les étudiants,,,https://www.lanouvelle.net/2019/10/09/debat-les-candidats-sexpriment-devant-les-etudiants/,2021-08-19 10:37:33,national
Plessisville,déficit,17,L'Express - Drummondville,Le Condor s'envole vers Nicolet - L'Express,,,https://www.journalexpress.ca/2018/06/19/le-condor-senvole-vers-nicolet/,2021-08-19 10:37:33,national
Plessisville,déficit,18,La Nouvelle Union,"Légalisation de la marijuana : nous voterons contre, voici pourquoi",,,https://www.lanouvelle.net/2017/11/24/legalisation-de-marijuana-voterons-contre-voici/,2021-08-19 10:37:33,national
