Fermont,"""santé publique""",23,ICI.Radio-Canada.ca,Reprise de l'activité minière : plus complexe qu'un simple décret gouvernemental,,,https://ici.radio-canada.ca/nouvelle/1694460/activite-miniere-fermont-reprise-cote-nord-minerai-de-fer-arcelor-rio-tinto-champion,2021-09-18 13:19:39,mixte
Fermont,"""santé publique""",24,ICI.Radio-Canada.ca,Entente à l'amiable conclue entre Bloom Lake et la Ville de Fermont,,,https://ici.radio-canada.ca/nouvelle/1707691/bloom-lake-fermont-entente-cour-mine-impots-fonciers,2021-09-18 13:19:40,mixte
Fermont,"""santé publique""",25,Le Soleil - Groupe Capitales Médias,La grève est terminée pour les 2500 travailleurs d'ArcelorMittal,2021-06-08,102,https://www.lesoleil.com/affaires/la-greve-est-terminee-pour-les-2500-travailleurs-darcelormittal-86517c452acd2740c348acdee72b7787,2021-09-18 13:19:40,mixte
Fermont,covid OR COVID,1,Ma Côte-Nord,Les gens d'affaires de la Côte-Nord veulent l'aide du fédéral contre la pénurie de main d'œuvre,2021-08-20,29,https://macotenord.com/les-gens-daffaires-de-la-cote-nord-veulent-laide-du-federal-contre-la-penurie-de-main-doeuvre/,2021-09-18 13:19:50,mixte
Fermont,covid OR COVID,2,ICI.Radio-Canada.ca,Les cas de variant indien à Terre-Neuve-et-Labrador inquiètent la Côte-Nord | Coronavirus,2021-05-31,110,https://ici.radio-canada.ca/nouvelle/1797278/covid-cote-nord-variant-indien-inquietude,2021-09-18 13:19:50,mixte
Fermont,covid OR COVID,3,Journal Le Manic,Test de dépistage recommandé pour les clients de trois bars de Fermont,2021-04-13,158,https://www.lemanic.ca/2021/04/13/test-de-depistage-recommande-pour-les-clients-de-trois-bars-de-fermont/,2021-09-18 13:19:50,mixte
Fermont,covid OR COVID,4,Ma Côte-Nord,COVID-19 : Le CISSS Côte-Nord renforce le contrôle frontalier à Blanc-Sablon et Fermont,2021-02-18,212,https://macotenord.com/covid-19-le-cisss-cote-nord-renforce-le-controle-frontalier-a-blanc-sablon-et-fermont/,2021-09-18 13:19:50,mixte
Fermont,covid OR COVID,5,Le Journal de Québec,Vaccination: des entreprises de la Côte-Nord contribuent à l'opération,2021-04-09,162,https://www.journaldequebec.com/2021/04/09/vaccination-des-entreprises-de-la-cote-nord-contribuent-a-loperation,2021-09-18 13:19:51,mixte
Fermont,covid OR COVID,6,La Presse,ArcelorMittal | Contraventions aux employés en grève à cause du non-respect du couvre-feu,2021-05-13,128,https://www.lapresse.ca/affaires/entreprises/2021-05-13/arcelormittal/contraventions-aux-employes-en-greve-a-cause-du-non-respect-du-couvre-feu.php,2021-09-18 13:19:51,mixte
Fermont,covid OR COVID,7,TVA Nouvelles,Une mine sur la Côte-Nord à la fine pointe de la technologie,2021-08-17,32,https://www.tvanouvelles.ca/2021/08/17/une-mine-sur-la-cote-nord-a-la-fine-pointe-de-la-technologie,2021-09-18 13:19:51,mixte
Fermont,covid OR COVID,8,ICI.Radio-Canada.ca,La vaccination élargie contre la COVID-19 débute dans l'Est-du-Québec | Coronavirus,2021-03-11,191,https://ici.radio-canada.ca/nouvelle/1776195/covid-vaccin-rendez-vous-70-ans-dose-coronavirus-masse-endroits-sites,2021-09-18 13:19:51,mixte
Fermont,covid OR COVID,9,ICI.Radio-Canada.ca,Le BAPE demande à Minerai de fer Québec de revoir son projet pour la mine du lac Bloom,2021-03-08,194,https://ici.radio-canada.ca/nouvelle/1775182/bape-audiences-publiques-conclusions-mine-lac-bloom-minerai-fer,2021-09-18 13:19:51,mixte
Fermont,covid OR COVID,10,Journal Le Manic,COVID-19 : les cliniques de vaccination se multiplient à l'est de Baie-Comeau,2021-03-09,193,https://www.lemanic.ca/2021/03/09/covid-19-les-cliniques-de-vaccination-se-multiplient-a-lest-de-baie-comeau/,2021-09-18 13:19:52,mixte
Fermont,covid OR COVID,11,Le Soleil - Groupe Capitales Médias,Le chef du Temaki au coeur d'une éclosion,2021-05-07,134,https://www.lesoleil.com/actualite/covid-19/le-chef-du-temaki-au-coeur-dune-eclosion-097a6ba864e53b77ffdc5f08229de904,2021-09-18 13:19:52,mixte
Fermont,covid OR COVID,12,Ma Côte-Nord,Avis important du CISSS Côte-Nord aux gens de Fermont,2021-04-13,158,https://macotenord.com/avis-important-du-cisss-cote-nord-aux-gens-de-fermont/,2021-09-18 13:19:52,mixte
Fermont,covid OR COVID,13,Le Journal de Québec,La présence du variant indien à Terre-Neuve-et-Labrador inquiète la Côte-Nord,2021-05-31,110,https://www.journaldequebec.com/2021/05/31/la-presence-du-variant-indien-a-terre-neuve-et-labrador-inquiete-la-cote-nord-1,2021-09-18 13:19:52,mixte
Fermont,covid OR COVID,14,Le Journal de Québec,La grève d'ArcelorMittal se poursuit à Fermont,2021-05-17,124,https://www.journaldequebec.com/2021/05/17/la-greve-darcelormittal-se-poursuit-a-fermont,2021-09-18 13:19:52,mixte
Fermont,covid OR COVID,15,ICI.Radio-Canada.ca,Décès d'un bambin à Fermont : le coroner s'interroge sur la qualité des soins reçus,2021-01-22,239,https://ici.radio-canada.ca/nouvelle/1765086/olivier-degarie-cyr-mort-medecin-cisss-cote-nord-rapport-causes,2021-09-18 13:19:53,mixte
Fermont,covid OR COVID,16,ICI.Radio-Canada.ca,Les mesures imposées pour le transit par Wabush inquiètent chez ArcelorMittal à Fermont,,,https://ici.radio-canada.ca/nouvelle/1679080/arcelor-mittal-wabush-terre-neuve-labrador-fermont-isolement-covid-19,2021-09-18 13:19:53,mixte
Fermont,covid OR COVID,17,ICI.Radio-Canada.ca,La Côte-Nord passe au palier d'alerte orange,2021-04-13,158,https://ici.radio-canada.ca/nouvelle/1784495/orange-cote-nord-palier-alerte-covid-19,2021-09-18 13:19:53,mixte
Fermont,covid OR COVID,18,Ma Côte-Nord,Une minière étudie des gisements de cuivre-nickel près de Fermont et de fer au Labrador,2021-02-16,214,https://macotenord.com/une-miniere-etudie-des-gisements-de-cuivre-nickel-pres-de-fermont-et-de-fer-au-labrador/,2021-09-18 13:19:53,mixte
Fermont,covid OR COVID,19,Ma Côte-Nord,Champion Iron a complété un trimestre de profits record et de réorganisation,2021-08-01,48,https://macotenord.com/champion-iron-a-complete-un-trimestre-de-profits-record-et-de-reorganisation/,2021-09-18 13:19:53,mixte
Fermont,covid OR COVID,20,ICI.Radio-Canada.ca,Un projet de mine de fer de 500 M$ à Chibougamau et au port de Saguenay,2021-04-23,148,https://ici.radio-canada.ca/nouvelle/1786262/mine-projet-nord-du-quebec,2021-09-18 13:19:54,mixte
Fermont,covid OR COVID,21,ICI.Radio-Canada.ca,COVID-19 : restriction sur des produits de base à Fermont,,,https://ici.radio-canada.ca/nouvelle/1665103/covid-19-restriction-produits-de-base-a-fermont,2021-09-18 13:19:54,mixte
Fermont,covid OR COVID,22,Ma Côte-Nord,Un cas de COVID dans une école à Fermont,,,https://macotenord.com/un-cas-de-covid-dans-une-ecole-a-fermont/,2021-09-18 13:19:54,mixte
Fermont,covid OR COVID,23,Ma Côte-Nord,ArcelorMittal financera des améliorations dans les CPE de Port-Cartier et Fermont,2021-06-17,93,https://macotenord.com/arcelormittal-financera-des-ameliorations-dans-les-cpe-de-port-cartier-et-fermont/,2021-09-18 13:19:54,mixte
Fermont,covid OR COVID,24,Le Journal de Québec,Champion Iron acquiert le projet minier Kami,2021-04-02,169,https://www.journaldequebec.com/2021/04/02/champion-acquiert-le-projet-minier-kami-1,2021-09-18 13:19:54,mixte
Fermont,covid OR COVID,25,ICI.Radio-Canada.ca,Une première ronde de vaccination terminée dans les MRC éloignées de la Côte-Nord | Coronavirus,2021-02-19,211,https://ici.radio-canada.ca/nouvelle/1772108/vaccination-covid-19-moderna-basse-cote-nord-fermont-schefferville-minganie,2021-09-18 13:19:54,mixte
Fermont,construction,1,Ma Côte-Nord,Champion Iron évalue des sites à Fermont et Sept-Îles pour une 2e usine,2021-09-10,8,https://macotenord.com/champion-iron-evalue-des-sites-a-fermont-et-sept-iles-pour-une-2e-usine/,2021-09-18 13:20:03,mixte
Fermont,construction,2,La Presse,"Côte-Nord | Le Fonds FTQ investit dans la mine du lac Bloom, près de Fermont",2021-08-19,30,https://www.lapresse.ca/affaires/2021-08-19/cote-nord/le-fonds-ftq-investit-dans-la-mine-du-lac-bloom-pres-de-fermont.php,2021-09-18 13:20:03,mixte
Fermont,construction,3,Le Journal de Québec,Le BAPE recommande le rejet du projet de la mine du lac Bloom,2021-03-05,197,https://www.journaldequebec.com/2021/03/05/le-bape-recommande-le-rejet-du-projet-de-la-mine-du-lac-bloom,2021-09-18 13:20:03,mixte
Fermont,construction,4,ICI.Radio-Canada.ca,Route 389 : des contrats accordés à des entreprises de Uashat mak Mani-utenam,2021-04-09,162,https://ici.radio-canada.ca/nouvelle/1783519/construction-contrat-innus-gouvernement-route-389,2021-09-18 13:20:03,mixte
Fermont,construction,5,La Presse,Secteur minier | Le prix du fer stimule les investissements sur la Côte-Nord,2021-05-07,134,https://www.lapresse.ca/affaires/economie/2021-05-07/secteur-minier/le-prix-du-fer-stimule-les-investissements-sur-la-cote-nord.php,2021-09-18 13:20:03,mixte
Fermont,construction,6,Ma Côte-Nord,Champion Iron a complété un trimestre de profits record et de réorganisation,2021-08-01,48,https://macotenord.com/champion-iron-a-complete-un-trimestre-de-profits-record-et-de-reorganisation/,2021-09-18 13:20:03,mixte
Fermont,construction,7,Le Journal de Québec,La grève d'ArcelorMittal se poursuit à Fermont,2021-05-17,124,https://www.journaldequebec.com/2021/05/17/la-greve-darcelormittal-se-poursuit-a-fermont,2021-09-18 13:20:04,mixte
Fermont,construction,8,Journal Nouvelles Hebdo,Le génie en région : MSH Services-Conseil a su faire sa place,2021-09-09,9,https://www.nouvelleshebdo.com/actualite/le-genie-en-region-msh-services-conseil-a-su-faire-sa-place/,2021-09-18 13:20:04,mixte
Fermont,construction,9,Showbizz.net,Découvrez les premières images emballantes de La faille 2,2021-09-07,11,https://showbizz.net/tele/decouvrez-les-premieres-images-emballantes-de-la-faille-2,2021-09-18 13:20:04,mixte
Fermont,construction,10,ICI.Radio-Canada.ca,Un projet de mine de fer de 500 M$ à Chibougamau et au port de Saguenay,2021-04-23,148,https://ici.radio-canada.ca/nouvelle/1786262/mine-projet-nord-du-quebec,2021-09-18 13:20:04,mixte
Fermont,construction,11,ICI.Radio-Canada.ca,60 ans de convois sur le chemin de fer entre Port-Cartier et Fermont,2020-12-23,269,https://ici.radio-canada.ca/nouvelle/1759208/transport-chemin-fer-fermont-mine,2021-09-18 13:20:04,mixte
Fermont,construction,12,Ma Côte-Nord,ArcelorMittal financera des améliorations dans les CPE de Port-Cartier et Fermont,2021-06-17,93,https://macotenord.com/arcelormittal-financera-des-ameliorations-dans-les-cpe-de-port-cartier-et-fermont/,2021-09-18 13:20:05,mixte
Fermont,construction,13,Le Journal de Québec,Champion Iron acquiert le projet minier Kami,2021-04-02,169,https://www.journaldequebec.com/2021/04/02/champion-acquiert-le-projet-minier-kami-1,2021-09-18 13:20:05,mixte
Fermont,construction,14,CNW Telbec,Construction du bureau d'information touristique de Fermont - ArcelorMittal s'engage aux côtés de la MRC de Caniapiscau pour la réalisation du projet,2020-12-07,285,https://www.newswire.ca/fr/news-releases/construction-du-bureau-d-information-touristique-de-fermont-arcelormittal-s-engage-aux-cotes-de-la-mrc-de-caniapiscau-pour-la-realisation-du-projet-833713795.html,2021-09-18 13:20:05,mixte
Fermont,construction,15,Journal Le Manic,"Le Fonds d'initiatives nordiques verse 1,9 M$ dans 21 projets sur la Côte-Nord",2021-07-02,78,https://www.lemanic.ca/2021/07/02/le-fonds-dinitiatives-nordiques-verse-19-m-dans-21-projets-sur-la-cote-nord/,2021-09-18 13:20:05,mixte
Fermont,construction,16,Le Soleil - Groupe Capitales Médias,Mine du lac Bloom: Québec appuie l'accroissement de la capacité à Pointe-Noire,2020-12-11,281,https://www.lesoleil.com/affaires/mine-du-lac-bloom-quebec-appuie-laccroissement-de-la-capacite-a-pointe-noire-2cb009159d921858e5e6420dcbdb86c6,2021-09-18 13:20:06,mixte
Fermont,construction,17,Ma Côte-Nord,Réorganisation dans les écoles avec une baisse de clientèle à Port-Cartier/Sept-Îles et une hausse à Fermont,2021-06-04,106,https://macotenord.com/reorganisation-dans-les-ecoles-avec-une-baisse-de-clientele-a-port-cartier-sept-iles-et-une-hausse-a-fermont/,2021-09-18 13:20:06,mixte
Fermont,construction,18,Le Journal de Québec,Côte-Nord: les Innus approuvent l'agrandissement du parc à résidus de la mine du lac Bloom,2020-11-18,304,https://www.journaldequebec.com/2020/11/18/cote-nord-les-innus-approuvent-lagrandissement-du-parc-a-residus-de-la-mine-du-lac-bloom,2021-09-18 13:20:06,mixte
Fermont,construction,19,Ma Côte-Nord,Nouveau record de production de plus de 8 millions de tonnes de fer en un an au Lac Bloom,2021-04-28,143,https://macotenord.com/nouveau-record-de-production-de-plus-de-8-millions-de-tonnes-de-fer-en-un-an-au-lac-bloom/,2021-09-18 13:20:06,mixte
Fermont,construction,20,ICI.Radio-Canada.ca,Encore plusieurs années de travaux sur la route 389,,,https://ici.radio-canada.ca/nouvelle/1710325/fermont-baie-comeau-construction-routier,2021-09-18 13:20:06,mixte
Fermont,construction,21,Radio-Canada.ca,Entente de principe chez ArcelorMittal,2021-06-06,104,https://ici.radio-canada.ca/nouvelle/1799155/entente-principe-arcelormittal-cote-nord-juin-2021,2021-09-18 13:20:07,mixte
Fermont,construction,22,TVQC,La faille saison 2: CLUB ILLICO dévoile une bande-annonce,2021-09-07,11,https://www.tvqc.com/2021/09/07/chaine/club-illico/la-faille-saison-2-club-illico-devoile-une-bande-annonce/,2021-09-18 13:20:07,mixte
Fermont,construction,23,Le Journal de Québec,Vaccination: des entreprises de la Côte-Nord contribuent à l'opération,2021-04-09,162,https://www.journaldequebec.com/2021/04/09/vaccination-des-entreprises-de-la-cote-nord-contribuent-a-loperation,2021-09-18 13:20:07,mixte
Fermont,construction,24,Le Journal de Montréal,Le combat pour le contrôle du lithium québécois bien loin d'être gagné,2021-05-05,136,https://www.journaldemontreal.com/2021/05/05/le-combat-pour-le-controle-du-lithium-quebecois-bien-loin-detre-gagne,2021-09-18 13:20:07,mixte
Fermont,construction,25,Journal Le Manic,Route 389 : début des travaux au nord de Manic-5,,,https://www.lemanic.ca/2019/04/08/route-389-debut-des-travaux-au-nord-de-manic-5/,2021-09-18 13:20:07,mixte
