Villes,Mots-clés,position du média,Nom du média,Titre de l'article,Date de publication,Journée de différence,URL,date et heure saisie,type mot-clés
Rivière-du-Loup,"""premier ministre""",1,Info Dimanche,Souvenirs d'une cérémonie enflammée…et détrempée | infodimanche.com,2021-08-14,1,https://www.infodimanche.com/actualites/sports/434253/souvenirs-dune-ceremonie-enflammeeet-detrempee,2021-08-15 10:40:10,national
Rivière-du-Loup,"""premier ministre""",2,Info Dimanche,Bernard Généreux tente d'intervenir pour le dragage à Rivière-du-Loup | infodimanche.com,2021-08-13,2,https://www.infodimanche.com/actualites/actualite/434186/bernard-genereux-tente-dintervenir-pour-le-dragage-a-riviere-du-loup,2021-08-15 10:40:10,national
Rivière-du-Loup,"""premier ministre""",3,Info Dimanche,Places en services de garde : le ministre Mathieu Lacombe «prend le pouls» de la région | infodimanche.com,2021-07-16,30,https://www.infodimanche.com/actualites/actualite/432045/places-en-services-de-garde-le-ministre-mathieu-lacombe-prend-le-pouls-de-la-region,2021-08-15 10:40:10,national
Rivière-du-Loup,"""premier ministre""",4,ICI.Radio-Canada.ca,Les conservateurs et les libéraux dévoilent leurs candidates | Élections Canada 2021,2021-08-12,3,https://ici.radio-canada.ca/nouvelle/1815693/france-gagnon-leonie-lajoie-candidate-elections-federales-rimouski-temiscouata,2021-08-15 10:40:11,national
Rivière-du-Loup,"""premier ministre""",5,TVA Nouvelles,Les développements sur le coronavirus du 9 août 2021,2021-08-09,6,https://www.tvanouvelles.ca/2021/08/09/en-direct--les-derniers-developpements-sur-le-coronavirus,2021-08-15 10:40:11,national
Rivière-du-Loup,"""premier ministre""",6,Le Journal de Québec,Une passionnée du communautaire,2021-08-02,13,https://www.journaldequebec.com/2021/08/02/une-passionnee-du-communautaire,2021-08-15 10:40:11,national
Rivière-du-Loup,"""premier ministre""",7,CIMT-CHAU,Bernard Généreux s'oppose au déclenchement des élections,2021-08-08,7,https://cimtchau.ca/nouvelles/bernard-genereux-soppose-au-declenchement-des-elections/,2021-08-15 10:40:11,national
Rivière-du-Loup,"""premier ministre""",8,Info Dimanche,Internet haute vitesse : des municipalités des Basques toujours dans l'incertitude | infodimanche.com,2021-07-21,25,https://www.infodimanche.com/actualites/actualite/432451/internet-haute-vitesse-des-municipalites-des-basques-toujours-dans-lincertitude,2021-08-15 10:40:12,national
Rivière-du-Loup,"""premier ministre""",9,Le Journal de Québec,"COVID-19: encourageant à Rimouski, inquiétant à Rivière-du-Loup",2021-05-11,96,https://www.journaldequebec.com/2021/05/11/covid-19-mesures-durgence-levees-des-lundi-a-rimouski,2021-08-15 10:40:12,national
Rivière-du-Loup,"""premier ministre""",10,ICI.Radio-Canada.ca,Le Bas-Saint-Laurent passe au rouge | Coronavirus,2021-04-01,136,https://ici.radio-canada.ca/nouvelle/1781480/bas-saint-laurent-covid-mesure-variant-zone-rouge-mars-2021,2021-08-15 10:40:12,national
Rivière-du-Loup,"""premier ministre""",11,Le Soleil - Groupe Capitales Médias,Un Québécois sur trois restera en rouge [VIDÉO],2021-05-25,82,https://www.lesoleil.com/actualite/covid-19/un-quebecois-sur-trois-restera-en-rouge-video-ab7e5fc879771a62ba240d1db0062333,2021-08-15 10:40:13,national
Rivière-du-Loup,"""premier ministre""",12,Info Dimanche,Caroline Proulx nommée ministre responsable de la région du Bas-Saint-Laurent | infodimanche.com,2021-05-05,102,https://www.infodimanche.com/actualites/actualite/425280/caroline-proulx-nommee-ministre-responsable-de-la-region-du-bas-saint-laurent,2021-08-15 10:40:13,national
Rivière-du-Loup,"""premier ministre""",13,ICI.Radio-Canada.ca,L'est du Bas-Saint-Laurent passera au jaune et l'ouest au orange dès lundi prochain,2021-06-01,75,https://ici.radio-canada.ca/nouvelle/1797813/changement-palier-bas-saint-laurent-est-ouest,2021-08-15 10:40:13,national
Rivière-du-Loup,"""premier ministre""",14,Info Dimanche,Déconfinement au Québec : le KRTB dans une zone grise | infodimanche.com,2021-05-19,88,https://www.infodimanche.com/actualites/covid-19/426688/deconfinement-au-quebec-le-krtb-dans-une-zone-grise,2021-08-15 10:40:13,national
Rivière-du-Loup,"""premier ministre""",15,Info Dimanche,Le KRTB passera en zone jaune lundi prochain | infodimanche.com,2021-06-08,68,https://www.infodimanche.com/actualites/covid-19/428568/le-krtb-passera-en-zone-jaune-lundi-prochain,2021-08-15 10:40:14,national
Rivière-du-Loup,"""premier ministre""",16,CNW Telbec,"Opération haute vitesse - Près de 39,7 M$ pour donner accès à Internet haute vitesse à 5 300 foyers dans le Bas-Saint-Laurent d'ici septembre 2022",2021-07-09,37,https://www.newswire.ca/fr/news-releases/operation-haute-vitesse-pres-de-39-7-m-pour-donner-acces-a-internet-haute-vitesse-a-5-300-foyers-dans-le-bas-saint-laurent-d-ici-septembre-2022-815126047.html,2021-08-15 10:40:14,national
Rivière-du-Loup,"""premier ministre""",17,Info Dimanche,Passage au palier d'alerte orange : le KRTB devra attendre une semaine de plus | infodimanche.com,2021-05-25,82,https://www.infodimanche.com/actualites/covid-19/427197/passage-au-palier-dalerte-orange-le-krtb-devra-attendre-une-semaine-de-plus,2021-08-15 10:40:14,national
Rivière-du-Loup,"""premier ministre""",18,La Presse,Éclosion à Rivière-du-Loup | Du Breton ferme son abattoir,2021-05-12,95,https://www.lapresse.ca/covid-19/2021-05-12/eclosion-a-riviere-du-loup/du-breton-ferme-son-abattoir.php,2021-08-15 10:40:14,national
Rivière-du-Loup,"""premier ministre""",19,Info Dimanche,Investissements routiers : près de 469 M$ pour le Bas-Saint-Laurent | infodimanche.com,2021-04-08,129,https://www.infodimanche.com/actualites/actualite/422630/investissements-routiers-pres-de-469-m$-pour-le-bas-saint-laurent,2021-08-15 10:40:14,national
Rivière-du-Loup,"""premier ministre""",20,ICI.Radio-Canada.ca,La nouvelle ministre responsable du Bas-Saint-Laurent en tournée dans la région,2021-06-15,61,https://ici.radio-canada.ca/nouvelle/1801725/caroline-proulx-ministre-responsable-bas-saint-laurent-tournee,2021-08-15 10:40:14,national
Rivière-du-Loup,"""premier ministre""",21,Info Dimanche,Couvre-feu : 10 500 $ d'amendes à sept employés du restaurant le Loft de Rivière-du-Loup | infodimanche.com,2021-04-01,136,https://www.infodimanche.com/actualites/actualite/422004/couvre-feu-10-500-$-damendes-a-sept-employes-du-restaurant-le-loft-de-riviere-du-loup,2021-08-15 10:40:15,national
Rivière-du-Loup,"""premier ministre""",22,Info Dimanche,Près de 868 000 $ pour améliorer la couverture ambulancière à Cabano | infodimanche.com,2021-04-30,107,https://www.infodimanche.com/actualites/actualite/424694/pres-de-868-000-$-pour-ameliorer-la-couverture-ambulanciere-a-cabano,2021-08-15 10:40:15,national
Rivière-du-Loup,"""premier ministre""",23,CIMT-CHAU,La Ville demande l'aide de Québec dans le dossier de la traverse de Rivière-du-Loup/Saint-Siméon,2021-02-08,188,https://cimtchau.ca/nouvelles/la-ville-demande-laide-de-quebec-dans-le-dossier-de-la-traverse-de-riviere-du-loup-saint-simeon/,2021-08-15 10:40:15,national
Rivière-du-Loup,"""premier ministre""",24,Info Dimanche,Les élus de la région souhaitent un retour de Denis Tardif au sein du caucus de la CAQ | infodimanche.com,2021-01-22,205,https://www.infodimanche.com/actualites/actualite/415985/les-elus-de-la-region-souhaitent-un-retour-de-denis-tardif-au-sein-du-caucus-de-la-caq,2021-08-15 10:40:15,national
Rivière-du-Loup,"""premier ministre""",25,CIMT-CHAU,Les enseignants du Cégep de Rivière-du-Loup de nouveau en grève le 13 mai,2021-05-11,96,https://cimtchau.ca/nouvelles/les-enseignants-du-cegep-de-riviere-du-loup-de-nouveau-en-greve-le-13-mai/,2021-08-15 10:40:15,national
Rivière-du-Loup,climat,1,ICI.Radio-Canada.ca,Le chef du Parti québécois en tournée dans l'Est-du-Québec,2021-07-29,17,https://ici.radio-canada.ca/nouvelle/1812583/tournee-paul-st-pierre-plamondon-est-quebec-gaspesie-bas-st-laurent-iles-madeleine,2021-08-15 10:40:53,national
Rivière-du-Loup,climat,2,Le Devoir,Mille défis surmontés pour l'agriculture… et autant à venir,2021-07-19,27,https://www.ledevoir.com/economie/618978/egoportrait-mille-defis-surmontes-et-autant-a-venir,2021-08-15 10:40:53,national
Rivière-du-Loup,climat,3,Info Dimanche,Big Wolf's Backyard Ultra : la chaleur n'est pas venue à bout de tous les coureurs | infodimanche.com,2021-07-18,28,https://www.infodimanche.com/actualites/sports/432133/big-wolfs-backyard-ultra-la-chaleur-nest-pas-venue-a-bout-de-tous-les-coureurs,2021-08-15 10:40:53,national
Rivière-du-Loup,climat,4,L'Écho de Maskinongé,Travaux d'asphaltage à Saint-Alexis-des-Monts,2021-07-27,19,https://www.lechodemaskinonge.com/actualites/travaux-dasphaltage-a-saint-alexis-des-monts/,2021-08-15 10:40:53,national
Rivière-du-Loup,climat,5,Le Quotidien - Groupe Capitales Médias,"Germain Lepage, octogénaire et globe-trotteur | Actualités",2021-08-09,6,https://www.lequotidien.com/actualites/germain-lepage-octogenaire-et-globe-trotteur-eecbe079af45c77f330a123245e1fdc4,2021-08-15 10:40:54,national
Rivière-du-Loup,climat,6,ICI.Radio-Canada.ca,"Des pompes pour dégager la rivière du Loup, demande le maire de Louiseville",2021-07-12,34,https://ici.radio-canada.ca/nouvelle/1808237/pompes-riviere-du-loup-sable-ecosysteme,2021-08-15 10:40:54,national
Rivière-du-Loup,climat,7,Info Dimanche,Une marche en appui aux actions climatiques à Rivière-du-Loup | infodimanche.com,,,https://www.infodimanche.com/actualites/actualite/371865/une-marche-en-appui-aux-actions-climatiques-a-riviere-du-loup,2021-08-15 10:40:54,national
Rivière-du-Loup,climat,8,Info Dimanche,COVID-19 : la mairesse de Rivière-du-Loup Sylvie Vignet est vaccinée | infodimanche.com,2021-04-12,125,https://www.infodimanche.com/actualites/covid-19/422937/covid-19-la-mairesse-de-riviere-du-loup-sylvie-vignet-est-vaccinee,2021-08-15 10:40:54,national
Rivière-du-Loup,climat,9,Info Dimanche,Mairie de Rivière-du-Loup : Sylvie Vignet passe le flambeau à Mario Bastille | infodimanche.com,2021-07-06,40,https://www.infodimanche.com/actualites/actualite/430995/mairie-de-riviere-du-loup-sylvie-vignet-passe-le-flambeau-a-mario-bastille,2021-08-15 10:40:54,national
Rivière-du-Loup,climat,10,Le Devoir,L'ancien maire de Rivière-du-Loup Michel Morin a été retrouvé sans vie,2021-05-24,83,https://www.ledevoir.com/societe/603998/l-ancien-maire-de-riviere-du-loup-michel-morin-a-ete-retrouve-sans-vie,2021-08-15 10:40:54,national
Rivière-du-Loup,climat,11,Le Soleil - Groupe Capitales Médias,COVID-19: violence et débordements dans des bars de Rivière-du-Loup et du Kamouraska,2020-12-14,244,https://www.lesoleil.com/actualite/en-region/covid-19-violence-et-debordements-dans-des-bars-de-riviere-du-loup-et-du-kamouraska-78293667bd983dabccce5d69e7ed6370,2021-08-15 10:40:55,national
Rivière-du-Loup,climat,12,Le Monde,"« Il y a tant à faire avant de craquer » : trois semaines après des inondations mortelles, la vallée de l'Ahr, dans l'ouest de l'Allemagne, peine à se remettre",2021-08-05,10,https://www.lemonde.fr/climat/article/2021/08/05/il-y-a-tant-a-faire-avant-de-craquer-trois-semaines-apres-les-inondations-mortelles-ahrweiler-peine-a-se-remettre_6090665_1652612.html,2021-08-15 10:40:55,national
Rivière-du-Loup,climat,13,Info Dimanche,Rivière-du-Loup marche pour le climat | infodimanche.com,,,https://www.infodimanche.com/actualites/actualite/372686/riviere-du-loup-marche-pour-le-climat,2021-08-15 10:40:55,national
Rivière-du-Loup,climat,14,L'Horizon,La Finlande s'invite au 46e gala des réussites du Cégep de Rivière-du-Loup,2021-04-22,115,http://www.journalhorizon.com/la-finlande-sinvite-au-46e-gala-des-reussites-du-cegep-de-riviere-du-loup/,2021-08-15 10:40:55,national
Rivière-du-Loup,climat,15,Info Dimanche,Projet de passerelle entre Saint-Ludger et le parc des Chutes à Rivière-du-Loup | infodimanche.com,2021-05-10,97,https://www.infodimanche.com/actualites/actualite/425653/projet-de-passerelle-entre-saint-ludger-et-le-parc-des-chutes-a-riviere-du-loup,2021-08-15 10:40:55,national
Rivière-du-Loup,climat,16,Le Soleil - Groupe Capitales Médias,Rivière-du-Loup: un prêtre coupable d'agressions sexuelles,2021-02-24,172,https://www.lesoleil.com/actualites/riviere-du-loup-un-pretre-coupable-dagressions-sexuelles-865c61015f47ac0f412082ae5e1930a1,2021-08-15 10:40:55,national
Rivière-du-Loup,climat,17,Le Droit - Groupe Capitales Médias,Hanté par une pierre tombale à Rivière-du-Loup,2021-02-17,179,https://www.ledroit.com/actualites/le-fil-groupe-capitales-medias/hante-par-une-pierre-tombale-a-riviere-du-loup-c389f86472dc3c8d65c53393c4c231e7,2021-08-15 10:40:56,national
Rivière-du-Loup,climat,18,Le Soleil - Groupe Capitales Médias,Appel au dépistage lancé auprès de clients de La Boîte à sushis de Rivière-du-Loup,2021-03-19,149,https://www.lesoleil.com/actualite/en-region/appel-au-depistage-lance-aupres-de-clients-de-la-boite-a-sushis-de-riviere-du-loup-172d5e2e138eb8a0cb2a97e36164ea30,2021-08-15 10:40:56,national
Rivière-du-Loup,climat,19,CIMT-CHAU,"« Le climat était devenu toxique », dit Sylvain Roy",2021-06-07,69,https://cimtchau.ca/nouvelles/le-climat-etait-devenu-toxique-dit-sylvain-roy/,2021-08-15 10:40:56,national
Rivière-du-Loup,climat,20,ICI.Radio-Canada.ca,L'éclosion chez Viandes du Breton a fait 94 cas de COVID-19 au total,2021-05-12,95,https://ici.radio-canada.ca/nouvelle/1792472/viandes-du-breton-riviere-loup-covid-eclosion-syndicat,2021-08-15 10:40:57,national
Rivière-du-Loup,climat,21,CIMT-CHAU,Climat de travail toxique : Marie-Eve Proulx démissionne de son poste de ministre,2021-05-04,103,https://cimtchau.ca/nouvelles/marie-eve-proulx-demissionne-de-son-poste-de-ministre/,2021-08-15 10:40:57,national
Rivière-du-Loup,climat,22,Le Journal de Montréal,"Climat : le seuil de +1,5 °C risque d'être atteint d'ici 2025, avertit l'ONU",2021-05-27,80,https://www.journaldemontreal.com/2021/05/27/climat--le-seuil-de-15-c-risque-detre-atteint-dici-2025-avertit-lonu,2021-08-15 10:40:57,national
Rivière-du-Loup,climat,23,Le Soleil - Groupe Capitales Médias,Rivière-du-Loup: trois ans de pénitencier pour un prêtre pédophile,2021-06-11,65,https://www.lesoleil.com/actualite/en-region/riviere-du-loup-trois-ans-de-penitencier-pour-un-pretre-pedophile-75cf81c7115882a98fdcac505005d176,2021-08-15 10:40:57,national
Rivière-du-Loup,climat,24,ICI.Radio-Canada.ca,L'est du Bas-Saint-Laurent passera au jaune et l'ouest au orange dès lundi prochain,2021-06-01,75,https://ici.radio-canada.ca/nouvelle/1797813/changement-palier-bas-saint-laurent-est-ouest,2021-08-15 10:40:57,national
Rivière-du-Loup,climat,25,Info Dimanche,Fin des travaux au barrage du lac de la Grande Fourche | infodimanche.com,2021-05-31,76,https://www.infodimanche.com/actualites/actualite/427651/fin-des-travaux-au-barrage-du-lac-de-la-grande-fourche,2021-08-15 10:40:58,national
Rivière-du-Loup,immigration,1,Le Devoir,Mille défis surmontés pour l'agriculture… et autant à venir,2021-07-19,27,https://www.ledevoir.com/economie/618978/egoportrait-mille-defis-surmontes-et-autant-a-venir,2021-08-15 10:41:07,national
Rivière-du-Loup,immigration,2,Info Dimanche,Près de 600 000 $ pour l'intégration des personnes immigrantes au BSL | infodimanche.com,2021-06-15,61,https://www.infodimanche.com/actualites/actualite/429217/pres-de-600-000-$-pour-lintegration-des-personnes-immigrantes-au-bsl,2021-08-15 10:41:07,national
Rivière-du-Loup,immigration,3,CIMT-CHAU,"Pénurie de main-d'œuvre : des restaurants ferment, des hôteliers sont à bout de souffle",2021-07-30,16,https://cimtchau.ca/nouvelles/penurie-de-main-doeuvre-des-restaurants-ferment-des-hoteliers-sont-a-bout-de-souffle/,2021-08-15 10:41:08,national
Rivière-du-Loup,immigration,4,Info Dimanche,Une nouvelle vie à Rivière-du-Loup | infodimanche.com,,,https://www.infodimanche.com/actualites/actualite/309124/une-nouvelle-vie-a-riviere-du-loup,2021-08-15 10:41:08,national
Rivière-du-Loup,immigration,5,Le Nouvelliste - Groupe Capitales Médias,Louiseville veut faciliter la navigation en creusant une partie de la rivière du Loup [ARTICLE AUDIO],2021-07-13,33,https://www.lenouvelliste.ca/actualites/louiseville-veut-faciliter-la-navigation-en-creusant-une-partie-de-la-riviere-du-loup-article-audio-ba5f655a7275fa2b4961995f3a258057,2021-08-15 10:41:08,national
Rivière-du-Loup,immigration,6,Info Dimanche,"2020, une année haute en couleurs pour le Centre local de développement de Rivière-du-Loup | infodimanche.com",2021-04-25,112,https://www.infodimanche.com/actualites/affaires-et-economie/424068/2020-une-annee-haute-en-couleurs-pour-le-centre-local-de-developpement-de-riviere-du-loup,2021-08-15 10:41:09,national
Rivière-du-Loup,immigration,7,Le Placoteux,Retard à l'Immigration : Une Réunionnaise à un cheveu de devoir rentrer chez elle - Journal Le Placoteux,2021-03-02,166,https://leplacoteux.com/retard-a-limmigration-une-reunionnaise-a-un-cheveu-de-devoir-rentrer-chez-elle/,2021-08-15 10:41:09,national
Rivière-du-Loup,immigration,8,ICI.Radio-Canada.ca,Un isolement exacerbé pour les immigrants durant le temps des Fêtes,2020-12-26,232,https://ici.radio-canada.ca/nouvelle/1759531/exil-immigration-pandemie-noel-rimouski-seul-solitude,2021-08-15 10:41:10,national
Rivière-du-Loup,immigration,9,L'Horizon,Le Parti Québécois presse le gouvernement d'agir pour régionaliser l'immigration,2021-06-21,55,http://www.journalhorizon.com/le-parti-quebecois-presse-le-gouvernement-dagir-pour-regionaliser-limmigration/,2021-08-15 10:41:10,national
Rivière-du-Loup,immigration,10,Le Devoir,Mobilisation autour du renvoi d'un travailleur essentiel vers l'Inde,2021-06-10,66,https://www.ledevoir.com/societe/609507/immigration-je-me-sens-comme-un-criminel-alors-que-je-n-ai-rien-fait,2021-08-15 10:41:10,national
Rivière-du-Loup,immigration,11,Le Journal de Montréal,La noyade démographique du peuple québécois | JDM,2021-04-07,130,https://www.journaldemontreal.com/2021/04/07/la-noyade-demographique-du-peuple-quebecois,2021-08-15 10:41:10,national
Rivière-du-Loup,immigration,12,Info Dimanche,Un nouveau visage au bureau de Rivière-du-Loup de Bernard Généreux | infodimanche.com,2021-06-17,59,https://www.infodimanche.com/actualites/actualite/429348/un-nouveau-visage-au-bureau-de-riviere-du-loup-de-bernard-genereux,2021-08-15 10:41:11,national
Rivière-du-Loup,immigration,13,Le Journal de Québec,À la recherche d'un «trésor archéologique» du Bas-Saint-Laurent,2021-02-14,182,https://www.journaldequebec.com/2021/02/14/a-la-recherche-dun-tresor-archeologique-du-bas-saint-laurent-1,2021-08-15 10:41:11,national
Rivière-du-Loup,immigration,14,ICI.Radio-Canada.ca,Des efforts déployés pour parler de vaccination avec les nouveaux arrivants,2021-05-16,91,https://ici.radio-canada.ca/nouvelle/1793442/pandemie-vaccination-nouvel-arrivant-immigrant-rimouski-immigration,2021-08-15 10:41:11,national
Rivière-du-Loup,immigration,15,Le Placoteux,"Retards dans le traitement de demandes auprès d'Immigration, Réfugiés et Citoyenneté Canada - Journal Le Placoteux",2021-02-19,177,https://leplacoteux.com/retards-dans-le-traitement-de-demandes-aupres-dimmigration-refugies-et-citoyennete-canada/,2021-08-15 10:41:11,national
Rivière-du-Loup,immigration,16,TVA Nouvelles,Délais pour la résidence permanente: «J'aurais pu m'imaginer vivre ici»,2021-07-12,34,https://www.tvanouvelles.ca/2021/07/12/delais-pour-la-residence-permanente-jaurais-pu-mimaginer-vivre-ici,2021-08-15 10:41:11,national
Rivière-du-Loup,immigration,17,CIMT-CHAU,Une table ronde sur l'emploi et l'immigration dans Charlevoix - TVA CIMT CHAU,2021-04-24,113,https://cimtchau.ca/nouvelles/82656/,2021-08-15 10:41:11,national
Rivière-du-Loup,immigration,18,Info Dimanche,Des personnes et des entreprises au cœur des activités du CLD de la région de Rivière-du-Loup | infodimanche.com,2021-04-01,136,https://www.infodimanche.com/actualites/affaires-et-economie/421940/des-personnes-et-des-entreprises-au-cur-des-activites-du-cld-de-la-region-de-riviere-du-loup,2021-08-15 10:41:12,national
Rivière-du-Loup,immigration,19,Le Soleil - Groupe Capitales Médias,Rimouski prend le virage de l'immigration | L'Est du Québec | Actualités,,,https://www.lesoleil.com/actualite/en-region/rimouski-prend-le-virage-de-limmigration-720191c93c6d53883d799c822456b969,2021-08-15 10:41:12,national
Rivière-du-Loup,immigration,20,Le Soleil - Groupe Capitales Médias,Éclosion à l'hôpital de Rivière-du-Loup: le nombre de cas augmente,2020-09-29,320,https://www.lesoleil.com/actualite/covid-19/eclosion-a-lhopital-de-riviere-du-loup-le-nombre-de-cas-augmente-2689639d7d3e0a5bfd15ffcb9307cdaf,2021-08-15 10:41:12,national
Rivière-du-Loup,immigration,21,Le Journal de Québec,COVID-19: François Legault défend le voyage au Pérou de son député Youri Chassin,2021-01-19,208,https://www.journaldequebec.com/2021/01/19/covid-19-francois-legault-defend-le-voyage-au-perou-de-son-depute-youri-chassin,2021-08-15 10:41:12,national
Rivière-du-Loup,immigration,22,Info Dimanche,Début de saison estivale en demi-teinte pour les restaurateurs de la région | infodimanche.com,2021-07-15,31,https://www.infodimanche.com/actualites/actualite/431801/debut-de-saison-estivale-en-demi-teinte-pour-les-restaurateurs-de-la-region,2021-08-15 10:41:12,national
Rivière-du-Loup,immigration,23,Le Journal de Montréal,Mois de l'histoire des Noirs: des entrepreneurs d'ici vous présentent leur réalité,2021-02-08,188,https://www.journaldemontreal.com/2021/02/08/mois-de-lhistoire-des-noirs-des-entrepreneurs-dici-vous-presentent-leur-realite,2021-08-15 10:41:13,national
Rivière-du-Loup,immigration,24,Info Dimanche,Le plus gros salon de l'emploi et de la formation continue revient pour une 2e édition | infodimanche.com,2021-03-24,144,https://www.infodimanche.com/actualites/id-plus-reportages-finances/420995/le-plus-gros-salon-de-lemploi-et-de-la-formation-continue-revient-pour-une-2e-edition,2021-08-15 10:41:13,national
Rivière-du-Loup,immigration,25,Info Dimanche,Bernard Généreux dresse le bilan de la session parlementaire | infodimanche.com,2021-06-28,48,https://www.infodimanche.com/actualites/actualite/430389/bernard-genereux-dresse-le-bilan-de-la-session-parlementaire,2021-08-15 10:41:13,national
Rivière-du-Loup,racisme,1,Baron Mag,Les nouvelles brassicoles de Baron Mag: 7 août 2021,2021-08-07,8,https://baronmag.com/2021/08/les-nouvelles-brassicoles-de-baron-mag-7-aout-2021/,2021-08-15 10:41:23,national
Rivière-du-Loup,racisme,2,ICI.Radio-Canada.ca,La Ligue de hockey junior du Manitoba prend des mesures pour contrer le racisme,2021-06-10,66,https://ici.radio-canada.ca/nouvelle/1800397/anti-racisme-education-hockey-wade-houle-saurette,2021-08-15 10:41:23,national
Rivière-du-Loup,racisme,3,Baron Mag,Les nouvelles brassicoles de Baron Mag: 4 août 2021,2021-08-04,11,https://baronmag.com/2021/08/les-nouvelles-brassicoles-de-baron-mag-4-aout-2021/,2021-08-15 10:41:23,national
Rivière-du-Loup,racisme,4,Le Journal de Québec,"Deux infirmières congédiées pour des propos racistes envers une autochtone: une «culture» difficile à changer, admet Dubé",2021-03-16,152,https://www.journaldequebec.com/2021/03/16/autochtone-victime-de-racisme-a-joliette-les-elus-de-lassemblee-nationale-choques,2021-08-15 10:41:23,national
Rivière-du-Loup,racisme,5,Le Devoir,Demande de recours collectif contre le racisme systémique dans la fonction publique canadienne,2020-12-19,239,https://www.ledevoir.com/societe/592058/societe-demande-de-recours-collectif-contre-le-racisme-systemique-dans-la-fonction-publique-canadienne,2021-08-15 10:41:24,national
Rivière-du-Loup,racisme,6,ICI.Radio-Canada.ca,Sensibilisation des futurs policiers au racisme : un ajout bien reçu à Rimouski,2021-04-09,128,https://ici.radio-canada.ca/nouvelle/1783464/autochtone-innus-cegep-rimouski-technique-policiere-racisme,2021-08-15 10:41:24,national
Rivière-du-Loup,racisme,7,Le Droit - Groupe Capitales Médias,Famille royale: Trudeau refuse de se prononcer sur les allégations de racisme,2021-03-10,158,https://www.ledroit.com/actualites/famille-royale-trudeau-refuse-de-se-prononcer-sur-les-allegations-de-racisme-7ac2d3d94afed321e42b500b680b70f1,2021-08-15 10:41:24,national
Rivière-du-Loup,racisme,8,TVA Nouvelles,Un commandant du SPVM dénonce le racisme systémique au sein de la police,2021-06-07,69,https://www.tvanouvelles.ca/2021/06/07/un-commandant-du-spvm-denonce-le-racisme-systemique-au-sein-de-la-police-1,2021-08-15 10:41:24,national
Rivière-du-Loup,racisme,9,TVA Nouvelles,La communauté asiatique de Montréal dénonce le racisme,2021-03-21,147,https://www.tvanouvelles.ca/2021/03/21/photos-des-centaines-de-personnes-a-la-manifestation-contre-le-racisme-anti-asiatique-1,2021-08-15 10:41:25,national
Rivière-du-Loup,racisme,10,Info Dimanche,Théâtre : King Dave en première québécoise à Rivière-du-Loup | infodimanche.com,2021-03-07,161,https://www.infodimanche.com/actualites/culture/419442/theatre-king-dave-en-premiere-quebecoise-a-riviere-du-loup,2021-08-15 10:41:25,national
Rivière-du-Loup,racisme,11,Le Journal de Québec,Quand le racisme est à géométrie variable,2021-03-17,151,https://www.journaldequebec.com/2021/03/17/quand-le-racisme-est-a-geometrie-variable,2021-08-15 10:41:25,national
Rivière-du-Loup,racisme,12,TVA Nouvelles,Euro 2020: des insultes racistes envers des joueurs anglais,2021-07-12,34,https://www.tvanouvelles.ca/2021/07/12/euro-des-insultes-racistes-envers-des-joueurs-anglais,2021-08-15 10:41:26,national
Rivière-du-Loup,racisme,13,Journal Métro,À la recherche de la cloche de la Visitation,2021-04-27,110,https://journalmetro.com/local/ahuntsic-cartierville/2635506/a-la-recherche-de-la-cloche-de-la-visitation/,2021-08-15 10:41:26,national
