Villes,Mots-clés,position du média,Nom du média,Titre de l'article,Date de publication,Journée de différence,URL,date et heure saisie,type mot-clés
Chambly,accident,1,Chambly Matin,"Une rétrocaveuse entre en collision avec un poteau électrique à Marieville - Chambly Matin - Journal le Chambly Matin, Montérégie Quotidien",2021-07-29,30,https://www.chamblymatin.com/information/nouvelles/manchettes-locales/ville-de-marieville-service-incendie-de-marieville-collision-faits-divers-urgence-hydro-quebec-accident.html,2021-08-28 16:42:59,local
Chambly,accident,2,La Nouvelle Union,Spectaculaire accident : l'alcool serait en cause,2021-08-06,22,https://www.lanouvelle.net/2021/08/06/spectaculaire-accident-lalcool-serait-en-cause/,2021-08-28 16:42:59,local
Chambly,accident,3,Chambly Matin,"Un motocycliste perd la vie dans un accident à Saint-Césaire - Chambly Matin - Journal le Chambly Matin, Montérégie Quotidien",2021-08-03,25,https://www.chamblymatin.com/information/nouvelles/manchettes-locales/ville-de-st-cesaire-fait-divers-accident-de-moto-surete-du-quebec-motocycliste.html,2021-08-28 16:42:59,local
Chambly,accident,4,Chambly Matin,"Collision entre deux véhicules à Marieville - Chambly Matin - Journal le Chambly Matin, Montérégie Quotidien",2021-08-23,5,https://www.chamblymatin.com/information/nouvelles/manchettes-locales/ville-de-marieville-faits-divers-collision-service-de-securite-incendie-de-marieville-accident-route-112.html,2021-08-28 16:42:59,local
Chambly,accident,5,actu.fr,"[MIS À JOUR] Grave accident à Chambly, une voiture chute de plusieurs mètres",2021-05-13,107,https://actu.fr/hauts-de-france/chambly_60139/chambly-grave-accident-de-la-route-a-cote-du-stade_41829685.html,2021-08-28 16:42:59,local
Chambly,accident,6,Le Journal de Chambly,Accident sur le boulevard de Périgny - Le journal de Chambly,2021-03-02,179,https://www.journaldechambly.com/accident-sur-le-boulevard-de-perigny-2/,2021-08-28 16:43:00,local
Chambly,accident,7,Chambly Matin,"Une rentrée scolaire en toute sécurité - Chambly Matin - Journal le Chambly Matin, Montérégie Quotidien",2021-08-27,1,https://www.chamblymatin.com/information/nouvelles/manchettes-locales/rentree-scolaire-securite-regie-intermunicipale-de-police-richelieu-saint-laurent.html,2021-08-28 16:43:00,local
Chambly,accident,8,Oise Hebdo,Une personne désincarcérée après un accident entre trois voitures près de Méru,2021-02-16,193,https://www.oisehebdo.fr/2021/02/16/une-personne-desincarceree-apres-un-accident-entre-trois-voitures-pres-de-meru/,2021-08-28 16:43:00,local
Chambly,accident,9,actu.fr,Chambly : un accident de la route fait cinq blessés sur la D1001,2021-03-14,167,https://actu.fr/hauts-de-france/chambly_60139/chambly-un-accident-de-la-route-fait-cinq-blesses-sur-la-d1001_40209797.html,2021-08-28 16:43:00,local
Chambly,accident,10,Le Courrier picard,Une mère de famille perd la vie dans un accident de la route à Puits-la-Vallée,2021-07-19,40,https://www.courrier-picard.fr/id214336/article/2021-07-19/une-mere-de-famille-perd-la-vie-dans-un-accident-de-la-route-puits-la-vallee,2021-08-28 16:43:01,local
Chambly,accident,11,Le Courrier picard,"Un carambolage fait un mort sur l’A1 dans l’Oise, la circulation très perturbée",2021-06-02,87,https://www.courrier-picard.fr/id198740/article/2021-06-02/lautoroute-a1-coupee-au-niveau-de-ressons-sur-matz-suite-un-grave-accident,2021-08-28 16:43:01,local
Chambly,accident,12,Chambly Matin,"Un véhicule a fait une sortie de route sur l'autoroute 10 à Marieville - Chambly Matin - Journal le Chambly Matin, Montérégie Quotidien",2021-07-08,51,https://www.chamblymatin.com/information/nouvelles/manchettes-locales/faits-divers-accident-sortie-de-route-marieville-surete-du-quebec.html,2021-08-28 16:43:02,local
Chambly,accident,13,Courrier Picard,Oise: une passagère de 38 ans décède dans un accident à Anserville,2021-02-13,196,https://www.courrier-picard.fr/id165204/article/2021-02-13/oise-circulation-interrompue-sur-la-d1001-hauteur-de-sainte-genevieve,2021-08-28 16:43:02,local
Chambly,accident,14,actu.fr,Oise : six blessés dans un accident entre deux voitures près de Méru,2021-04-13,137,https://actu.fr/hauts-de-france/andeville_60012/oise-six-blesses-dans-un-accident-entre-deux-voitures-pres-de-meru_41010846.html,2021-08-28 16:43:02,local
Chambly,accident,15,Le Courrier picard,Oise: un motard perd la vie après un accident à Auteuil,2021-06-07,82,https://www.courrier-picard.fr/id200247/article/2021-06-07/un-mort-dans-un-accident-de-moto-auteuil,2021-08-28 16:43:02,local
Chambly,accident,16,Chambly Matin,"Accident mortel impliquant un cycliste à Marieville - Chambly Matin - Journal le Chambly Matin, Montérégie Quotidien",2021-06-09,80,https://www.chamblymatin.com/information/nouvelles/manchettes-locales/ville-de-marieville-faits-divers-accident-mortel-cycliste-surete-du-quebec.html,2021-08-28 16:43:03,local
Chambly,accident,17,Chambly Matin,"Un camion semi-remorque fait une sortie de route vendredi à Marieville - Chambly Matin - Journal le Chambly Matin, Montérégie Quotidien",2021-05-03,117,https://www.chamblymatin.com/information/nouvelles/manchettes-locales/ville-de-marieville-accident-service-incendie-de-marieville-faits-divers.html,2021-08-28 16:43:03,local
Chambly,accident,18,Info Dimanche,Accident sur l'autoroute 20 à Rivière-du-Loup | infodimanche.com,2021-06-06,83,https://www.infodimanche.com/actualites/faits-divers/428381/accident-sur-lautoroute-20-a-riviere-du-loup,2021-08-28 16:43:03,local
Chambly,accident,19,La Voix de l'est - Groupe Capitales Médias,Accident sur l'A10: plusieurs accusations pour deux jeunes,2021-05-31,89,https://www.lavoixdelest.ca/actualites/accident-sur-la10-plusieurs-accusations-pour-deux-jeunes-8e334534dfb47b338c52e3020785ceda,2021-08-28 16:43:03,local
Chambly,accident,20,Le Courrier picard,Accident entre un camion et une voiture près de Warluis,2021-06-01,88,https://www.courrier-picard.fr/id198544/article/2021-06-01/accident-entre-un-camion-et-une-voiture-pres-de-warluis,2021-08-28 16:43:04,local
Chambly,accident,21,Le Courrier picard,Une femme grièvement blessée après un accident à Francastel,2021-07-26,33,https://www.courrier-picard.fr/id216531/article/2021-07-26/une-femme-grievement-blessee-apres-un-accident-francastel,2021-08-28 16:43:04,local
Chambly,accident,22,Le Courrier picard,"Saint-Sulpice: cinq blessés, dont un héliporté, après un accident de la route [mis à jour]",2021-06-05,84,https://www.courrier-picard.fr/id199769/article/2021-06-05/saint-sulpice-plusieurs-blesses-dans-un-accident-de-la-route,2021-08-28 16:43:04,local
Chambly,accident,23,Le Courrier picard,Noailles: deux blessés lors d’un choc entre une voiture et une moto,2021-06-07,82,https://www.courrier-picard.fr/id200453/article/2021-06-07/noailles-deux-blesses-lors-dun-choc-entre-une-voiture-et-une-moto,2021-08-28 16:43:04,local
Chambly,accident,24,Le Journal de Chambly,Les conclusions du coroner - Le journal de Chambly,2021-06-02,87,https://www.journaldechambly.com/les-conclusions-du-coroner/,2021-08-28 16:43:05,local
Chambly,accident,25,Le Courrier picard,Un accident sur la D1330 entre Senlis et Creil,2021-07-13,46,https://www.courrier-picard.fr/id212412/article/2021-07-13/un-accident-sur-la-d1330-entre-senlis-et-creil,2021-08-28 16:43:05,local
Chambly,décès OR mort,1,Le Journal de Chambly,COVID-19 : une rentrée scolaire masquée au Québec - Le journal de Chambly,2021-08-24,4,https://www.journaldechambly.com/covid-19-une-rentree-scolaire-masquee-au-quebec/,2021-08-28 16:43:40,local
Chambly,décès OR mort,2,NecrologieCanada,CHEVALIER MICHEL 2021,2021-08-05,23,https://necrocanada.com/deces-2021/chevalier-michel-2021/,2021-08-28 16:43:40,local
Chambly,décès OR mort,3,NecrologieCanada,LEBLANC PIERRE 2021,2021-08-20,8,https://necrocanada.com/deces-2021/leblanc-pierre-2021/,2021-08-28 16:43:41,local
Chambly,décès OR mort,4,Chambly Matin,"Un motocycliste perd la vie dans un accident à Saint-Césaire - Chambly Matin - Journal le Chambly Matin, Montérégie Quotidien",2021-08-03,25,https://www.chamblymatin.com/information/nouvelles/manchettes-locales/ville-de-st-cesaire-fait-divers-accident-de-moto-surete-du-quebec-motocycliste.html,2021-08-28 16:43:41,local
Chambly,décès OR mort,5,NecrologieCanada,Veronique Laberge 2021,2021-08-25,3,https://necrocanada.com/deces-2021/veronique-laberge-2021/,2021-08-28 16:43:41,local
Chambly,décès OR mort,6,NecrologieCanada,Jean-Guy Millaire 2021,2021-08-19,9,https://necrocanada.com/deces-2021/jean-guy-millaire-2021/,2021-08-28 16:43:41,local
Chambly,décès OR mort,7,NecrologieCanada,PILON GUY 2021,2021-08-12,16,https://necrocanada.com/deces-2021/pilon-guy-2021/,2021-08-28 16:43:41,local
Chambly,décès OR mort,8,NecrologieCanada,Rosario Lamoureux 2021,2021-08-18,10,https://necrocanada.com/deces-2021/rosario-lamoureux-2021/,2021-08-28 16:43:42,local
Chambly,décès OR mort,9,NecrologieCanada,Marie Anne Côte-Giroux 2021,2021-08-21,7,https://necrocanada.com/deces-2021/marie-anne-cote-giroux-2021/,2021-08-28 16:43:42,local
Chambly,décès OR mort,10,NecrologieCanada,NORMANDIN LOISELLE LOUISE 2021,2021-08-12,16,https://necrocanada.com/deces-2021/normandin-loiselle-louise-2021/,2021-08-28 16:43:42,local
Chambly,décès OR mort,11,NecrologieCanada,Raymond Drolet 2021,2021-08-11,17,https://necrocanada.com/deces-2021/raymond-drolet-2021/,2021-08-28 16:43:42,local
Chambly,décès OR mort,12,Le Journal de Chambly,Vaccination obligatoire pour les travailleurs de la santé - Le journal de Chambly,2021-08-17,11,https://www.journaldechambly.com/vaccination-obligatoire-pour-les-travailleurs-de-la-sante/,2021-08-28 16:43:42,local
Chambly,décès OR mort,13,Le Journal de Montréal,Visages de notre histoire: portrait de Gaby Bernier,2021-08-08,20,https://www.journaldemontreal.com/2021/08/08/visages-de-notre-histoire-portrait-de-gaby-bernier,2021-08-28 16:43:43,local
Chambly,décès OR mort,14,NecrologieCanada,DUBOIS NeE BEAUDRY COLETTE 2021,2021-08-12,16,https://necrocanada.com/deces-2021/dubois-nee-beaudry-colette-2021/,2021-08-28 16:43:43,local
Chambly,décès OR mort,15,NecrologieCanada,Henriette Dulude 2021,2021-08-06,22,https://necrocanada.com/deces-2021/henriette-dulude-2021/,2021-08-28 16:43:43,local
Chambly,décès OR mort,16,NecrologieCanada,Gilles Leger 2021,2021-08-19,9,https://necrocanada.com/deces-2021/gilles-leger-2021/,2021-08-28 16:43:43,local
Chambly,décès OR mort,17,NecrologieCanada,JALBERT GUY OI 2021,2021-08-14,14,https://necrocanada.com/deces-2021/jalbert-guy-oi-2021/,2021-08-28 16:43:44,local
Chambly,décès OR mort,18,Le Journal de Chambly,Passeport vaccinal : confirmation du 1er septembre - Le journal de Chambly,2021-08-10,18,https://www.journaldechambly.com/passeport-vaccinal-confirmation-du-1er-septembre/,2021-08-28 16:43:44,local
Chambly,décès OR mort,19,NecrologieCanada,Claude Demers 2021,2021-08-07,21,https://necrocanada.com/deces-2021/claude-demers-2021/,2021-08-28 16:43:44,local
Chambly,décès OR mort,20,Le Journal de Chambly,La Sûreté du Québec dresse un bilan routier plus lourd cette année pour les vacances de la construction - Le journal de Chambly,2021-08-05,23,https://www.journaldechambly.com/la-surete-du-quebec-dresse-un-bilan-routier-plus-lourd-cette-annee-pour-les-vacances-de-la-construction/,2021-08-28 16:43:44,local
Chambly,décès OR mort,21,Le Journal de Chambly,Une locataire bientôt « à la rue » - Le journal de Chambly,2021-07-30,29,https://www.journaldechambly.com/une-locataire-bientot-a-la-rue/,2021-08-28 16:43:45,local
Chambly,décès OR mort,22,NecrologieCanada,Yvon Bouchard 2021,2021-08-13,15,https://necrocanada.com/deces-2021/yvon-bouchard-2021/,2021-08-28 16:43:45,local
Chambly,décès OR mort,23,Le Journal de Chambly,Deux femmes en mots dits - Le journal de Chambly,2021-08-17,11,https://www.journaldechambly.com/deux-femmes-en-mots-dits/,2021-08-28 16:43:45,local
Chambly,décès OR mort,24,Le Journal de Montréal,"LAOUN NASSIF, Rénata",2021-07-31,28,https://www.journaldemontreal.com/2021/07/31/6eb81b383f/laoun-nassif-renata,2021-08-28 16:43:45,local
Chambly,décès OR mort,25,Le Quotidien - Groupe Capitales Médias,Chiots à donner: les fraudeurs peaufinent leur stratagème,2021-08-28,0,https://www.lequotidien.com/actualites/chiots-a-donner-les-fraudeurs-peaufinent-leur-stratageme-58f26d6e23fb0417eba9a1d70cf2163c,2021-08-28 16:43:45,local
Chambly,incendie,1,actu.fr,Chambly : une personne touchée dans l'incendie de son appartement,2021-08-06,22,https://actu.fr/hauts-de-france/chambly_60139/chambly-une-personne-touchee-dans-l-incendie-de-son-appartement_43969398.html,2021-08-28 16:43:53,local
Chambly,incendie,2,Chambly Matin,"Une rétrocaveuse entre en collision avec un poteau électrique à Marieville - Chambly Matin - Journal le Chambly Matin, Montérégie Quotidien",2021-07-29,30,https://www.chamblymatin.com/information/nouvelles/manchettes-locales/ville-de-marieville-service-incendie-de-marieville-collision-faits-divers-urgence-hydro-quebec-accident.html,2021-08-28 16:43:53,local
Chambly,incendie,3,Chambly Matin,"Trois maisons sont la proie des flammes à Marieville - Chambly Matin - Journal le Chambly Matin, Montérégie Quotidien",2021-08-10,18,https://www.chamblymatin.com/information/nouvelles/manchettes-locales/ville-de-marieville-faits-divers-incendie-service-incendie-surete-du-quebec-trois-maisons-sont-la-proie-des-flammes.html,2021-08-28 16:43:53,local
Chambly,incendie,4,Le Courrier picard,Une bougie met le feu à un appartement à Chambly,2021-08-06,22,https://www.courrier-picard.fr/id219501/article/2021-08-06/une-bougie-met-le-feu-un-appartement-chambly,2021-08-28 16:43:54,local
Chambly,incendie,5,EvasionFM,Les pompiers ont évité la propagation d'un incendie à Chambly,2021-08-09,19,https://www.evasionfm.com/actualite-68208-les-pompiers-ont-evite-la-propagation-d-un-incendie-a-chambly.html,2021-08-28 16:43:54,local
Chambly,incendie,6,Chambly Matin,"Collision entre deux véhicules à Marieville - Chambly Matin - Journal le Chambly Matin, Montérégie Quotidien",2021-08-23,5,https://www.chamblymatin.com/information/nouvelles/manchettes-locales/ville-de-marieville-faits-divers-collision-service-de-securite-incendie-de-marieville-accident-route-112.html,2021-08-28 16:43:54,local
Chambly,incendie,7,L'Oeil Régional,Le journal de la Vallée du Richelieu,2021-08-04,24,https://www.oeilregional.com/un-acte-de-civisme-se-transforme-en-amitie/,2021-08-28 16:43:54,local
Chambly,incendie,8,Le Journal de Chambly,Incendie sur la rue Michel-Levasseur - Le journal de Chambly,2021-06-18,71,https://www.journaldechambly.com/incendie-sur-la-rue-michel-levasseur/,2021-08-28 16:43:55,local
Chambly,incendie,9,Le Journal de Chambly,Incendie de forêt au mont Rougemont - Le journal de Chambly,2021-05-16,104,https://www.journaldechambly.com/incendie-de-foret-au-mont-rougemont/,2021-08-28 16:43:55,local
Chambly,incendie,10,Le Journal de Chambly,Incendie à l'école secondaire de Chambly - Le journal de Chambly,2020-11-30,271,https://www.journaldechambly.com/incendie-a-lecole-secondaire/,2021-08-28 16:43:55,local
Chambly,incendie,11,Chambly Matin,"Un garage est la proie des flammes à Carignan - Chambly Matin - Journal le Chambly Matin, Montérégie Quotidien",2021-03-29,152,https://www.chamblymatin.com/information/nouvelles/manchettes-locales/ville-de-carignan-incendie-incendie-dans-un-garage-faits-divers-service-incendie-de-chambly.html,2021-08-28 16:43:55,local
Chambly,incendie,12,Chambly Matin,"Violent incendie de résidence à Marieville, vendredi dernier - Chambly Matin - Journal le Chambly Matin, Montérégie Quotidien",2021-02-24,185,https://www.chamblymatin.com/information/nouvelles/manchettes-locales/ville-de-marieville-faits-divers-incendie-service-incendie-de-marieville.html,2021-08-28 16:43:55,local
Chambly,incendie,13,Chambly Matin,"Pratique incendie à Saint-Mathias-Sur-Richelieu - Chambly Matin - Journal le Chambly Matin, Montérégie Quotidien",2021-04-18,132,https://www.chamblymatin.com/information/nouvelles/manchettes-locales/pratique-incendie-faits-divers-saint-mathias-sur-richelieu-service-incendie-de-marieville-richelieu-apam-pratique.html,2021-08-28 16:43:56,local
Chambly,incendie,14,Chambly Matin,"Incendie sur le pont de la piste cyclable, la route des champs à Marieville - Chambly Matin - Journal le Chambly Matin, Montérégie Quotidien",2021-03-10,171,https://www.chamblymatin.com/information/nouvelles/manchettes-locales/service-incendie-de-marieville-la-route-des-champs-incendie-mrc-de-rouville-faits-divers.html,2021-08-28 16:43:56,local
Chambly,incendie,15,Le Journal de Chambly,« V'là la maison qui brûle » - Le journal de Chambly,2021-05-03,117,https://www.journaldechambly.com/vla-la-maison-qui-brule/,2021-08-28 16:43:56,local
Chambly,incendie,16,Chambly Matin,"Incendie suspect dans une résidence de Rougemont - Chambly Matin - Journal le Chambly Matin, Montérégie Quotidien",2021-03-09,172,https://www.chamblymatin.com/information/nouvelles/manchettes-locales/ville-de-rougemont-service-incendie-incendie-suspect-faits-divers-surete-du-quebec-association-des-pompiers-auxiliaires-de-la-monteregie.html,2021-08-28 16:43:56,local
Chambly,incendie,17,Le Journal de Chambly,Une niveleuse s'embrase - Le journal de Chambly,2020-11-19,282,https://www.journaldechambly.com/une-niveleuse-sembrase/,2021-08-28 16:43:56,local
Chambly,incendie,18,Chambly Matin,"Un camion semi-remorque fait une sortie de route vendredi à Marieville - Chambly Matin - Journal le Chambly Matin, Montérégie Quotidien",2021-05-03,117,https://www.chamblymatin.com/information/nouvelles/manchettes-locales/ville-de-marieville-accident-service-incendie-de-marieville-faits-divers.html,2021-08-28 16:43:57,local
Chambly,incendie,19,Le Journal de Chambly,Feu et vol dans la même fin de semaine - Le journal de Chambly,2020-11-25,276,https://www.journaldechambly.com/feu-et-vol-dans-la-meme-fin-de-semaine/,2021-08-28 16:43:57,local
Chambly,incendie,20,Chambly Matin,"Réglementation sur les feux extérieurs et feux d'artifice à Carignan - Chambly Matin - Journal le Chambly Matin, Montérégie Quotidien",2021-06-22,67,https://www.chamblymatin.com/information/nouvelles/manchettes-locales/ville-de-carignan-reglement-feux-exterieurs.html,2021-08-28 16:43:57,local
Chambly,incendie,21,Le Journal de Chambly,Incendie dans une demeure à Chambly - Le journal de Chambly,,,https://www.journaldechambly.com/incendie-dans-une-demeure-a-chambly/,2021-08-28 16:43:57,local
Chambly,incendie,22,Le Canada Français,Gigantesque brasier sur la rue Massenet,2021-05-31,89,https://www.canadafrancais.com/2021/05/31/gigantesque-brasier-sur-la-rue-massenet/,2021-08-28 16:43:58,local
Chambly,incendie,23,Le Journal de Chambly,Améliorer la cohésion des interventions sur le bassin de Chambly - Le journal de Chambly,2021-04-28,122,https://www.journaldechambly.com/ameliorer-la-cohesion-des-interventions-sur-le-bassin-de-chambly/,2021-08-28 16:43:58,local
Chambly,incendie,24,Le Journal de Chambly,Un feu à ciel ouvert à l'origine d'un important incendie - Le journal de Chambly,,,https://www.journaldechambly.com/un-incendie/,2021-08-28 16:43:58,local
Chambly,incendie,25,Chambly Matin,"Un garage est la proie des flammes à Marieville - Chambly Matin - Journal le Chambly Matin, Montérégie Quotidien",2021-05-03,117,https://www.chamblymatin.com/information/nouvelles/manchettes-locales/faits-divers-incendie-a-marieville-service-de-securite-incendie-de-marieville.html,2021-08-28 16:43:58,local
Chambly,police OR Sûreté,1,Chambly Matin,"Une rentrée scolaire en toute sécurité - Chambly Matin - Journal le Chambly Matin, Montérégie Quotidien",2021-08-27,1,https://www.chamblymatin.com/information/nouvelles/manchettes-locales/rentree-scolaire-securite-regie-intermunicipale-de-police-richelieu-saint-laurent.html,2021-08-28 16:44:06,local
Chambly,police OR Sûreté,2,Le Journal de Chambly,Code de la sécurité routière - Le journal de Chambly,2021-08-26,2,https://www.journaldechambly.com/code-de-la-securite-routiere/,2021-08-28 16:44:06,local
Chambly,police OR Sûreté,3,Le Journal de Chambly,La Sûreté du Québec dresse un bilan routier plus lourd cette année pour les vacances de la construction - Le journal de Chambly,2021-08-05,23,https://www.journaldechambly.com/la-surete-du-quebec-dresse-un-bilan-routier-plus-lourd-cette-annee-pour-les-vacances-de-la-construction/,2021-08-28 16:44:06,local
Chambly,police OR Sûreté,4,Le Journal de Chambly,Travaux sur la route 112 : une amélioration de la circulation - Le journal de Chambly,2021-08-19,9,https://www.journaldechambly.com/travaux-sur-la-route-112-une-amelioration-de-la-circulation/,2021-08-28 16:44:07,local
Chambly,police OR Sûreté,5,Chambly Matin,"Trois maisons sont la proie des flammes à Marieville - Chambly Matin - Journal le Chambly Matin, Montérégie Quotidien",2021-08-10,18,https://www.chamblymatin.com/information/nouvelles/manchettes-locales/ville-de-marieville-faits-divers-incendie-service-incendie-surete-du-quebec-trois-maisons-sont-la-proie-des-flammes.html,2021-08-28 16:44:07,local
Chambly,police OR Sûreté,6,Chambly Matin,"Un motocycliste perd la vie dans un accident à Saint-Césaire - Chambly Matin - Journal le Chambly Matin, Montérégie Quotidien",2021-08-03,25,https://www.chamblymatin.com/information/nouvelles/manchettes-locales/ville-de-st-cesaire-fait-divers-accident-de-moto-surete-du-quebec-motocycliste.html,2021-08-28 16:44:07,local
Chambly,police OR Sûreté,7,La Nouvelle Union,Spectaculaire accident : l'alcool serait en cause,2021-08-06,22,https://www.lanouvelle.net/2021/08/06/spectaculaire-accident-lalcool-serait-en-cause/,2021-08-28 16:44:07,local
Chambly,police OR Sûreté,8,Le Journal de Chambly,Perquisitions de stupéfiants - Le journal de Chambly,2021-06-29,60,https://www.journaldechambly.com/perquisition-de-stuepfiants/,2021-08-28 16:44:07,local
Chambly,police OR Sûreté,9,TVA Nouvelles,Honorés pour avoir sauvé une femme de la noyade,2021-05-24,96,https://www.tvanouvelles.ca/2021/05/24/honores-pour-avoir-sauve-une-femme-de-la-noyade,2021-08-28 16:44:08,local
Chambly,police OR Sûreté,10,Le Quotidien - Groupe Capitales Médias,Chiots à donner: les fraudeurs peaufinent leur stratagème,2021-08-28,0,https://www.lequotidien.com/actualites/chiots-a-donner-les-fraudeurs-peaufinent-leur-stratageme-58f26d6e23fb0417eba9a1d70cf2163c,2021-08-28 16:44:08,local
Chambly,police OR Sûreté,11,Le Journal de Chambly,Barricade sur l'île Demers - Le journal de Chambly,2021-06-14,75,https://www.journaldechambly.com/barricade-sur-lile-demers/,2021-08-28 16:44:08,local
Chambly,police OR Sûreté,12,Le Journal de Chambly,Couvre-feu : la police aux aguets - Le journal de Chambly,2021-01-08,232,https://www.journaldechambly.com/couvre-feu-la-police-aux-aguets/,2021-08-28 16:44:08,local
Chambly,police OR Sûreté,13,Chambly Matin,"Opération policière en partenariat avec les contrôleurs routiers - Chambly Matin - Journal le Chambly Matin, Montérégie Quotidien",2021-05-15,105,https://www.chamblymatin.com/information/nouvelles/manchettes-locales/surete-du-quebec-controleur-routier-mrc-de-rouville.html,2021-08-28 16:44:08,local
Chambly,police OR Sûreté,14,Chambly Matin,"Perquisition à Carignan - Chambly Matin - Journal le Chambly Matin, Montérégie Quotidien",2021-05-18,102,https://www.chamblymatin.com/information/nouvelles/manchettes-locales/ville-de-carignan-operation-policiere-lutte-contre-la-drogue-surete-du-quebec.html,2021-08-28 16:44:09,local
Chambly,police OR Sûreté,15,Chambly Matin,"Bilan de l'opération nationale concertée comportements imprudents - Chambly Matin - Journal le Chambly Matin, Montérégie Quotidien",2021-04-24,126,https://www.chamblymatin.com/information/nouvelles/manchettes-locales/surete-du-quebec-bilan-d-operation.html,2021-08-28 16:44:09,local
Chambly,police OR Sûreté,16,Le Journal de Chambly,Perquisition de stupéfiants à Carignan - Le journal de Chambly,2021-02-17,192,https://www.journaldechambly.com/perquisition-de-stupefiants-a-carignan/,2021-08-28 16:44:09,local
Chambly,police OR Sûreté,17,Le Journal de Chambly,Une fin de semaine de contrôles routiers - Le journal de Chambly,2021-02-05,204,https://www.journaldechambly.com/fin-de-semaine-de-controles-routiers/,2021-08-28 16:44:09,local
Chambly,police OR Sûreté,18,Le Journal de Chambly,Les interventions policières du couvre-feu - Le journal de Chambly,2021-01-12,228,https://www.journaldechambly.com/les-interventions-policieres-du-couvre-feu/,2021-08-28 16:44:10,local
Chambly,police OR Sûreté,19,Chambly Matin,"La Régie intermunicipale de police Richelieu–Saint-Laurent a remis 24 constats d'infraction en une semaine - Chambly Matin - Journal le Chambly Matin, Montérégie Quotidien",2021-04-07,143,https://www.chamblymatin.com/information/nouvelles/manchettes-locales/la-regie-intermunicipale-de-police-richelieu-saint-laurent-covid-19-faits-divers-constat-d-infaction-mesures-sanitaire.html,2021-08-28 16:44:10,local
Chambly,police OR Sûreté,20,Chambly Matin,"Présence policière accrue pour la semaine de relâche - Chambly Matin - Journal le Chambly Matin, Montérégie Quotidien",2021-03-01,180,https://www.chamblymatin.com/information/nouvelles/manchettes-locales/semaine-de-relache-regie-intermunicipale-de-police-richelieu-saint-laurent-covid-19.html,2021-08-28 16:44:10,local
Chambly,police OR Sûreté,21,Le Journal de Chambly,Accident sur le boulevard de Périgny - Le journal de Chambly,2021-03-02,179,https://www.journaldechambly.com/accident-sur-le-boulevard-de-perigny-2/,2021-08-28 16:44:10,local
Chambly,police OR Sûreté,22,Le Canada Français,Deux vols qualifiés dans le même dépanneur,2021-06-21,68,https://www.canadafrancais.com/2021/06/21/deux-vols-qualifies-dans-le-meme-depanneur/,2021-08-28 16:44:10,local
