Villes,Mots-clés,position du média,Nom du média,Titre de l'article,Date de publication,Journée de différence,URL,date et heure saisie,type mot-clés
Baie-Comeau,élection OR campagne,1,Journal Le Manic,Serge Deschênes gagne l'élection dans Trudel,2021-11-07,11,https://www.lemanic.ca/2021/11/07/serge-deschenes-gagne-lelection-dans-trudel/,2021-11-18 17:03:24,mixte
Baie-Comeau,élection OR campagne,2,Le Journal de Québec,Le Drakkar se venge et surprend les Remparts,2021-11-15,3,https://www.journaldequebec.com/2021/11/14/le-drakkar-se-venge-et-surprend-les-remparts,2021-11-18 17:03:25,mixte
Baie-Comeau,élection OR campagne,3,TVA Nouvelles,Municipales 2021: les résultats d'une soirée forte en rebondissements,2021-11-07,11,https://www.tvanouvelles.ca/2021/11/07/en-direct--les-resultats-des-elections-municipales-2021,2021-11-18 17:03:25,mixte
Baie-Comeau,élection OR campagne,4,Journal Le Manic,"Élus, candidats et citoyens marchent pour le climat à Baie-Comeau",2021-10-23,26,https://www.lemanic.ca/2021/10/23/elus-candidats-et-citoyens-marchent-pour-le-climat-a-baie-comeau/,2021-11-18 17:03:25,mixte
Baie-Comeau,élection OR campagne,5,Journal Le Manic,René Labrosse veut être au service des gens,2021-11-17,1,https://www.lemanic.ca/2021/11/17/rene-labrosse-veut-etre-au-service-des-gens/,2021-11-18 17:03:25,mixte
Baie-Comeau,élection OR campagne,6,ICI.Radio-Canada.ca,Élections municipales : jour de vote dans l'Est-du-Québec | Élections municipales au Québec 2021,2021-11-07,11,https://ici.radio-canada.ca/nouvelle/1837605/villes-municipalites-maires-conseillers-bas-laurent-gaspesie-cote-nord,2021-11-18 17:03:25,mixte
Baie-Comeau,élection OR campagne,7,Journal Le Manic,COVID : la Côte-Nord prête pour la troisième dose et la vaccination des jeunes,2021-11-10,8,https://www.lemanic.ca/2021/11/10/covid-la-cote-nord-prete-pour-la-troisieme-dose-et-la-vaccination-des-jeunes/,2021-11-18 17:03:25,mixte
Baie-Comeau,élection OR campagne,8,Le Journal de Québec,Le Drakkar remporte un festival offensif contre le Titan,2021-10-29,20,https://www.journaldequebec.com/2021/10/29/lhjmq-le-drakkar-met-fin-a-sa-disette,2021-11-18 17:03:26,mixte
Baie-Comeau,élection OR campagne,9,TVA Nouvelles,Élections municipales déclenchées à Baie-Comeau,2021-09-17,62,https://www.tvanouvelles.ca/2021/09/17/elections-municipales-declenchees-a-baie-comeau,2021-11-18 17:03:26,mixte
Baie-Comeau,élection OR campagne,10,Journal Le Manic,Salut Côte-Nord!,2021-10-20,29,https://www.lemanic.ca/2021/10/20/salut-cote-nord/,2021-11-18 17:03:26,mixte
Baie-Comeau,élection OR campagne,11,Journal Le Manic,Michel Beaulieu est élu dans Saint-Nom-de-Marie,2021-11-07,11,https://www.lemanic.ca/2021/11/07/michel-beaulieu-est-elu-dans-saint-nom-de-marie/,2021-11-18 17:03:26,mixte
Baie-Comeau,élection OR campagne,12,La Releve,Opération Nez rouge: de retour pour vos retours sur la Rive-Sud,2021-11-05,13,https://www.lareleve.qc.ca/2021/11/05/operation-nez-rouge-de-retour-pour-vos-retours-sur-la-rive-sud/,2021-11-18 17:03:26,mixte
Baie-Comeau,élection OR campagne,13,Journal Le Manic,AGIR pour demain dans la Manicouagan en adoptant un comportement écoresponsable,2021-10-20,29,https://www.lemanic.ca/2021/10/20/agir-pour-demain-dans-la-manicouagan-en-adoptant-un-comportement-ecoresponsable/,2021-11-18 17:03:26,mixte
Baie-Comeau,élection OR campagne,14,Journal Le Manic,Yves Montigny réélu sans opposition à Baie-Comeau,2021-10-01,48,https://www.lemanic.ca/2021/10/01/yves-montigny-reelu-sans-opposition-a-baie-comeau/,2021-11-18 17:03:27,mixte
Baie-Comeau,élection OR campagne,15,RDS,LHJMQ : résumé des matchs du vendredi 12 novembre 2021 dans le circuit Courteau,2021-11-12,6,https://www.rds.ca/hockey/lhjmq/lhjmq-resume-des-matchs-du-vendredi-12-novembre-2021-dans-le-circuit-courteau-1.14685372,2021-11-18 17:03:27,mixte
Baie-Comeau,élection OR campagne,16,Journal Le Manic,Baie-Comeau permettra le vote par correspondance pour les 70 ans et plus,2021-06-23,148,https://www.lemanic.ca/2021/06/23/baie-comeau-permettra-le-vote-par-correspondance-pour-les-70-ans-et-plus/,2021-11-18 17:03:27,mixte
Baie-Comeau,élection OR campagne,17,Franceinfo,"REPORTAGE. Présidentielle 2022 : à Strasbourg, des musulmans regrettent un ""discours islamophobe décomplexé""",2021-11-14,4,https://www.francetvinfo.fr/elections/reportage-presidentielle-2022-a-strasbourg-des-musulmans-regrettent-un-discours-islamophobe-decomplexe_4823527.html,2021-11-18 17:03:27,mixte
Baie-Comeau,élection OR campagne,18,Le Devoir,Ces municipalités qui se battent pour de l'eau potable,2021-10-23,26,https://www.ledevoir.com/societe/642327/quebec-ces-municipalites-qui-se-battent-pour-de-l-eau-potable,2021-11-18 17:03:27,mixte
Baie-Comeau,élection OR campagne,19,Journal Le Manic,Élections municipales : Dany Gauthier souhaite ravir le quartier Trudel à Baie-Comeau,2021-06-30,141,https://www.lemanic.ca/2021/06/30/elections-municipales-dany-gauthier-souhaite-ravir-le-quartier-trudel-a-baie-comeau/,2021-11-18 17:03:28,mixte
Baie-Comeau,élection OR campagne,20,Journal Le Manic,Cyrille Boucher vise le poste de préfet,2021-09-27,52,https://www.lemanic.ca/2021/09/27/cyrille-boucher-vise-le-poste-de-prefet/,2021-11-18 17:03:28,mixte
Baie-Comeau,élection OR campagne,21,RDS,LHJMQ : les Saguenéens triomphent lors des retrouvailles avec Hendrix Lapierre,2021-11-14,4,https://www.rds.ca/hockey/lhjmq/lhjmq-les-sagueneens-triomphent-lors-des-retrouvailles-avec-hendrix-lapierre-1.14687953,2021-11-18 17:03:28,mixte
Baie-Comeau,élection OR campagne,22,Journal Le Manic,Dave Savard plonge dans Sainte-Amélie,2021-09-30,49,https://www.lemanic.ca/2021/09/30/dave-savard-plonge-dans-sainte-amelie/,2021-11-18 17:03:28,mixte
Baie-Comeau,élection OR campagne,23,RDS,LHJMQ : un retour victorieux pour Xavier Simoneau à Drummondville,2021-11-03,15,https://www.rds.ca/hockey/lhjmq/lhjmq-un-retour-victorieux-pour-xavier-simoneau-a-drummondville-1.14675849,2021-11-18 17:03:29,mixte
Baie-Comeau,élection OR campagne,24,Journal Le Manic,Clara Mayer briguera les suffrages dans le quartier Trudel,2021-09-03,76,https://www.lemanic.ca/2021/09/03/clara-mayer-briguera-les-suffrages-dans-le-quartier-trudel/,2021-11-18 17:03:29,mixte
Baie-Comeau,élection OR campagne,25,Journal Le Manic,L'ex-maire de Pointe-aux-Outardes veut se faire élire dans le quartier Trudel,2021-09-10,69,https://www.lemanic.ca/2021/09/10/lex-maire-de-pointe-aux-outardes-veut-se-faire-elire-dans-le-quartier-trudel/,2021-11-18 17:03:29,mixte
Baie-Comeau,député,1,Journal Le Manic,Le 5 à Huîtres de la Fondation du cégep de Baie-Comeau est de retour,2021-11-05,13,https://www.lemanic.ca/2021/11/05/le-5-a-huitres-de-la-fondation-du-cegep-de-baie-comeau-est-de-retour/,2021-11-18 17:04:05,mixte
Baie-Comeau,député,2,Journal Le Manic,"Élus, candidats et citoyens marchent pour le climat à Baie-Comeau",2021-10-23,26,https://www.lemanic.ca/2021/10/23/elus-candidats-et-citoyens-marchent-pour-le-climat-a-baie-comeau/,2021-11-18 17:04:06,mixte
Baie-Comeau,député,3,Le Journal de Québec,Baie-Comeau: un marché d'alimentation recrute dans la communauté innue de Pessamit,2021-10-21,28,https://www.journaldequebec.com/2021/10/21/baie-comeau-un-marche-dalimentation-recrute-dans-la-communaute-innue-de-pessamit-1,2021-11-18 17:04:06,mixte
Baie-Comeau,député,4,Journal Le Manic,Pétanque : Baie-Comeau devient une référence au Québec,2021-10-24,25,https://www.lemanic.ca/2021/10/24/petanque-baie-comeau-devient-une-reference-au-quebec/,2021-11-18 17:04:06,mixte
Baie-Comeau,député,5,TVA Nouvelles,Municipales 2021: les résultats d'une soirée forte en rebondissements,2021-11-07,11,https://www.tvanouvelles.ca/2021/11/07/en-direct--les-resultats-des-elections-municipales-2021,2021-11-18 17:04:06,mixte
Baie-Comeau,député,6,Mon Matane,Éphémérides du 24 octobre : la Société des traversiers du Québec annonce la construction de son futur navire amiral en 2011,2021-10-24,25,https://monmatane.com/ephemerides-du-24-octobre-la-societe-des-traversiers-du-quebec-annonce-la-construction-de-son-futur-navire-amiral-en-2011/,2021-11-18 17:04:07,mixte
Baie-Comeau,député,7,Journal Le Manic,La question des transports préoccupe le député Ouellet,2021-09-10,69,https://www.lemanic.ca/2021/09/10/la-question-des-transports-preoccupe-le-depute-ouellet/,2021-11-18 17:04:07,mixte
Baie-Comeau,député,8,Mon Matane,Éphémérides du 29 octobre : l'Association des chasseurs dénonce la parade des carcasses d'orignaux en 2003,2021-10-29,20,https://monmatane.com/ephemerides-du-29-octobre-lassociation-des-chasseurs-denonce-la-parade-des-carcasses-dorignaux-en-2003/,2021-11-18 17:04:07,mixte
Baie-Comeau,député,9,Journal Le Manic,Le candidat du Parti libéral dans Manicouagan enfin connu,2021-08-27,83,https://www.lemanic.ca/2021/08/27/le-candidat-du-parti-liberal-dans-manicouagan-enfin-connu/,2021-11-18 17:04:07,mixte
Baie-Comeau,député,10,Le Journal de Québec,Assemblée nationale: des élus arrivent avec leur glacière pour éviter de se déplacer à Québec,2021-04-13,219,https://www.journaldequebec.com/2021/04/13/des-elus-arrivent-avec-leur-glaciere,2021-11-18 17:04:07,mixte
Baie-Comeau,député,11,Mon Matane,Éphémérides du 27 octobre : Ry Uy et sa famille cambodgienne baptisés à Sainte-Félicité en 1985,2021-10-27,22,https://monmatane.com/ephemerides-du-27-octobre-ry-uy-et-sa-famille-cambodgienne-baptises-a-sainte-felicite-en-1985/,2021-11-18 17:04:07,mixte
Baie-Comeau,député,12,Le Journal de Québec,Est du Québec: des réalités différentes d'un coin à l'autre,2021-11-06,12,https://www.journaldequebec.com/2021/11/06/des-realites-differentes-dun-coin-a-lautre,2021-11-18 17:04:08,mixte
Baie-Comeau,député,13,Ma Côte-Nord,Le lieutenant québécois du Parti conservateur Richard Martel en précampagne sur la Côte-Nord,2021-08-08,102,https://macotenord.com/le-lieutenant-quebecois-du-parti-conservateur-richard-martel-en-precampagne-sur-la-cote-nord/,2021-11-18 17:04:08,mixte
Baie-Comeau,député,14,Le Journal de Québec,Éclosion dans une école primaire de Baie-Comeau,2021-10-12,37,https://www.journaldequebec.com/2021/10/12/eclosion-dans-une-ecole-primaire-de-baie-comeau-1,2021-11-18 17:04:08,mixte
Baie-Comeau,député,15,Mon Matane,Éphémérides du 1er novembre : Matane vit avec les inconvénients de l'heure des Maritimes en 1962,2021-11-01,17,https://monmatane.com/ephemerides-du-1er-novembre-matane-vit-avec-les-inconvenients-de-lheure-des-maritimes-en-1962/,2021-11-18 17:04:08,mixte
Baie-Comeau,député,16,Journal Le Manic,Élections : cinq candidats s'affrontent officiellement dans Manicouagan,2021-09-01,78,https://www.lemanic.ca/2021/09/01/elections-cinq-candidats-saffrontent-officiellement-dans-manicouagan/,2021-11-18 17:04:08,mixte
Baie-Comeau,député,17,Journal Le Manic,Vaccination : le député Ouellet espère une sensibilité du gouvernement,2021-10-08,41,https://www.lemanic.ca/2021/10/08/vaccination-le-depute-ouellet-espere-une-sensibilite-du-gouvernement/,2021-11-18 17:04:08,mixte
Baie-Comeau,député,18,Journal Le Manic,Claude Montigny reçoit la médaille de l'Assemblée nationale,2020-12-17,336,https://www.lemanic.ca/2020/12/17/claude-montigny-recoit-la-medaille-de-lassemblee-nationale/,2021-11-18 17:04:09,mixte
Baie-Comeau,député,19,ICI.Radio-Canada.ca,"La Côte-Nord pourrait revenir en zone jaune bientôt, estime la santé publique | Coronavirus",2021-05-13,189,https://ici.radio-canada.ca/nouvelle/1792864/palier-jaune-cote-nord-richard-fachehoun-cisss-conference-presse,2021-11-18 17:04:09,mixte
Baie-Comeau,député,20,Journal Le Manic,Rodrigue Vigneault sera candidat conservateur dans Manicouagan,2020-12-03,350,https://www.lemanic.ca/2020/12/03/rodrigue-vigneault-sera-candidat-conservateur-dans-manicouagan/,2021-11-18 17:04:09,mixte
Baie-Comeau,député,21,Journal Le Manic,Un spectacle de la Saint-Jean signé Chaud Bizzz,2021-06-16,155,https://www.lemanic.ca/2021/06/16/un-spectacle-de-la-saint-jean-signe-chaud-bizzz/,2021-11-18 17:04:09,mixte
Baie-Comeau,député,22,La Presse,Baie-Comeau retient son souffle | La Presse,2021-04-28,204,https://www.lapresse.ca/covid-19/2021-04-28/baie-comeau-retient-son-souffle.php,2021-11-18 17:04:09,mixte
Baie-Comeau,député,23,Journal Le Manic,Le député Ouellet dit non à un éventuel reconfinement de la Côte-Nord,2021-01-05,317,https://www.lemanic.ca/2021/01/05/le-depute-ouellet-dit-non-a-un-eventuel-reconfinement-de-la-cote-nord/,2021-11-18 17:04:10,mixte
Baie-Comeau,député,24,Journal Le Manic,Maison en Gros s'installera aux Galeries Baie-Comeau,2021-06-02,169,https://www.lemanic.ca/2021/06/02/maison-en-gros-sinstallera-aux-galeries-baie-comeau/,2021-11-18 17:04:10,mixte
Baie-Comeau,député,25,Le Journal de Québec,Nos routes en déroute: bien des bris sur la route... d'un traversier,2021-06-05,166,https://www.journaldequebec.com/2021/06/05/nos-routes-en-deroute-bien-des-bris-sur-la-route-dun-traversier,2021-11-18 17:04:10,mixte
Baie-Comeau,"""arme à feu""",1,Radio-Canada.ca,Les autorités innues de Pessamit accusent la SQ de profilage racial,2021-02-03,288,https://ici.radio-canada.ca/espaces-autochtones/1768213/innus-pessamit-profilage-racial-police-territoire-surete,2021-11-18 17:04:17,mixte
Baie-Comeau,"""arme à feu""",2,Journal Le Manic,L'accès facile aux armes à feu augmente les risques de suicide,,,https://www.lemanic.ca/2020/09/29/lacces-facile-aux-armes-a-feu-augmente-les-risques-de-suicide/,2021-11-18 17:04:17,mixte
Baie-Comeau,"""arme à feu""",3,ICI.Radio-Canada.ca,Ouverture de la chasse à l'orignal à l'arc et à l'arbalète dans la zone 18,,,https://ici.radio-canada.ca/nouvelle/1731717/chasse-orignal-arc-arbalete-zone-18-cote-nord-minganie,2021-11-18 17:04:17,mixte
Baie-Comeau,"""arme à feu""",4,Journal Le Manic,Un homme arrêté pour agression armée à Sept-Îles,2021-07-20,121,https://www.lemanic.ca/2021/07/20/un-homme-arrete-pour-agression-armee-a-sept-iles/,2021-11-18 17:04:17,mixte
Baie-Comeau,"""arme à feu""",5,Journal Le Manic,Un ado sauve son ami d'un camp de chasse en feu,,,https://www.lemanic.ca/2020/10/07/un-ado-sauve-son-ami-dun-camp-de-chasse-en-feu/,2021-11-18 17:04:18,mixte
Baie-Comeau,"""arme à feu""",6,Journal Le Manic,Baie-Comeau refuse de se mêler du registre des armes à feu,,,https://www.lemanic.ca/2019/01/23/baie-comeau-refuse-de-se-meler-du-registre-des-armes-a-feu/,2021-11-18 17:04:18,mixte
Baie-Comeau,"""arme à feu""",7,Le Soleil - Groupe Capitales Médias,Coupable d'avoir braqué une arme sur une ado,2021-04-28,204,https://www.lesoleil.com/2021/04/28/coupable-davoir-braque-une-arme-sur-une-ado-09516ab8ecf58ce121fd59b24f7bbfe9,2021-11-18 17:04:18,mixte
Baie-Comeau,"""arme à feu""",8,ICI.Radio-Canada.ca,Des chasseurs insatisfaits de l'assouplissement de la loi sur les armes à feu,,,https://ici.radio-canada.ca/nouvelle/1148657/chasseurs-registre-armes-feu,2021-11-18 17:04:18,mixte
Baie-Comeau,"""arme à feu""",9,L'Express - Drummondville,Des recrues dynamiques (photos) - L'Express,2021-02-14,277,https://www.journalexpress.ca/2021/02/14/des-recrues-dynamiques-photos-drakkar-voltigeurs-drummondville-lhjmq/,2021-11-18 17:04:18,mixte
Baie-Comeau,"""arme à feu""",10,Ma Côte-Nord,Arrestations musclées par la SQ | Le Conseil de bande de Pessamit demande une enquête,2021-02-03,288,https://macotenord.com/arrestations-musclees-par-la-sq-le-conseil-de-bande-de-pessamit-demande-une-enquete/,2021-11-18 17:04:19,mixte
Baie-Comeau,"""santé publique""",1,Journal Le Manic,COVID : la Côte-Nord prête pour la troisième dose et la vaccination des jeunes,2021-11-10,8,https://www.lemanic.ca/2021/11/10/covid-la-cote-nord-prete-pour-la-troisieme-dose-et-la-vaccination-des-jeunes/,2021-11-18 17:04:26,mixte
Baie-Comeau,"""santé publique""",2,Le Journal de Québec,COVID-19: l'épidémie semble s'essouffler dans les écoles primaires de Baie-Comeau,2021-11-09,9,https://www.journaldequebec.com/2021/11/09/covid-19-lepidemie-semble-sessouffler-dans-les-ecoles-primaires-de-baie-comeau-1,2021-11-18 17:04:26,mixte
Baie-Comeau,"""santé publique""",3,Journal Le Manic,"Neuf cas de COVID-19 de plus, encore, dans la Manicouagan",2021-11-09,9,https://www.lemanic.ca/2021/11/09/neuf-cas-de-covid-19-de-plus-encore-dans-la-manicouagan/,2021-11-18 17:04:27,mixte
Baie-Comeau,"""santé publique""",4,Ma Côte-Nord,50 cas de COVID-19 sur la Côte-Nord,2021-10-18,31,https://macotenord.com/50-cas-de-covid-19-sur-la-cote-nord/,2021-11-18 17:04:27,mixte
Baie-Comeau,"""santé publique""",5,ICI.Radio-Canada.ca,COVID-19 : 15 cas confirmés à l'école Vents-et-Marées de Rivière-Ouelle,2021-10-05,44,https://ici.radio-canada.ca/nouvelle/1829303/eclosion-ecole-riviere-ouelle-bilan-cas-5-octobre-2021-bas-saint-laurent-mrc,2021-11-18 17:04:27,mixte
Baie-Comeau,"""santé publique""",6,CNW Telbec,Pandémie de la COVID-19 - Mesures rehaussées en milieu scolaire à Baie-Comeau,2021-11-04,14,https://www.newswire.ca/fr/news-releases/pandemie-de-la-covid-19-mesures-rehaussees-en-milieu-scolaire-a-baie-comeau-816589739.html,2021-11-18 17:04:27,mixte
Baie-Comeau,"""santé publique""",7,Journal Le Manic,Le masque en classe au primaire pour trois semaines de plus à Baie-Comeau,2021-11-15,3,https://www.lemanic.ca/2021/11/15/le-masque-au-primaire-pour-trois-semaines-de-plus-a-baie-comeau/,2021-11-18 17:04:27,mixte
Baie-Comeau,"""santé publique""",8,Journal Le Manic,Intercar : la liaison Saguenay-Tadoussac sur la glace,2021-10-22,27,https://www.lemanic.ca/2021/10/22/intercar-la-liaison-saguenay-tadoussac-sur-la-glace/,2021-11-18 17:04:28,mixte
Baie-Comeau,"""santé publique""",9,ICI.Radio-Canada.ca,15 nouveaux cas et au moins 500 personnes en isolement sur la Côte-Nord,2021-04-27,205,https://ici.radio-canada.ca/nouvelle/1788338/coronavirus-pandemie-27-avril-2021-manicouagan-baie-comeau,2021-11-18 17:04:28,mixte
Baie-Comeau,"""santé publique""",10,ICI.Radio-Canada.ca,Trois nouveaux cas de COVID-19 et une présence significative de variants sur la Côte-Nord | Coronavirus,2021-04-05,227,https://ici.radio-canada.ca/nouvelle/1782368/coronavirus-bilan-5-avril-2021-sante-publique-cote-nord,2021-11-18 17:04:28,mixte
Baie-Comeau,"""santé publique""",11,ICI.Radio-Canada.ca,"La Côte-Nord pourrait revenir en zone jaune bientôt, estime la santé publique | Coronavirus",2021-05-13,189,https://ici.radio-canada.ca/nouvelle/1792864/palier-jaune-cote-nord-richard-fachehoun-cisss-conference-presse,2021-11-18 17:04:28,mixte
Baie-Comeau,"""santé publique""",12,ICI.Radio-Canada.ca,COVID-19: éclosion de 9 cas dans un milieu scolaire de la Manicouagan | Coronavirus,2021-10-11,38,https://ici.radio-canada.ca/nouvelle/1830837/bilan-covid-coronavirus-11-octobre-2021-sante-publique-cote-nord,2021-11-18 17:04:28,mixte
Baie-Comeau,"""santé publique""",13,Le Journal de Québec,Est du Québec: des réalités différentes d'un coin à l'autre,2021-11-06,12,https://www.journaldequebec.com/2021/11/06/des-realites-differentes-dun-coin-a-lautre,2021-11-18 17:04:28,mixte
Baie-Comeau,"""santé publique""",14,La Presse,COVID-19 | « C'est pas le temps de visiter des gens qu'on aime »,2021-04-26,206,https://www.lapresse.ca/covid-19/2021-04-26/covid-19/c-est-pas-le-temps-de-visiter-des-gens-qu-on-aime.php,2021-11-18 17:04:29,mixte
Baie-Comeau,"""santé publique""",15,Journal Le Manic,COVID-19 : un cas déclaré au cégep de Baie-Comeau,2021-03-15,248,https://www.lemanic.ca/2021/03/15/covid-19-un-cas-declare-au-cegep-de-baie-comeau/,2021-11-18 17:04:29,mixte
Baie-Comeau,"""santé publique""",16,Le Soleil - Groupe Capitales Médias,La propagation du coronavirus s'accélère sur la Côte-Nord et au Bas-Saint-Laurent,2021-04-28,204,https://www.lesoleil.com/2021/04/28/la-propagation-du-coronavirus-saccelere-sur-la-cote-nord-et-au-bas-saint-laurent-13c0acc1f4b42ecb22f31a44b4890c21,2021-11-18 17:04:29,mixte
Baie-Comeau,"""santé publique""",17,ICI.Radio-Canada.ca,Deux nouvelles personnes atteintes de la COVID-19 sur la Côte-Nord,2021-04-28,204,https://ici.radio-canada.ca/nouvelle/1788641/pandemie-bilan-manicouagan-28-avril-2021-test-depistage,2021-11-18 17:04:29,mixte
Baie-Comeau,"""santé publique""",18,Journal Le Manic,Six éclosions de COVID-19 sur la Côte-Nord,2021-10-06,43,https://www.lemanic.ca/2021/10/06/six-eclosions-de-covid-19-sur-la-cote-nord/,2021-11-18 17:04:29,mixte
Baie-Comeau,"""santé publique""",19,Le Soleil - Groupe Capitales Médias,La santé publique publie des consignes de santé sur l'accès à la Côte-Nord,2020-12-08,345,https://www.lesoleil.com/2020/12/08/la-sante-publique-publie-des-consignes-de-sante-sur-lacces-a-la-cote-nord-0ef3c43a4f7e3f3a2c79cf5951e0c8bf,2021-11-18 17:04:30,mixte
Baie-Comeau,"""santé publique""",20,Journal Le Manic,Le variant Delta et la rentrée scolaire préoccupent sur la Côte-Nord,2021-08-26,84,https://www.lemanic.ca/2021/08/26/le-variant-delta-et-la-rentree-scolaire-preoccupent-sur-la-cote-nord/,2021-11-18 17:04:30,mixte
Baie-Comeau,"""santé publique""",21,Journal Le Manic,(Mise à jour) COVID-19 : quatre infections de plus sur la Côte-Nord,2021-04-02,230,https://www.lemanic.ca/2021/04/02/covid-19-quatre-nouvelles-infections-de-plus-sur-la-cote-nord/,2021-11-18 17:04:30,mixte
Baie-Comeau,"""santé publique""",22,ICI.Radio-Canada.ca,Les deux cas de COVID-19 chez le Drakkar sont invalidés par la santé publique | Coronavirus,2021-03-20,243,https://ici.radio-canada.ca/nouvelle/1778799/covid-19-hockey-lhjmq-sherbrooke-drakkar-covid,2021-11-18 17:04:30,mixte
Baie-Comeau,"""santé publique""",23,Journal Le Manic,COVID-19 : au moins sept cas de variants sur la Côte-Nord,2021-04-05,227,https://www.lemanic.ca/2021/04/05/covid-19-au-moins-sept-cas-de-variants-sur-la-cote-nord/,2021-11-18 17:04:31,mixte
Baie-Comeau,"""santé publique""",24,Le Soleil - Groupe Capitales Médias,Plus forte hausse quotidienne des cas de COVID dans la région de Baie-Comeau,,,https://www.lesoleil.com/2020/11/20/plus-forte-hausse-quotidienne-des-cas-de-covid-dans-la-region-de-baie-comeau-b33aede9ec927215f00cb76ebf605101,2021-11-18 17:04:31,mixte
Baie-Comeau,"""santé publique""",25,TVA Nouvelles,La pénurie d'infirmières pèse lourd sur la Côte-Nord,2021-08-26,84,https://www.tvanouvelles.ca/2021/08/26/la-penurie-dinfirmieres-pese-lourd-sur-la-cote-nord-1,2021-11-18 17:04:31,mixte
Baie-Comeau,covid OR COVID,1,Le Journal de Québec,COVID-19: l'épidémie semble s'essouffler dans les écoles primaires de Baie-Comeau,2021-11-09,9,https://www.journaldequebec.com/2021/11/09/covid-19-lepidemie-semble-sessouffler-dans-les-ecoles-primaires-de-baie-comeau-1,2021-11-18 17:04:38,mixte
Baie-Comeau,covid OR COVID,2,Journal Le Manic,COVID : la Côte-Nord prête pour la troisième dose et la vaccination des jeunes,2021-11-10,8,https://www.lemanic.ca/2021/11/10/covid-la-cote-nord-prete-pour-la-troisieme-dose-et-la-vaccination-des-jeunes/,2021-11-18 17:04:39,mixte
Baie-Comeau,covid OR COVID,3,Journal Le Manic,La COVID-19 poursuit ses ravages à l'école Boisvert à Baie-Comeau,2021-10-28,21,https://www.lemanic.ca/2021/10/28/la-covid-19-poursuit-ses-ravages-a-lecole-boisvert-a-baie-comeau/,2021-11-18 17:04:39,mixte
Baie-Comeau,covid OR COVID,4,Le Journal de Québec,Les navires de croisière de retour sur le fleuve Saint-Laurent,2021-11-13,5,https://www.journaldequebec.com/2021/11/12/les-navires-de-croisieres-de-retour-sur-le-fleuve-saint-laurent-1,2021-11-18 17:04:39,mixte
Baie-Comeau,covid OR COVID,5,Journal Le Manic,Le masque en classe au primaire pour trois semaines de plus à Baie-Comeau,2021-11-15,3,https://www.lemanic.ca/2021/11/15/le-masque-au-primaire-pour-trois-semaines-de-plus-a-baie-comeau/,2021-11-18 17:04:39,mixte
Baie-Comeau,covid OR COVID,6,TVA Sports,Ce n'est que partie remise pour Jennifer Bellerose,2021-11-17,1,https://www.tvasports.ca/2021/11/17/ce-nest-que-partie-remise-pour-jennifer-bellerose,2021-11-18 17:04:39,mixte
Baie-Comeau,covid OR COVID,7,TVA Nouvelles,Les développements sur le coronavirus du 9 novembre,2021-11-09,9,https://www.tvanouvelles.ca/2021/11/09/en-direct--les-derniers-developpements-sur-le-coronavirus,2021-11-18 17:04:39,mixte
Baie-Comeau,covid OR COVID,8,Journal Le Manic,Les maisons à vendre sont une denrée rare sur la Côte-Nord,2021-10-25,24,https://www.lemanic.ca/2021/10/25/les-maisons-a-vendre-sont-une-denree-rare-sur-la-cote-nord/,2021-11-18 17:04:40,mixte
Baie-Comeau,covid OR COVID,9,Le Journal de Québec,Le Drakkar vise un deuxième gain d'affilée,2021-11-02,16,https://www.journaldequebec.com/2021/11/02/le-drakkar-vise-un-deuxieme-gain-daffilee,2021-11-18 17:04:40,mixte
Baie-Comeau,covid OR COVID,10,Journal Le Manic,Belle vitesse de croisière pour les Rapidos malgré la COVID,2021-10-26,23,https://www.lemanic.ca/2021/10/26/belle-vitesse-de-croisiere-pour-les-rapidos-malgre-la-covid/,2021-11-18 17:04:40,mixte
Baie-Comeau,covid OR COVID,11,Le Journal de Québec,Le Drakkar dominé,2021-11-13,5,https://www.journaldequebec.com/2021/11/12/le-drakkar-domine,2021-11-18 17:04:40,mixte
Baie-Comeau,covid OR COVID,12,Le Journal de Québec,Éclosion dans une école primaire de Baie-Comeau,2021-10-12,37,https://www.journaldequebec.com/2021/10/12/eclosion-dans-une-ecole-primaire-de-baie-comeau-1,2021-11-18 17:04:40,mixte
Baie-Comeau,covid OR COVID,13,Le Journal de Montréal,"LHJMQ: le Titan plie, mais ne casse pas",2021-11-14,4,https://www.journaldemontreal.com/2021/11/13/lhjmq-le-titan-plie-mais-ne-casse-pas,2021-11-18 17:04:41,mixte
Baie-Comeau,covid OR COVID,14,La Presse,COVID-19 | « C'est pas le temps de visiter des gens qu'on aime »,2021-04-26,206,https://www.lapresse.ca/covid-19/2021-04-26/covid-19/c-est-pas-le-temps-de-visiter-des-gens-qu-on-aime.php,2021-11-18 17:04:41,mixte
