Terrebonne,maire OR mairesse,20,TVA Nouvelles,Municipales 2021: Mathieu Traversy souhaite devenir maire de Terrebonne,2021-06-05,166,https://www.tvanouvelles.ca/2021/06/05/municipales-2021-mathieu-traversy-souhaite-devenir-maire-de-terrebonne,2021-11-18 12:28:27,local
Terrebonne,maire OR mairesse,21,Le Journal de Montréal,Le bras droit du maire de Terrebonne accusé de fraude électorale,2021-09-07,72,https://www.journaldemontreal.com/2021/09/07/le-bras-droit-du-maire-de-terrebonne-accuse-de-fraude-electorale-1,2021-11-18 12:28:27,local
Terrebonne,maire OR mairesse,22,LesAffaires.com,Municipales 2021: des gagnants et des perdants | LesAffaires.com,2021-11-08,10,https://www.lesaffaires.com/blogues/raphael-melancon/municipales-2021-des-gagnants-et-des-perdants/628694,2021-11-18 12:28:27,local
Terrebonne,maire OR mairesse,23,La Presse,Des priorités pour Valérie Plante | La Presse,2021-11-17,1,https://www.lapresse.ca/debats/chroniques/2021-11-17/des-priorites-pour-valerie-plante.php,2021-11-18 12:28:28,local
Terrebonne,maire OR mairesse,24,Le Journal de Montréal,Bisbille au conseil municipal de Terrebonne: un élu visé par plusieurs plaintes,2021-03-16,247,https://www.journaldemontreal.com/2021/03/16/bisbille-au-conseil-municipal-de-terrebonne-un-elu-vise-par-plusieurs-plaintes-1,2021-11-18 12:28:28,local
Terrebonne,maire OR mairesse,25,Radio-Canada.ca,Des matières dangereuses près de chez vous : « un autre Lac-Mégantic est possible »,2021-11-11,7,https://ici.radio-canada.ca/sports/podium/2463/serge-dessureault-alpinisme-k2-conjointe-famille,2021-11-18 12:28:28,local
Terrebonne,candidat,1,La Presse,Élections municipales | Autour de Montréal : entre nouveauté et continuité,2021-11-08,10,https://www.lapresse.ca/actualites/grand-montreal/2021-11-08/elections-municipales/autour-de-montreal-entre-nouveaute-et-continuite.php,2021-11-18 12:28:37,local
Terrebonne,candidat,2,Le Journal de Montréal,Rive-Nord de Montréal: une lutte serrée à trois candidats à Laval,2021-11-06,12,https://www.journaldemontreal.com/2021/11/06/rive-nord-de-montreal-une-lutte-serree-a-trois-candidats-a-laval,2021-11-18 12:28:37,local
Terrebonne,candidat,3,Le Devoir,Huit courses municipales à surveiller hors de Montréal,2021-11-06,12,https://www.ledevoir.com/politique/regions/645540/huit-courses-a-surveiller-hors-de-montreal,2021-11-18 12:28:38,local
Terrebonne,candidat,4,ICI.Radio-Canada.ca,Allégations d'agression sexuelle : Coderre réclame le départ d'un candidat adverse | Élections municipales au Québec 2021,2021-11-04,14,https://ici.radio-canada.ca/nouvelle/1837220/enquete-craig-sauve-projet-montreal-2012,2021-11-18 12:28:38,local
Terrebonne,candidat,5,ICI.Radio-Canada.ca,Stéphane Boyer élu maire de Laval,2021-11-07,11,https://ici.radio-canada.ca/nouvelle/1838024/laval-couronne-nord-elections-municipales-2021,2021-11-18 12:28:38,local
Terrebonne,candidat,6,Le Devoir,Les résultats des municipales aux quatre coins du Québec,2021-11-08,10,https://www.ledevoir.com/politique/645852/beaudin-devient-la-toute-premiere-mairesse-de-sherbrooke,2021-11-18 12:28:38,local
Terrebonne,candidat,7,Le Journal de Montréal,Tous les développements des élections municipales | JDM,2021-11-08,10,https://www.journaldemontreal.com/2021/11/07/suivez-en-direct-tous-les-developpements-des-elections-municipales,2021-11-18 12:28:38,local
Terrebonne,candidat,8,Le Journal de Montréal,Élections municipales: suspense et luttes serrées | JDM,2021-11-03,15,https://www.journaldemontreal.com/2021/11/03/elections-municipales-suspense-et-luttes-serrees,2021-11-18 12:28:39,local
Terrebonne,candidat,9,Courrier Laval,Requalification des terrains de golf: six candidats se prononcent,2021-11-03,15,https://courrierlaval.com/requalification-des-terrains-de-golf-six-candidats-se-prononcent/,2021-11-18 12:28:39,local
Terrebonne,candidat,10,La Presse,Élections générales de 2022 | Une fondatrice de la CAQ songe à être candidate,2021-11-11,7,https://www.lapresse.ca/actualites/politique/2021-11-11/elections-generales-de-2022/une-fondatrice-de-la-caq-songe-a-etre-candidate.php,2021-11-18 12:28:39,local
Terrebonne,candidat,11,LesAffaires.com,Municipales 2021: des gagnants et des perdants | LesAffaires.com,2021-11-08,10,https://www.lesaffaires.com/blogues/raphael-melancon/municipales-2021-des-gagnants-et-des-perdants/628694,2021-11-18 12:28:39,local
Terrebonne,candidat,12,La Presse,Des priorités pour Valérie Plante | La Presse,2021-11-17,1,https://www.lapresse.ca/debats/chroniques/2021-11-17/des-priorites-pour-valerie-plante.php,2021-11-18 12:28:39,local
Terrebonne,candidat,13,La Presse,Voter pour son milieu de vie | La Presse,2021-11-06,12,https://www.lapresse.ca/debats/editoriaux/2021-11-06/voter-pour-son-milieu-de-vie.php,2021-11-18 12:28:40,local
Terrebonne,candidat,14,Le Journal de Québec,Élections municipales: une première à la mairie de Saint-Lambert,2021-11-08,10,https://www.journaldequebec.com/2021/11/08/elections-municipales-une-premiere-a-la-mairie-de-saint-lambert,2021-11-18 12:28:40,local
Terrebonne,candidat,15,ICI.Radio-Canada.ca,Le député de Terrebonne Michel Boudrias mis à l'écart par le Bloc québécois,2021-08-04,106,https://ici.radio-canada.ca/nouvelle/1814257/bloc-quebecois-bq-investitures-candidature-nathalie-sinclair-desgagnes,2021-11-18 12:28:40,local
Terrebonne,candidat,16,"98,5 fm",Il reste une semaine et demie à la campagne municipale au Québec… Et y a deux histoires concernant des candidats ont retenu notre attention pour des raisons très différentes…. — 98.5 Montréal,2021-10-27,22,https://www.985fm.ca/audio/434984/il-reste-une-semaine-et-demie-a-la-campagne-municipale-au-quebec-et-y-a-deux-histoires-concernant-des-candidats-ont-retenu-notre-attention-pour-des-raisons-tres-differentes,2021-11-18 12:28:41,local
Terrebonne,candidat,17,La Presse,Terrebonne | L'avenir d'un ancien champ de tir devient un enjeu électoral,2021-08-26,84,https://www.lapresse.ca/elections-federales/2021-08-26/terrebonne/l-avenir-d-un-ancien-champ-de-tir-devient-un-enjeu-electoral.php,2021-11-18 12:28:41,local
Terrebonne,candidat,18,Radio-Canada.ca,Mathieu Traversy officiellement candidat à la mairie de Terrebonne,2021-06-07,164,https://ici.radio-canada.ca/nouvelle/1799577/elections-municipales-lanaudiere-ex-depute-pequiste,2021-11-18 12:28:41,local
Terrebonne,candidat,19,TVA Nouvelles,Le torchon brûle toujours entre la juge en chef et le ministre,2021-11-06,12,https://www.tvanouvelles.ca/2021/11/06/le-torchon-brule-toujours-entre-la-juge-en-chef-et-le-ministre-1,2021-11-18 12:28:41,local
Terrebonne,candidat,20,Le Journal de Montréal,Terrebonne: Les conventions collectives au cœur de la campagne électorale municipale,2021-09-01,78,https://www.journaldemontreal.com/2021/09/01/terrebonne--les-conventions-collectives-au-cur-de-la-campagne-electorale-municipale-1,2021-11-18 12:28:41,local
Terrebonne,candidat,21,Radio-Canada.ca,L'investiture du député bloquiste de Terrebonne Michel Boudrias contestée,2021-07-28,113,https://ici.radio-canada.ca/nouvelle/1812301/nathalie-sinclair-gagne-candidature-bq,2021-11-18 12:28:42,local
Terrebonne,candidat,22,TVA Nouvelles,Trois ans pour mettre fin à la « crise de confiance » envers l'UPAC,2021-11-09,9,https://www.tvanouvelles.ca/2021/11/09/trois-ans-pour-mettre-fin-a-la--crise-de-confiance--envers-lupac-1,2021-11-18 12:28:42,local
Terrebonne,candidat,23,L'Express Montcalm,Luc Thériault l'emporte dans Montcalm,2021-09-20,59,https://www.lexpressmontcalm.com/article/2021/09/20/luc-theriault-l-emporte-dans-montcalm,2021-11-18 12:28:42,local
Terrebonne,candidat,24,Radio-Canada.ca,Près de 60 % des candidats de Projet Montréal seront des femmes | Élections municipales au Québec 2021,2021-09-23,56,https://ici.radio-canada.ca/nouvelle/1826385/equipe-projet-montreal-elections-municipales-montreal-2021-parite,2021-11-18 12:28:42,local
Terrebonne,candidat,25,TVA Nouvelles,Le bras droit du maire de Terrebonne accusé de fraude électorale,2021-09-07,72,https://www.tvanouvelles.ca/2021/09/07/le-bras-droit-du-maire-de-terrebonne-accuse-de-fraude-electorale,2021-11-18 12:28:43,local
Terrebonne,préfet,1,L'Action,Près de 870 000 $ pour des projets touristiques lanaudois,2021-08-10,100,https://www.laction.com/article/2021/08/10/pres-de-870-000-pour-des-projets-touristiques-lanaudois,2021-11-18 12:28:50,local
Terrebonne,préfet,2,L'Express Montcalm,Yannick Thibeault vise la préfecture,2021-09-23,56,https://www.lexpressmontcalm.com/article/2021/09/23/yannick-thibeault-vise-la-prefecture,2021-11-18 12:28:51,local
Terrebonne,préfet,3,L'Express Montcalm,Patrick Massé sera candidat à la préfecture de la MRC de Montcalm,2021-08-24,86,https://www.lexpressmontcalm.com/article/2021/08/24/patrick-masse-sera-candidat-a-la-prefecture-de-la-mrc-de-montcalm,2021-11-18 12:28:51,local
Terrebonne,préfet,4,La Presse,Une guerre du bungalow dans les couronnes de Montréal,2021-10-13,36,https://www.lapresse.ca/actualites/grand-montreal/2021-10-13/une-guerre-du-bungalow-dans-les-couronnes-de-montreal.php,2021-11-18 12:28:51,local
Terrebonne,"""travaux routiers""",1,Truck Stop Québec,Travaux routiers sur l'autoroute 640 à Terrebonne et à Mascouche,2021-08-03,107,https://www.truckstopquebec.com/travaux-routiers-sur-lautoroute-640-a-terrebonne-et-a-mascouche-64533/,2021-11-18 12:28:58,local
Terrebonne,"""travaux routiers""",2,Hebdo Rive Nord,Les travaux se poursuivent à Repentigny,2021-07-27,114,https://www.hebdorivenord.com/article/2021/07/27/les-travaux-se-poursuivent-a-repentigny,2021-11-18 12:28:58,local
Terrebonne,"""travaux routiers""",3,L'Action,Des travaux seront entamés sur la route 158 - Joliette,2021-05-27,175,https://www.laction.com/article/2021/05/27/des-travaux-seront-entames-sur-la-route-158,2021-11-18 12:28:59,local
Terrebonne,"""travaux routiers""",4,Hebdo Rive Nord,De nombreux octrois contrats pour l'amélioration du réseau routier,2021-04-22,210,https://www.hebdorivenord.com/article/2021/04/22/de-nombreux-octrois-contrats-pour-l-amelioration-du-reseau-routier,2021-11-18 12:28:59,local
Terrebonne,"""travaux routiers""",5,La Presse,Réfection d'une courbe dangereuse | Wentworth-Nord patiente depuis plus de 20 ans,2021-07-19,122,https://www.lapresse.ca/actualites/2021-07-19/refection-d-une-courbe-dangereuse/wentworth-nord-patiente-depuis-plus-de-20-ans.php,2021-11-18 12:28:59,local
Terrebonne,"""travaux routiers""",6,L'Action,Début du pavage sur le chemin de Saint-Norbert - Joliette,2021-09-24,55,https://www.laction.com/article/2021/09/24/debut-du-pavage-sur-le-chemin-de-saint-norbert,2021-11-18 12:28:59,local
Terrebonne,"""travaux routiers""",7,L'Action,Travaux d'entretien sur le chemin Manawan - Joliette,2021-07-20,121,https://www.laction.com/article/2021/07/20/travaux-d-entretien-sur-le-chemin-manawan,2021-11-18 12:29:00,local
Terrebonne,autobus OR tramway,1,La Presse,La Presse à la COP26 | Cinq milliards pour des autobus électriques au Québec | La Presse,2021-11-03,15,https://www.lapresse.ca/actualites/environnement/2021-11-03/la-presse-a-la-cop26/cinq-milliards-pour-des-autobus-electriques-au-quebec.php,2021-11-18 12:29:07,local
Terrebonne,autobus OR tramway,2,Le Journal de Québec,Lévis encore à la traîne pour le financement du transport collectif,2021-10-22,27,https://www.journaldequebec.com/2021/10/21/levis-encore-a-la-traine-pour-le-financement-du-transport-collectif,2021-11-18 12:29:08,local
Terrebonne,autobus OR tramway,3,Le Devoir,Huit courses municipales à surveiller hors de Montréal,2021-11-06,12,https://www.ledevoir.com/politique/regions/645540/huit-courses-a-surveiller-hors-de-montreal,2021-11-18 12:29:08,local
Terrebonne,autobus OR tramway,4,TVA Nouvelles,Lion ouvre un «centre d'expérience» à Terrebonne,2021-09-07,72,https://www.tvanouvelles.ca/2021/09/07/lion-ouvre-un-centre-dexperience-a-terrebonne-1,2021-11-18 12:29:08,local
Terrebonne,autobus OR tramway,5,LeLézard.com,Autoroute 640 à Terrebonne - Fermetures partielles de jour de l'autoroute 640 les 15 et 16 septembre,2021-09-14,65,https://www.lelezard.com/communique-19996528.html,2021-11-18 12:29:08,local
Terrebonne,autobus OR tramway,6,Nord Info et Voix des Mille-Iles,Refonte du réseau de bus: exo lance ses consultations publiques,2021-09-09,70,https://www.nordinfo.com/actualites/refonte-du-reseau-de-bus-exo-lance-ses-consultations-publiques/,2021-11-18 12:29:09,local
Terrebonne,autobus OR tramway,7,La Presse,Québec | L'élection du tramway a enfin lieu,2021-10-09,40,https://www.lapresse.ca/actualites/2021-10-09/quebec/l-election-du-tramway-a-enfin-lieu.php,2021-11-18 12:29:09,local
Terrebonne,autobus OR tramway,8,La Presse,Legault et Labeaume scelleront un accord sur le tramway mercredi,2021-03-15,248,https://www.lapresse.ca/actualites/2021-03-15/legault-et-labeaume-scelleront-un-accord-sur-le-tramway-mercredi.php,2021-11-18 12:29:09,local
Terrebonne,autobus OR tramway,9,L'Express Montcalm,Des dizaines d'élèves privés de transport quotidiennement,2021-10-06,43,https://www.lexpressmontcalm.com/article/2021/10/06/des-dizaines-d-eleves-prives-de-transport-quotidiennement,2021-11-18 12:29:09,local
Terrebonne,autobus OR tramway,10,Radio-Canada.ca,Consultation sur le tramway : la 3e Avenue à privilégier?,2021-05-10,192,https://ici.radio-canada.ca/nouvelle/1791892/seances-consultations-tramway-quebec-saint-roch-vieux-limoilou-maizerets-destimauville,2021-11-18 12:29:10,local
Terrebonne,autobus OR tramway,11,La Presse,Sherbrooke | Un autobus scolaire fonce dans un commerce,2021-09-02,77,https://www.lapresse.ca/actualites/justice-et-faits-divers/2021-09-02/sherbrooke/un-autobus-scolaire-fonce-dans-un-commerce.php,2021-11-18 12:29:10,local
Terrebonne,autobus OR tramway,12,La Presse,Drummondville | Un cycliste meurt après avoir été happé par un autobus scolaire,2021-09-30,49,https://www.lapresse.ca/actualites/justice-et-faits-divers/2021-09-30/drummondville/un-cycliste-meurt-apres-avoir-ete-happe-par-un-autobus-scolaire.php,2021-11-18 12:29:10,local
Terrebonne,autobus OR tramway,13,Le Journal de Montréal,Un homme armé arrêté après s'être barricadé à Terrebonne,2021-07-14,127,https://www.journaldemontreal.com/2021/07/13/grand-deploiement-policier-a-terrebonne,2021-11-18 12:29:10,local
Terrebonne,autobus OR tramway,14,CNW Telbec,Début des travaux de construction du futur centre de service d'exo à Repentigny,2021-06-17,154,https://www.newswire.ca/fr/news-releases/debut-des-travaux-de-construction-du-futur-centre-de-service-d-exo-a-repentigny-866474766.html,2021-11-18 12:29:10,local
Terrebonne,autobus OR tramway,15,Hebdo Rive Nord,Exo adopte de nouveaux horaires de train et d'autobus pour l'automne,2021-08-25,85,https://www.hebdorivenord.com/article/2021/08/25/exo-adopte-de-nouveaux-horaires-de-train-et-d-autobus-pour-l-automne,2021-11-18 12:29:11,local
Terrebonne,autobus OR tramway,16,Radio-Canada.ca,Tramway : le maire de Québec a une nouvelle proposition qu'il est prêt à soumettre,2021-02-25,266,https://ici.radio-canada.ca/nouvelle/1773289/labeaume-tramway-lettre-premier-ministre-negociations,2021-11-18 12:29:11,local
Terrebonne,autobus OR tramway,17,La Presse,Usine de batteries | Lion Électrique s'installe à Mirabel,2021-06-03,168,https://www.lapresse.ca/affaires/entreprises/2021-06-03/usine-de-batteries/lion-electrique-s-installe-a-mirabel.php,2021-11-18 12:29:11,local
Terrebonne,autobus OR tramway,18,La Presse,Une guerre du bungalow dans les couronnes de Montréal,2021-10-13,36,https://www.lapresse.ca/actualites/grand-montreal/2021-10-13/une-guerre-du-bungalow-dans-les-couronnes-de-montreal.php,2021-11-18 12:29:12,local
Terrebonne,autobus OR tramway,19,La Presse,Où s'en va le train de banlieue ?,2021-06-15,156,https://www.lapresse.ca/actualites/grand-montreal/2021-06-15/ou-s-en-va-le-train-de-banlieue.php,2021-11-18 12:29:12,local
Terrebonne,autobus OR tramway,20,L'Action,Les MRC du nord de Lanaudière s'unissent pour faire la promotion du transport collectif,2021-08-21,89,https://www.laction.com/article/2021/08/21/les-mrc-du-nord-de-lanaudiere-s-unissent-pour-faire-la-promotion-du-transport-collectif,2021-11-18 12:29:12,local
Terrebonne,autobus OR tramway,21,Journal Métro,Le REM va transformer le réseau Exo,2021-04-26,206,https://journalmetro.com/actualites/montreal/2635226/exo-le-rem-va-transformer-le-reseau/,2021-11-18 12:29:12,local
Terrebonne,autobus OR tramway,22,La Presse,Montréal | Une femme dans un état critique après avoir été heurtée par un autobus,2021-01-22,300,https://www.lapresse.ca/actualites/justice-et-faits-divers/2021-01-22/montreal/une-femme-dans-un-etat-critique-apres-avoir-ete-heurtee-par-un-autobus.php,2021-11-18 12:29:13,local
Terrebonne,autobus OR tramway,23,L'Action,De l'argent pour l'électrification des autobus scolaires dans le comté de Berthier,2021-11-04,14,https://www.laction.com/article/2021/11/04/de-l-argent-pour-l-electrification-des-autobus-scolaires-dans-le-comte-de-berthier,2021-11-18 12:29:13,local
Terrebonne,autobus OR tramway,24,La Presse,Plus de transport collectif réclamé à Terrebonne,,,https://www.lapresse.ca/actualites/grand-montreal/2020-03-02/plus-de-transport-collectif-reclame-a-terrebonne,2021-11-18 12:29:13,local
Terrebonne,autobus OR tramway,25,Mon Joliette,Port du masque: une chauffeuse de bus agressée - la police de Terrebonne arrête un suspect,,,https://monjoliette.com/port-du-masque-une-chauffeuse-de-bus-agressee-la-police-de-terrebonne-arrete-un-suspect/,2021-11-18 12:29:13,local
Terrebonne,météo,1,MétéoMédia,La première tempête de 2021 frappe le Québec,2021-01-18,304,https://www.meteomedia.com/ca/nouvelles/article/la-premiere-vraie-tempete-frappe-le-quebec,2021-11-18 12:29:21,local
Terrebonne,météo,2,L'Action,Geosapiens et Hydro Météo s'associent pour améliorer la gestion des inondations,2021-09-20,59,https://www.laction.com/article/2021/09/20/geosapiens-et-hydro-meteo-s-associent-pour-ameliorer-la-gestion-des-inondations,2021-11-18 12:29:21,local
Terrebonne,météo,3,Le Journal de Montréal,"Tremblement de terre de magnitude 3,9 près de l'Épiphanie",2021-05-17,185,https://www.journaldemontreal.com/2021/05/17/region-de-joliette--une-secousse-fait-trembler-la-terre,2021-11-18 12:29:22,local
Terrebonne,météo,4,MétéoMédia,Pelletage : six conseils pour éviter les blessures,2021-02-15,276,https://www.meteomedia.com/ca/nouvelles/article/pelletage-six-conseils-pour-eviter-les-blessures,2021-11-18 12:29:22,local
Terrebonne,météo,5,MétéoMédia,Encore un risque d'orages violents au Québec,2021-01-12,310,https://www.meteomedia.com/ca/nouvelles/article/orages-veille-tornade-quebec,2021-11-18 12:29:22,local
Terrebonne,météo,6,Le Journal de Québec,Un chauffard aurait causé une collision mortelle à Terrebonne,2021-08-18,92,https://www.journaldequebec.com/2021/08/18/collision-mortelle-a-terrebonne,2021-11-18 12:29:22,local
Terrebonne,météo,7,TVA Nouvelles,Pourquoi aucune alerte avant la tornade meurtrière de Mascouche?,2021-06-23,148,https://www.tvanouvelles.ca/2021/06/23/pourquoi-aucune-alerte-avant-la-tornade-meurtriere-de-mascouche,2021-11-18 12:29:22,local
Terrebonne,météo,8,Le Journal de Montréal,Coupe du monde de vélo de montagne: la météo vole la vedette à Les Gets,2021-07-04,137,https://www.journaldemontreal.com/2021/07/04/coupe-du-monde-de-velo-de-montagne-la-meteo-vole-la-vedette-a-les-gets,2021-11-18 12:29:23,local
Terrebonne,météo,9,Le Journal de Montréal,Terrebonne: Incendie suspect sur un site patrimonial,2021-03-17,246,https://www.journaldemontreal.com/2021/03/17/terrebonne--incendie-suspect-sur-un-site-patrimonial,2021-11-18 12:29:23,local
Terrebonne,météo,10,Le Journal de Montréal,Comparaison douteuse : un élu de Terrebonne également policier au SPVM dans l'embarras,2021-04-14,218,https://www.journaldemontreal.com/2021/04/13/un-elu-de-terrebonne-policier-au-spvm-dans-lembarras-1,2021-11-18 12:29:23,local
Terrebonne,météo,11,Le Journal de Québec,Le Groupe ATIS remercie 300 travailleurs et ferme une usine,2021-02-26,265,https://www.journaldequebec.com/2021/02/26/restructuration-le-groupe-atis-remercie-300-travailleurs,2021-11-18 12:29:24,local
Terrebonne,météo,12,"98,5 fm",La nuit dernière | Coups de feu entendus à proximité du Centre universitaire de santé McGill,2021-08-24,86,https://www.985fm.ca/nouvelles/faits-divers/418173/la-nuit-derniere-coups-de-feu-entendus-a-proximite-du-centre-universitaire-de-sante-mcgill,2021-11-18 12:29:24,local
Terrebonne,météo,13,Le Journal de Montréal,"Rénover un bâtiment historique pour en faire un restaurant, tout un défi",2021-09-20,59,https://www.journaldemontreal.com/2021/09/20/renover-un-batiment-historique-pour-en-faire-un-restaurant-tout-un-defi,2021-11-18 12:29:24,local
Terrebonne,météo,14,Le Journal de Montréal,Rive-Nord de Montréal: des automobilistes maîtrisent un homme en crise sur la 640,2021-08-18,92,https://www.journaldemontreal.com/2021/08/18/rive-nord-de-montreal-pres-dune-dizaine-de-citoyens-maitrisent-un-homme-en-crise,2021-11-18 12:29:24,local
Terrebonne,météo,15,MétéoMédia,Cinq activités moins connues à faire près de Montréal,2021-06-21,150,https://www.meteomedia.com/ca/nouvelles/article/cinq-activites-moins-connues-a-faire-pres-de-montreal,2021-11-18 12:29:24,local
Terrebonne,météo,16,MétéoMédia,Tornade confirmée au Québec,,,https://www.meteomedia.com/ca/nouvelles/article/heure-en-heure-veille-dorages-violents-les-pires-secteurs-ici,2021-11-18 12:29:25,local
Terrebonne,météo,17,Le Journal de Montréal,Bisbille au conseil municipal de Terrebonne: un élu visé par plusieurs plaintes,2021-03-16,247,https://www.journaldemontreal.com/2021/03/16/bisbille-au-conseil-municipal-de-terrebonne-un-elu-vise-par-plusieurs-plaintes-1,2021-11-18 12:29:25,local
Terrebonne,météo,18,MétéoMédia,Réjouissez-vous ! Le dernier gel approche,,,https://www.meteomedia.com/ca/nouvelles/article/jardiniers-rejouissez-vous-le-dernier-gel-approche,2021-11-18 12:29:25,local
Terrebonne,météo,19,Le Journal de Montréal,Terrebonne: le BEI enquête sur la mort d'un sexagénaire lors d'une opération policière,2021-09-28,51,https://www.journaldemontreal.com/2021/09/28/terrebonne-le-bei-enquete-sur-la-mort-dun-sexagenaire-lors-dune-operation-policiere,2021-11-18 12:29:25,local
Terrebonne,météo,20,La Presse,La Presse en Colombie-Britannique | Une saison aride pour l'industrie agricole | La Presse,2021-07-24,117,https://www.lapresse.ca/actualites/2021-07-24/la-presse-en-colombie-britannique/une-saison-aride-pour-l-industrie-agricole.php,2021-11-18 12:29:26,local
Terrebonne,météo,21,Le Journal de Québec,Biovert prête pour l'international,2021-08-30,80,https://www.journaldequebec.com/2021/08/30/biovert-prete-pour-linternational,2021-11-18 12:29:26,local
Terrebonne,météo,22,Le Journal de Québec,La fin du Groupe ATIS: des pertes de 100 millions $ pour trois actionnaires,2021-09-08,71,https://www.journaldequebec.com/2021/09/08/des-pertes-de-100-m-pour-les-actionnaires-datis,2021-11-18 12:29:26,local
Terrebonne,météo,23,Le Journal de Montréal,Un homme armé arrêté après s'être barricadé à Terrebonne,2021-07-14,127,https://www.journaldemontreal.com/2021/07/13/grand-deploiement-policier-a-terrebonne,2021-11-18 12:29:26,local
Terrebonne,météo,24,MétéoMédia,89 mm de pluie tombés en 24 heures : voyez où.,,,https://www.meteomedia.com/ca/nouvelles/article/heure-en-heure-alertes-dorages-violents-en-vigueur-voyez-ou,2021-11-18 12:29:26,local
Terrebonne,météo,25,Le Journal de Québec,Les champions des tickets après 20h,2021-02-28,263,https://www.journaldequebec.com/2021/02/28/les-champions-des-tickets-apres-20h,2021-11-18 12:29:27,local
