Villes,Mots-clés,position du média,Nom du média,Titre de l'article,Date de publication,Journée de différence,URL,date et heure saisie,type mot-clés
Havre-Saint-Pierre,"""premier ministre""",1,World Socialist Web Site,Grève des 900 travailleurs de la fonderie de Rio Tinto en Colombie-Britannique sur des questions de sous-traitance et de droit de retraite,2021-07-28,8,https://www.wsws.org/fr/articles/2021/07/28/rtin-j28.html,2021-08-05 13:49:20,national
Havre-Saint-Pierre,"""premier ministre""",2,L’actualité,Vieillir à la maison,2021-08-04,1,https://lactualite.com/societe/vieillir-a-la-maison/,2021-08-05 13:49:20,national
Havre-Saint-Pierre,"""premier ministre""",3,Le Quotidien - Groupe Capitales Médias,François Legault rencontre la direction de Rio Tinto,2021-03-22,136,https://www.lequotidien.com/affaires/francois-legault-rencontre-la-direction-de-rio-tinto-941ed01c8ef52a2388dc964849a1b7e6,2021-08-05 13:49:21,national
Havre-Saint-Pierre,"""premier ministre""",4,Le Soleil - Groupe Capitales Médias,Lorraine Richard en réflexion pour une candidature en 2022 | Politique | Actualités,2021-06-14,52,https://www.lesoleil.com/actualite/politique/lorraine-richard-en-reflexion-pour-une-candidature-en-2022-b49b2034feef47426dcfc180b1d1c37a,2021-08-05 13:49:21,national
Havre-Saint-Pierre,"""premier ministre""",5,Ma Côte-Nord,Pétition pour une levée du couvre-feu au gré des marées lorsque le capelan roule,2021-05-03,94,https://macotenord.com/petition-pour-une-levee-du-couvre-feu-au-gre-des-marees-lorsque-le-capelan-roule/,2021-08-05 13:49:21,national
Havre-Saint-Pierre,"""premier ministre""",6,Ma Côte-Nord,Une manifestation pour l'annulation du couvre-feu prévue ce samedi,2021-01-12,205,https://macotenord.com/une-manifestation-pour-retirer-le-couvre-feu-ce-samedi/,2021-08-05 13:49:21,national
Havre-Saint-Pierre,"""premier ministre""",7,Ma Côte-Nord,Le ministre québécois de l'Environnement procède à une annonce aujourd'hui à Anticosti,2020-09-28,311,https://macotenord.com/le-ministre-quebecois-de-lenvironnement-procede-a-une-annonce-aujourdhui-a-anticosti/,2021-08-05 13:49:21,national
Havre-Saint-Pierre,"""premier ministre""",8,Côté Manche,Photos. L'ancien Premier ministre Edouard Philippe en visite surprise à Saint-Lô,2021-07-01,35,https://actu.fr/normandie/saint-lo_50502/photos-l-ancien-premier-ministre-edouard-philippe-en-visite-surprise-a-saint-lo_43132769.html/amp,2021-08-05 13:49:22,national
Havre-Saint-Pierre,"""premier ministre""",9,Magazine MCI,Rio Tinto Fer et Titane projette de devenir le premier producteur d'oxyde de scandium en Amérique du Nord,2021-01-15,202,https://magazinemci.com/2021/01/15/rio-tinto-fer-et-titane-projette-de-devenir-le-premier-producteur-doxyde-de-scandium-en-amerique-du-nord/,2021-08-05 13:49:22,national
Havre-Saint-Pierre,"""premier ministre""",10,Magazine MCI,MCS – inauguration de la nouvelle usine à Sorel-Tracy – Magazine MCI,2021-06-21,45,https://magazinemci.com/2021/06/21/mcs-inauguration-de-la-nouvelle-usine-a-sorel-tracy/,2021-08-05 13:49:22,national
Havre-Saint-Pierre,"""premier ministre""",11,Ouest-France,Près de Rennes. Edouard Philippe en petit comité à Saint-Grégoire,2021-05-07,90,https://www.ouest-france.fr/bretagne/rennes-35000/pres-de-rennes-edouard-philippe-en-petit-comite-a-saint-gregoire-fe61fe2e-af58-11eb-b100-a92ec708d065,2021-08-05 13:49:23,national
Havre-Saint-Pierre,"""premier ministre""",12,Le Soleil - Groupe Capitales Médias,"Vent, pluie et neige sur plusieurs régions du Québec",2020-12-01,247,https://www.lesoleil.com/actualite/environnement/vent-pluie-et-neige-sur-plusieurs-regions-du-quebec-a513a15674b2306c85587425b7c817e1,2021-08-05 13:49:23,national
Havre-Saint-Pierre,"""premier ministre""",13,Le Soleil - Groupe Capitales Médias,"La COVID encore agressive au Bas-Saint-Laurent, en déclin ailleurs dans l'Est",2021-05-19,78,https://www.lesoleil.com/actualite/en-region/la-covid-encore-agressive-au-bas-saint-laurent-en-declin-ailleurs-dans-lest-74d9aea25f83aea5b38856d170c8164f,2021-08-05 13:49:23,national
Havre-Saint-Pierre,"""premier ministre""",14,ICI.Radio-Canada.ca,Cinq féminicides en un mois au Québec : des moyens réclamés pour lutter contre la violence,2021-03-18,140,https://ici.radio-canada.ca/nouvelle/1775704/journee-internationale-droit-femme-centre-hebergement-violence-conjugale,2021-08-05 13:49:23,national
Havre-Saint-Pierre,"""premier ministre""",15,ICI.Radio-Canada.ca,COVID-19 : Québec cherche des renforts pour les CPE | Coronavirus,2020-12-09,239,https://ici.radio-canada.ca/nouvelle/1755620/covid-19-quebec-campagne-recrutement-cpe,2021-08-05 13:49:23,national
Havre-Saint-Pierre,"""premier ministre""",16,La Montagne,La venue de l'ancien Premier ministre Edouard Philippe a fait l'événement dans une librairie de Vichy (Allier),2021-06-16,50,https://www.lamontagne.fr/vichy-03200/actualites/la-venue-de-l-ancien-premier-ministre-edouard-philippe-a-fait-l-evenement-dans-une-librairie-de-vichy-allier_13968918/,2021-08-05 13:49:24,national
Havre-Saint-Pierre,"""premier ministre""",17,Le Soleil - Groupe Capitales Médias,L'éclosion de COVID-19 sous contrôle au chantier Romaine,2021-05-10,87,https://www.lesoleil.com/actualite/en-region/leclosion-de-covid-19-sous-controle-au-chantier-romaine-ffa98fc15f067d63fd2816167ed98261,2021-08-05 13:49:24,national
Havre-Saint-Pierre,"""premier ministre""",18,Le Figaro,"EN DIRECT - Déconfinement: couvre-feu à 20h dès mardi, pas de dérogation le 31 décembre annonce Jean Castex",2020-12-10,238,https://www.lefigaro.fr/sciences/en-direct-covid-19-les-francais-dans-l-attente-des-annonces-de-castex-sur-le-deconfinement-20201210,2021-08-05 13:49:24,national
Havre-Saint-Pierre,"""premier ministre""",19,LaDepeche.fr,Édouard Philippe se confie : « Je ne vais pas nier que j’aime être aux manettes »,2021-04-03,124,https://www.ladepeche.fr/amp/2021/04/02/edouard-philippe-se-confie-je-ne-vais-pas-nier-que-jaime-etre-aux-manettes-9465994.php,2021-08-05 13:49:24,national
Havre-Saint-Pierre,"""premier ministre""",20,Le Devoir,"Les Innus doivent négocier, dit Québec",,,https://www.ledevoir.com/politique/quebec/445340/blocage-du-chantier-de-la-romaine-la-confrontation-est-vouee-a-l-echec-dit-couillard,2021-08-05 13:49:25,national
Havre-Saint-Pierre,"""premier ministre""",21,la Manche Libre,Manche. Le Premier ministre en déplacement à Brécey,2021-03-25,133,https://www.lamanchelibre.fr/actualite-933961-manche-le-premier-ministre-en-deplacement-a-brecey,2021-08-05 13:49:25,national
Havre-Saint-Pierre,"""premier ministre""",22,Le Télégramme,Maël de Calan et l’ex-Premier ministre Édouard Philippe au Phare du Minou,2021-07-03,33,https://www.letelegramme.fr/_amp/411/12782411.php,2021-08-05 13:49:26,national
Havre-Saint-Pierre,"""premier ministre""",23,InfoNormandie.com,Seine-Maritime : Jean Castex et trois ministres en visite au Havre vendredi 22 janvier,2021-01-21,196,https://www.infonormandie.com/Seine-Maritime-Jean-Castex-et-trois-ministres-en-visite-au-Havre-vendredi-22-janvier_a29964.html,2021-08-05 13:49:26,national
Havre-Saint-Pierre,"""premier ministre""",24,lepopulaire.fr,L'ancien Premier ministre Édouard Philippe remet la légion d'honneur au maire de Limoges,2021-05-05,92,https://www.lepopulaire.fr/limoges-87000/actualites/l-ancien-premier-ministre-edouard-philippe-remet-la-legion-d-honneur-au-maire-de-limoges_13949136/,2021-08-05 13:49:26,national
Havre-Saint-Pierre,"""premier ministre""",25,ICI.Radio-Canada.ca,Des gens d'affaires désirent une seule traverse entre Anticosti et la Côte-Nord,,,https://ici.radio-canada.ca/nouvelle/1062876/des-gens-daffaires-desirent-une-seule-traverse-entre-anticosti-et-la-cote-nord,2021-08-05 13:49:26,national
Havre-Saint-Pierre,climat,1,Les Échos,Comment le « petit Versailles de l'atome » s'est retrouvé sur le plateau de Saclay,2021-07-27,9,https://www.lesechos.fr/pme-regions/ile-de-france/comment-le-petit-versailles-de-latome-sest-retrouve-sur-le-plateau-de-saclay-1334983,2021-08-05 13:50:02,national
Havre-Saint-Pierre,climat,2,actu.fr,Il descend la Seine à la nage jusqu'au Havre. Halte à Val-de-Reuil pour Arthur Germain,2021-07-16,20,https://actu.fr/normandie/val-de-reuil_27701/il-descend-la-seine-a-la-nage-halte-a-val-de-reuil-pour-arthur-germain_43502133.html/amp,2021-08-05 13:50:03,national
Havre-Saint-Pierre,climat,3,La Presse,Des centaines de caribous abattus | La chasse traditionnelle autochtone dans le viseur de Québec,2021-05-23,74,https://www.lapresse.ca/actualites/environnement/2021-05-23/des-centaines-de-caribous-abattus/la-chasse-traditionnelle-autochtone-dans-le-viseur-de-quebec.php,2021-08-05 13:50:03,national
Havre-Saint-Pierre,climat,4,ICI.Radio-Canada.ca,Tourisme : trop tard pour prévoir une visite de Manic-2 et Manic-5,2021-06-21,45,https://ici.radio-canada.ca/nouvelle/1802588/hydro-quebec-visite-barrage-hydroelectrique-romaine-voyage-cote-nord,2021-08-05 13:50:03,national
Havre-Saint-Pierre,climat,5,Le Journal de Montréal,Un autochtone s'attire la colère sur internet,2021-03-28,130,https://www.journaldemontreal.com/2021/03/28/un-autochtone-sattire-la-colere-sur-internet,2021-08-05 13:50:03,national
Havre-Saint-Pierre,climat,6,Radio-Canada.ca,Tempête hivernale : les conditions routières s'améliorent dans l'Est-du-Québec,2021-02-03,183,http://ici.radio-canada.ca/amp/1768007/tempete-neige-hiver-panne-route-ecole-fermees-vent-pannes-3-fevrier-2021,2021-08-05 13:50:04,national
Havre-Saint-Pierre,climat,7,La Croix,Dans la tête de l'incendiaire de la cathédrale de Nantes Que s'est-il passé,2021-07-18,18,https://www.la-croix.com/France/tete-lincendiaire-cathedrale-Nantes-2021-07-15-1201166437,2021-08-05 13:50:04,national
Havre-Saint-Pierre,climat,8,ICI.Radio-Canada.ca,"Vents forts, vagues et tempête hivernale prévus dans l'Est-du-Québec",2020-11-24,254,https://ici.radio-canada.ca/nouvelle/1751928/environnement-canada-vagues-neige-deferlement-meteo,2021-08-05 13:50:04,national
Havre-Saint-Pierre,climat,9,Ouest-France,"Érosion du littoral. À Saint-Pierre-et-Miquelon, des côtes rongées à l’os",2020-11-16,262,https://amp.ouest-france.fr/saint-pierre-et-miquelon/erosion-du-littoral-a-saint-pierre-et-miquelon-des-cotes-rongees-a-l-os-7052940,2021-08-05 13:50:05,national
Havre-Saint-Pierre,climat,10,ICI.Radio-Canada.ca,Des centaines de professionnels de l'éducation en grève cet avant-midi,2021-04-29,98,https://ici.radio-canada.ca/nouvelle/1788865/greve-education-professionels-cote-nord-bas-saint-laurent-gaspesie,2021-08-05 13:50:05,national
Havre-Saint-Pierre,climat,11,Le Soleil - Groupe Capitales Médias,"Vent, pluie et neige sur plusieurs régions du Québec",2020-12-01,247,https://www.lesoleil.com/actualite/environnement/vent-pluie-et-neige-sur-plusieurs-regions-du-quebec-a513a15674b2306c85587425b7c817e1,2021-08-05 13:50:05,national
Havre-Saint-Pierre,climat,12,Le Soleil - Groupe Capitales Médias,"Depuis une tourbière québécoise, le premier bilan carbone des barrages [PHOTOS]",,,https://www.lesoleil.com/actualite/environnement/depuis-une-tourbiere-quebecoise-le-premier-bilan-carbone-des-barrages-photos-ba21625c5535e285b4394a5a41a57112,2021-08-05 13:50:05,national
Havre-Saint-Pierre,climat,13,Novethic.fr,En Live : le projet de loi Climat et résilience adopté à l'Assemblée nationale après trois semaines de débats,2021-04-19,108,https://www.novethic.fr/amp/actualite/environnement/climat/isr-rse/en-live-l-assemblee-nationale-debute-l-examen-de-la-loi-climat-et-resilience-149668.html,2021-08-05 13:50:06,national
Havre-Saint-Pierre,climat,14,MétéoMédia,Trois choses à savoir sur le premier système d’avril,2021-04-01,126,https://www.meteomedia.com/ca/nouvelles/article/trois-choses-a-savoir-sur-le-premier-systeme-davril,2021-08-05 13:50:06,national
Havre-Saint-Pierre,climat,15,Ouest-France,TEMOIGNAGES. Les lycéens saint-lois toujours motivés pour défendre le climat,2021-03-24,134,https://www.ouest-france.fr/normandie/saint-lo-50000/temoignages-les-lyceens-saint-lois-toujours-motives-pour-defendre-le-climat-f14f3576-8ca8-11eb-89fb-a21dad2358c6,2021-08-05 13:50:07,national
Havre-Saint-Pierre,climat,16,L’actualité,Vive le Québec sauvage : 65 sites où découvrir la biodiversité,2021-05-05,92,https://lactualite.com/environnement/vive-le-quebec-sauvage-65-sites-ou-decouvrir-la-biodiversite/,2021-08-05 13:50:07,national
Havre-Saint-Pierre,climat,17,Ouest-France,"Cholet. Au nom du climat, des Choletais en lutte sur la butte bloqué",2021-05-09,88,https://www.ouest-france.fr/pays-de-la-loire/cholet-49300/cholet-au-nom-du-climat-des-choletais-en-lutte-sur-la-butte-ac4d3e9a-b0b2-11eb-be69-b9212f8a3350,2021-08-05 13:50:07,national
Havre-Saint-Pierre,climat,18,ICI.Radio-Canada.ca,De nombreuses observations de méduses dans le Golfe du Saint-Laurent,,,https://ici.radio-canada.ca/ohdio/premiere/emissions/d-est-en-est/segments/entrevue/189775/observations-nombreuses-meduse-golfe-cote-nord-gaspesie-rechauffement-climatique-eaux-chaudes-vents-hypotheses,2021-08-05 13:50:07,national
Havre-Saint-Pierre,climat,19,ICI.Radio-Canada.ca,Nouvelle caserne de pompiers à Havre-Saint-Pierre,,,https://ici.radio-canada.ca/nouvelle/1019709/nouvelle-caserne-pompiers-havre-saint-pierre,2021-08-05 13:50:07,national
Havre-Saint-Pierre,climat,20,ICI.Radio-Canada.ca,"La mine Tio de Havre-Saint-Pierre pourrait fermer en 2019, selon le Syndicat des métallos",,,https://ici.radio-canada.ca/nouvelle/1041423/metallos-denonce-attitude-rio-tinto-fer-et-titane-mine-tio-havre-saint-pierre,2021-08-05 13:50:08,national
Havre-Saint-Pierre,climat,21,La République du Centre,"Marche pour le climat à Orléans et Montargis : ""Oui, il y a urgence à agir !"" - Orléans (45000)",2021-05-09,88,https://www.larep.fr/orleans-45000/actualites/marche-pour-le-climat-a-orleans-et-montargis-oui-il-y-a-urgence-a-agir_13950944/,2021-08-05 13:50:08,national
Havre-Saint-Pierre,climat,22,Ouest-France,Vague de chaleur de l'Ouest américain et canadien : le changement climatique a dopé le phénomène,2021-07-01,35,https://amp.ouest-france.fr/monde/canada/vague-de-chaleur-de-l-ouest-americain-et-canadien-le-changement-climatique-a-dope-le-phenomene-7328000,2021-08-05 13:50:09,national
Havre-Saint-Pierre,climat,23,MétéoMédia,Week-end : quelques flocons et températures clémentes avant le grand froid,2021-02-06,180,https://www.meteomedia.com/ca/nouvelles/article/un-repit-avant-la-chute-cest-le-temps-de-jouer-dehors,2021-08-05 13:50:09,national
Havre-Saint-Pierre,climat,24,Le Journal de Québec,Les touristes sont nombreux à visiter l'Archipel-de-Mingan,,,https://www.journaldequebec.com/2020/07/20/les-touristes-nombreux-a-visiter-larchipel-de-mingan-1,2021-08-05 13:50:09,national
Havre-Saint-Pierre,climat,25,Ouest-France,Environnement. Le pape appuie les militants du climat,2021-03-15,143,https://amp.ouest-france.fr/societe/religions/pape-francois/environnement-le-pape-appuie-les-militants-du-climat-7187895,2021-08-05 13:50:09,national
Havre-Saint-Pierre,immigration,1,Ma Côte-Nord,Le chef du Bloc Yves-François Blanchet marque l'histoire en Basse-Côte-Nord,2021-07-12,24,https://macotenord.com/le-chef-du-bloc-yves-francois-blanchet-marque-lhistoire-en-basse-cote-nord/,2021-08-05 13:50:17,national
Havre-Saint-Pierre,immigration,2,journal le soir,Cinq lieux à visiter pour favoriser l'intégration,2021-07-21,15,https://journallesoir.ca/2021/07/21/cinq-lieux-a-visiter-pour-favoriser-lintegration/,2021-08-05 13:50:18,national
Havre-Saint-Pierre,immigration,3,Le Journal de Québec,"«Mon vrai métier, c'est humoriste» - Guy Nantel",2021-03-28,130,https://www.journaldequebec.com/2021/03/28/mon-vrai-metier-cest-humoriste---guy-nantel,2021-08-05 13:50:18,national
Havre-Saint-Pierre,immigration,4,Le Quotidien - Groupe Capitales Médias,François Legault rencontre la direction de Rio Tinto,2021-03-22,136,https://www.lequotidien.com/affaires/francois-legault-rencontre-la-direction-de-rio-tinto-941ed01c8ef52a2388dc964849a1b7e6,2021-08-05 13:50:18,national
Havre-Saint-Pierre,immigration,5,Le Soleil - Groupe Capitales Médias,Lorraine Richard en réflexion pour une candidature en 2022 | Politique | Actualités,2021-06-14,52,https://www.lesoleil.com/actualite/politique/lorraine-richard-en-reflexion-pour-une-candidature-en-2022-b49b2034feef47426dcfc180b1d1c37a,2021-08-05 13:50:18,national
Havre-Saint-Pierre,immigration,6,ICI.Radio-Canada.ca,"Les restaurants ouverts en Minganie cet été, mais « de peine et de misère »",,,https://ici.radio-canada.ca/nouvelle/1173355/tourisme-minganie-penurie-travailleur-emploi-cuisine,2021-08-05 13:50:18,national
Havre-Saint-Pierre,immigration,7,La Tribune - Groupe Capitales Médias,Des grands espaces de Tadoussac à Mingan | Le Mag,,,https://www.latribune.ca/le-mag/des-grands-espaces-de-tadoussac-a-mingan-afe97f48e8c23c8b8739a0d4142edd1d,2021-08-05 13:50:19,national
Havre-Saint-Pierre,immigration,8,ICI.Radio-Canada.ca,Faire du pouce entre Godbout et Baie-Comeau à 89 ans... et aveugle,2020-08-14,356,https://ici.radio-canada.ca/nouvelle/1726482/jean-louis-parisot-non-voyant-godbout-baie-comeau-aveugle-pouce-autobus,2021-08-05 13:50:19,national
Havre-Saint-Pierre,immigration,9,LaPresse.ca,Havre-Saint-Pierre: la face cachée du «Klondike»,,,https://www.lapresse.ca/actualites/national/201311/11/01-4709384-havre-saint-pierre-la-face-cachee-du-klondike.php,2021-08-05 13:50:19,national
Havre-Saint-Pierre,immigration,10,Paris-Normandie,Une exposition à ciel ouvert dans les jardins à Saint-Pierre-de-Manneville samedi 26 et dimanche 27 juin,2021-06-26,40,https://www.paris-normandie.fr/id206812/article/2021-06-26/une-exposition-ciel-ouvert-dans-les-jardins-saint-pierre-de-manneville-samedi-26,2021-08-05 13:50:19,national
Havre-Saint-Pierre,immigration,11,Paris-Normandie,"L’ancien patron du Club-Saint-Pierre, près de Rouen, livre ses souvenirs",2020-12-15,233,https://www.paris-normandie.fr/id148707/article/2020-12-15/lancien-patron-du-club-saint-pierre-pres-de-rouen-livre-ses-souvenirs,2021-08-05 13:50:20,national
Havre-Saint-Pierre,immigration,12,Radio Canada International,Montréal à Havre St-Pierre : plus de 1000 km en voiture électrique,,,https://www.rcinet.ca/fr/2016/10/22/montreal-a-havre-st-pierre-plus-de-1000km-en-voiture-electrique/,2021-08-05 13:50:20,national
Havre-Saint-Pierre,immigration,13,La Voix de l'est - Groupe Capitales Médias,Rio Tinto enclenchera la production d'un minéral critique à Sorel-Tracy,2021-01-14,203,https://www.lavoixdelest.ca/affaires/rio-tinto-enclenchera-la-production-dun-mineral-critique-a-sorel-tracy-5fa8d9f7821dcaae1db17d85a70b6efc,2021-08-05 13:50:20,national
Havre-Saint-Pierre,immigration,14,Paris-Normandie,"D'où vient la polémique sur l'église de Buglise, à Cauville-sur-Mer, près du Havre ?",2021-06-04,62,https://www.paris-normandie.fr/id199392/article/2021-06-04/dou-vient-la-polemique-sur-leglise-de-buglise-cauville-sur-mer-pres-du-havre,2021-08-05 13:50:20,national
Havre-Saint-Pierre,immigration,15,Paris-Normandie,Une maison ravagée par un incendie à Saint-Pierre-de-Manneville,2021-06-16,50,https://www.paris-normandie.fr/id203303/article/2021-06-16/une-maison-ravagee-par-un-incendie-saint-pierre-de-manneville?amp,2021-08-05 13:50:21,national
Havre-Saint-Pierre,immigration,16,Paris-Normandie,Le meilleur boulanger de France est normand : le candidat de Franqueville-Saint-Pierre remporte l’émission,2021-04-23,104,https://www.paris-normandie.fr/id186076/article/2021-04-23/le-meilleur-boulanger-de-france-est-de-franqueville-saint-pierre,2021-08-05 13:50:21,national
Havre-Saint-Pierre,immigration,17,Paris-Normandie,"Près du Havre, un incendie ravage un entrepôt de 4000 m² : quatre entreprises détruites",2021-05-15,82,https://www.paris-normandie.fr/id192756/article/2021-05-15/pres-du-havre-un-incendie-ravage-un-entrepot-de-4000-m2-abritant-quatre,2021-08-05 13:50:21,national
Havre-Saint-Pierre,immigration,18,Le Journal de Montréal,Appelez-le maintenant Bernard «Trump» Gauthier | JDM,,,https://www.journaldemontreal.com/2016/12/10/appelez-le-maintenant-bernard-trump-gauthier,2021-08-05 13:50:21,national
Havre-Saint-Pierre,immigration,19,Paris-Normandie,"Le village de Saint-Jouin-Bruneval, près du Havre, retrouve un café-restaurant en centre bourg",2021-05-30,67,https://www.paris-normandie.fr/id197777/article/2021-05-30/le-village-de-saint-jouin-bruneval-pres-du-havre-retrouve-un-cafe-restaurant-en,2021-08-05 13:50:21,national
Havre-Saint-Pierre,immigration,20,Paris-Normandie,précédent Transports dangereux : pourquoi un industriel de Saint-Pierre-lès-Elbeuf préfère la route au rail,2021-02-03,183,https://www.paris-normandie.fr/id161860/article/2021-02-03/transports-dangereux-pourquoi-un-industriel-de-saint-pierre-les-elbeuf-prefere,2021-08-05 13:50:22,national
Havre-Saint-Pierre,immigration,21,Paris-Normandie,"Près de Fécamp, des habitants unis pour faire reculer le projet de pylône de téléphonie mobile",2021-04-07,120,https://www.paris-normandie.fr/id180923/article/2021-04-07/pres-de-fecamp-des-habitants-unis-pour-faire-reculer-le-projet-de-pylone-de,2021-08-05 13:50:22,national
Havre-Saint-Pierre,immigration,22,Paris-Normandie,La municipalité de Saint-Pierre-lès-Elbeuf dit non au rallye des Cent Margelles,2021-02-28,158,https://www.paris-normandie.fr/id169693/article/2021-02-28/la-municipalite-de-saint-pierre-les-elbeuf-dit-non-au-rallye-des-cent-margelles,2021-08-05 13:50:22,national
Havre-Saint-Pierre,immigration,23,ICI.Radio-Canada.ca,Traversier vers Anticosti : deux municipalités dévitalisées veulent être les ports d'attache,,,https://ici.radio-canada.ca/nouvelle/1080188/traversier-vers-anticosti-deux-municipalites-devitalisees-veulent-etre-les-ports-dattache,2021-08-05 13:50:22,national
Havre-Saint-Pierre,immigration,24,Paris-Normandie,"À Saint-Romain-de-Colbosc, près du Havre, bientôt une boutique de seconde main",2021-03-29,129,https://www.paris-normandie.fr/id178032/article/2021-03-29/saint-romain-de-colbosc-pres-du-havre-bientot-une-boutique-de-seconde-main,2021-08-05 13:50:22,national
Havre-Saint-Pierre,immigration,25,Paris-Normandie,Stéphanie Kerbarh réagit à l’intervention de son collègue député à Saint-Pierre-en-Port,2021-04-08,119,https://www.paris-normandie.fr/id181189/article/2021-04-08/telephonie-saint-pierre-en-port-stephanie-kerbarh-reagit-lintervention-de-son,2021-08-05 13:50:23,national
Havre-Saint-Pierre,racisme,1,Ma Côte-Nord,Des Innus de la région victimes de racisme,2020-10-01,308,https://macotenord.com/des-innus-de-la-region-victimes-de-racisme/,2021-08-05 13:50:30,national
Havre-Saint-Pierre,racisme,2,Ma Côte-Nord,Maya Cousineau Mollen - un modèle pour les jeunes Innus,2020-11-03,275,https://macotenord.com/maya-cousineau-mollen-un-modele-pour-les-jeunes-innus/,2021-08-05 13:50:31,national
Havre-Saint-Pierre,racisme,3,Le Journal de Québec,"«Mon vrai métier, c'est humoriste» - Guy Nantel",2021-03-28,130,https://www.journaldequebec.com/2021/03/28/mon-vrai-metier-cest-humoriste---guy-nantel,2021-08-05 13:50:31,national
Havre-Saint-Pierre,racisme,4,Le Devoir,La discrimination contres les Autochtones dans les soins de santé n'est toujours pas documentée,2021-05-12,85,https://www.ledevoir.com/societe/sante/600557/un-phenomene-que-quebec-ne-documente-toujours-pas,2021-08-05 13:50:31,national
Havre-Saint-Pierre,racisme,5,Le Journal de Québec,Il n'y a plus que 600 caribous forestiers sur la Côte-Nord,2021-03-29,129,https://www.journaldequebec.com/2021/03/29/il-ny-a-plus-que-600caribous-forestiers-sur-la-cote-nord,2021-08-05 13:50:31,national
Havre-Saint-Pierre,racisme,6,Paris-Normandie,Propos racistes sur WhatsApp. Le policier de Rouen qui avait dénoncé ses collègues témoigne sur France 2,2021-04-08,119,https://www.paris-normandie.fr/id181083/article/2021-04-08/propos-racistes-sur-whatsapp-le-policier-de-rouen-qui-avait-denonce-ses,2021-08-05 13:50:31,national
Havre-Saint-Pierre,racisme,7,Le Devoir,Un meilleur accompagnement réclamé pour les Autochtones dans les hôpitaux,2021-02-17,169,https://www.ledevoir.com/societe/sante/595376/un-meilleur-accompagnement-reclame-pour-les-autochtones,2021-08-05 13:50:32,national
Havre-Saint-Pierre,racisme,8,Ouest-France,"PSG - Basaksehir. Un arbitre accusé de racisme, le match arrêté et reporté",2020-12-09,239,https://amp.ouest-france.fr/sport/football/ligue-des-champions/direct-ligue-des-champions-le-psg-doit-finir-le-travail-face-au-basaksehir-istanbul-7078260,2021-08-05 13:50:32,national
Havre-Saint-Pierre,racisme,9,Ouest-France,Saint-Lô. Une trentaine de personnes mobilisées contre le racisme,2021-06-12,54,https://amp.ouest-france.fr/normandie/saint-lo-50000/saint-lo-une-trentaine-de-personnes-mobilisees-contre-le-racisme-54a34f22-cb74-11eb-999d-2d92d8ad77b3,2021-08-05 13:50:32,national
Havre-Saint-Pierre,racisme,10,Ouest-France,PSG – Basaksehir. Scandale historique à Paris : un arbitre accusé de propos racistes,2020-12-08,240,https://amp.ouest-france.fr/sport/football/ligue-des-champions/psg-basaksehir-un-arbitre-accuse-de-propos-racistes-le-match-arrete-7078328,2021-08-05 13:50:32,national
Havre-Saint-Pierre,racisme,11,ICI.Radio-Canada.ca,Étudier tout en travaillant comme enseignant à Fermont et à Havre-Saint-Pierre,,,https://ici.radio-canada.ca/nouvelle/1154112/conciliation-travail-etude-enseignants-nord-cotiers-scolaire,2021-08-05 13:50:33,national
Havre-Saint-Pierre,racisme,12,Sudinfo.be,Antoine Griezmann et Ousmane Dembélé se défendent des accusations de racisme anti-asiatique: «Je suis désolé si j'ai pu offenser mes amis japonais»,2021-07-05,31,https://www.sudinfo.be/id403832/article/2021-07-05/antoine-griezmann-et-ousmane-dembele-se-defendent-des-accusations-de-racisme,2021-08-05 13:50:33,national
