Havre-Saint-Pierre,racisme,13,Ouest-France éditions locales,Caen. SOS Racisme organise un concours photo sur le thème de la diversité,2020-09-01,338,https://amp.ouest-france.fr/normandie/caen-14000/caen-sos-racisme-organise-un-concours-photo-sur-le-theme-de-la-diversite-6955553,2021-08-05 13:50:33,national
Havre-Saint-Pierre,racisme,14,ICI.Radio-Canada.ca,Faire que les Innus se sentent à l'aise dans les établissements de santé de la Côte-Nord,2021-01-21,196,https://ici.radio-canada.ca/espaces-autochtones/1714465/cisss-cote-nord-hopitaux-medecine-autochtone-premieres-nations-innu-dale-walker-soins-sante,2021-08-05 13:50:33,national
Havre-Saint-Pierre,racisme,15,Paris-Normandie,Une exposition à ciel ouvert dans les jardins à Saint-Pierre-de-Manneville samedi 26 et dimanche 27 juin,2021-06-26,40,https://www.paris-normandie.fr/id206812/article/2021-06-26/une-exposition-ciel-ouvert-dans-les-jardins-saint-pierre-de-manneville-samedi-26,2021-08-05 13:50:34,national
Havre-Saint-Pierre,racisme,16,ICI.Radio-Canada.ca,Entente conclue entre Ekuanitshit et Rio Tinto,,,https://ici.radio-canada.ca/nouvelle/1392701/ekuanitshit-rio-tinto-fer-titane-autochtone-entente-havre-saint-pierre,2021-08-05 13:50:34,national
Havre-Saint-Pierre,racisme,17,Paris-Normandie,Marche des Libertés contre l’extrême droite au Havre: «Redonner un nouveau signal d’alerte»,2021-06-12,54,https://www.paris-normandie.fr/id202191/article/2021-06-12/marche-des-libertes-contre-lextreme-droite-au-havre-redonner-un-nouveau-signal,2021-08-05 13:50:34,national
Havre-Saint-Pierre,racisme,18,Sudinfo.be,Belgique – Russie: l'UEFA soutient les protestations contre le racisme et condamne les huées des fans russes,2021-06-13,53,https://www.sudinfo.be/id399515/article/2021-06-13/belgique-russie-luefa-soutient-les-protestations-contre-le-racisme-et-condamne,2021-08-05 13:50:34,national
Havre-Saint-Pierre,racisme,19,Paris-Normandie,Une maison ravagée par un incendie à Saint-Pierre-de-Manneville,2021-06-16,50,https://www.paris-normandie.fr/id203303/article/2021-06-16/une-maison-ravagee-par-un-incendie-saint-pierre-de-manneville?amp,2021-08-05 13:50:35,national
Havre-Saint-Pierre,racisme,20,ICI.Radio-Canada.ca,Première fin de semaine satisfaisante pour le Festivoix,2021-06-28,38,https://ici.radio-canada.ca/nouvelle/1804889/festivoix-festival-trois-rivieres-bilan-positif,2021-08-05 13:50:35,national
Havre-Saint-Pierre,racisme,21,Le Penthièvre,"Saint-Brieuc : à 38 ans, Véronique Martin est commissaire de police",2021-04-29,98,https://actu.fr/bretagne/saint-brieuc_22278/saint-brieuc-a-38-ans-veronique-martinest-commissaire-de-police_41120480.html/amp,2021-08-05 13:50:36,national
Havre-Saint-Pierre,racisme,22,Paris-Normandie,"Football. Qui est Demba Ba, l'homme qui a fait arrêter le match PSG - Basaksehir Istanbul ?",2020-12-09,239,https://www.paris-normandie.fr/id148779/article/2020-12-09/football-qui-est-demba-ba-lhomme-qui-fait-arreter-le-match-psg-basaksehir,2021-08-05 13:50:36,national
Havre-Saint-Pierre,racisme,23,Ligue de Football Professionnel,"Homos ou hétéros, on porte tous le même maillot lfp.fr",2021-05-12,85,https://www.lfp.fr/Articles/JOUONS-LA-COLLECTIF/2021/05/11/homos-ou-heteros-on-porte-tous-le-meme-maillot,2021-08-05 13:50:36,national
Havre-Saint-Pierre,racisme,24,Sudinfo.be,Mouctar Diakhaby victime de racisme: les joueurs de Valence mis sous pression pour remonter sur le terrain,2021-04-05,122,https://www.sudinfo.be/id385476/article/2021-04-05/mouctar-diakhaby-victime-de-racisme-les-joueurs-de-valence-mis-sous-pression,2021-08-05 13:50:36,national
Havre-Saint-Pierre,racisme,25,Journal Métro,«Le Phoenix»: une série road-trip en Winnebago,2020-08-21,349,https://journalmetro.com/culture/2503404/phoenix-serie-road-trip-winnebago/amp/,2021-08-05 13:50:37,national
Havre-Saint-Pierre,Chine,1,LesAffaires.com,Scandium: le Québec conteste l'oligopole de la Chine et de la Russie,2021-06-25,41,https://www.lesaffaires.com/blogues/francois-normand/scandium-le-quebec-conteste-loligopole-de-la-chine-et-de-la-russie/625817,2021-08-05 13:50:46,national
Havre-Saint-Pierre,Chine,2,La Presse,Grande entrevue Stéphane Leblanc | Au cœur de la révolution du scandium,2021-03-16,142,https://www.lapresse.ca/affaires/entreprises/2021-03-16/grande-entrevue-stephane-leblanc/au-coeur-de-la-revolution-du-scandium.php,2021-08-05 13:50:47,national
Havre-Saint-Pierre,Chine,3,Ouest-France,JO 2021. Qui sont les 63 athlètes de l’Ouest à participer aux Jeux olympiques de Tokyo ?,2021-07-22,14,https://amp.ouest-france.fr/jeux-olympiques/jo-2021-qui-sont-les-63-athletes-de-l-ouest-a-participer-aux-jeux-olympiques-de-tokyo-f6c6cfe8-eaf7-11eb-8b38-277ec158c67f,2021-08-05 13:50:47,national
Havre-Saint-Pierre,Chine,4,La Presse,Des centaines de caribous abattus | La chasse traditionnelle autochtone dans le viseur de Québec,2021-05-23,74,https://www.lapresse.ca/actualites/environnement/2021-05-23/des-centaines-de-caribous-abattus/la-chasse-traditionnelle-autochtone-dans-le-viseur-de-quebec.php,2021-08-05 13:50:47,national
Havre-Saint-Pierre,Chine,5,ELLE France,Lanzarote : une maison hommage à César Manrique,2021-08-01,4,https://www.elle.fr/Deco/Reportages/Visites-maisons/Lanzarote-une-maison-hommage-a-Cesar-Manrique,2021-08-05 13:50:48,national
Havre-Saint-Pierre,Chine,6,Numéro Magazine,"A Montpellier, des œuvres d'art exceptionnelles s'invitent dans un hôtel de luxe",2021-07-29,7,https://www.numero.com/fr/art/hotel-richer-belleval-montpellier-jim-dine-jan-fabre-marlene-mocquet-fondation-helenis,2021-08-05 13:50:48,national
Havre-Saint-Pierre,Chine,7,Le Journal de Montréal,Rio Tinto se lance dans la production d'oxyde de scandium à Sorel-Tracy,2021-01-14,203,https://www.journaldemontreal.com/2021/01/14/rio-tinto-se-lance-dans-la-production-doxyde-de-scandium-a-sorel-tracy,2021-08-05 13:50:48,national
Havre-Saint-Pierre,Chine,8,Le Journal Toulousain,Découvrez notre top 10 des visites à faire à Toulouse,2021-07-31,5,https://www.lejournaltoulousain.fr/societe/top-10-visites-toulouse-121996/amp/,2021-08-05 13:50:49,national
Havre-Saint-Pierre,Chine,9,Ma Côte-Nord,Des bénéfices en baisse de 20% pour Rio Tinto pendant la pandémie,,,https://macotenord.com/des-benefices-en-baisse-de-20-pour-rio-tinto-pendant-la-pandemie/,2021-08-05 13:50:49,national
Havre-Saint-Pierre,Chine,10,ICI.Radio-Canada.ca,"Malgré la tempête COVID, les mines de fer voguent à vive allure sur la Côte-Nord",,,https://ici.radio-canada.ca/nouvelle/1720275/fer-mine-industrie-economie-cote-nord-minerai,2021-08-05 13:50:49,national
Havre-Saint-Pierre,Chine,11,Ouest-France,CARTE. L’été en Sarthe : où boire un verre entre guinguettes et endroits atypiques,2021-07-22,14,https://www.ouest-france.fr/economie/tourisme/guide-ete/carte-l-ete-en-sarthe-ou-boire-un-verre-entre-guinguettes-et-endroits-atypiques-78be6086-bd6e-11eb-b95a-34f62fcd19a0,2021-08-05 13:50:50,national
Havre-Saint-Pierre,Chine,12,Radio-Canada.ca,Autochtones Josée Rock : être Innue au 21e siècle,2021-04-23,104,http://ici.radio-canada.ca/amp/1786368/josee-rock-etre-innue-au-21e-siecle,2021-08-05 13:50:50,national
Havre-Saint-Pierre,Chine,13,Le Parisien,"Au Havre, avec le Saint-Exupéry, c’est le retour des géants des mers",2020-12-15,233,https://www.leparisien.fr/economie/au-havre-avec-le-saint-exupery-c-est-le-retour-des-geants-des-mers-15-12-2020-8414339.php,2021-08-05 13:50:50,national
Havre-Saint-Pierre,Chine,14,Ricochet,Il est temps de parler de la transmission de la COVID-19 par aérosols | Ricochet,2021-01-04,213,https://ricochet.media/fr/3422/Temps,2021-08-05 13:50:50,national
Havre-Saint-Pierre,Chine,15,La Presse,Redonner au peuple l'accès à ses plans d'eau,2021-06-24,42,https://www.lapresse.ca/debats/opinions/2021-06-24/redonner-au-peuple-l-acces-a-ses-plans-d-eau.php,2021-08-05 13:50:51,national
Havre-Saint-Pierre,Chine,16,La Presse,La Côte-Nord en véhicule électrique: défi relevé,2020-09-09,330,https://www.lapresse.ca/debats/opinions/2020-09-09/la-cote-nord-en-vehicule-electrique-defi-releve.php,2021-08-05 13:50:51,national
Havre-Saint-Pierre,Chine,17,Paris-Normandie,"Covid-19. Près du Havre, l'usine Renault Sandouville arrêtée par une pénurie",2021-02-06,180,https://www.paris-normandie.fr/id163014/article/2021-02-06/covid-19-pres-du-havre-lusine-renault-sandouville-arretee-par-une-penurie,2021-08-05 13:50:51,national
Havre-Saint-Pierre,Chine,18,Paris-Normandie,Une nouvelle adresse de street-food chinoise dans le centre-ville de Rouen,2021-03-30,128,https://www.paris-normandie.fr/id178529/article/2021-03-30/une-nouvelle-adresse-de-street-food-chinoise-dans-le-centre-ville-de-rouen,2021-08-05 13:50:51,national
Havre-Saint-Pierre,Chine,19,Ouest-France,Pourquoi un morceau de fusée chinoise va percuter la Terre d’ici à dimanche,2021-05-08,89,https://amp.ouest-france.fr/monde/la-conquete-spatiale-de-la-chine-ne-se-fait-pas-sans-retombees-de-debris-sur-terre-318115de-adaa-11eb-ae73-cbd3b5cdc4b3,2021-08-05 13:50:51,national
Havre-Saint-Pierre,Chine,20,Le Droit - Groupe Capitales Médias,La santé publique publie des consignes de santé sur l'accès à la Côte-Nord,2020-12-08,240,https://www.ledroit.com/actualites/covid-19/la-sante-publique-publie-des-consignes-de-sante-sur-lacces-a-la-cote-nord-0ef3c43a4f7e3f3a2c79cf5951e0c8bf,2021-08-05 13:50:52,national
Havre-Saint-Pierre,Chine,21,Paris-Normandie,"Pierre Lenoir Vaquero sort un livre artistique sur la crise sanitaire, « Un monde en confinement »",2021-03-28,130,https://www.paris-normandie.fr/id177715/article/2021-03-28/pierre-lenoir-sort-un-livre-artistique-sur-la-crise-sanitaire-un-monde-en,2021-08-05 13:50:52,national
Havre-Saint-Pierre,Chine,22,Droit-Inc.com,Demandes de type « Wellington » en droit québécois : le début d'un retour du balancier?,2021-06-11,55,https://www.droit-inc.com/article28860-Demandes-de-type-Wellington-en-droit-quebecois-le-debut-d-un-retour-du-balancier,2021-08-05 13:50:52,national
Havre-Saint-Pierre,Chine,23,Le Courrier Cauchois,"Coopérative linière Terre de lin. ""Nos exports ont repris y compris en Chine""",2021-02-17,169,https://www.lecourriercauchois.fr/actualite-274967-cooperative-liniere-terre-de-lin-nos-exports-ont-repris-y-compris-en-chine,2021-08-05 13:50:52,national
Havre-Saint-Pierre,Chine,24,Fabula,"Perspectives dix-neuviémistes : Chine-France et retour 从十九世纪的视野出发：中法之间 Perspectives on and from the 19th Century: from China to France and back (Univ. Fudan, Shangai)",2021-06-03,63,https://www.fabula.org/actualites/colloque-internationalperspectives-dix-neuviemistes-chine-france-et-retourcong-shi-jiu-shi-ji-de_102372.php,2021-08-05 13:50:53,national
Havre-Saint-Pierre,Chine,25,Le Journal de Montréal,Ces restos qui nous manquent,2021-04-02,125,https://www.journaldemontreal.com/2021/04/02/ces-restos-qui-nous-manquent,2021-08-05 13:50:53,national
Havre-Saint-Pierre,Biden OR Trump,1,Radio-Canada.ca,Lorraine Richard veut une Maison des aînés sans personnes ayant une déficience intellectuelle,2021-06-02,64,http://ici.radio-canada.ca/amp/1797906/lorraine-richard-havre-saint-pierre-maison-aines-deficients-handicapes,2021-08-05 13:51:01,national
Havre-Saint-Pierre,Biden OR Trump,2,ICI.Radio-Canada.ca,Maison des aînés sans résidents avec déficiences : Lorraine Richard fait réagir,2021-06-04,62,https://ici.radio-canada.ca/nouvelle/1798593/havre-saint-pierre-maison-aines-handicap,2021-08-05 13:51:01,national
Havre-Saint-Pierre,Biden OR Trump,3,ICI.Radio-Canada.ca,Romaine-4 : Hydro-Québec suspend ses travaux non prioritaires,2021-05-03,94,https://ici.radio-canada.ca/nouvelle/1789883/coronavirus-bilan-19-cas-3-mai-2021-hydro-quebec,2021-08-05 13:51:02,national
Havre-Saint-Pierre,Biden OR Trump,4,Le Journal de Montréal,Appelez-le maintenant Bernard «Trump» Gauthier | JDM,,,https://www.journaldemontreal.com/2016/12/10/appelez-le-maintenant-bernard-trump-gauthier,2021-08-05 13:51:02,national
Havre-Saint-Pierre,Biden OR Trump,5,ICI.Radio-Canada.ca,Un hydravion d'une centaine d'années retrouvé au fond d'un lac près de Sept-Îles,2020-10-27,282,https://ici.radio-canada.ca/nouvelle/1744582/mario-cyr-mysteres-avion-plongee-epave,2021-08-05 13:51:02,national
Havre-Saint-Pierre,Biden OR Trump,6,ICI.Radio-Canada.ca,Une cinquième journée sans eau courante à Ekuanitshit,2020-12-28,220,https://ici.radio-canada.ca/nouvelle/1759780/ekuanitshit-eau-potable-bris-aqueduc,2021-08-05 13:51:02,national
Havre-Saint-Pierre,Biden OR Trump,7,Le Quotidien - Groupe Capitales Médias,François Legault rencontre la direction de Rio Tinto,2021-03-22,136,https://www.lequotidien.com/affaires/francois-legault-rencontre-la-direction-de-rio-tinto-941ed01c8ef52a2388dc964849a1b7e6,2021-08-05 13:51:02,national
Havre-Saint-Pierre,Biden OR Trump,8,ICI.Radio-Canada.ca,La Côte-Nord doit bonifier ses infrastructures touristiques,2020-09-03,336,https://ici.radio-canada.ca/nouvelle/1731107/tourisme-annee-record-infrastructure-camping-vr-vacances,2021-08-05 13:51:02,national
Havre-Saint-Pierre,Biden OR Trump,9,Le Club de Mediapart,Haïti: des siècles de colonisation et de domination,2021-07-07,29,https://blogs.mediapart.fr/jean-marc-b/blog/070721/haiti-des-siecles-de-colonisation-et-de-domination,2021-08-05 13:51:03,national
Havre-Saint-Pierre,Biden OR Trump,10,ICI.Radio-Canada.ca,Des citoyens interrompent la séance du conseil municipal de Havre-Saint-Pierre,,,https://ici.radio-canada.ca/nouvelle/1085412/havre-saint-pierre-impot-foncier-hausse-conseil-municipal,2021-08-05 13:51:03,national
Havre-Saint-Pierre,Biden OR Trump,11,ICI.Radio-Canada.ca,Un projet de loi déposé pour réduire la charge fiscale du Port de Havre-Saint-Pierre,,,https://ici.radio-canada.ca/nouvelle/1391109/projet-loi-204-fiscale-port-havre-saint-pierre-duplessis-taxe,2021-08-05 13:51:03,national
Havre-Saint-Pierre,Biden OR Trump,12,ICI.Radio-Canada.ca,Des maisons vendues avant même d'être visitées en Minganie,2020-11-02,276,https://ici.radio-canada.ca/nouvelle/1746278/maison-vendre-minganie-immobilier-sept-iles-baie-comeau-pandemie-covid,2021-08-05 13:51:03,national
Havre-Saint-Pierre,Biden OR Trump,13,ICI.Radio-Canada.ca,Les mises à pied se multiplient dans les grandes industries de la Côte-Nord,,,https://ici.radio-canada.ca/nouvelle/1688586/covid-19-mises-a-pied-mine-fer-cote-nord,2021-08-05 13:51:03,national
Havre-Saint-Pierre,Biden OR Trump,14,ICI.Radio-Canada.ca,Atterrissage difficile pour un avion à Havre-Saint-Pierre,,,https://ici.radio-canada.ca/nouvelle/1086045/atterrissage-difficile-avion-havre-saint-pierre,2021-08-05 13:51:04,national
Havre-Saint-Pierre,Biden OR Trump,15,ICI.Radio-Canada.ca,"La mine Tio de Havre-Saint-Pierre pourrait fermer en 2019, selon le Syndicat des métallos",,,https://ici.radio-canada.ca/nouvelle/1041423/metallos-denonce-attitude-rio-tinto-fer-et-titane-mine-tio-havre-saint-pierre,2021-08-05 13:51:04,national
Havre-Saint-Pierre,Biden OR Trump,16,La Voix de l'est - Groupe Capitales Médias,Rio Tinto enclenchera la production d'un minéral critique à Sorel-Tracy,2021-01-14,203,https://www.lavoixdelest.ca/affaires/rio-tinto-enclenchera-la-production-dun-mineral-critique-a-sorel-tracy-5fa8d9f7821dcaae1db17d85a70b6efc,2021-08-05 13:51:04,national
Havre-Saint-Pierre,Biden OR Trump,17,Le Journal de Montréal,Natashquan: un road trip pas comme les autres,,,https://www.journaldemontreal.com/2018/07/14/un-road-trip-pas-comme-les-autres,2021-08-05 13:51:04,national
Havre-Saint-Pierre,Biden OR Trump,18,ICI.Radio-Canada.ca,La réflexion sur le transport entre Sept-Îles et Havre-Saint-Pierre reprend,,,https://ici.radio-canada.ca/nouvelle/1052094/transport-regional-intercar-sept-iles-havre-saint-pierre,2021-08-05 13:51:05,national
Havre-Saint-Pierre,Biden OR Trump,19,Ouest-France,"États-Unis. Qui est Karine Jean-Pierre, la nouvelle porte-parole de Joe Biden née en Martinique ?",2021-05-28,69,https://amp.ouest-france.fr/monde/etats-unis/joe-biden/etats-unis-qui-est-karine-jean-pierre-la-nouvelle-porte-parole-de-joe-biden-nee-en-martinique-94c8cc0c-bef0-11eb-a219-8f747c6d3d1b,2021-08-05 13:51:05,national
Havre-Saint-Pierre,Biden OR Trump,20,ICI.Radio-Canada.ca,"Contre vents et marées, le complexe aquatique de la Minganie ouvre ses portes",,,https://ici.radio-canada.ca/nouvelle/1098161/ouverture-complexe-aquatique-minganie-havre-saint-pierre,2021-08-05 13:51:05,national
Havre-Saint-Pierre,Biden OR Trump,21,Radio-Canada,Pierre Arcand est à Havre-Saint-Pierre à quelques jours de la fermeture de la mine de Rio Tinto Fer et Titane,,,https://ici.radio-canada.ca/nouvelle/744123/pierre-arcand-havre-saint-pierre-fermeture-mine-havre-saint-pierre-rio-tinto-fer-et-titane,2021-08-05 13:51:05,national
Havre-Saint-Pierre,Biden OR Trump,22,ICI.Radio-Canada.ca,"Le phœnix , un road movie télé qui vous fait voyager de Montréal à la Côte-Nord",2020-08-31,339,https://ici.radio-canada.ca/nouvelle/1730272/television-serie-francis-leclerc-guylaine-tremblay-josee-deschenes,2021-08-05 13:51:05,national
Havre-Saint-Pierre,Biden OR Trump,23,ICI.Radio-Canada.ca,Les risques du manque de réseau cellulaire sur la route 138,,,https://ici.radio-canada.ca/nouvelle/1247782/portable-reseau-cote-nord-telephone-telephonie,2021-08-05 13:51:06,national
Havre-Saint-Pierre,Biden OR Trump,24,ICI.Radio-Canada.ca,Trois prêtres arrêtés et accusés de crimes à caractère sexuel,,,https://ici.radio-canada.ca/nouvelle/1716314/eglise-congregation-attentat-pudeur-grossiere-indecence,2021-08-05 13:51:06,national
Havre-Saint-Pierre,Biden OR Trump,25,ICI.Radio-Canada.ca,Le transport par autocar entre Baie-Comeau et Québec reprendra en septembre,2020-08-13,357,https://ici.radio-canada.ca/nouvelle/1726337/autobus-reprise-cote-nord-transport-region-intercar,2021-08-05 13:51:06,national
Havre-Saint-Pierre,déficit,1,L’actualité,Vieillir à la maison,2021-08-04,1,https://lactualite.com/societe/vieillir-a-la-maison/,2021-08-05 13:51:13,national
