Villes,Mots-clés,position du média,Nom du média,Titre de l'article,Date de publication,Journée de différence,URL,date et heure saisie,type mot-clés
Havre-Saint-Pierre ,premier ministre,1,CNW Telbec,Les minéraux critiques et stratégiques au Québec - Québec participe à l'inauguration d'une nouvelle usine de démonstration commerciale d'extraction de scandium à Sorel-Tracy,2021-06-17,28,https://www.newswire.ca/fr/news-releases/les-mineraux-critiques-et-strategiques-au-quebec-quebec-participe-a-l-inauguration-d-une-nouvelle-usine-de-demonstration-commerciale-d-extraction-de-scandium-a-sorel-tracy-840769132.html,2021-07-15 14:11:02,national
Havre-Saint-Pierre ,premier ministre,2,LesAffaires.com,Scandium: le Québec conteste l'oligopole de la Chine et de la Russie,2021-06-25,20,https://www.lesaffaires.com/blogues/francois-normand/scandium-le-quebec-conteste-loligopole-de-la-chine-et-de-la-russie/625817,2021-07-15 14:11:02,national
Havre-Saint-Pierre ,premier ministre,3,Côté Manche,Photos. L'ancien Premier ministre Edouard Philippe en visite surprise à Saint-Lô,2021-07-01,14,https://actu.fr/normandie/saint-lo_50502/photos-l-ancien-premier-ministre-edouard-philippe-en-visite-surprise-a-saint-lo_43132769.html,2021-07-15 14:11:03,national
Havre-Saint-Pierre ,premier ministre,4,Magazine MCI,MCS – inauguration de la nouvelle usine à Sorel-Tracy – Magazine MCI,2021-06-21,24,https://magazinemci.com/2021/06/21/mcs-inauguration-de-la-nouvelle-usine-a-sorel-tracy/,2021-07-15 14:11:03,national
Havre-Saint-Pierre ,premier ministre,5,Ouest-France,Élections régionales en Normandie : revivez la campagne en cinq actes,2021-06-29,16,https://www.ouest-france.fr/elections/regionales/elections-regionales-en-normandie-revivez-la-campagne-en-cinq-actes-09b6d558-d5ae-11eb-8505-6750ce5b83e2,2021-07-15 14:11:03,national
Havre-Saint-Pierre ,premier ministre,6,Le Soleil - Groupe Capitales Médias,Une priorité nationale: redonner au peuple l'accès à ses plans d'eau,2021-06-20,25,https://www.lesoleil.com/opinions/une-priorite-nationale-redonner-au-peuple-lacces-a-ses-plans-deau-978a1722b55e1515d8bf40d24477cf4b,2021-07-15 14:11:04,national
Havre-Saint-Pierre ,premier ministre,7,Ouest-France,Normandie. Revivez le premier tour des élections régionales et départementales du 20 juin 2021,2021-06-21,24,https://www.ouest-france.fr/elections/regionales/direct-normandie-regionales-et-departementales-tous-les-resultats-des-elections-b81fa25e-d1c7-11eb-8e4c-918871d455e6,2021-07-15 14:11:04,national
Havre-Saint-Pierre ,premier ministre,8,Franceinfo,"Elections régionales et départementales : revivez la journée de scrutin, encore marquée par l'abstention",2021-06-27,18,https://www.francetvinfo.fr/elections/direct-regionales-departementales-2021-suivez-2e-tour-election-participation-vote-en-france_4676753.html,2021-07-15 14:11:04,national
Havre-Saint-Pierre ,premier ministre,9,La Croix,Dans la tête de l'incendiaire de la cathédrale de Nantes,2021-07-15,0,https://www.la-croix.com/France/tete-lincendiaire-cathedrale-Nantes-2021-07-15-1201166437,2021-07-15 14:11:05,national
Havre-Saint-Pierre ,premier ministre,10,ICI.Radio-Canada.ca,Une conférence virtuelle entre le nouveau patron de Rio Tinto et François Legault | Industries Saguenay-Lac-Saint-Jean,2021-03-22,115,https://ici.radio-canada.ca/nouvelle/1779185/aluminium-fer-titane-gouvernement,2021-07-15 14:11:05,national
Havre-Saint-Pierre ,premier ministre,11,Mon Matane,Éphémérides du 25 juin : Matane la dernière ville canadienne avant Gaspé en 1932,2021-06-25,20,https://monmatane.com/ephemerides-du-25-juin-matane-la-derniere-ville-canadienne-avant-gaspe-en-1932/,2021-07-15 14:11:05,national
Havre-Saint-Pierre ,premier ministre,12,Ma Côte-Nord,Pétition pour une levée du couvre-feu au gré des marées lorsque le capelan roule,2021-05-03,73,https://macotenord.com/petition-pour-une-levee-du-couvre-feu-au-gre-des-marees-lorsque-le-capelan-roule/,2021-07-15 14:11:06,national
Havre-Saint-Pierre ,premier ministre,13,Le Journal de Québec,"«Mon vrai métier, c'est humoriste» - Guy Nantel",2021-03-28,109,https://www.journaldequebec.com/2021/03/28/mon-vrai-metier-cest-humoriste---guy-nantel,2021-07-15 14:11:06,national
Havre-Saint-Pierre ,premier ministre,14,Ma Côte-Nord,Le ministre québécois de l'Environnement procède à une annonce aujourd'hui à Anticosti,2020-09-28,290,https://macotenord.com/le-ministre-quebecois-de-lenvironnement-procede-a-une-annonce-aujourdhui-a-anticosti/,2021-07-15 14:11:06,national
Havre-Saint-Pierre ,premier ministre,15,La Presse,Grande entrevue Stéphane Leblanc | Au cœur de la révolution du scandium,2021-03-16,121,https://www.lapresse.ca/affaires/entreprises/2021-03-16/grande-entrevue-stephane-leblanc/au-coeur-de-la-revolution-du-scandium.php,2021-07-15 14:11:06,national
Havre-Saint-Pierre ,premier ministre,16,La Presse,"Il y a 20 ans, Québec indemnisait les orphelins de Duplessis | « Le passé ne pourra jamais être refait »",2021-05-24,52,https://www.lapresse.ca/actualites/2021-05-24/il-y-a-20-ans-quebec-indemnisait-les-orphelins-de-duplessis/le-passe-ne-pourra-jamais-etre-refait.php,2021-07-15 14:11:07,national
Havre-Saint-Pierre ,premier ministre,17,Le Soleil - Groupe Capitales Médias,"Vent, pluie et neige sur plusieurs régions du Québec",2020-12-01,226,https://www.lesoleil.com/actualite/environnement/vent-pluie-et-neige-sur-plusieurs-regions-du-quebec-a513a15674b2306c85587425b7c817e1,2021-07-15 14:11:07,national
Havre-Saint-Pierre ,premier ministre,18,Ouest-France,Près de Rennes. Edouard Philippe en petit comité à Saint-Grégoire,2021-05-07,69,https://www.ouest-france.fr/bretagne/rennes-35000/pres-de-rennes-edouard-philippe-en-petit-comite-a-saint-gregoire-fe61fe2e-af58-11eb-b100-a92ec708d065,2021-07-15 14:11:07,national
Havre-Saint-Pierre ,premier ministre,19,Ma Côte-Nord,La députée Richard anticipe une pénurie d'éducatrices en CPE cruelle pour les parents de la Côte-Nord,2021-06-04,41,https://macotenord.com/la-deputee-richard-anticipe-une-penurie-deducatrices-en-cpe-cruelle-pour-les-parents-de-la-cote-nord/,2021-07-15 14:11:07,national
Havre-Saint-Pierre ,premier ministre,20,Le Journal de Montréal,Rio Tinto se lance dans la production d'oxyde de scandium à Sorel-Tracy,2021-01-14,182,https://www.journaldemontreal.com/2021/01/14/rio-tinto-se-lance-dans-la-production-doxyde-de-scandium-a-sorel-tracy,2021-07-15 14:11:08,national
Havre-Saint-Pierre ,premier ministre,21,ICI.Radio-Canada.ca,COVID-19 : Québec cherche des renforts pour les CPE | Coronavirus,2020-12-09,218,https://ici.radio-canada.ca/nouvelle/1755620/covid-19-quebec-campagne-recrutement-cpe,2021-07-15 14:11:08,national
Havre-Saint-Pierre ,premier ministre,22,Le Journal de Montréal,Les redevances ont plus que doublé,2020-08-10,339,https://www.journaldemontreal.com/2020/08/10/les-redevances-ont-plus-que-double,2021-07-15 14:11:08,national
Havre-Saint-Pierre ,premier ministre,23,France Bleu,"Déconfinement : couvre-feu, Nouvel An, lieux culturels… Ce qu’il faut retenir des annonces de Jean Castex",2020-12-10,217,https://www.francebleu.fr/infos/sante-sciences/direct-video-coronavirus-suivez-la-conference-de-presse-du-premier-ministre-jean-castex-1607524146,2021-07-15 14:11:09,national
Havre-Saint-Pierre ,premier ministre,24,La Presse,Enquête sur la mort de Joyce Echaquan | « Ça va rouvrir les plaies »,2021-05-13,63,https://www.lapresse.ca/actualites/2021-05-13/enquete-sur-la-mort-de-joyce-echaquan/ca-va-rouvrir-les-plaies.php,2021-07-15 14:11:09,national
Havre-Saint-Pierre ,premier ministre,25,France 3 Régions,"Le Havre, parmi les 3 villes choisies pour expérimenter le dépistage massif de Covid-19",2020-12-04,223,https://france3-regions.francetvinfo.fr/normandie/seine-maritime/havre/havre-parmi-3-villes-choisies-experimenter-depistage-massif-covid-19-1901248.html,2021-07-15 14:11:09,national
Havre-Saint-Pierre ,climat,1,La Croix,Dans la tête de l'incendiaire de la cathédrale de Nantes,2021-07-15,0,https://www.la-croix.com/France/tete-lincendiaire-cathedrale-Nantes-2021-07-15-1201166437,2021-07-15 14:11:53,national
Havre-Saint-Pierre ,climat,2,La Presse,Des centaines de caribous abattus | La chasse traditionnelle autochtone dans le viseur de Québec,2021-05-23,53,https://www.lapresse.ca/actualites/environnement/2021-05-23/des-centaines-de-caribous-abattus/la-chasse-traditionnelle-autochtone-dans-le-viseur-de-quebec.php,2021-07-15 14:11:54,national
Havre-Saint-Pierre ,climat,3,Ma Côte-Nord,Pas de problème de ressource et un prix record le crabe de la Côte-Nord,2021-04-18,88,https://macotenord.com/pas-de-probleme-de-ressource-et-un-prix-record-le-crabe-de-la-cote-nord/,2021-07-15 14:11:54,national
Havre-Saint-Pierre ,climat,4,Le Journal de Montréal,21 choses à faire lors de votre prochain road trip sur la Côte-Nord,2021-02-23,142,https://www.journaldemontreal.com/2021/02/23/21-choses-a-faire-absolument-lors-dun-road-trip-sur-la-cote-nord,2021-07-15 14:11:54,national
Havre-Saint-Pierre ,climat,5,Le Soleil - Groupe Capitales Médias,"Vent, pluie et neige sur plusieurs régions du Québec",2020-12-01,226,https://www.lesoleil.com/actualite/environnement/vent-pluie-et-neige-sur-plusieurs-regions-du-quebec-a513a15674b2306c85587425b7c817e1,2021-07-15 14:11:55,national
Havre-Saint-Pierre ,climat,6,MétéoMédia,Trois choses à savoir sur le premier système d’avril,2021-04-01,105,https://www.meteomedia.com/ca/nouvelles/article/trois-choses-a-savoir-sur-le-premier-systeme-davril,2021-07-15 14:11:55,national
Havre-Saint-Pierre ,climat,7,Le Journal de Montréal,Un autochtone s'attire la colère sur internet,2021-03-28,109,https://www.journaldemontreal.com/2021/03/28/un-autochtone-sattire-la-colere-sur-internet,2021-07-15 14:11:55,national
Havre-Saint-Pierre ,climat,8,Paris-Normandie,"Au Havre, il faisait régner un climat de violence et de terreur au sein de la famille",2021-04-22,84,https://www.paris-normandie.fr/id185667/article/2021-04-22/au-havre-il-faisait-regner-un-climat-de-violence-et-de-terreur-au-sein-de-la,2021-07-15 14:11:56,national
Havre-Saint-Pierre ,climat,9,ICI.Radio-Canada.ca,De nombreuses observations de méduses dans le Golfe du Saint-Laurent,2020-07-22,358,https://ici.radio-canada.ca/ohdio/premiere/emissions/d-est-en-est/segments/entrevue/189775/observations-nombreuses-meduse-golfe-cote-nord-gaspesie-rechauffement-climatique-eaux-chaudes-vents-hypotheses,2021-07-15 14:11:56,national
Havre-Saint-Pierre ,climat,10,ICI.Radio-Canada.ca,Six fois plus de signalements d'ours noir près des centres urbains de la Haute-Côte-Nord,2020-10-08,280,https://ici.radio-canada.ca/nouvelle/1739576/ours-noir-manicouagan-haute-cote-nord-signalement-presence,2021-07-15 14:11:56,national
Havre-Saint-Pierre ,climat,11,Ouest-France,"Érosion du littoral. À Saint-Pierre-et-Miquelon, des côtes rongées à l’os",2020-11-16,241,https://www.ouest-france.fr/saint-pierre-et-miquelon/erosion-du-littoral-a-saint-pierre-et-miquelon-des-cotes-rongees-a-l-os-7052940,2021-07-15 14:11:57,national
Havre-Saint-Pierre ,climat,12,Novethic.fr,En Live : le projet de loi Climat et résilience adopté à l'Assemblée nationale après trois semaines de débats,2021-04-19,87,https://www.novethic.fr/actualite/environnement/climat/isr-rse/en-live-l-assemblee-nationale-debute-l-examen-de-la-loi-climat-et-resilience-149668.html,2021-07-15 14:11:57,national
Havre-Saint-Pierre ,climat,13,Le Journal de Québec,Les touristes sont nombreux à visiter l'Archipel-de-Mingan,,,https://www.journaldequebec.com/2020/07/20/les-touristes-nombreux-a-visiter-larchipel-de-mingan-1,2021-07-15 14:11:57,national
Havre-Saint-Pierre ,climat,14,Le Journal de Québec,Entreprises Reprise du chantier de La Romaine,2021-05-18,58,https://www.journaldequebec.com/2021/05/18/reprise-du-chantier-de-la-romaine,2021-07-15 14:11:57,national
Havre-Saint-Pierre ,climat,15,Le Journal de Québec,Jusqu'à 1 M$ par chambre: des maisons des aînés qui vont coûter une vraie fortune,2021-06-04,41,https://www.journaldequebec.com/2021/06/04/des-maisons-des-aines-qui-vont-couter-une-vraie-fortune,2021-07-15 14:11:58,national
Havre-Saint-Pierre ,climat,16,Ouest-France,Saint-Lô. Une discussion collective pour le climat,2021-05-09,67,https://www.ouest-france.fr/normandie/saint-lo-50000/saint-lo-une-discussion-collective-pour-le-climat-21a49714-b0c3-11eb-be69-b9212f8a3350,2021-07-15 14:11:58,national
Havre-Saint-Pierre ,climat,17,Ouest-France,"Cholet. Au nom du climat, des Choletais en lutte sur la butte bloqué",2021-05-09,67,https://www.ouest-france.fr/pays-de-la-loire/cholet-49300/cholet-au-nom-du-climat-des-choletais-en-lutte-sur-la-butte-ac4d3e9a-b0b2-11eb-be69-b9212f8a3350,2021-07-15 14:11:58,national
Havre-Saint-Pierre ,climat,18,Ouest-France,Auray. Huit associations organisent une nouvelle marche pour le climat,2021-05-04,72,https://www.ouest-france.fr/bretagne/auray-56400/auray-huit-associations-organisent-une-nouvelle-marche-pour-le-climat-9e3bfcf0-ace4-11eb-92f6-be09dcfccdb7,2021-07-15 14:11:58,national
Havre-Saint-Pierre ,climat,19,L’actualité,Vive le Québec sauvage : 65 sites où découvrir la biodiversité,2021-05-05,71,https://lactualite.com/environnement/vive-le-quebec-sauvage-65-sites-ou-decouvrir-la-biodiversite/,2021-07-15 14:11:59,national
Havre-Saint-Pierre ,climat,20,La République du Centre,"Marche pour le climat à Orléans et Montargis : ""Oui, il y a urgence à agir !"" - Orléans (45000)",2021-05-09,67,https://www.larep.fr/orleans-45000/actualites/marche-pour-le-climat-a-orleans-et-montargis-oui-il-y-a-urgence-a-agir_13950944/,2021-07-15 14:11:59,national
Havre-Saint-Pierre ,climat,21,Ouest-France,Caen. La Marche pour le climat réchauffe le centre-ville bloqué,2021-03-20,117,https://www.ouest-france.fr/normandie/caen-la-marche-pour-le-climat-rechauffe-le-centre-ville-7194617,2021-07-15 14:11:59,national
Havre-Saint-Pierre ,climat,22,Courrier Picard,Une marche pour le climat ce dimanche à Amiens,2021-05-05,71,https://www.courrier-picard.fr/id189647/article/2021-05-05/une-marche-pour-le-climat-ce-dimanche-amiens,2021-07-15 14:12:00,national
Havre-Saint-Pierre ,climat,23,Ouest-France,"Cholet. Pour le climat, un peu plus de 100 personnes seulement sont montées au Champ-de-Bataille",2021-05-09,67,https://www.ouest-france.fr/pays-de-la-loire/cholet-49300/cholet-pour-le-climat-un-peu-plus-de-100-personnes-seulement-sont-montees-au-champ-de-bataille-df820922-b0b1-11eb-bd90-d6f259c33f22,2021-07-15 14:12:00,national
Havre-Saint-Pierre ,climat,24,Ouest-France,"Morlaix. Une marche pour le climat dimanche, veille de l’examen du projet de loi",2021-03-26,111,https://www.ouest-france.fr/bretagne/morlaix-29600/morlaix-une-marche-pour-le-climat-dimanche-veille-de-l-examen-du-projet-de-loi-89ebe0a6-8e1e-11eb-a1bb-f434af1b4244,2021-07-15 14:12:00,national
Havre-Saint-Pierre ,climat,25,Hominidés,Les origines du monde - exposition - Orsay - Paris,,,https://www.hominides.com/html/exposition/origines-du-monde-1477.php,2021-07-15 14:12:00,national
Havre-Saint-Pierre ,immigration,1,Ma Côte-Nord,Le chef du Bloc Yves-François Blanchet marque l'histoire en Basse-Côte-Nord,2021-07-12,3,https://macotenord.com/le-chef-du-bloc-yves-francois-blanchet-marque-lhistoire-en-basse-cote-nord/,2021-07-15 14:12:12,national
Havre-Saint-Pierre ,immigration,2,Le Journal de Québec,"«Mon vrai métier, c'est humoriste» - Guy Nantel",2021-03-28,109,https://www.journaldequebec.com/2021/03/28/mon-vrai-metier-cest-humoriste---guy-nantel,2021-07-15 14:12:12,national
Havre-Saint-Pierre ,immigration,3,ICI.Radio-Canada.ca,"La Côte-Nord continue de perdre des résidents, mais fait des efforts pour renverser la tendance",,,https://ici.radio-canada.ca/nouvelle/1154187/cote-nord-solde-migratoire-regions-efforts-renverser-tendance,2021-07-15 14:12:13,national
Havre-Saint-Pierre ,immigration,4,ICI.Radio-Canada.ca,"Les restaurants ouverts en Minganie cet été, mais « de peine et de misère »",,,https://ici.radio-canada.ca/nouvelle/1173355/tourisme-minganie-penurie-travailleur-emploi-cuisine,2021-07-15 14:12:13,national
Havre-Saint-Pierre ,immigration,5,La Presse,Immigration: des experts dénoncent la vision «simpliste» de Québec,,,https://www.lapresse.ca/actualites/2019-11-07/immigration-des-experts-denoncent-la-vision-simpliste-de-quebec,2021-07-15 14:12:13,national
Havre-Saint-Pierre ,immigration,6,Le Devoir,Libre opinion «Défranchouiller» le Québec,2021-05-19,57,https://www.ledevoir.com/opinion/libre-opinion/602567/libre-opinion-defranchouiller-le-quebec,2021-07-15 14:12:14,national
Havre-Saint-Pierre ,immigration,7,Le Devoir,"Prendre la route de la Côte-Nord, pour les baleines et tellement plus!",,,https://www.ledevoir.com/vivre/voyage/507385/prendre-la-route-de-la-cote-nord-pour-les-baleines-et-tellement-plus,2021-07-15 14:12:14,national
Havre-Saint-Pierre ,immigration,8,ICI.Radio-Canada.ca,"Natashquan, 20 ans après le prolongement de la route 138",,,https://ici.radio-canada.ca/nouvelle/1003053/route138-natashquan-ouverture,2021-07-15 14:12:14,national
Havre-Saint-Pierre ,immigration,9,Le Nouvelliste - Groupe Capitales Médias,Rio Tinto enclenchera la production d'un minéral critique à Sorel-Tracy,2021-01-14,182,https://www.lenouvelliste.ca/affaires/rio-tinto-enclenchera-la-production-dun-mineral-critique-a-sorel-tracy-5fa8d9f7821dcaae1db17d85a70b6efc,2021-07-15 14:12:14,national
Havre-Saint-Pierre ,immigration,10,ICI.Radio-Canada.ca,Le Téléjournal de Bernard Derome,,,https://ici.radio-canada.ca/nouvelle/1141984/bernard-derome-carriere-telejournal-journaliste-presentateur-archives,2021-07-15 14:12:14,national
Havre-Saint-Pierre ,immigration,11,Le Journal de Montréal,Appelez-le maintenant Bernard «Trump» Gauthier | JDM,,,https://www.journaldemontreal.com/2016/12/10/appelez-le-maintenant-bernard-trump-gauthier,2021-07-15 14:12:15,national
Havre-Saint-Pierre ,immigration,12,La Presse,Course au PQ | Surveillez le deuxième | La Presse,2020-10-06,282,https://www.lapresse.ca/actualites/2020-10-06/course-au-pq/surveillez-le-deuxieme.php,2021-07-15 14:12:15,national
Havre-Saint-Pierre ,immigration,13,Droit-Inc.com,Demandes de type « Wellington » en droit québécois : le début d'un retour du balancier?,2021-06-11,34,https://www.droit-inc.com/article28860-Demandes-de-type-Wellington-en-droit-quebecois-le-debut-d-un-retour-du-balancier,2021-07-15 14:12:15,national
Havre-Saint-Pierre ,immigration,14,ICI.Radio-Canada.ca,Faire que les Innus se sentent à l'aise dans les établissements de santé de la Côte-Nord,2021-01-21,175,https://ici.radio-canada.ca/espaces-autochtones/1714465/cisss-cote-nord-hopitaux-medecine-autochtone-premieres-nations-innu-dale-walker-soins-sante,2021-07-15 14:12:15,national
Havre-Saint-Pierre ,immigration,15,Le Devoir,"Le «Bella Desgagnés» sur la Côte-Nord, une croisière hors du temps",,,https://www.ledevoir.com/vivre/voyage/567031/escapade-le-i-bella-desgagnes-i-sur-la-cote-nord-une-croisiere-hors-du-temps,2021-07-15 14:12:16,national
Havre-Saint-Pierre ,immigration,16,Ouest-France,Ploubazlanec. Le musée national de l’histoire de l’immigration s’intéresse au parrainage républicain,2021-06-01,44,https://www.ouest-france.fr/bretagne/ploubazlanec-22620/ploubazlanec-le-musee-national-de-l-histoire-de-l-immigration-s-interesse-au-parrainage-republicain-03ba9d70-c2f2-11eb-a0fd-d76aa8d70710,2021-07-15 14:12:16,national
Havre-Saint-Pierre ,immigration,17,Ouest-France,Normandie. Le bateau avec des migrants à bord avait chaviré : huit arrestations,2021-06-03,42,https://www.ouest-france.fr/normandie/normandie-le-bateau-avec-des-migrants-a-bord-avait-chavire-huit-arrestations-e1f0f2be-c3ac-11eb-b322-dcd0256dd6a7,2021-07-15 14:12:16,national
Havre-Saint-Pierre ,immigration,18,Radio-Canada,Le patrimoine de Gilles Vigneault sauvé,,,https://ici.radio-canada.ca/nouvelle/734040/patrimoine-gilles-vigneault-sauve-natashquan,2021-07-15 14:12:16,national
Havre-Saint-Pierre ,immigration,19,ICI.Radio-Canada.ca,Moins de neige sur la chaussée de la route 138 grâce aux brise-vent,,,https://ici.radio-canada.ca/nouvelle/1499217/chaussee-138-hiver-route-brise-vent-anti-poudrerie,2021-07-15 14:12:17,national
Havre-Saint-Pierre ,immigration,20,Le Soleil - Groupe Capitales Médias,Taxi Coop Québec 525-5191: une nouvelle image et une entente avec UEAT,2021-04-13,93,https://www.lesoleil.com/affaires/taxi-coop-quebec-525-5191-une-nouvelle-image-et-une-entente-avec-ueat-45e94bf3cf2241f4f7b53a56a5b97d06,2021-07-15 14:12:17,national
Havre-Saint-Pierre ,immigration,21,La Voix de l'est - Groupe Capitales Médias,Micheline Duff: Grosse-Île et ses «anges gardiens»… de 1847,2021-02-20,145,https://www.lavoixdelest.ca/arts/micheline-duff-grosse-ile-et-ses-anges-gardiens-de-1847-9c48d0fc7ef8f01af276e08a8bbba12a,2021-07-15 14:12:17,national
Havre-Saint-Pierre ,immigration,22,Outre-mer la 1ère,Une quarantaine de réfugiés syriens installés dans une rue de Cayenne en attendant une solution de la Croix-Ro,2021-06-14,31,https://la1ere.francetvinfo.fr/guyane/centre-littoral/cayenne/une-quarantaine-de-refugies-syriens-installes-dans-une-rue-de-cayenne-en-attendant-une-solution-de-la-croix-rouge-1033573.html,2021-07-15 14:12:17,national
Havre-Saint-Pierre ,immigration,23,actu.fr,"Asile et immigration : au Havre, les associations dénoncent le durcissement de la loi",,,https://actu.fr/normandie/le-havre_76351/asile-immigration-havre-associations-denoncent-durcissement-loi_21180108.html,2021-07-15 14:12:18,national
Havre-Saint-Pierre ,immigration,24,ICI.Radio-Canada.ca,Des manifestants innus de Natashquan bloquent l'accès au chantier de la Romaine,,,https://ici.radio-canada.ca/nouvelle/729865/manifestation-chantier-romaine,2021-07-15 14:12:18,national
Havre-Saint-Pierre ,immigration,25,Ouest-France éditions locales,Saint-Brieuc. Un projet inédit de logements pour des familles sans-papiers qui sont à la rue,2021-03-29,108,https://www.ouest-france.fr/bretagne/saint-brieuc-22000/saint-brieuc-un-projet-inedit-de-logements-pour-des-familles-sans-papiers-qui-sont-a-la-rue-br-44f4b1be-8e5d-11eb-a1bb-f434af1b4244,2021-07-15 14:12:18,national
Havre-Saint-Pierre ,racisme,1,Le Journal de Québec,"«Mon vrai métier, c'est humoriste» - Guy Nantel",2021-03-28,109,https://www.journaldequebec.com/2021/03/28/mon-vrai-metier-cest-humoriste---guy-nantel,2021-07-15 14:12:30,national
Havre-Saint-Pierre ,racisme,2,Ma Côte-Nord,Maya Cousineau Mollen - un modèle pour les jeunes Innus,2020-11-03,254,https://macotenord.com/maya-cousineau-mollen-un-modele-pour-les-jeunes-innus/,2021-07-15 14:12:30,national
Havre-Saint-Pierre ,racisme,3,Le Devoir,La discrimination contres les Autochtones dans les soins de santé n'est toujours pas documentée,2021-05-12,64,https://www.ledevoir.com/societe/sante/600557/un-phenomene-que-quebec-ne-documente-toujours-pas,2021-07-15 14:12:30,national
Havre-Saint-Pierre ,racisme,4,La Presse,Des centaines de caribous abattus | La chasse traditionnelle autochtone dans le viseur de Québec,2021-05-23,53,https://www.lapresse.ca/actualites/environnement/2021-05-23/des-centaines-de-caribous-abattus/la-chasse-traditionnelle-autochtone-dans-le-viseur-de-quebec.php,2021-07-15 14:12:31,national
Havre-Saint-Pierre ,racisme,5,La Presse,Enquête sur la mort de Joyce Echaquan | « Ça va rouvrir les plaies »,2021-05-13,63,https://www.lapresse.ca/actualites/2021-05-13/enquete-sur-la-mort-de-joyce-echaquan/ca-va-rouvrir-les-plaies.php,2021-07-15 14:12:31,national
Havre-Saint-Pierre ,racisme,6,Le Journal de Québec,Il n'y a plus que 600 caribous forestiers sur la Côte-Nord,2021-03-29,108,https://www.journaldequebec.com/2021/03/29/il-ny-a-plus-que-600caribous-forestiers-sur-la-cote-nord,2021-07-15 14:12:31,national
Havre-Saint-Pierre ,racisme,7,La Presse,L'étudiant a toujours raison | La Presse,2020-10-15,273,https://www.lapresse.ca/actualites/2020-10-15/l-etudiant-a-toujours-raison.php,2021-07-15 14:12:31,national
Havre-Saint-Pierre ,racisme,8,Ouest-France,"ENTRETIEN. Ancien maire, il témoigne du racisme qu'il côtoie depuis son élection",2021-05-17,59,https://www.ouest-france.fr/bretagne/saint-coulitz-29150/entretien-ancien-maire-il-temoigne-du-racisme-qu-il-cotoie-depuis-son-election-821e3168-add5-11eb-ae73-cbd3b5cdc4b3,2021-07-15 14:12:32,national
Havre-Saint-Pierre ,racisme,9,Le Devoir,Un meilleur accompagnement réclamé pour les Autochtones dans les hôpitaux,2021-02-17,148,https://www.ledevoir.com/societe/sante/595376/un-meilleur-accompagnement-reclame-pour-les-autochtones,2021-07-15 14:12:32,national
Havre-Saint-Pierre ,racisme,10,Ouest-France,"Accusé de racisme pour sa parodie d’Aya Nakamura, Omar Sy réplique sur Twitter",2020-11-25,232,https://www.ouest-france.fr/culture/people/accuse-de-racisme-pour-sa-parodie-d-aya-nakamura-omar-sy-replique-sur-twitter-7062201,2021-07-15 14:12:32,national
Havre-Saint-Pierre ,racisme,11,ICI.Radio-Canada.ca,Les Cayens de Havre-Saint-Pierre affirment leur origine acadienne,,,https://ici.radio-canada.ca/nouvelle/1118802/les-cayens-de-havre-saint-pierre-affirment-leur-origine-acadienne,2021-07-15 14:12:33,national
Havre-Saint-Pierre ,racisme,12,Ouest-France,PSG – Basaksehir. Scandale historique à Paris : un arbitre accusé de propos racistes,2020-12-08,219,https://www.ouest-france.fr/sport/football/ligue-des-champions/psg-basaksehir-un-arbitre-accuse-de-propos-racistes-le-match-arrete-7078328,2021-07-15 14:12:33,national
Havre-Saint-Pierre ,racisme,13,Ouest-France,"Télévision. «Rire ensemble contre le racisme», avec la comédienne Nadège Beausson-Diagne",2021-03-16,121,https://www.ouest-france.fr/medias/television/television-rire-ensemble-contre-le-racisme-avec-la-comedienne-nadege-beausson-diagne-7188609,2021-07-15 14:12:33,national
