Havre-Saint-Pierre ,racisme,14,Ouest-France,Christophe Castaner qualifie le RN de « parti raciste » et prend ses distances avec Gérald Darmanin,2021-05-26,50,https://www.ouest-france.fr/politique/christophe-castaner/christophe-castaner-qualifie-le-rn-de-parti-raciste-et-prend-ses-distances-avec-gerald-darmanin-6d089a4a-be04-11eb-9b0c-ceb32611b3fa,2021-07-15 14:12:34,national
Havre-Saint-Pierre ,racisme,15,Ouest-France,"PSG - Basaksehir. Un arbitre accusé de racisme, le match arrêté et reporté",2020-12-09,218,https://www.ouest-france.fr/sport/football/ligue-des-champions/direct-ligue-des-champions-le-psg-doit-finir-le-travail-face-au-basaksehir-istanbul-7078260,2021-07-15 14:12:34,national
Havre-Saint-Pierre ,racisme,16,France Bleu,Plusieurs joueurs du Clermont Foot visés par des messages racistes sur les réseaux sociaux,2021-04-17,89,https://www.francebleu.fr/sports/football/plusieurs-jours-du-clermont-foot-vises-par-des-messages-racistes-sur-les-reseaux-sociaux-1618651927,2021-07-15 14:12:34,national
Havre-Saint-Pierre ,racisme,17,ICI.Radio-Canada.ca,Faire que les Innus se sentent à l'aise dans les établissements de santé de la Côte-Nord,2021-01-21,175,https://ici.radio-canada.ca/espaces-autochtones/1714465/cisss-cote-nord-hopitaux-medecine-autochtone-premieres-nations-innu-dale-walker-soins-sante,2021-07-15 14:12:35,national
Havre-Saint-Pierre ,racisme,18,Ouest-France éditions locales,Angers. Un appel au rassemblement à la Roseraie pour dire « stop au racisme »,2021-03-17,120,https://www.ouest-france.fr/pays-de-la-loire/angers-49000/angers-un-appel-au-rassemblement-a-la-roseraie-pour-dire-stop-au-racisme-7190301,2021-07-15 14:12:35,national
Havre-Saint-Pierre ,racisme,19,ICI.Radio-Canada.ca,"Violence conjugale : l'aide de Québec bienvenue, mais tardive",2021-04-24,82,https://ici.radio-canada.ca/nouvelle/1787626/feminicide-aide-organisme-la-montee-havre-des-femmes,2021-07-15 14:12:35,national
Havre-Saint-Pierre ,racisme,20,Ouest-France,"« Chaud Cacao ». La chanson d’Annie Cordy n’est pas raciste, affirme son parolier",2021-03-25,112,https://www.ouest-france.fr/culture/musiques/chaud-cacao-la-chanson-d-annie-cordy-n-est-pas-raciste-affirme-son-parolier-7201007,2021-07-15 14:12:36,national
Havre-Saint-Pierre ,racisme,21,ICI.Radio-Canada.ca,Les ambitions internationales du FLQ,2020-10-01,287,https://ici.radio-canada.ca/recit-numerique/1014/front-liberation-quebec-flq-frontiere-etats-unis-algerie,2021-07-15 14:12:36,national
Havre-Saint-Pierre ,racisme,22,Ouest-France éditions locales,Il n’y a pas eu de tentative d’enlèvement près du collège Saint-Pierre à Caen,2021-03-31,106,https://www.ouest-france.fr/normandie/caen-14000/il-n-y-a-pas-eu-de-tentative-span-style-font-family-source-sans-pro-arial-d-enlevement-pres-du-college-saint-pierre-a-caen-span-171c6f1a-922d-11eb-8153-111acea7321d,2021-07-15 14:12:36,national
Havre-Saint-Pierre ,racisme,23,ICI.Radio-Canada.ca,"Les restaurants ouverts en Minganie cet été, mais « de peine et de misère »",,,https://ici.radio-canada.ca/nouvelle/1173355/tourisme-minganie-penurie-travailleur-emploi-cuisine,2021-07-15 14:12:36,national
Havre-Saint-Pierre ,racisme,24,Ouest-France éditions locales,Marseille. Les propos racistes du président d’un club nautique suscitent l’indignation,2021-04-27,79,https://www.ouest-france.fr/provence-alpes-cote-dazur/marseille-13000/marseille-des-propos-racistes-du-president-d-un-club-nautique-suscitent-l-indignation-5f342244-a76c-11eb-bac8-769827b2d6b4,2021-07-15 14:12:37,national
Havre-Saint-Pierre ,racisme,25,Ouest-France éditions locales,Angers. Propos racistes : Christophe Béchu condamne les propos de son ex-colistière Amanda Guénard,2021-04-13,93,https://www.ouest-france.fr/pays-de-la-loire/angers-49000/angers-propos-racistes-christophe-bechu-condamne-les-propos-de-son-ex-colistiere-amanda-guenard-22a711b2-9c61-11eb-9b2c-e8a37d17d734,2021-07-15 14:12:37,national
Havre-Saint-Pierre ,Chine,1,LesAffaires.com,Scandium: le Québec conteste l'oligopole de la Chine et de la Russie,2021-06-25,20,https://www.lesaffaires.com/blogues/francois-normand/scandium-le-quebec-conteste-loligopole-de-la-chine-et-de-la-russie/625817,2021-07-15 14:12:49,national
Havre-Saint-Pierre ,Chine,2,La Presse,Grande entrevue Stéphane Leblanc | Au cœur de la révolution du scandium,2021-03-16,121,https://www.lapresse.ca/affaires/entreprises/2021-03-16/grande-entrevue-stephane-leblanc/au-coeur-de-la-revolution-du-scandium.php,2021-07-15 14:12:49,national
Havre-Saint-Pierre ,Chine,3,TVA Nouvelles,Camping: la Côte-Nord se prépare pour les touristes,2021-05-10,66,https://www.tvanouvelles.ca/2021/05/10/camping-la-cote-nord-se-prepare-pour-les-touristes,2021-07-15 14:12:50,national
Havre-Saint-Pierre ,Chine,4,"What's up Doc, le magazine des jeunes médecins",PROGRAMME ESTIVAL : EN VOITURE SIMONE !,2021-07-13,2,https://www.whatsupdoc-lemag.fr/grand-format/programme-estival-en-voiture-simone,2021-07-15 14:12:50,national
Havre-Saint-Pierre ,Chine,5,La Presse,Des centaines de caribous abattus | La chasse traditionnelle autochtone dans le viseur de Québec,2021-05-23,53,https://www.lapresse.ca/actualites/environnement/2021-05-23/des-centaines-de-caribous-abattus/la-chasse-traditionnelle-autochtone-dans-le-viseur-de-quebec.php,2021-07-15 14:12:50,national
Havre-Saint-Pierre ,Chine,6,Radio-Canada.ca,Tempête hivernale : les conditions routières s'améliorent dans l'Est-du-Québec,2021-02-03,162,https://ici.radio-canada.ca/nouvelle/1768007/tempete-neige-hiver-panne-route-ecole-fermees-vent-pannes-3-fevrier-2021,2021-07-15 14:12:51,national
Havre-Saint-Pierre ,Chine,7,ICI.Radio-Canada.ca,Les Cayens de Havre-Saint-Pierre affirment leur origine acadienne,,,https://ici.radio-canada.ca/nouvelle/1118802/les-cayens-de-havre-saint-pierre-affirment-leur-origine-acadienne,2021-07-15 14:12:51,national
Havre-Saint-Pierre ,Chine,8,Le Journal de Montréal,Rio Tinto se lance dans la production d'oxyde de scandium à Sorel-Tracy,2021-01-14,182,https://www.journaldemontreal.com/2021/01/14/rio-tinto-se-lance-dans-la-production-doxyde-de-scandium-a-sorel-tracy,2021-07-15 14:12:51,national
Havre-Saint-Pierre ,Chine,9,Paris-Normandie,précédent La récolte 2021 de lin s'annonce prometteuse en pays de Caux,2021-06-21,24,https://www.paris-normandie.fr/id205228/article/2021-06-21/la-recolte-2021-de-lin-sannonce-prometteuse-en-pays-de-caux,2021-07-15 14:12:51,national
Havre-Saint-Pierre ,Chine,10,Radio-Canada.ca,Autochtones Josée Rock : être Innue au 21e siècle,2021-04-23,83,https://ici.radio-canada.ca/espaces-autochtones/1786368/josee-rock-etre-innue-au-21e-siecle,2021-07-15 14:12:52,national
Havre-Saint-Pierre ,Chine,11,Le Parisien,"Au Havre, avec le Saint-Exupéry, c’est le retour des géants des mers",2020-12-15,212,https://www.leparisien.fr/economie/au-havre-avec-le-saint-exupery-c-est-le-retour-des-geants-des-mers-15-12-2020-8414339.php,2021-07-15 14:12:52,national
Havre-Saint-Pierre ,Chine,12,Le Journal de Québec,Avenir moins ombrageux pour les employés de Rio Tinto fer et titane de Havre-Saint-Pierre,,,https://www.journaldequebec.com/2018/06/29/avenir-moins-ombrageux-pour-les-employes-de-rio-tinto-fer-et-titane-de-havre-saint-pierre,2021-07-15 14:12:52,national
Havre-Saint-Pierre ,Chine,13,Ricochet,Il est temps de parler de la transmission de la COVID-19 par aérosols | Ricochet,2021-01-04,192,https://ricochet.media/fr/3422/Temps,2021-07-15 14:12:52,national
Havre-Saint-Pierre ,Chine,14,Le Soleil - Groupe Capitales Médias,Des grands espaces de Tadoussac à Mingan | Le bourlingueur | Le Mag,,,https://www.lesoleil.com/le-mag/le-bourlingueur/des-grands-espaces-de-tadoussac-a-mingan-afe97f48e8c23c8b8739a0d4142edd1d,2021-07-15 14:12:53,national
Havre-Saint-Pierre ,Chine,15,ICI.Radio-Canada.ca,La sinueuse histoire de la route 138,,,https://ici.radio-canada.ca/nouvelle/1142402/la-sinueuse-histoire-de-la-route-138,2021-07-15 14:12:53,national
Havre-Saint-Pierre ,Chine,16,Journal Le Manic,Des opportunités à saisir pour l'industrie minière,2020-07-30,350,https://www.lemanic.ca/2020/07/30/des-opportunites-a-saisir-pour-lindustrie-miniere/,2021-07-15 14:12:53,national
Havre-Saint-Pierre ,Chine,17,ICI.Radio-Canada.ca,Atterrissage difficile pour un avion à Havre-Saint-Pierre,,,https://ici.radio-canada.ca/nouvelle/1086045/atterrissage-difficile-avion-havre-saint-pierre,2021-07-15 14:12:53,national
Havre-Saint-Pierre ,Chine,18,Ouest-France,"Covid-19. Dongning, ville chinoise de 200 000 habitants, en confinement après un cas positif",2020-12-12,215,https://www.ouest-france.fr/monde/chine/covid-19-dongning-ville-chinoise-de-200-000-habitants-en-confinement-apres-un-cas-positif-7083525,2021-07-15 14:12:54,national
Havre-Saint-Pierre ,Chine,19,ICI.Radio-Canada.ca,"La Côte-Nord continue de perdre des résidents, mais fait des efforts pour renverser la tendance",,,https://ici.radio-canada.ca/nouvelle/1154187/cote-nord-solde-migratoire-regions-efforts-renverser-tendance,2021-07-15 14:12:54,national
Havre-Saint-Pierre ,Chine,20,Le Quotidien - Groupe Capitales Médias,Les poules pondeuses toujours en demande | Toit et moi,2021-04-17,89,https://www.lequotidien.com/toit-et-moi/les-poules-pondeuses-toujours-en-demande-cbe79cb9de61e5ea335f322c96b51e09,2021-07-15 14:12:54,national
Havre-Saint-Pierre ,Chine,21,Fabula,"Perspectives dix-neuviémistes : Chine-France et retour 从十九世纪的视野出发：中法之间 Perspectives on and from the 19th Century: from China to France and back (Univ. Fudan, Shangai)",2021-06-03,42,https://www.fabula.org/actualites/colloque-internationalperspectives-dix-neuviemistes-chine-france-et-retourcong-shi-jiu-shi-ji-de_102372.php,2021-07-15 14:12:55,national
Havre-Saint-Pierre ,Chine,22,Le Courrier Cauchois,"Coopérative linière Terre de lin. ""Nos exports ont repris y compris en Chine""",2021-02-17,148,https://www.lecourriercauchois.fr/actualite-274967-cooperative-liniere-terre-de-lin-nos-exports-ont-repris-y-compris-en-chine,2021-07-15 14:12:55,national
Havre-Saint-Pierre ,Chine,23,Le Nouvelliste - Groupe Capitales Médias,Ces cours d'eau à découvrir en sup,2021-05-01,75,https://www.lenouvelliste.ca/sports/sport-local/ces-cours-deau-a-decouvrir-en-sup-fdae40bac7e27d801a5890f9dc8dae83,2021-07-15 14:12:55,national
Havre-Saint-Pierre ,Chine,24,Paris-Normandie,"Covid-19. Le test anal, jugé plus fiable, de plus en plus utilisé en Chine",2021-01-27,169,https://www.paris-normandie.fr/id159859/article/2021-01-27/covid-19-le-test-anal-juge-plus-fiable-de-plus-en-plus-utilise-en-chine,2021-07-15 14:12:55,national
Havre-Saint-Pierre ,Chine,25,Le Journal de Montréal,Ces restos qui nous manquent,2021-04-02,104,https://www.journaldemontreal.com/2021/04/02/ces-restos-qui-nous-manquent,2021-07-15 14:12:56,national
Havre-Saint-Pierre ,Biden OR Trump,1,Le Journal de Québec,Il n'y a plus que 600 caribous forestiers sur la Côte-Nord,2021-03-29,108,https://www.journaldequebec.com/2021/03/29/il-ny-a-plus-que-600caribous-forestiers-sur-la-cote-nord,2021-07-15 14:13:06,national
Havre-Saint-Pierre ,Biden OR Trump,2,Le Journal de Montréal,Appelez-le maintenant Bernard «Trump» Gauthier | JDM,,,https://www.journaldemontreal.com/2016/12/10/appelez-le-maintenant-bernard-trump-gauthier,2021-07-15 14:13:07,national
Havre-Saint-Pierre ,Biden OR Trump,3,Le Journal de Montréal,Les Québécois pourront s'envoler pour le Nord cet été,2021-04-09,97,https://www.journaldemontreal.com/2021/04/08/les-quebecois-pourront-senvoler-pour-le-nord-cet-ete,2021-07-15 14:13:07,national
Havre-Saint-Pierre ,Biden OR Trump,4,Le Journal de Montréal,Les redevances ont plus que doublé,2020-08-10,339,https://www.journaldemontreal.com/2020/08/10/les-redevances-ont-plus-que-double,2021-07-15 14:13:07,national
Havre-Saint-Pierre ,Biden OR Trump,5,ICI.Radio-Canada.ca,Havre-Saint-Pierre et Natashquan perdent leur quincaillerie,,,https://ici.radio-canada.ca/nouvelle/1039420/havre-saint-pierre-et-natashquan-perdent-leur-quincaillerie,2021-07-15 14:13:08,national
Havre-Saint-Pierre ,Biden OR Trump,6,ICI.Radio-Canada.ca,Vers un festival de musique à Havre-Saint-Pierre,,,https://ici.radio-canada.ca/nouvelle/1102608/tourisme-minganie-artistes-evenement,2021-07-15 14:13:08,national
Havre-Saint-Pierre ,Biden OR Trump,7,Le Nouvelliste - Groupe Capitales Médias,Rio Tinto enclenchera la production d'un minéral critique à Sorel-Tracy,2021-01-14,182,https://www.lenouvelliste.ca/affaires/rio-tinto-enclenchera-la-production-dun-mineral-critique-a-sorel-tracy-5fa8d9f7821dcaae1db17d85a70b6efc,2021-07-15 14:13:08,national
Havre-Saint-Pierre ,Biden OR Trump,8,ICI.Radio-Canada.ca,Au tour de Havre-Saint-Pierre de s'exprimer sur le désenclavement d'Anticosti,,,https://ici.radio-canada.ca/nouvelle/1066969/consultation-havre-saint-pierre-desenclavement-anticosti,2021-07-15 14:13:09,national
Havre-Saint-Pierre ,Biden OR Trump,9,Ouest-France,REPORTAGE. Les partisans de Donald Trump fidèles jusqu’au bout,2021-01-06,190,https://www.ouest-france.fr/monde/etats-unis/reportage-les-partisans-de-donald-trump-fideles-jusqu-au-bout-7109792,2021-07-15 14:13:09,national
Havre-Saint-Pierre ,Biden OR Trump,10,Le Journal de Montréal,Thelma et Louise en Winnebago...,2020-08-20,329,https://www.journaldemontreal.com/2020/08/20/thelma-et-louise-en-winnebago,2021-07-15 14:13:09,national
Havre-Saint-Pierre ,Biden OR Trump,11,Ouest-France,Présidentielle américaine. Trump a-t-il encore une chance de transformer sa défaite en victoire ?,2020-12-16,211,https://www.ouest-france.fr/monde/etats-unis/presidentielle-americaine-trois-questions-sur-l-acharnement-de-donald-trump-a-contester-sa-defaite-7088824,2021-07-15 14:13:10,national
Havre-Saint-Pierre ,Biden OR Trump,12,Ouest-France,"États-Unis. Donald Trump se démène en Floride, mais Joe Biden domine les sondages",2020-10-17,271,https://www.ouest-france.fr/monde/etats-unis/etats-unis-donald-trump-se-demene-en-floride-mais-joe-biden-domine-les-sondages-7018025,2021-07-15 14:13:10,national
Havre-Saint-Pierre ,Biden OR Trump,13,ladepeche.fr,Quelle vie pour Donald Trump après sa défaite à l'élection présidentielle ?,2020-11-08,249,https://www.ladepeche.fr/2020/11/08/quelle-vie-pour-donald-trump-apres-sa-defaite-a-lelection-presidentielle-9189564.php,2021-07-15 14:13:10,national
Havre-Saint-Pierre ,Biden OR Trump,14,Le Journal de Montréal,L'appel de la Gaspésie,,,https://www.journaldemontreal.com/2020/07/15/lappel-de-la-gaspesie,2021-07-15 14:13:11,national
Havre-Saint-Pierre ,Biden OR Trump,15,Paris-Normandie,Saint-Pierre-du-Vauvray : le maire sortant dépose un deuxième recours devant le Conseil d’Etat,2021-01-09,187,https://www.paris-normandie.fr/id155084/article/2021-01-09/saint-pierre-du-vauvray-le-maire-sortant-depose-un-deuxieme-recours-devant-le,2021-07-15 14:13:11,national
Havre-Saint-Pierre ,Biden OR Trump,16,Paris-Normandie,précédent Le président de la SNCF à Rouen au chevet des lignes Paris-Le Havre,2021-02-01,164,https://www.paris-normandie.fr/id161220/article/2021-02-01/le-president-de-la-sncf-rouen-au-chevet-des-lignes-paris-le-havre,2021-07-15 14:13:11,national
Havre-Saint-Pierre ,Biden OR Trump,17,HuffPost Quebec,La traversée du Bella Desgagnés : le trésor caché du tourisme québécois,,,https://quebec.huffingtonpost.ca/2018/05/22/de-rimouski-a-blanc-sablon-le-tresor-cache-du-tourisme-quebecois_a_23440968/,2021-07-15 14:13:12,national
Havre-Saint-Pierre ,Biden OR Trump,18,Le Quotidien - Groupe Capitales Médias,Un contrat de 32 millions $ à la Romaine-4 pour Fernand Gilbert,2020-08-18,331,https://www.lequotidien.com/affaires/un-contrat-de-32-millions--a-la-romaine-4-pour-fernand-gilbert-462bb5a7b87f0fd30cfb5ae0438f6a6f,2021-07-15 14:13:12,national
Havre-Saint-Pierre ,Biden OR Trump,19,24 heures,Exotisme en Suisse (22/41) - L’île Saint-Pierre sur les traces d’un promeneur solitaire,2020-07-30,350,https://www.24heures.ch/lile-saint-pierre-sur-les-traces-dun-promeneur-solitaire-971760680766,2021-07-15 14:13:12,national
Havre-Saint-Pierre ,Biden OR Trump,20,Ouest-France,États-Unis. Donald Trump refuse de témoigner lors de son procès en destitution,2021-02-05,160,https://www.ouest-france.fr/monde/etats-unis/donald-trump/etats-unis-donald-trump-refuse-de-temoigner-lors-de-son-proces-en-destitution-7143717,2021-07-15 14:13:13,national
Havre-Saint-Pierre ,Biden OR Trump,21,Journal de Montréal,De Ouagadougou à Havre-Saint-Pierre,,,https://www.journaldemontreal.com/2012/06/03/de-ouagadougou-a-havre-saint-pierre,2021-07-15 14:13:13,national
Havre-Saint-Pierre ,Biden OR Trump,22,Yahoo Actualités,"Deux suicides et un meurtre : près du Havre, la vengeance familiale vire au drame",2021-05-23,53,https://fr.news.yahoo.com/deux-suicides-meurtre-pr%C3%A8s-havre-060000427.html,2021-07-15 14:13:13,national
Havre-Saint-Pierre ,Biden OR Trump,23,Ouest-France,États-Unis. Joe Biden soigne sa gauche en début de mandat,2021-02-17,148,https://www.ouest-france.fr/monde/etats-unis/etats-unis-joe-biden-soigne-sa-gauche-en-debut-de-mandat-7157514,2021-07-15 14:13:13,national
Havre-Saint-Pierre ,Biden OR Trump,24,Ouest-France,États-Unis. Le plan de relance de Joe Biden fait l’objet d’âpres tractations au Sénat,2021-03-06,131,https://www.ouest-france.fr/monde/etats-unis/etats-unis-le-plan-de-relance-de-joe-biden-fait-l-objet-d-apres-tractations-au-senat-7176806,2021-07-15 14:13:14,national
Havre-Saint-Pierre ,Biden OR Trump,25,Ouest-France,Le gouvernement Trump procède à une nouvelle exécution malgré la pandémie de Covid-19,2020-12-11,216,https://www.ouest-france.fr/societe/peine-de-mort/le-gouvernement-trump-se-prepare-a-une-nouvelle-execution-malgre-la-pandemie-de-covid-19-7080998,2021-07-15 14:13:14,national
Havre-Saint-Pierre ,déficit,1,Ouest-France,Normandie. Revivez le premier tour des élections régionales et départementales du 20 juin 2021,2021-06-21,24,https://www.ouest-france.fr/elections/regionales/direct-normandie-regionales-et-departementales-tous-les-resultats-des-elections-b81fa25e-d1c7-11eb-8e4c-918871d455e6,2021-07-15 14:13:26,national
Havre-Saint-Pierre ,déficit,2,Le Journal de Québec,Jusqu'à 1 M$ par chambre: des maisons des aînés qui vont coûter une vraie fortune,2021-06-04,41,https://www.journaldequebec.com/2021/06/04/des-maisons-des-aines-qui-vont-couter-une-vraie-fortune,2021-07-15 14:13:26,national
Havre-Saint-Pierre ,déficit,3,La Presse,"« Je n'ai jamais vu ça, une sécheresse comme ça »",2021-06-08,37,https://www.lapresse.ca/actualites/2021-06-08/je-n-ai-jamais-vu-ca-une-secheresse-comme-ca.php,2021-07-15 14:13:27,national
Havre-Saint-Pierre ,déficit,4,La Tribune,"Covid-19 en 24h : réouverture des restaurants, magasins Printemps, déficit en zone euro...",2021-04-26,80,https://www.latribune.fr/economie/france/covid-19-en-24h-reouverture-des-restaurants-magasins-printemps-deficit-en-zone-euro-883293.html,2021-07-15 14:13:27,national
Havre-Saint-Pierre ,déficit,5,France Bleu,INFO FRANCE BLEU : le HAC va terminer la saison avec dix millions d’euros de recettes en moins que prévu,2021-03-30,107,https://www.francebleu.fr/sports/football/info-france-bleu-le-hac-va-terminer-la-saison-avec-dix-millions-d-euros-de-recettes-en-moins-que-1617032824,2021-07-15 14:13:28,national
Havre-Saint-Pierre ,déficit,6,Paris-Normandie,Pour le géographe Laurent Chalard : « la Seine-Maritime souffre d'un déficit d'image »,2020-12-30,197,https://www.paris-normandie.fr/id152453/article/2020-12-30/pour-le-geographe-laurent-chalard-la-seine-maritime-souffre-dun-deficit-dimage,2021-07-15 14:13:28,national
Havre-Saint-Pierre ,déficit,7,Radio-Canada.ca,Ces HLM qui vivent sur du « temps emprunté »,2021-02-25,140,https://ici.radio-canada.ca/nouvelle/1773260/logements-sociaux-hlm-mauvais-etat-investissement-federal,2021-07-15 14:13:29,national
Havre-Saint-Pierre ,déficit,8,France Bleu,Ligue 2 : les actionnaires du HAC furieux contre les propos de Vincent Volpe,2021-04-30,76,https://www.francebleu.fr/sports/football/ligue-2-les-actionnaires-du-hac-furieux-contre-les-propos-de-vincent-volpe-1619785638,2021-07-15 14:13:29,national
Havre-Saint-Pierre ,déficit,9,Paris-Normandie,La filière logistique du lycée Saint-Vincent-de-Paul du Havre finalement maintenue,2021-03-12,125,https://www.paris-normandie.fr/id173082/article/2021-03-12/la-filiere-logistique-du-lycee-saint-vincent-de-paul-du-havre-finalement,2021-07-15 14:13:29,national
Havre-Saint-Pierre ,déficit,10,ICI.Radio-Canada.ca,Dix ans de la Romaine : les remous d'un chantier monumental,,,https://ici.radio-canada.ca/nouvelle/1169855/10-ans-la-romaine-hydro-quebec-electricite-barrage-chantier-cote-nord,2021-07-15 14:13:30,national
Havre-Saint-Pierre ,déficit,11,Ouest-France,Lanvollon. Des frais supplémentaires et un déficit enregistré pour l’Ogec,2021-06-14,31,https://www.ouest-france.fr/bretagne/lanvollon-22290/des-frais-supplementaires-et-un-deficit-enregistre-pour-logec-b07efb7f-3ab3-409e-a697-0a608e209aa9,2021-07-15 14:13:30,national
Havre-Saint-Pierre ,déficit,12,Paris-Normandie,"précédent Fécamp : une taxe poubelle à 17,3 % pour tous les habitants de l'Agglo",2021-04-14,92,https://www.paris-normandie.fr/id183227/article/2021-04-14/fecamp-une-taxe-poubelle-173-pour-tous-les-habitants-de-lagglo,2021-07-15 14:13:30,national
Havre-Saint-Pierre ,déficit,13,La Montagne,Clermont Foot - Le Havre (1-1) : Tell et Dossou ou le bal des entrants,2021-04-18,88,https://www.lamontagne.fr/clermont-ferrand-63000/sports/clermont-foot-le-havre-1-1-tell-et-dossou-ou-le-bal-des-entrants_13942364/,2021-07-15 14:13:31,national
Havre-Saint-Pierre ,déficit,14,France 3 Régions,Régionales 2021 en Normandie : découvrez la liste des candidats déclarés et leur programme,2021-05-17,59,https://france3-regions.francetvinfo.fr/normandie/regionales-2021-en-normandie-decouvrez-la-liste-des-candidats-declares-et-leur-programme-2090227.html,2021-07-15 14:13:31,national
Havre-Saint-Pierre ,déficit,15,Paris-Normandie,La Ville de Bois-Guillaume entend rattraper son retard en construction de logements sociaux,2021-02-02,163,https://www.paris-normandie.fr/id161660/article/2021-02-02/la-ville-de-bois-guillaume-entend-rattraper-son-retard-en-construction-de,2021-07-15 14:13:32,national
Havre-Saint-Pierre ,déficit,16,Paris-Normandie,"Au Havre, le Club nautique havrais nage en eaux claires malgré une «année blanche»",2020-10-16,272,https://www.paris-normandie.fr/art/actualites/societe/au-havre-le-club-nautique-havrais-nage-en-eaux-claires-malgre-une-annee-blanche-AA17357896,2021-07-15 14:13:32,national
Havre-Saint-Pierre ,déficit,17,ICI.Radio-Canada.ca,Gaspillage de la forêt québécoise au chantier de la Romaine,,,https://ici.radio-canada.ca/nouvelle/1001805/gaspillage-de-la-foret-quebecoise-au-chantier-de-la-romaine,2021-07-15 14:13:32,national
Havre-Saint-Pierre ,déficit,18,Paris-Normandie,"Popularité, nombre de licenciés... QRM bientôt en Ligue 2, ça change quoi pour Le Petit-Quevilly ?",2021-04-18,88,https://www.paris-normandie.fr/id184298/article/2021-04-18/popularite-nombre-de-licencies-qrm-bientot-en-ligue-2-ca-change-quoi-pour-le,2021-07-15 14:13:32,national
Havre-Saint-Pierre ,déficit,19,Paris-Normandie,"À Saint-Marcel, dans l’Eure, l’avenir du camping est bien sombre",2021-04-10,96,https://www.paris-normandie.fr/id181764/article/2021-04-10/saint-marcel-dans-leure-lavenir-du-camping-est-bien-sombre,2021-07-15 14:13:33,national
Havre-Saint-Pierre ,déficit,20,Paris-Normandie,Un label pour défendre leur savoir-faire : ces boulangers de Normandie qui prônent le fait maison,2021-03-02,135,https://www.paris-normandie.fr/id170114/article/2021-03-02/un-label-pour-defendre-leur-savoir-faire-ces-boulangers-de-normandie-qui-pronent,2021-07-15 14:13:33,national
Havre-Saint-Pierre ,déficit,21,Paris-Normandie,Des Normands se sont lancés dans le projet (un peu) fou de produire du vin local,2021-04-17,89,https://www.paris-normandie.fr/id184189/article/2021-04-17/des-normands-se-sont-lances-dans-le-projet-un-peu-fou-de-produire-du-vin-local,2021-07-15 14:13:33,national
Havre-Saint-Pierre ,déficit,22,Ouest-France,Lorient. Un nouveau président au Lorient tennis-club – Ouest-France,2021-06-03,42,https://www.ouest-france.fr/bretagne/lorient-56100/lorient-un-nouveau-president-au-lorient-tennis-club-d2a7c9b2-c461-11eb-9a3b-3513ab8ec4ec,2021-07-15 14:13:33,national
Havre-Saint-Pierre ,déficit,23,Ouest-France,En Mayenne. Ils roulaient tous à plus de 145 km/h,2021-04-07,99,https://www.ouest-france.fr/pays-de-la-loire/mayenne-53100/en-mayenne-ils-roulaient-tous-a-plus-de-145-km-h-3a1deeaa-9785-11eb-857f-b72ea088bc99,2021-07-15 14:13:34,national
Havre-Saint-Pierre ,déficit,24,Le Soleil - Groupe Capitales Médias,La Côte-Nord prisée des vacanciers | Affaires,,,https://www.lesoleil.com/affaires/la-cote-nord-prisee-des-vacanciers-c878ca999335868a7633208c61568d8b,2021-07-15 14:13:34,national
Havre-Saint-Pierre ,déficit,25,Ouest-France,Saint-Lô. L’Union des cyclotouristes a un nouveau bureau et continue les sorties,2021-03-09,128,https://www.ouest-france.fr/normandie/saint-lo-50000/saint-lo-l-union-des-cyclotouristes-a-un-nouveau-bureau-et-continue-les-sorties-7179996,2021-07-15 14:13:34,national
