Villes,Mots-clés,position du média,Nom du média,Titre de l'article,Date de publication,Journée de différence,URL,date et heure saisie,type mot-clés
Amqui,élection OR campagne,1,L'Avant-Poste,Une campagne de terrain pour la députée Kristina Michaud,2021-09-01,29,https://www.lavantposte.ca/article/2021/09/01/une-campagne-de-terrain-pour-la-deputee-kristina-michaud,2021-09-30 17:13:22,mixte
Amqui,élection OR campagne,2,Mon Matane,Victoire écrasante de Kristina Michaud dans Avignon-La Mitis-Matane-Matapédia,2021-09-21,9,https://monmatane.com/victoire-ecrasante-de-kristina-michaud-dans-avignon-la-mitis-matane-matapedia/,2021-09-30 17:13:22,mixte
Amqui,élection OR campagne,3,Le Soleil - Groupe Capitales Médias,"Les bloquistes maintiennent leurs gains dans l'Est, la ministre Lebouthillier réélue",2021-09-21,9,https://www.lesoleil.com/actualite/les-elections-federales/les-bloquistes-maintiennent-leurs-gains-dans-lest-la-ministre-lebouthillier-reelue-28c0ad7a49af5b467ddbefaefea2393f,2021-09-30 17:13:23,mixte
Amqui,élection OR campagne,4,L’Avantage gaspésien,Dernier tour de piste à Matane pour le libéral Louis-Éric Savoie avant le Jour J,2021-09-16,14,https://www.lavantagegaspesien.com/article/2021/09/16/dernier-tour-de-piste-a-matane-pour-le-liberal-louis-eric-savoie-avant-le-jour-j,2021-09-30 17:13:23,mixte
Amqui,élection OR campagne,5,L'Avant-Poste,Nouvelle candidate à la mairie d'Amqui,2021-08-03,58,https://www.lavantposte.ca/article/2021/08/03/nouvelle-candidate-a-la-mairie-d-amqui,2021-09-30 17:13:23,mixte
Amqui,élection OR campagne,6,L'Avant-Poste,Jean-Yves Fournier s'ajoute dans la course à la mairie d'Amqui,2021-09-23,7,https://www.lavantposte.ca/article/2021/09/23/jean-yves-fournier-s-ajoute-dans-la-course-a-la-mairie-d-amqui,2021-09-30 17:13:23,mixte
Amqui,élection OR campagne,7,ICI.Radio-Canada.ca,Un premier candidat à la mairie d'Amqui,2021-06-23,99,https://ici.radio-canada.ca/nouvelle/1803936/normand-boulianne-amqui-mairie-conseiller-elections,2021-09-30 17:13:24,mixte
Amqui,élection OR campagne,8,ICI.Radio-Canada.ca,La conseillère Sylvie Blanchette tentera de se faire élire mairesse d'Amqui | Élections municipales au Québec 2021,2021-08-24,37,https://ici.radio-canada.ca/nouvelle/1814246/sylvie-blanchette-mairesse-amqui-elections-municipales,2021-09-30 17:13:24,mixte
Amqui,élection OR campagne,9,Mon Matane,Un petit avant-goût des élections municipales à Matane et à Amqui,2021-08-05,56,https://monmatane.com/un-petit-avant-gout-des-elections-municipales-a-matane-et-amqui/,2021-09-30 17:13:24,mixte
Amqui,élection OR campagne,10,L'Avant-Poste,Le maire de Causapscal tire sa révérence,2021-04-27,156,https://www.lavantposte.ca/article/2021/04/27/le-maire-de-causapscal-tire-sa-reverence,2021-09-30 17:13:24,mixte
Amqui,élection OR campagne,11,ICI.Radio-Canada.ca,"Amqui reçoit 3,3 M$ pour le gymnase au CMÉC et la rénovation du Carrefour-Sportif",2021-05-31,122,https://ici.radio-canada.ca/nouvelle/1797468/projet-gymnase-centre-etudes-collegiales-matapedien-amqui-pafirs,2021-09-30 17:13:24,mixte
Amqui,élection OR campagne,12,iHeartRadio,Il y aura une course à la mairie d'Amqui,2021-07-30,62,https://www.iheartradio.ca/rouge-fm/rouge-fm-rimouski/nouvelles/il-y-aura-une-course-a-la-mairie-d-amqui-1.15738613,2021-09-30 17:13:25,mixte
Amqui,élection OR campagne,13,ICI.Radio-Canada.ca,"Le « train » de la vaccination est lancé, affirme le CISSS du Bas-Saint-Laurent | Coronavirus",2021-03-18,196,https://ici.radio-canada.ca/nouvelle/1778167/coronavirus-vaccins-rimouski-amqui-campagne-sante-eglise-pie-x,2021-09-30 17:13:25,mixte
Amqui,élection OR campagne,14,L'Avant-Poste,Pierre D'Amours ne se présentera pas aux prochaines élections,2021-04-20,163,https://www.lavantposte.ca/article/2021/04/20/pierre-d-amours-ne-se-presentera-pas-aux-prochaines-elections,2021-09-30 17:13:25,mixte
Amqui,élection OR campagne,15,L'Avant-Poste,Éric Barnabé à nouveau candidat pour le Parti populaire du Canada dans Avignon-La Mitis-Matane-Matapédia.,2021-08-29,32,https://www.lavantposte.ca/article/2021/08/29/eric-barnabe-a-nouveau-candidat-pour-le-parti-populaire-du-canada-dans-avignon-la-mitis-matane-matapedia,2021-09-30 17:13:25,mixte
Amqui,élection OR campagne,16,L'Avant-Poste,Sayabec : Marcel Belzile sollicite un deuxième mandat à la mairie,2021-08-17,44,https://www.lavantposte.ca/article/2021/08/17/sayabec-marcel-belzile-sollicite-un-deuxieme-mandat-a-la-mairie,2021-09-30 17:13:26,mixte
Amqui,élection OR campagne,17,L'Avant-Poste,Les 80 ans et plus vaccinés fin mars à Amqui,2021-03-03,211,https://www.lavantposte.ca/article/2021/03/03/les-80-ans-et-plus-vaccines-fin-mars-a-amqui,2021-09-30 17:13:26,mixte
Amqui,élection OR campagne,18,L'Avant-Poste,Les candidats ouvrent leurs locaux de campagne à Amqui,,,https://www.lavantposte.ca/article/2019/09/11/les-candidats-ouvrent-leurs-locaux-de-campagne-a-amqui,2021-09-30 17:13:26,mixte
Amqui,élection OR campagne,19,Mon Matane,"Pavage aidant, la route entre Matane et Amqui prend du mieux",2021-06-17,105,https://monmatane.com/pavage-aidant-la-route-entre-matane-et-amqui-prend-mieux/,2021-09-30 17:13:26,mixte
Amqui,élection OR campagne,20,L'Avant-Poste,Kristina Michaud devient officiellement candidate du Bloc québécois aux prochaines élections,2021-08-12,49,https://www.lavantposte.ca/article/2021/08/12/kristina-michaud-devient-officiellement-candidate-du-bloc-quebecois-aux-prochaines-elections,2021-09-30 17:13:27,mixte
Amqui,élection OR campagne,21,iHeartRadio,Une première candidature dans le district du Bic,2021-06-08,114,https://www.iheartradio.ca/rouge-fm/rouge-fm-rimouski/nouvelles/une-premiere-candidature-dans-le-district-du-bic-1.15378891,2021-09-30 17:13:27,mixte
Amqui,élection OR campagne,22,iHeartRadio,Inauguration du nouveau garage municipal à Amqui,2021-06-17,105,https://www.iheartradio.ca/rouge-fm/rouge-fm-rimouski/nouvelles/inauguration-du-nouveau-garage-municipal-a-amqui-1.15439191,2021-09-30 17:13:27,mixte
Amqui,élection OR campagne,23,ICI.Radio-Canada.ca,Portrait de circonscription : Rimouski-Neigette–Témiscouata–Les Basques | Élections Canada 2021,2021-08-17,44,https://ici.radio-canada.ca/nouvelle/1817166/circonscription-rimouski-neigette-temiscouata-basques-elections,2021-09-30 17:13:27,mixte
Amqui,élection OR campagne,24,iHeartRadio,France Gagnon est la candidate des conservateurs dans Rimouski-Neigette-Témiscouata-Les Basques,2021-08-10,51,https://www.iheartradio.ca/rouge-fm/rouge-fm-rimouski/nouvelles/france-gagnon-est-la-candidate-des-conservateurs-dans-rimouski-neigette-temiscouata-les-basques-1.15816467,2021-09-30 17:13:27,mixte
Amqui,élection OR campagne,25,ICI.Radio-Canada.ca,La MRC de La Matapédia intente un recours judiciaire contre la Ville d'Amqui,,,https://ici.radio-canada.ca/nouvelle/1730248/amqui-matapedia-mrc-entente-justice-tribunal-conflit-municipal,2021-09-30 17:13:28,mixte
Amqui,député,1,Le Soleil - Groupe Capitales Médias,"Les bloquistes maintiennent leurs gains dans l'Est, la ministre Lebouthillier réélue",2021-09-21,9,https://www.lesoleil.com/actualite/les-elections-federales/les-bloquistes-maintiennent-leurs-gains-dans-lest-la-ministre-lebouthillier-reelue-28c0ad7a49af5b467ddbefaefea2393f,2021-09-30 17:14:03,mixte
Amqui,député,2,Mon Matane,Victoire écrasante de Kristina Michaud dans Avignon-La Mitis-Matane-Matapédia,2021-09-21,9,https://monmatane.com/victoire-ecrasante-de-kristina-michaud-dans-avignon-la-mitis-matane-matapedia/,2021-09-30 17:14:03,mixte
Amqui,député,3,L’Avantage gaspésien,Dernier tour de piste à Matane pour le libéral Louis-Éric Savoie avant le Jour J,2021-09-16,14,https://www.lavantagegaspesien.com/article/2021/09/16/dernier-tour-de-piste-a-matane-pour-le-liberal-louis-eric-savoie-avant-le-jour-j,2021-09-30 17:14:03,mixte
Amqui,député,4,Mon Matane,Éphémérides du 25 septembre : Gaétan Bernier fait revivre en 2009 le village de Saint-Nil fermé en 1974,2021-09-25,5,https://monmatane.com/ephemerides-du-25-septembre-gaetan-bernier-fait-revivre-en-2009-le-village-de-saint-nil-ferme-en-1974/,2021-09-30 17:14:04,mixte
Amqui,député,5,Mon Matane,Éphémérides du 4 septembre : Matane achète l'ancien Théâtre National pour en faire un stationnement,2021-09-04,26,https://monmatane.com/ephemerides-du-4-septembre-matane-achete-lancien-theatre-national-pour-en-faire-un-stationnement/,2021-09-30 17:14:04,mixte
Amqui,député,6,L'Avant-Poste,Kristina Michaud devient officiellement candidate du Bloc québécois aux prochaines élections,2021-08-12,49,https://www.lavantposte.ca/article/2021/08/12/kristina-michaud-devient-officiellement-candidate-du-bloc-quebecois-aux-prochaines-elections,2021-09-30 17:14:04,mixte
Amqui,député,7,ICI.Radio-Canada.ca,"Pandémie, départ et enjeux locaux pour Pascal Bérubé",2021-06-18,104,https://ici.radio-canada.ca/nouvelle/1802779/pascal-berube-bilan-session-parlementaire-2021-parti-quebecois,2021-09-30 17:14:04,mixte
Amqui,député,8,journal le soir,Le procès pour parjure de l'homme d'affaires Jacques Dumont terminé,2021-09-02,28,https://journallesoir.ca/2021/09/02/le-proces-pour-parjure-de-lhomme-daffaires-jacques-dumont-termine/,2021-09-30 17:14:04,mixte
Amqui,député,9,iHeartRadio,Inauguration du nouveau garage municipal à Amqui,2021-06-17,105,https://www.iheartradio.ca/rouge-fm/rouge-fm-rimouski/nouvelles/inauguration-du-nouveau-garage-municipal-a-amqui-1.15439191,2021-09-30 17:14:05,mixte
Amqui,député,10,journal le soir,Verdict rendu le 8 octobre dans le procès de parjure de Jacques Dumont,2021-09-03,27,https://journallesoir.ca/2021/09/03/verdict-rendu-le-8-octobre-dans-le-proces-de-parjure-de-jacques-dumont/,2021-09-30 17:14:05,mixte
Amqui,député,11,ICI.Radio-Canada.ca,Entente entre la MRC et la Ville d'Amqui,2021-08-25,36,https://ici.radio-canada.ca/nouvelle/1819253/entente-services-municipaux-mrc-matapedia-amqui-centre-administratif,2021-09-30 17:14:05,mixte
Amqui,député,12,ICI.Radio-Canada.ca,"Amqui reçoit 3,3 M$ pour le gymnase au CMÉC et la rénovation du Carrefour-Sportif",2021-05-31,122,https://ici.radio-canada.ca/nouvelle/1797468/projet-gymnase-centre-etudes-collegiales-matapedien-amqui-pafirs,2021-09-30 17:14:05,mixte
Amqui,député,13,L'Avant-Poste,Kristina Michaud : une politicienne bien ancrée dans sa circonscription,2021-08-25,36,https://www.lavantposte.ca/article/2021/08/25/kristina-michaud-une-politicienne-bien-ancree-dans-sa-circonscription,2021-09-30 17:14:05,mixte
Amqui,député,14,journal le soir,Amqui inaugure son nouveau garage municipal,2021-06-19,103,https://journallesoir.ca/2021/06/19/amqui-inaugure-son-nouveau-garage-municipal/,2021-09-30 17:14:06,mixte
Amqui,député,15,ICI.Radio-Canada.ca,Un premier candidat à la mairie d'Amqui,2021-06-23,99,https://ici.radio-canada.ca/nouvelle/1803936/normand-boulianne-amqui-mairie-conseiller-elections,2021-09-30 17:14:06,mixte
Amqui,député,16,iHeartRadio,Le député Harold Lebel est accusé d'agression sexuelle,2021-01-11,262,https://www.iheartradio.ca/rouge-fm/rouge-fm-amqui/nouvelles/le-depute-harold-lebel-est-accuse-d-agression-sexuelle-1.14345971,2021-09-30 17:14:06,mixte
Amqui,député,17,Info Dimanche,Près de 868 000 $ pour améliorer la couverture ambulancière à Cabano | infodimanche.com,2021-04-30,153,https://www.infodimanche.com/actualites/actualite/424694/pres-de-868-000-$-pour-ameliorer-la-couverture-ambulanciere-a-cabano,2021-09-30 17:14:07,mixte
Amqui,député,18,Le Soleil - Groupe Capitales Médias,Le député Will Amos «nu» lors de la période de questions à Ottawa,2021-04-14,169,https://www.lesoleil.com/actualite/le-depute-will-amos-nu-lors-de-la-periode-de-questions-a-ottawa-fba299fc5f3807b71753a2768f4adde6,2021-09-30 17:14:07,mixte
Amqui,député,19,L'Avant-Poste,Un pionnier du monde de la santé honoré à Amqui,,,https://www.lavantposte.ca/article/2020/09/15/un-pionnier-du-monde-de-la-sante-honore-a-amqui,2021-09-30 17:14:07,mixte
Amqui,député,20,Radio-Canada.ca,Pascal Bérubé quittera les fonctions de chef parlementaire du Parti québécois,2021-07-02,90,https://ici.radio-canada.ca/nouvelle/1805766/politique-quebec-pascal-berube-chef-parlementaire-quitte-ete,2021-09-30 17:14:07,mixte
Amqui,député,21,L'Avant-Poste,Les candidats ouvrent leurs locaux de campagne à Amqui,,,https://www.lavantposte.ca/article/2019/09/11/les-candidats-ouvrent-leurs-locaux-de-campagne-a-amqui,2021-09-30 17:14:08,mixte
Amqui,député,22,ICI.Radio-Canada.ca,Les députés du Bloc québécois en route vers le caucus à Bonaventure,,,https://ici.radio-canada.ca/nouvelle/1727253/bloc-yves-francois-blanchet-quebec-gaspe-riviere-loup-rimouski-amqui-bonaventure,2021-09-30 17:14:08,mixte
Amqui,député,23,ICI.Radio-Canada.ca,Portrait de circonscription : Rimouski-Neigette–Témiscouata–Les Basques | Élections Canada 2021,2021-08-17,44,https://ici.radio-canada.ca/nouvelle/1817166/circonscription-rimouski-neigette-temiscouata-basques-elections,2021-09-30 17:14:08,mixte
Amqui,député,24,ICI.Radio-Canada.ca,François Lapointe candidat libéral dans Montmagny–L'Islet–Kamouraska–Rivière-du-Loup | Élections Canada 2021,2021-08-17,44,https://ici.radio-canada.ca/nouvelle/1817081/francois-lapointe-candidat-parti-liberal-canada-plc-montmagny-lislet-kamouraska-rdl,2021-09-30 17:14:08,mixte
Amqui,député,25,Mon Matane,"Pavage aidant, la route entre Matane et Amqui prend du mieux",2021-06-17,105,https://monmatane.com/pavage-aidant-la-route-entre-matane-et-amqui-prend-mieux/,2021-09-30 17:14:08,mixte
Amqui,"""arme à feu""",1,Le Nouvelliste - Groupe Capitales Médias,Trois-Rivières: un individu atteint par balles au centre-ville,2021-07-18,74,https://www.lenouvelliste.ca/actualites/justice-et-faits-divers/trois-rivieres-un-individu-atteint-par-balles-au-centre-ville-3f763d5242f859b9e90209c8e413b9d0,2021-09-30 17:14:15,mixte
Amqui,"""arme à feu""",2,Le Nouvelliste - Groupe Capitales Médias,Tentative de meurtre à Trois-Rivières: un jeune de 17 ans détenu,2021-07-19,73,https://www.lenouvelliste.ca/actualites/justice-et-faits-divers/tentative-de-meurtre-a-trois-rivieres-un-jeune-de-17-ans-detenu-04922f1261e0dbe0bb9f7b95a93aa78f,2021-09-30 17:14:16,mixte
Amqui,"""arme à feu""",3,Le Soleil - Groupe Capitales Médias,L'enfant happé par un véhicule à Amqui est décédé,,,https://www.lesoleil.com/actualites/lenfant-happe-par-un-vehicule-a-amqui-est-decede-bc68bc31de44d5b6947441f3d5acd3ab,2021-09-30 17:14:16,mixte
Amqui,"""arme à feu""",4,Le Soleil - Groupe Capitales Médias,Une grève des douaniers canadiens de plus en plus probable,2021-08-03,58,https://www.lesoleil.com/actualite/une-greve-des-douaniers-canadiens-de-plus-en-plus-probable-e524279d8e37a68285cee35438b4d072,2021-09-30 17:14:16,mixte
Amqui,"""arme à feu""",5,iHeartRadio,"Le Bas-Saint-Laurent reste en zone orange, les élus satisfaits",2020-10-14,351,https://www.iheartradio.ca/rouge-fm/rouge-fm-rimouski/nouvelles/le-bas-saint-laurent-reste-en-zone-orange-les-elus-satisfaits-1.13707352,2021-09-30 17:14:16,mixte
Amqui,"""arme à feu""",6,CIMT-CHAU,Places en garderie : une mobilisation dimanche à Rivière-du-Loup,2021-05-08,145,https://cimtchau.ca/nouvelles/places-en-garderie-une-mobilisation-dimanche-a-riviere-du-loup/,2021-09-30 17:14:17,mixte
Amqui,"""arme à feu""",7,Le Soleil - Groupe Capitales Médias,Le torchon brûle entre la MRC de La Matapédia et la Ville d'Amqui,,,https://www.lesoleil.com/actualite/en-region/le-torchon-brule-entre-la-mrc-de-la-matapedia-et-la-ville-damqui-3bd1e4fd9cb30133f24dd06957fbd044,2021-09-30 17:14:17,mixte
Amqui,"""arme à feu""",8,Le Soleil - Groupe Capitales Médias,Un motoneigiste perd la vie dans La Matapédia,2021-03-20,194,https://www.lesoleil.com/actualite/en-region/un-motoneigiste-perd-la-vie-dans-la-matapedia-654245f6f09ed7339a58f14dcf5db1c0,2021-09-30 17:14:17,mixte
Amqui,"""arme à feu""",9,Le Soleil - Groupe Capitales Médias,Disparition à Amqui: le corps de Françoise St-Onge retrouvé dans la rivière Matapédia,,,https://www.lesoleil.com/actualite/en-region/disparition-a-amqui-le-corps-de-francoise-st-onge-retrouve-dans-la-riviere-matapedia-151429deef31adbe9540bf54e7e494cd,2021-09-30 17:14:17,mixte
Amqui,"""arme à feu""",10,Le Soleil - Groupe Capitales Médias,Le wagon Lynnewood quitte Amqui pour la Pennsylvanie,,,https://www.lesoleil.com/actualites/le-wagon-lynnewood-quitte-amqui-pour-la-pennsylvanie-718a049f35c2d485394b432af82217a5,2021-09-30 17:14:18,mixte
Amqui,"""arme à feu""",11,Le Soleil - Groupe Capitales Médias,"Accusé à tort, Mamadi Fara Camara poursuit Montréal et le DPCP",2021-07-14,78,https://www.lesoleil.com/actualite/accuse-a-tort-mamadi-fara-camara-poursuit-montreal-et-le-dpcp-fe3862e6268ce16555476c959bb87d18,2021-09-30 17:14:18,mixte
Amqui,"""arme à feu""",12,ICI.Radio-Canada.ca,Des milliers de chasseurs à l'orignal au Bas-Saint-Laurent et en Gaspésie,,,https://ici.radio-canada.ca/nouvelle/1352721/chasse-orignal-carabine-arme-bsl-est,2021-09-30 17:14:18,mixte
Amqui,"""arme à feu""",13,Le Nouvelliste - Groupe Capitales Médias,Vol à main armée à la bijouterie La Perle Rare du Cap-de-la-Madeleine,2020-11-28,306,https://www.lenouvelliste.ca/actualites/justice-et-faits-divers/vol-a-main-armee-a-la-bijouterie-la-perle-rare-du-cap-de-la-madeleine-3f0b94ff92bd68e998d0f1a1324ede19,2021-09-30 17:14:18,mixte
Amqui,"""arme à feu""",14,Mon Matane,Éphémérides 27 mars : Philéas Blouin condamné à la pendaison puis à l'emprisonnement à vie,2021-03-27,187,https://monmatane.com/ephemerides-27-mars-phileas-blouin-condamne-a-la-pendaison-puis-a-lemprisonnement-a-vie/,2021-09-30 17:14:18,mixte
Amqui,"""arme à feu""",15,Le Soleil - Groupe Capitales Médias,Amqui: un chirurgien refuse de pratiquer des césariennes,,,https://www.lesoleil.com/actualite/en-region/amqui-un-chirurgien-refuse-de-pratiquer-des-cesariennes-5fa45a10f3f62c1c9c70ab8826078ca1,2021-09-30 17:14:18,mixte
Amqui,"""arme à feu""",16,Mon Matane,Éphémérides du 2 juin : le bloquiste René Canuel facilement réélu dans Matapédia-Matane en 1997,2021-06-02,120,https://monmatane.com/ephemerides-du-2-juin-le-bloquiste-rene-canuel-facilement-reelu-dans-matapedia-matane-en-1997/,2021-09-30 17:14:19,mixte
Amqui,"""arme à feu""",17,Le Soleil - Groupe Capitales Médias,PolySeSouvient demande au ministre Blair de concrétiser la promesse sur les armes,,,https://www.lesoleil.com/actualite/polysesouvient-demande-au-ministre-blair-de-concretiser-la-promesse-sur-les-armes-ea82bd0682e958dadf236b5ce6ea84b8,2021-09-30 17:14:19,mixte
Amqui,"""arme à feu""",18,Mon Matane,Éphémérides du 26 août : un mort et plus de 125 000 $ de dommages à la suite d'une explosion dans un garage en 1957 à Matane,2021-08-26,35,https://monmatane.com/ephemerides-du-26-aout-un-mort-et-plus-de-125-000-de-dommages-a-la-suite-dune-explosion-dans-un-garage-en-1957-a-matane/,2021-09-30 17:14:19,mixte
Amqui,"""arme à feu""",19,Le Soleil - Groupe Capitales Médias,Le Bas-Saint-Laurent prêt à vacciner ses résidents de 80 ans et plus,2021-02-24,218,https://www.lesoleil.com/actualite/en-region/le-bas-saint-laurent-pret-a-vacciner-ses-residents-de-80-ans-et-plus-0a8a74301fef2fb30f4995f7a308bbe2,2021-09-30 17:14:19,mixte
Amqui,"""arme à feu""",20,ICI.Radio-Canada.ca,Début de la chasse à l'orignal sur la réserve faunique Duchénier,,,https://ici.radio-canada.ca/nouvelle/1294127/chasse-orignal-reserve-faunique-duchenier-rimouski,2021-09-30 17:14:20,mixte
Amqui,"""arme à feu""",21,ICI.Radio-Canada.ca,Chasse à l'orignal : la face méconnue du tourisme de luxe,,,https://ici.radio-canada.ca/nouvelle/1364039/chasse-orignaux-chasseurs-gaspesie-tarifs-prix-pourvoiries,2021-09-30 17:14:20,mixte
Amqui,"""arme à feu""",22,Le Soleil - Groupe Capitales Médias,Décès de l'agriculteur Claude Rivard: «on vient de perdre une bibliothèque»,2021-05-18,135,https://www.lesoleil.com/actualite/en-region/deces-de-lagriculteur-claude-rivard-on-vient-de-perdre-une-bibliotheque-79db902d449ea2e7bbbca5f40a016e60,2021-09-30 17:14:20,mixte
Amqui,"""arme à feu""",23,Mon Matane,Éphémérides 30 mars : la pendaison puis le pénitencier pour Élise Plante-Dubé,2021-03-30,184,https://monmatane.com/ephemerides-30-mars-la-pendaison-puis-le-penitencier-pour-elise-plante-dube/,2021-09-30 17:14:20,mixte
Amqui,"""arme à feu""",24,TVA Nouvelles,Funérailles du père et ses fils tués dans un accident à Saint-Vianney,,,https://www.tvanouvelles.ca/2018/01/17/funerailles-du-pere-et-ses-fils-tues-dans-un-accident-a-saint-vianney,2021-09-30 17:14:21,mixte
Amqui,"""arme à feu""",25,Le Soleil - Groupe Capitales Médias,Un premier festival de danse contemporaine en Gaspésie,,,https://www.lesoleil.com/arts/un-premier-festival-de-danse-contemporaine-en-gaspesie-f70a7be60232c2d834d601f44c4303f6,2021-09-30 17:14:21,mixte
Amqui,"""santé publique""",1,NecrologieCanada,EdmondGignac 2021,2021-09-29,1,https://necrocanada.com/deces-2021/edmondgignac-2021/,2021-09-30 17:14:28,mixte
Amqui,"""santé publique""",2,NecrologieCanada,LauraGallant 2021,2021-09-28,2,https://necrocanada.com/deces-2021/lauragallant-2021/,2021-09-30 17:14:28,mixte
Amqui,"""santé publique""",3,NecrologieCanada,PierretteBerube Morin Le vendredi 28 janvier 1949 Le vendredi 24 septembre 2021,2021-09-29,1,https://necrocanada.com/deces-2021/pierretteberube-morin-le-vendredi-28-janvier-1949-le-vendredi-24-septembre-2021/,2021-09-30 17:14:28,mixte
Amqui,"""santé publique""",4,NecrologieCanada,LauraGallant Le mardi 27 janvier 1959 Le vendredi 24 septembre 2021,2021-09-28,2,https://necrocanada.com/deces-2021/lauragallant-le-mardi-27-janvier-1959-le-vendredi-24-septembre-2021/,2021-09-30 17:14:29,mixte
Amqui,"""santé publique""",5,NecrologieCanada,PierretteBerube Morin 2021,2021-09-29,1,https://necrocanada.com/deces-2021/pierretteberube-morin-2021/,2021-09-30 17:14:29,mixte
Amqui,"""santé publique""",6,NecrologieCanada,Marie-BertheParent Le dimanche 12 mai 1940 Le vendredi 24 septembre 2021,2021-09-27,3,https://necrocanada.com/deces-2021/marie-bertheparent-le-dimanche-12-mai-1940-le-vendredi-24-septembre-2021/,2021-09-30 17:14:29,mixte
Amqui,"""santé publique""",7,NecrologieCanada,Jean-PaulGaudreault Le jeudi 23 juin 1938 Le vendredi 27 août 2021,2021-09-04,26,https://necrocanada.com/deces-2021/jean-paulgaudreault-le-jeudi-23-juin-1938-le-vendredi-27-aout-2021/,2021-09-30 17:14:29,mixte
Amqui,"""santé publique""",8,NecrologieCanada,GhislainVezina Le dimanche 3 août 1947 Le jeudi 9 septembre 2021,2021-09-14,16,https://necrocanada.com/deces-2021/ghislainvezina-le-dimanche-3-aout-1947-le-jeudi-9-septembre-2021/,2021-09-30 17:14:29,mixte
Amqui,"""santé publique""",9,NecrologieCanada,LydiaReichenbach Le mardi 24 mars 1964 Le samedi 25 septembre 2021,2021-09-27,3,https://necrocanada.com/deces-2021/lydiareichenbach-le-mardi-24-mars-1964-le-samedi-25-septembre-2021/,2021-09-30 17:14:30,mixte
Amqui,"""santé publique""",10,NecrologieCanada,DanielleLemieux Le dimanche 4 janvier 1953 Le dimanche 19 septembre 2021,2021-09-21,9,https://necrocanada.com/deces-2021/daniellelemieux-le-dimanche-4-janvier-1953-le-dimanche-19-septembre-2021/,2021-09-30 17:14:30,mixte
Amqui,"""santé publique""",11,L'Avant-Poste,Les 80 ans et plus vaccinés fin mars à Amqui,2021-03-03,211,https://www.lavantposte.ca/article/2021/03/03/les-80-ans-et-plus-vaccines-fin-mars-a-amqui,2021-09-30 17:14:30,mixte
Amqui,"""santé publique""",12,NecrologieCanada,RaymondDurette Le dimanche 11 août 1935 Le samedi 11 septembre 2021,2021-09-14,16,https://necrocanada.com/deces-2021/raymonddurette-le-dimanche-11-aout-1935-le-samedi-11-septembre-2021/,2021-09-30 17:14:30,mixte
Amqui,"""santé publique""",13,NecrologieCanada,GastonLamarre Le dimanche 31 janvier 1954 Le mardi 21 septembre 2021,2021-09-24,6,https://necrocanada.com/deces-2021/gastonlamarre-le-dimanche-31-janvier-1954-le-mardi-21-septembre-2021/,2021-09-30 17:14:30,mixte
Amqui,"""santé publique""",14,ICI.Radio-Canada.ca,"Le « train » de la vaccination est lancé, affirme le CISSS du Bas-Saint-Laurent | Coronavirus",2021-03-18,196,https://ici.radio-canada.ca/nouvelle/1778167/coronavirus-vaccins-rimouski-amqui-campagne-sante-eglise-pie-x,2021-09-30 17:14:31,mixte
Amqui,"""santé publique""",15,L'Avant-Poste,Vaccination : une clinique mobile de passage dans la Vallée,2021-06-30,92,https://www.lavantposte.ca/article/2021/06/30/vaccination-une-clinique-mobile-de-passage-dans-la-vallee,2021-09-30 17:14:31,mixte
Amqui,"""santé publique""",16,NecrologieCanada,GabriellePineau Le lundi 4 mai 1931 Le mardi 21 septembre 2021,2021-09-29,1,https://necrocanada.com/deces-2021/gabriellepineau-le-lundi-4-mai-1931-le-mardi-21-septembre-2021/,2021-09-30 17:14:31,mixte
Amqui,"""santé publique""",17,NecrologieCanada,BrigitteVaillancourt Bouchard 2021,2021-09-13,17,https://necrocanada.com/deces-2021/brigittevaillancourt-bouchard-2021/,2021-09-30 17:14:31,mixte
Amqui,"""santé publique""",18,NecrologieCanada,YolandeMorin Hammond Le jeudi 19 octobre 1939 Le mardi 14 septembre 2021,2021-09-18,12,https://necrocanada.com/deces-2021/yolandemorin-hammond-le-jeudi-19-octobre-1939-le-mardi-14-septembre-2021/,2021-09-30 17:14:31,mixte
Amqui,"""santé publique""",19,NecrologieCanada,SylvieHarvey 2021,2021-09-07,23,https://necrocanada.com/deces-2021/sylvieharvey-2021/,2021-09-30 17:14:32,mixte
Amqui,"""santé publique""",20,NecrologieCanada,Marcelle-AlmaLevesque Le lundi 9 février 1931 Le mercredi 15 septembre 2021,2021-09-16,14,https://necrocanada.com/deces-2021/marcelle-almalevesque-le-lundi-9-fevrier-1931-le-mercredi-15-septembre-2021/,2021-09-30 17:14:32,mixte
Amqui,"""santé publique""",21,NecrologieCanada,Marie-PauleGauthier Le lundi 22 décembre 1930 Le vendredi 3 septembre 2021,2021-09-17,13,https://necrocanada.com/deces-2021/marie-paulegauthier-le-lundi-22-decembre-1930-le-vendredi-3-septembre-2021/,2021-09-30 17:14:32,mixte
