Ormstown,construction,1,Coup d'Oeil,Construction de 64 logements: un nouveau projet immobilier de 17 M$ à Saint-Rémi - Coup d'œil,2021-02-19,170,https://www.coupdoeil.info/2021/02/19/construction-de-64-logements-un-nouveau-projet-immobilier-de-17-m-a-saint-remi/,2021-08-08 09:43:01,mixte
Ormstown,construction,2,Le Journal Saint-François,La fin d'une époque : le Centre médical d'Ormstown ferme définitivement,2021-04-12,118,https://www.journalsaint-francois.ca/la-fin-dune-epoque-le-centre-medical-dormstown-ferme-definitivement/,2021-08-08 09:43:01,mixte
Ormstown,construction,3,Le Journal Saint-François,La future bibliothèque d'Ormstown pourrait coûter près de 2 millions $,2020-09-30,312,https://www.journalsaint-francois.ca/la-future-bibliotheque-dormstown-pourrait-couter-pres-de-2-millions/,2021-08-08 09:43:01,mixte
Ormstown,construction,4,Le Journal Saint-François,Le développement domiciliaire bat son plein à Ormstown,,,https://www.journalsaint-francois.ca/le-developpement-domiciliaire-bat-son-plein-a-ormstown/,2021-08-08 09:43:01,mixte
Ormstown,construction,5,CNW Telbec,Soutien aux infrastructures récréatives et sportives - Les gouvernements du Canada et du Québec investissent dans des projets récréatifs et sportifs dans la région de la Montérégie,2021-06-04,65,https://www.newswire.ca/fr/news-releases/soutien-aux-infrastructures-recreatives-et-sportives-les-gouvernements-du-canada-et-du-quebec-investissent-dans-des-projets-recreatifs-et-sportifs-dans-la-region-de-la-monteregie-878889317.html,2021-08-08 09:43:02,mixte
Ormstown,construction,6,Le Journal Saint-François,Ormstown en mode croissance,,,https://www.journalsaint-francois.ca/ormstown-mode-croissance/,2021-08-08 09:43:02,mixte
Ormstown,construction,7,Le Journal de Montréal,"TREMBLAY, Jean",2021-02-06,183,https://www.journaldemontreal.com/2021/02/06/80ca83c38e/tremblay-jean,2021-08-08 09:43:02,mixte
Ormstown,construction,8,Le Journal de Montréal,Trois accidents dans la cour de sa garderie en deux mois,2020-10-18,294,https://www.journaldemontreal.com/2020/10/18/trois-accidents-dans-la-cour-de-sa-garderie-en-deux-mois,2021-08-08 09:43:03,mixte
Ormstown,construction,9,Le Journal Saint-François,Plus de 360 000$ pour les infrastructures récréosportives,2021-05-31,69,https://www.journalsaint-francois.ca/Plus-de-36000-pour-les-infrastructures-recreosportives/,2021-08-08 09:43:03,mixte
Ormstown,construction,10,Le Journal de Montréal,Ormstown: il tue sa femme et retourne l'arme contre lui,,,https://www.journaldemontreal.com/2020/06/12/deux-septuagenaires-trouves-sans-vie-a-ormstown-1,2021-08-08 09:43:03,mixte
Ormstown,construction,11,INFOSuroit.com,Pelletée de terre pour le nouvel hôtel de ville d'Ormstown,,,https://www.infosuroit.com/pelletee-de-terre-pour-le-nouvel-hotel-de-ville-d-ormstown/,2021-08-08 09:43:03,mixte
Ormstown,construction,12,Le Journal de Montréal,"UPTON, Edward Gary",2020-12-31,220,https://www.journaldemontreal.com/2020/12/31/aa1abb26ea/upton-edward-gary,2021-08-08 09:43:03,mixte
Ormstown,construction,13,Le Journal de Chambly,"Couvre-feu : Montréal repasse à 20 h, la Montérégie reste à 21 h 30 - Le journal de Chambly",2021-04-08,122,https://www.journaldechambly.com/couvre-feu-montreal-repasse-a-20-h-la-monteregie-reste-a-21-h-30/,2021-08-08 09:43:03,mixte
Ormstown,construction,14,Le Journal de Montréal,"Les routes dangereuses du Québec : des victoires, mais à quel prix?",2020-10-17,295,https://www.journaldemontreal.com/2020/10/17/des-victoires-mais-a-quel-prix,2021-08-08 09:43:04,mixte
Ormstown,construction,15,Le Journal de Montréal,Ceux qui ont eu la COVID-19 près de chez vous,,,https://www.journaldemontreal.com/2020/06/10/ceux-qui-ont-eu-la-covid-19-pres-de-chez-vous,2021-08-08 09:43:04,mixte
Ormstown,construction,16,Le Journal de Montréal,"HÉBERT, Monique (née Grégoire)",2021-04-17,113,https://www.journaldemontreal.com/2021/04/17/f499b2e3f8/hebert-monique--nee-gregoire,2021-08-08 09:43:04,mixte
Ormstown,construction,17,ICI.Radio-Canada.ca,Les vidanges dans nos campagnes,,,https://ici.radio-canada.ca/info/2019/03/sols-contamines-terres-agricoles-enquete-quebec/,2021-08-08 09:43:04,mixte
Ormstown,construction,18,Le Journal de Montréal,Un médecin radié cinq ans pour une relation avec une patiente,2020-11-24,257,https://www.journaldemontreal.com/2020/11/24/un-medecin-radie-cinq-ans-pour-une-relation-avec-une-patiente-1,2021-08-08 09:43:04,mixte
Ormstown,construction,19,La Presse,"Internet haute vitesse en région | Les gouvernements versent 28,6 millions à Vidéotron pour connecter 5500 foyers",2021-06-14,55,https://www.lapresse.ca/affaires/techno/2021-06-14/internet-haute-vitesse-en-region/les-gouvernements-versent-28-6-millions-a-videotron-pour-connecter-5500-foyers.php,2021-08-08 09:43:05,mixte
Ormstown,construction,20,Le Journal de Québec,Enquêtes Morts après avoir pris du Viagra,2021-02-27,162,https://www.journaldequebec.com/2021/02/27/morts-apres-avoir-pris-du-viagra,2021-08-08 09:43:05,mixte
Ormstown,construction,21,INFOSuroit.com,Un nouveau directeur général à la Municipalité d'Ormstown,,,https://www.infosuroit.com/un-nouveau-directeur-general-a-la-municipalite-d-ormstown/,2021-08-08 09:43:05,mixte
Ormstown,construction,22,Le Journal de Montréal,Accidents de moto en série au Québec,2021-04-11,119,https://www.journaldemontreal.com/2021/04/10/saint-esprit-autre-accident-de-moto,2021-08-08 09:43:05,mixte
Ormstown,construction,23,Le Journal Saint-François,Ormstown inaugure son nouvel hôtel de ville,,,https://www.journalsaint-francois.ca/ormstown-inaugure-nouvel-hotel-de-ville/,2021-08-08 09:43:05,mixte
Ormstown,construction,24,LaPresse.ca,Construction: la prison après la vie de seigneur,,,https://www.lapresse.ca/actualites/justice-et-affaires-criminelles/affaires-criminelles/201402/09/01-4737167-construction-la-prison-apres-la-vie-de-seigneur.php,2021-08-08 09:43:05,mixte
Ormstown,construction,25,INFOSuroit.com,"Avec la chaleur, le projet de piscine refait surface à Ormstown",,,https://www.infosuroit.com/avec-la-chaleur-le-projet-de-piscine-refait-surface-a-ormstown/,2021-08-08 09:43:06,mixte
