Villes,Mots-clés,position du média,Nom du média,Titre de l'article,Date de publication,Journée de différence,URL,date et heure saisie
Baie-Comeau ,premier ministre,1,CNW Telbec,"Fonds d'initiatives nordiques - 21 projets de la Côte-Nord bénéficient d'un soutien de 1,9 M$",2021-06-30,3,https://www.newswire.ca/fr/news-releases/fonds-d-initiatives-nordiques-21-projets-de-la-cote-nord-beneficient-d-un-soutien-de-1-9-m--857487303.html,2021-07-03 19:07:04
Baie-Comeau ,premier ministre,2,Le Journal de Québec,"«On vous tend la main, M. Legault», dit le président d'Alliance forêt boréale",2021-06-17,16,https://www.journaldequebec.com/2021/06/17/on-vous-tend-la-main-m-legault-dit-le-president-dalliance-foret-boreale,2021-07-03 19:07:04
Baie-Comeau ,premier ministre,3,ICI.Radio-Canada.ca,Industrie forestière : Martin Ouellet veut éviter la perte définitive d'emplois,2021-06-17,16,https://ici.radio-canada.ca/nouvelle/1802265/usine-pate-papier-baie-comeau-martin-ouellet,2021-07-03 19:07:04
Baie-Comeau ,premier ministre,4,Journal Le Manic,"Le Fonds d'initiatives nordiques verse 1,9 M$ dans 21 projets sur la Côte-Nord",2021-07-02,1,https://www.lemanic.ca/2021/07/02/le-fonds-dinitiatives-nordiques-verse-19-m-dans-21-projets-sur-la-cote-nord/,2021-07-03 19:07:05
Baie-Comeau ,premier ministre,5,Journal Le Manic,Baie-Comeau cible à nouveau le pavillon Mance pour la Maison du premier ministre,2021-04-20,74,https://www.lemanic.ca/2021/04/20/baie-comeau-cible-a-nouveau-le-pavillon-mance-pour-la-maison-du-premier-ministre/,2021-07-03 19:07:05
Baie-Comeau ,premier ministre,6,Mon Matane,Éphémérides du 15 juin : René Lévesque président d'honneur du Festival de la crevette en 1979,2021-06-15,18,https://monmatane.com/ephemerides-du-15-juin-rene-levesque-president-dhonneur-du-festival-de-la-crevette-en-1979/,2021-07-03 19:07:05
Baie-Comeau ,premier ministre,7,Le Journal de Québec,Nos routes en déroute: bien des bris sur la route... d'un traversier,2021-06-05,28,https://www.journaldequebec.com/2021/06/05/nos-routes-en-deroute-bien-des-bris-sur-la-route-dun-traversier,2021-07-03 19:07:05
Baie-Comeau ,premier ministre,8,Journal Le Manic,Pâtes et papiers : le plan de sauvetage du premier ministre Legault ravit la Manicouagan,2021-03-12,113,https://www.lemanic.ca/2021/03/12/pates-et-papiers-le-plan-de-sauvetage-du-premier-ministre-legault-ravit-la-manicouagan/,2021-07-03 19:07:05
Baie-Comeau ,premier ministre,9,ICI.Radio-Canada.ca,Fermeture de Produits forestiers Résolu : Legault promet un « énorme plan »,2021-03-12,113,https://ici.radio-canada.ca/nouvelle/1776769/resolu-fermeture-industrie-forestiere-diversification,2021-07-03 19:07:05
Baie-Comeau ,premier ministre,10,Journal Le Manic,Deux appels de Brian Mulroney pour Samuel,2020-12-01,214,https://www.lemanic.ca/2020/12/01/deux-appels-de-brian-mulroney-pour-samuel/,2021-07-03 19:07:05
Baie-Comeau ,premier ministre,11,Journal Le Manic,Confinement : la Côte-Nord ne lance pas la serviette,2021-01-07,177,https://www.lemanic.ca/2021/01/07/confinement-la-cote-nord-ne-lance-pas-la-serviette/,2021-07-03 19:07:06
Baie-Comeau ,premier ministre,12,Journal Le Manic,« On se demande tous ce que ça va prendre pour tomber en zone jaune » - Yves Montigny,2021-03-04,121,https://www.lemanic.ca/2021/03/04/on-se-demande-tous-ce-que-ca-va-prendre-pour-tomber-en-zone-jaune-yves-montigny/,2021-07-03 19:07:06
Baie-Comeau ,premier ministre,13,ICI.Radio-Canada.ca,La Côte-Nord passera au palier d'alerte jaune le lundi 24 mai,2021-05-20,44,https://ici.radio-canada.ca/nouvelle/1794301/palier-alerte-region-cote-nord-pandemie-covid-tourime,2021-07-03 19:07:06
Baie-Comeau ,premier ministre,14,La Presse,Résolu ferme ses usines d'Amos et de Baie-Comeau,2021-04-30,64,https://www.lapresse.ca/affaires/entreprises/2021-04-30/resolu-ferme-ses-usines-d-amos-et-de-baie-comeau.php,2021-07-03 19:07:06
Baie-Comeau ,premier ministre,15,Journal Le Manic,Actualité La Côte-Nord revient en zone jaune,2021-03-17,108,https://www.lemanic.ca/2021/03/17/la-cote-nord-revient-en-zone-jaune/,2021-07-03 19:07:06
Baie-Comeau ,premier ministre,16,Le Journal de Québec,«Petit déconfinement»: le Québec coupé en deux,2021-02-02,151,https://www.journaldequebec.com/2021/02/02/en-direct-covid-19-legault-fait-le-point-sur-lallegement-des-mesures-sanitaires-au-quebec,2021-07-03 19:07:06
Baie-Comeau ,premier ministre,17,ICI.Radio-Canada.ca,Budget 2021 : déception sur la Côte-Nord | Budget du Québec 2021,2021-03-26,99,https://ici.radio-canada.ca/nouvelle/1780354/budget-quebec-2021-deception-elus-cote-nord-chambre-commerce-forets,2021-07-03 19:07:06
Baie-Comeau ,premier ministre,18,Radio-Canada.ca,Troisième lien : le gouvernement accusé « d'utiliser » l'est du Québec | 3e lien,2021-05-26,38,https://ici.radio-canada.ca/nouvelle/1794747/tunnel-quebec-levis-cote-nord-bas-saint-laurentreactions-prudence,2021-07-03 19:07:07
Baie-Comeau ,premier ministre,19,ICI.Radio-Canada.ca,La Côte-Nord en zone jaune dès jeudi,2020-09-29,277,https://ici.radio-canada.ca/nouvelle/1737243/cote-nord-zone-jaune-prealerte-coronavirus,2021-07-03 19:07:07
Baie-Comeau ,premier ministre,20,Journal Le Manic,Le premier ministre François Legault veut interdire tous les vols internationaux non essentiels,2021-01-19,165,https://www.lemanic.ca/2021/01/19/le-premier-ministre-francois-legault-veut-interdire-tous-les-vols-internationaux-non-essentiels/,2021-07-03 19:07:07
Baie-Comeau ,premier ministre,21,ICI.Radio-Canada.ca,Une dernière condition avant de lancer le projet de parc éolien Apuiat,2020-07-17,351,https://ici.radio-canada.ca/nouvelle/1720323/francois-legault-eolien-apuiat-hydro-quebec-sante-urgences,2021-07-03 19:07:07
Baie-Comeau ,premier ministre,22,Journal Le Manic,La Côte-Nord retrouve le palier orange dès mercredi,2021-04-13,81,https://www.lemanic.ca/2021/04/13/la-cote-nord-retrouve-le-palier-orange-des-mercredi/,2021-07-03 19:07:07
Baie-Comeau ,premier ministre,23,Journal Le Manic,François Legault à Baie-Comeau vendredi,2020-07-15,353,https://www.lemanic.ca/2020/07/15/francois-legault-a-baie-comeau-vendredi/,2021-07-03 19:07:07
Baie-Comeau ,premier ministre,24,Journal Le Manic,Relâche : un « gros test » qui inquiète le premier ministre Legault,2021-02-23,130,https://www.lemanic.ca/2021/02/23/relache-un-gros-test-qui-inquiete-le-premier-ministre-legault/,2021-07-03 19:07:07
Baie-Comeau ,premier ministre,25,La Presse,Baie-Comeau retient son souffle | La Presse,2021-04-28,66,https://www.lapresse.ca/covid-19/2021-04-28/baie-comeau-retient-son-souffle.php,2021-07-03 19:07:08
Baie-Comeau ,climat,1,Le Journal de Québec,Réouverture de l'usine d'Arbec de Port-Cartier,2021-06-30,3,https://www.journaldequebec.com/2021/06/30/reouverture-de-lusine-darbec-de-port-cartier-1,2021-07-03 19:07:43
Baie-Comeau ,climat,2,La Terre de chez nous,Serveurs informatiques : une source de chaleur à explorer | La Terre de Chez Nous,2021-06-20,13,https://www.laterre.ca/utiliterre/technique/serveurs-informatiques-une-source-de-chaleur-a-explorer,2021-07-03 19:07:43
Baie-Comeau ,climat,3,Journal Le Manic,Près de 150 personnes marchent pour le climat à Baie-Comeau,,,https://www.lemanic.ca/2019/09/27/les-gens-marchent-pour-le-climat-a-baie-comeau/,2021-07-03 19:07:43
Baie-Comeau ,climat,4,Le Journal de Québec,"«On vous tend la main, M. Legault», dit le président d'Alliance forêt boréale",2021-06-17,16,https://www.journaldequebec.com/2021/06/17/on-vous-tend-la-main-m-legault-dit-le-president-dalliance-foret-boreale,2021-07-03 19:07:43
Baie-Comeau ,climat,5,Journal Le Manic,Un jeune de Baie-Comeau au premier Laboratoire des jeunes journalistes en environnement,2021-06-01,32,https://www.lemanic.ca/2021/06/01/un-jeune-de-baie-comeau-au-premier-laboratoire-des-jeunes-journalistes-en-environnement/,2021-07-03 19:07:43
Baie-Comeau ,climat,6,Journal Le Manic,"Chaînes de blocs : ""Aujourd'hui, c'est une journée formidable pour Baie-Comeau""",2021-01-29,155,https://www.lemanic.ca/2021/01/29/chaines-de-blocs-aujourdhui-cest-une-journee-formidable-pour-baie-comeau/,2021-07-03 19:07:44
Baie-Comeau ,climat,7,Journal Le Manic,Les organismes communautaires de la Côte-Nord demandent plus d'équité et de justice sociale,2021-03-19,106,https://www.lemanic.ca/2021/03/19/les-organismes-communautaires-de-la-cote-nord-demandent-plus-dequite-et-de-justice-sociale/,2021-07-03 19:07:44
Baie-Comeau ,climat,8,ICI.Radio-Canada.ca,Le Noël blanc 2020 menacé par de fortes pluies et 12 °C,2020-12-21,194,https://ici.radio-canada.ca/nouvelle/1758737/noel-blanc-quebec-systeme-pluie-chaleur,2021-07-03 19:07:44
Baie-Comeau ,climat,9,Journal Le Manic,La rivière Portneuf affectée par les conditions climatiques,2020-12-29,186,https://www.lemanic.ca/2020/12/29/la-riviere-portneuf-affectee-par-les-conditions-climatiques/,2021-07-03 19:07:44
Baie-Comeau ,climat,10,ICI.Radio-Canada.ca,Réserve de biodiversité à Baie-Comeau : désaccord sur le tracé,2021-05-31,33,https://ici.radio-canada.ca/nouvelle/1794515/pointe-saint-gilles-reserve-biodiversite-baiecomeau-desaccord-municipalite,2021-07-03 19:07:44
Baie-Comeau ,climat,11,ICI.Radio-Canada.ca,Rétablir un climat de confiance aiderait à la relance économique de la Côte-Nord | Coronavirus,,,https://ici.radio-canada.ca/nouvelle/1711106/relance-economie-cote-nord-covid-restauration-tourisme-commerce,2021-07-03 19:07:45
Baie-Comeau ,climat,12,Journal Le Manic,Actualité 19 octobre 2020 à 03h00 Autobus Manic prend le virage vert,2020-10-19,257,https://www.lemanic.ca/2020/10/19/autobus-manic-prend-le-virage-vert/,2021-07-03 19:07:45
Baie-Comeau ,climat,13,Journal Le Manic,La Table des groupes populaires de la Côte-Nord sensible au réchauffement climatique,,,https://www.lemanic.ca/2019/11/09/la-table-des-groupes-populaires-de-la-cote-nord-sensible-au-rechauffement-climatique/,2021-07-03 19:07:45
Baie-Comeau ,climat,14,Journal Le Manic,Les conditions météo difficiles annulent des traversées,2020-11-02,243,https://www.lemanic.ca/2020/11/02/les-conditions-meteo-difficiles-modifications-des-horaires-des-traverses-matane-baie-comeau-godbout/,2021-07-03 19:07:45
Baie-Comeau ,climat,15,Le Soleil - Groupe Capitales Médias,Climat toxique à Rideau Hall: Julie Payette démissionne,2021-01-22,162,https://www.lesoleil.com/actualite/climat-toxique-a-rideau-hall-julie-payette-demissionne-d4245cb314189c91ee01e967206c6466,2021-07-03 19:07:45
Baie-Comeau ,climat,16,Journal Le Manic,(Mise à jour) Le randonneur égaré dans les monts Groulx est retrouvé,2021-05-23,41,https://www.lemanic.ca/2021/05/23/un-randonneur-porte-disparu-dans-les-monts-groulx/,2021-07-03 19:07:45
Baie-Comeau ,climat,17,TVA Nouvelles,La traverse Matane–Baie-Comeau–Godbout encore à l'arrêt,2021-05-04,60,https://www.tvanouvelles.ca/2021/05/04/la-traverser-matanebaie-comeaugodbout-encore-a-larret-1,2021-07-03 19:07:46
Baie-Comeau ,climat,18,La Presse,"Traverse Matane–Baie-Comeau–Godbout | Le F.-A.-Gauthier en réparation, pas de service avant lundi au plus tôt",2020-11-20,225,https://www.lapresse.ca/actualites/regional/2020-11-20/traverse-matane-baie-comeau-godbout/le-f-a-gauthier-en-reparation-pas-de-service-avant-lundi-au-plus-tot.php,2021-07-03 19:07:46
Baie-Comeau ,climat,19,Radio-Canada.ca,Les flocons s'accumulent sur l'est du pays,2021-01-16,168,https://ici.radio-canada.ca/nouvelle/1763628/tempete-hivernale-quebec-neige-meteo-routes,2021-07-03 19:07:46
Baie-Comeau ,climat,20,Radio-Canada.ca,Routes enneigées et déplacements compliqués dans l'Est-du-Québec,2021-03-01,124,https://ici.radio-canada.ca/nouvelle/1774053/tempete-est-quebec-neige-vent-blizzard-bas-saint-laurent-gaspesie-cote-nord-meteo-routes,2021-07-03 19:07:46
Baie-Comeau ,climat,21,Journal Le Manic,La protection des berges à Pointe-aux-Outardes franchit une importante étape,2021-03-22,103,https://www.lemanic.ca/2021/03/22/la-protection-des-berges-a-pointe-aux-outardes-franchit-une-importante-etape/,2021-07-03 19:07:46
Baie-Comeau ,climat,22,Journal Le Manic,Un mois de février tout en douceur dans la Manicouagan,2021-03-03,122,https://www.lemanic.ca/2021/03/03/un-mois-de-fevrier-tout-en-douceur-dans-la-manicouagan/,2021-07-03 19:07:47
Baie-Comeau ,climat,23,Radio-Canada.ca,Une « tempête de neige » fonce sur le Québec,2021-04-21,73,https://ici.radio-canada.ca/nouvelle/1786335/tempete-printaniere-quebec-depression-record-avril-2021,2021-07-03 19:07:47
Baie-Comeau ,climat,24,Radio-Canada.ca,La tempête continue à faire rage dans l'Est-du-Québec,2021-03-03,122,https://ici.radio-canada.ca/nouvelle/1774323/tempete-bas-saint-laurent-gaspesie-cote-nord-2-mars-2021-poudrerie-route-132-138-20,2021-07-03 19:07:47
Baie-Comeau ,climat,25,ICI.Radio-Canada.ca,Météo difficile à prévoir en Gaspésie et sur la Côte-Nord,2020-11-16,229,https://ici.radio-canada.ca/nouvelle/1749701/tempete-vent-pluie-neige-novembre-gaspe-cote-avertissement,2021-07-03 19:07:48
Baie-Comeau ,racisme,1,Le Soleil - Groupe Capitales Médias,Le P'tit Mag: 4 autochtones d'exception,2021-07-03,0,https://www.lesoleil.com/le-mag/le-ptit-mag-4-autochtones-dexception-48818671266333706a278c126fd0b264,2021-07-03 19:08:00
Baie-Comeau ,racisme,2,La Presse,Colombie-Britannique | Le village d'Anahim Lake derrière Carey Price,2021-06-30,3,https://www.lapresse.ca/sports/hockey/2021-06-30/colombie-britannique/le-village-d-anahim-lake-derriere-carey-price.php,2021-07-03 19:08:00
Baie-Comeau ,racisme,3,Le Soleil - Groupe Capitales Médias,Marche contre le racisme à Québec: admettre les réalités pour avancer [PHOTOS],2021-03-21,104,https://www.lesoleil.com/actualite/marche-contre-le-racisme-a-quebec-admettre-les-realites-pour-avancer-photos-ede3d604441eafbeb4aba43128ba78c6,2021-07-03 19:08:00
Baie-Comeau ,racisme,4,ICI.Radio-Canada.ca,Sensibilisation des futurs policiers au racisme : un ajout bien reçu à Rimouski,2021-04-09,85,https://ici.radio-canada.ca/nouvelle/1783464/autochtone-innus-cegep-rimouski-technique-policiere-racisme,2021-07-03 19:08:00
Baie-Comeau ,racisme,5,Le Soleil - Groupe Capitales Médias,70% des Canadiens noirs confrontés au racisme régulièrement selon une étude,2021-05-21,43,https://www.lesoleil.com/actualite/70-des-canadiens-noirs-confrontes-au-racisme-regulierement-selon-une-etude-dce54ce52005be0546d09ecd9dd11215,2021-07-03 19:08:01
Baie-Comeau ,racisme,6,ICI.Radio-Canada.ca,"Le racisme systémique envers les Autochtones, aussi dans le système de santé",2021-01-21,163,https://ici.radio-canada.ca/espaces-autochtones/1712863/premieres-nations-quebec-soins-psychiatrie-securite-culturelle-sante-hopital-discrimination-autochtones,2021-07-03 19:08:01
Baie-Comeau ,racisme,7,Le Journal de Montréal,Santé Mal formés sur la santé autochtone,2021-02-07,146,https://www.journaldemontreal.com/2021/02/07/mal-formes-sur-la-sante-autochtone,2021-07-03 19:08:01
Baie-Comeau ,racisme,8,Le Soleil - Groupe Capitales Médias,"Le racisme est répandu dans les hôpitaux, selon des Autochtones",2020-10-05,271,https://www.lesoleil.com/actualite/le-racisme-est-repandu-dans-les-hopitaux-selon-des-autochtones-ff18f315c112a89df8edc4efed82ad48,2021-07-03 19:08:01
Baie-Comeau ,racisme,9,Journal Le Manic,Des élèves du CÉA de l'Estuaire marchent en l'honneur de Joyce Echaquan,2020-11-03,242,https://www.lemanic.ca/2020/11/03/des-eleves-du-cea-de-lestuaire-marchent-en-lhonneur-de-joyce-echaquan/,2021-07-03 19:08:02
Baie-Comeau ,racisme,10,Le Soleil - Groupe Capitales Médias,Une communauté innue crie au profilage racial après une interpellation musclée,2021-02-03,150,https://www.lesoleil.com/actualite/en-region/une-communaute-innue-crie-au-profilage-racial-apres-une-interpellation-musclee-a6f4c02dfa869a68a87440b4e24bc1a9,2021-07-03 19:08:02
Baie-Comeau ,racisme,11,Journal Le Manic,Une soirée commémorative pour Joyce Echaquan à Papinachois jeudi,2020-10-07,269,https://www.lemanic.ca/2020/10/07/une-soiree-commemorative-pour-joyce-echaquan-a-papinachois-jeudi/,2021-07-03 19:08:02
Baie-Comeau ,racisme,12,Le Journal de Québec,«Ils ont peur d'aller à l'hôpital»,2020-09-30,276,https://www.journaldequebec.com/2020/09/30/ils-ont-peur-daller-a-lhopital,2021-07-03 19:08:02
Baie-Comeau ,racisme,13,La Presse,Joliette | Les voisins éloignés | La Presse,2020-11-07,238,https://www.lapresse.ca/actualites/2020-11-07/joliette/les-voisins-eloignes.php,2021-07-03 19:08:02
Baie-Comeau ,racisme,14,Le Devoir,Des préjugés au bout de la route,2021-05-12,52,https://www.ledevoir.com/societe/600514/des-prejuges-au-bout-de-la-route,2021-07-03 19:08:02
Baie-Comeau ,racisme,15,Le Soleil - Groupe Capitales Médias,Le DG des Oilers se dit dégoûté par les insultes racistes contre Ethan Bear,2021-05-26,38,https://www.lesoleil.com/sports/le-dg-des-oilers-se-dit-degoute-par-les-insultes-racistes-contre-ethan-bear-19382adde001ef1d147f388101dfb76d,2021-07-03 19:08:03
Baie-Comeau ,racisme,16,Le Devoir,Un meilleur accompagnement réclamé pour les Autochtones dans les hôpitaux,2021-02-17,136,https://www.ledevoir.com/societe/sante/595376/un-meilleur-accompagnement-reclame-pour-les-autochtones,2021-07-03 19:08:03
Baie-Comeau ,racisme,17,Le Journal de Québec,"«Mon vrai métier, c'est humoriste» - Guy Nantel",2021-03-28,97,https://www.journaldequebec.com/2021/03/28/mon-vrai-metier-cest-humoriste---guy-nantel,2021-07-03 19:08:03
Baie-Comeau ,racisme,18,Le Devoir,"Autochtones et soins de santé: l'affaire Joyce Echaquan, loin d'être un cas isolé",2021-05-11,53,https://www.ledevoir.com/societe/600493/l-affaire-joyce-echaquan-loin-d-etre-un-cas-isole,2021-07-03 19:08:03
Baie-Comeau ,racisme,19,Le Droit - Groupe Capitales Médias,Le «racisme» de Thalie | Chroniques,,,https://www.ledroit.com/chroniques/le-racisme-de-thalie-9108cfddb935c9d65b08bf68ea5287b7,2021-07-03 19:08:03
Baie-Comeau ,racisme,20,Le Devoir,«J'ai eu à faire face à des attitudes racistes dans mes années de pratique»,2020-10-03,273,https://www.ledevoir.com/opinion/idees/587150/j-ai-eu-a-faire-face-a-des-attitudes-racistes-dans-mes-annees-de-pratique,2021-07-03 19:08:03
Baie-Comeau ,racisme,21,ICI.Radio-Canada.ca,Le BEI enquête sur une intervention de la SQ dans le secteur de Pessamit,2021-02-03,150,https://ici.radio-canada.ca/nouvelle/1768127/racisme-profilage-racial-police-autochtones-innus-surete-quebec,2021-07-03 19:08:04
Baie-Comeau ,racisme,22,Le Soleil - Groupe Capitales Médias,Racisme : la longue histoire de la protestation dans le sport américain,2020-08-26,311,https://www.lesoleil.com/sports/racisme--la-longue-histoire-de-la-protestation-dans-le-sport-americain-19941d2cf35944945dcbc344d92c18ae,2021-07-03 19:08:04
Baie-Comeau ,racisme,23,ICI.Radio-Canada.ca,Des Innus dénoncent la discrimination raciale au hockey mineur sur la Côte-Nord,,,https://ici.radio-canada.ca/espaces-autochtones/1156621/hockey-mineur-discriminations-innus-cote-nord-racisme,2021-07-03 19:08:04
Baie-Comeau ,racisme,24,ICI.Radio-Canada.ca,Allochtones et Innus solidaires contre le racisme à Sept-Îles,,,https://ici.radio-canada.ca/nouvelle/1709973/manifestation-sept-iles-innus-racisme-7-juin,2021-07-03 19:08:04
Baie-Comeau ,racisme,25,La Presse,"Enquête sur la mort de Joyce Echaquan | « Il y en aura d'autres, j'en suis certain »",2021-05-31,33,https://www.lapresse.ca/actualites/2021-05-31/enquete-sur-la-mort-de-joyce-echaquan/il-y-en-aura-d-autres-j-en-suis-certain.php,2021-07-03 19:08:05
Baie-Comeau ,Chine,1,Journal Le Manic,Trois entreprises exportatrices de la Côte-Nord remportent un prix MercadOr,2021-06-18,15,https://www.lemanic.ca/2021/06/18/trois-entreprises-exportatrices-de-la-cote-nord-remportent-un-prix-mercador/,2021-07-03 19:08:12
Baie-Comeau ,Chine,2,Journal Le Manic,Chine : Alcoa suit la situation de près,,,https://www.lemanic.ca/2020/03/10/chine-alcoa-suit-la-situation-de-pres/,2021-07-03 19:08:12
Baie-Comeau ,Chine,3,Guy Bouchard,Boréal Club devient une franchise Snack Town | Journal Informes Affaires,2021-06-18,15,https://informeaffaires.com/regional/commerces-et-services/boreal-club-devient-une-franchise-snack-town,2021-07-03 19:08:12
Baie-Comeau ,Chine,4,Journal Le Manic,Des avancées pour le projet Baie-Comeau Minéral,2021-05-03,61,https://www.lemanic.ca/2021/05/03/des-avancees-pour-le-projet-baie-comeau-mineral/,2021-07-03 19:08:12
Baie-Comeau ,Chine,5,Journal Le Manic,L'éventuelle conversion de la papetière n'est pas pour demain,2021-04-28,66,https://www.lemanic.ca/2021/04/28/leventuelle-conversion-de-la-papetiere-nest-pas-pour-demain/,2021-07-03 19:08:12
Baie-Comeau ,Chine,6,ICI.Radio-Canada.ca,"Des Innus négligés par la DPJ à Baie-Comeau, selon le syndicat des intervenants",2021-03-25,100,https://ici.radio-canada.ca/espaces-autochtones/1779956/innus-negligence-dpj-baie-comeau-syndicat-autochtones,2021-07-03 19:08:12
Baie-Comeau ,Chine,7,Le Soleil - Groupe Capitales Médias,Le ton monte encore entre le Canada et la Chine,2021-02-18,135,https://www.lesoleil.com/actualite/le-ton-monte-encore-entre-le-canada-et-la-chine-83ef74021281fa8bf8af034d6a416568,2021-07-03 19:08:13
Baie-Comeau ,Chine,8,ICI.Radio-Canada.ca,Un feu de forêt sévit près de Baie-Comeau,,,https://ici.radio-canada.ca/nouvelle/1713720/feu-foret-138-baie-comeau-sopfeu,2021-07-03 19:08:13
Baie-Comeau ,Chine,9,Journal Le Manic,Mine et aciérie : trois délégués de la Manicouagan en Chine,,,https://www.lemanic.ca/2019/01/31/mine-et-acierie-trois-delegues-de-la-manicouagan-en-chine/,2021-07-03 19:08:13
Baie-Comeau ,Chine,10,Radio-Canada.ca,Un début de saison hâtif pour les golfeurs,2021-05-10,54,https://ici.radio-canada.ca/nouvelle/1790706/ouverture-saison-club-golf-mai-2021-meteo-terrain-est-du-quebec,2021-07-03 19:08:13
Baie-Comeau ,Chine,11,Le Journal de Montréal,Les forestières d'ici engrangent les profits,2021-03-20,105,https://www.journaldemontreal.com/2021/03/20/les-forestieres-dici-engrangent-les-profits,2021-07-03 19:08:13
Baie-Comeau ,Chine,12,ICI.Radio-Canada.ca,Mason Graphite songe à construire une usine ailleurs qu'à Baie-Comeau,,,https://ici.radio-canada.ca/nouvelle/1712379/mason-graphite-mine-baie-comeau-transformation-batterie-voiture-electrique,2021-07-03 19:08:14
Baie-Comeau ,Chine,13,Ma Côte-Nord,Vingt-trois infirmières en renfort en périnatalité pour Sept-Îles et Baie-Comeau,2020-08-17,320,https://macotenord.com/vingt-trois-infirmieres-en-renfort-en-perinatalite-pour-sept-iles-et-baie-comeau/,2021-07-03 19:08:14
Baie-Comeau ,Chine,14,Ma Côte-Nord,Les ours qui rôdent sont «affamés» Accueil,2020-09-17,289,https://macotenord.com/les-ours-qui-rodent-sont-affames/,2021-07-03 19:08:14
Baie-Comeau ,Chine,15,Le Quotidien - Groupe Capitales Médias,Pont sur le Saguenay et chemin de fer à Dolbeau: une firme chinoise se manifeste,,,https://www.lequotidien.com/actualites/pont-sur-le-saguenay-et-chemin-de-fer-a-dolbeau-une-firme-chinoise-se-manifeste-b500ec655951d6e8a102a2835d55903e,2021-07-03 19:08:14
Baie-Comeau ,Chine,16,Journal Le Manic,Tarifs sur l'aluminium canadien : une riposte aux Américains est souhaitée,2020-08-07,330,https://www.lemanic.ca/2020/08/07/tarifs-sur-laluminium-canadien-une-riposte-aux-americains-est-souhaitee/,2021-07-03 19:08:14
Baie-Comeau ,Chine,17,ICI.Radio-Canada.ca,Une centaine de personnes manifestent contre les restrictions sanitaires à Rimouski | Coronavirus,2021-03-20,105,https://ici.radio-canada.ca/nouvelle/1778806/manifestation-liberte-rimouski-mesures-restrictions-sanitaires,2021-07-03 19:08:15
Baie-Comeau ,Chine,18,ICI.Radio-Canada.ca,Les cégépiens de l'Est-du-Québec veulent des changements pour améliorer leur santé mentale,2021-02-05,148,https://ici.radio-canada.ca/nouvelle/1767822/etudiant-cegep-sante-mentale-psychologique-aide-presentiel-isolement,2021-07-03 19:08:15
Baie-Comeau ,Chine,19,Le Soleil - Groupe Capitales Médias,Ouighours: une large majorité de Canadiens pour la fermeté envers Pékin,2021-03-08,117,https://www.lesoleil.com/actualite/ouighours-une-large-majorite-de-canadiens-pour-la-fermete-envers-pekin-2900f8ad2bc19b8bb444a0ecf75c5457,2021-07-03 19:08:15
Baie-Comeau ,Chine,20,radio-canada.ca,Micoua-Saguenay : les monteurs de lignes de retour lundi,2021-05-16,48,https://ici.radio-canada.ca/nouvelle/1793295/hydro-quebec-ligne-cote-nord-saguenay,2021-07-03 19:08:15
Baie-Comeau ,Chine,21,Journal Le Manic,Une firme chinoise s'intéresse au rail et au pont,,,https://www.lemanic.ca/2019/08/22/une-firme-chinoise-sinteresse-au-rail-et-au-pont/,2021-07-03 19:08:15
Baie-Comeau ,Chine,22,Le Soleil - Groupe Capitales Médias,"Shabu shabu, la fondue «chinoise»… à la japonaise | Le Mag",2021-02-06,147,https://www.lesoleil.com/le-mag/shabu-shabu-la-fondue-chinoise-a-la-japonaise-ee8507550e4f36de10d9826d4a7a164f,2021-07-03 19:08:16
Baie-Comeau ,Chine,23,La Presse,Nos requins du Québec | La Presse,2020-11-29,216,https://www.lapresse.ca/actualites/sciences/2020-11-29/nos-requins-du-quebec.php,2021-07-03 19:08:16
Baie-Comeau ,Chine,24,Radio-Canada.ca,Québec octroie 10 M$ supplémentaires au transport interurbain,2021-02-02,151,https://ici.radio-canada.ca/nouvelle/1767814/quebec-aide-financiere-10-million-transport-autobus-interurbain-regions-intercar-keolis,2021-07-03 19:08:16
Baie-Comeau ,Chine,25,Droit-Inc.com,Des nouveaux juges à la Cour du Québec,2021-06-03,30,https://www.droit-inc.com/article28816-Des-nouveaux-juges-a-la-Cour-du-Quebec,2021-07-03 19:08:17
Baie-Comeau ,Biden OR Trump,1,Le Journal de Montréal,"Biden sera l'ami du Canada, dit Mulroney",2020-11-07,238,https://www.journaldemontreal.com/2020/11/07/biden-sera-lami-du-canada-dit-mulroney,2021-07-03 19:08:24
Baie-Comeau ,Biden OR Trump,2,ICI.Radio-Canada.ca,Un début de saison de golf hâtif sur la Côte-Nord,2021-05-03,61,https://ici.radio-canada.ca/nouvelle/1789795/baie-comeau-sept-iles-tot-ouverture-saison,2021-07-03 19:08:24
